record_num,age_upon_outcome,animal_id,animal_type,breed,color,date_of_birth,datetime,monthyear,name,outcome_subtype,outcome_type,sex_upon_outcome,location_lat,location_long,age_upon_outcome_in_weeks
1,3 years,A746874,Cat,Domestic Shorthair Mix,Black/White,4/10/2014,4/11/2017 9:00,2017-04-11T09:00:00,,SCRP,Transfer,Neutered Male,30.50665787,-97.34087807,156.7678571
2,1 year,A725717,Cat,Domestic Shorthair Mix,Silver Tabby,5/2/2015,5/6/2016 10:49,2016-05-06T10:49:00,,SCRP,Transfer,Spayed Female,30.65259846,-97.74199635,52.92152778
3,2 years,A716330,Dog,Chihuahua Shorthair Mix,Brown/White,11/18/2013,12/28/2015 18:43,2015-12-28T18:43:00,Frank,,Adoption,Neutered Male,30.75957481,-97.55237538,110.1114087
4,7 months,A733653,Cat,Siamese Mix,Seal Point,1/25/2016,8/27/2016 18:11,2016-08-27T18:11:00,Kitty,,Adoption,Intact Female,30.31880634,-97.72403767,30.82251984
5,2 years,A691584,Dog,Labrador Retriever Mix,Tan/White,11/6/2012,5/30/2015 13:48,2015-05-30T13:48:00,Luke,,Return to Owner,Neutered Male,30.71048156,-97.56229744,133.6535714
6,5 years,A696004,Dog,Cardigan Welsh Corgi Mix,Sable/White,1/27/2010,1/28/2015 10:39,2015-01-28T10:39:00,Lucy,Rabies Risk,Euthanasia,Spayed Female,30.67373659,-97.70797153,261.0633929
7,2 years,A673830,Dog,Pit Bull Mix,Black/White,3/3/2012,3/19/2014 15:15,2014-03-19T15:15:00,*Seth,Aggressive,Euthanasia,Neutered Male,30.29542566,-97.31366421,106.6622024
8,1 year,A736551,Dog,Labrador Retriever Australian Cattle Dog,Black,10/12/2015,11/27/2016 18:00,2016-11-27T18:00:00,*Mia,,Adoption,Spayed Female,30.44432128,-97.73269803,58.96428571
9,3 years,A720214,Dog,Labrador Retriever Mix,Red/White,2/4/2013,2/11/2016 12:41,2016-02-11T12:41:00,Blessing,,Adoption,Spayed Female,30.38706482,-97.36843397,157.5040675
10,3 months,A664290,Cat,Domestic Shorthair Mix,Tortie,9/1/2013,12/8/2013 14:58,2013-12-08T14:58:00,*Taylor,,Adoption,Spayed Female,30.75831055,-97.6182922,14.0890873
11,1 year,A721199,Dog,Dachshund Wirehair Mix,Tan/White,2/23/2015,2/27/2016 17:49,2016-02-27T17:49:00,Belle,,Adoption,Spayed Female,30.72902728,-97.37533282,52.8203373
12,1 year,A664843,Dog,Pit Bull Mix,Brown/White,6/9/2013,8/18/2014 17:24,2014-08-18T17:24:00,Sherlock,Partner,Transfer,Neutered Male,30.45155494,-97.47410451,62.24642857
13,1 year,A700408,Cat,Domestic Shorthair Mix,Brown Tabby/White,4/13/2014,4/15/2015 13:34,2015-04-15T13:34:00,Nyla,,Return to Owner,Spayed Female,30.41011545,-97.56241567,52.5093254
14,2 years,A742287,Dog,Boxer Bullmastiff,Brown Brindle/White,1/18/2015,2/11/2017 12:30,2017-02-11T12:30:00,*Kawhi,,Adoption,Neutered Male,30.45511486,-97.30877805,107.9315476
15,3 years,A712638,Dog,Pit Bull Mix,Red/White,9/26/2012,7/18/2016 17:52,2016-07-18T17:52:00,Marcus,Partner,Transfer,Neutered Male,30.57982992,-97.55884879,198.8206349
16,5 years,A723742,Dog,Miniature Schnauzer Mix,Black/White,4/5/2011,4/10/2016 17:27,2016-04-10T17:27:00,Gretchen,,Adoption,Spayed Female,30.47928849,-97.40885316,261.8181548
17,6 months,A668960,Dog,Pit Bull Mix,Blue/White,6/12/2013,12/27/2013 16:56,2013-12-27T16:56:00,*Gigi,,Adoption,Spayed Female,30.59434108,-97.24899336,28.38650794
18,2 months,A693288,Cat,Domestic Shorthair Mix,Brown Tabby/White,9/28/2014,12/9/2014 18:36,2014-12-09T18:36:00,,,Adoption,Spayed Female,30.45276783,-97.46205072,10.39642857
19,4 months,A709511,Cat,Domestic Medium Hair Mix,White/Black,7/10/2015,11/13/2015 14:00,2015-11-13T14:00:00,*Toad,Foster,Adoption,Neutered Male,30.52028775,-97.65742044,18.08333333
20,1 year,A693126,Dog,American Bulldog Mix,White/Brown,12/2/2013,2/28/2015 17:42,2015-02-28T17:42:00,George,,Adoption,Neutered Male,30.5777123,-97.64388266,64.81964286
21,2 years,A730354,Dog,Pit Bull Mix,Blue/White,7/2/2015,7/1/2017 18:11,2017-07-01T18:11:00,Mia,,Adoption,Spayed Female,30.48156897,-97.36949609,104.3939484
22,5 years,A615748,Dog,Labrador Retriever Mix,Black,12/11/2009,10/26/2015 18:13,2015-10-26T18:13:00,Blackie,Suffering,Euthanasia,Neutered Male,30.71720698,-97.29528331,306.537004
23,2 years,A692137,Dog,Pit Bull Mix,Blue/White,5/15/2013,3/1/2016 15:26,2016-03-01T15:26:00,Shadow,Partner,Transfer,Intact Male,30.36915965,-97.3810872,145.9490079
24,3 weeks,A704707,Cat,Siamese Mix,Seal Point,5/17/2015,6/8/2015 16:25,2015-06-08T16:25:00,,Partner,Transfer,Unknown,30.70993564,-97.69685334,3.240575397
25,2 months,A725966,Cat,Domestic Shorthair Mix,Tortie,3/20/2016,5/24/2016 11:01,2016-05-24T11:01:00,*Star,,Adoption,Spayed Female,30.52017076,-97.53178243,9.351289683
26,1 year,A743231,Cat,Domestic Shorthair Mix,Black,2/6/2016,2/7/2017 9:00,2017-02-07T09:00:00,,SCRP,Transfer,Intact Female,30.2920164,-97.42662919,52.48214286
27,2 years,A764418,Dog,Chihuahua Shorthair Mix,Tan/White,12/29/2015,12/30/2017 11:58,2017-12-30T11:58:00,Burro,,Return to Owner,Neutered Male,30.27716894,-97.71227555,104.6426587
28,1 year,A743879,Dog,Pit Bull Mix,Black/White,2/18/2016,6/16/2017 14:58,2017-06-16T14:58:00,*Tallulah,Partner,Transfer,Spayed Female,30.75736753,-97.46674216,69.23194444
29,2 months,A756064,Cat,Domestic Shorthair Mix,Blue,6/13/2017,8/16/2017 0:00,2017-08-16T00:00:00,,Partner,Transfer,Intact Male,30.29341166,-97.29019484,9.142857143
30,3 years,A648094,Dog,Dachshund Chihuahua Shorthair,Red,11/21/2012,7/21/2016 18:58,2016-07-21T18:58:00,Brawndo,,Adoption,Neutered Male,30.7173271,-97.48834083,191.255754
31,5 years,A651202,Dog,Maltese Mix,White,4/7/2009,9/6/2014 17:11,2014-09-06T17:11:00,Daisy,,Return to Owner,Spayed Female,30.48740064,-97.73007411,282.6737103
32,3 months,A687515,Cat,Domestic Shorthair Mix,Orange Tabby,5/29/2014,9/7/2014 18:30,2014-09-07T18:30:00,Dinah,,Adoption,Spayed Female,30.53705367,-97.56848156,14.53869048
33,2 years,A709958,Dog,Australian Cattle Dog Mix,Brown Brindle/White,8/15/2013,8/23/2015 19:23,2015-08-23T19:23:00,Jack,,Adoption,Intact Female,30.69373851,-97.57660032,105.5439484
34,3 months,A753983,Cat,Domestic Shorthair Mix,Orange Tabby,4/13/2017,7/16/2017 19:19,2017-07-16T19:19:00,,Snr,Transfer,Unknown,30.43018877,-97.58375536,13.54355159
35,7 years,A712377,Cat,Domestic Shorthair Mix,Brown Tabby/White,9/22/2008,9/23/2015 9:00,2015-09-23T09:00:00,,SCRP,Transfer,Neutered Male,30.59149195,-97.64170614,365.3392857
36,6 months,A706953,Dog,Labrador Retriever Mix,Yellow,12/6/2014,7/6/2015 11:33,2015-07-06T11:33:00,,Medical,Euthanasia,Intact Female,30.54808024,-97.29699691,30.35446429
37,3 months,A739519,Cat,Domestic Shorthair Mix,Brown Tabby,11/6/2016,2/11/2017 18:46,2017-02-11T18:46:00,Mojito,,Adoption,Spayed Female,30.68318128,-97.24581916,13.96884921
38,2 months,A760125,Cat,Domestic Shorthair Mix,White/Black,7/29/2017,10/17/2017 0:00,2017-10-17T00:00:00,,Partner,Transfer,Neutered Male,30.5414257,-97.46339942,11.42857143
39,1 year,A707145,Dog,Dachshund Mix,Brown/White,7/8/2014,7/10/2015 14:01,2015-07-10T14:01:00,Puppy,Partner,Transfer,Intact Female,30.32625576,-97.58265481,52.51200397
40,2 months,A710726,Cat,Domestic Shorthair Mix,Torbie,8/4/2015,10/24/2015 18:17,2015-10-24T18:17:00,*Zara,,Adoption,Spayed Female,30.38500588,-97.52092098,11.68025794
41,2 years,A699587,Dog,Miniature Poodle Mix,White,3/30/2013,4/3/2015 17:26,2015-04-03T17:26:00,Paisley,,Adoption,Spayed Female,30.28807307,-97.70830367,104.9609127
42,1 year,A691043,Dog,Pug Chihuahua Shorthair,Tan/Black,7/29/2013,11/2/2014 12:50,2014-11-02T12:50:00,Thor,Partner,Transfer,Intact Male,30.60249091,-97.55654615,65.93353175
43,2 years,A697233,Dog,Pit Bull Mix,Tan/White,2/20/2013,4/5/2015 14:10,2015-04-05T14:10:00,*Tolliver,Partner,Transfer,Neutered Male,30.30918992,-97.40739133,110.655754
44,8 years,A724746,Cat,Domestic Shorthair Mix,Orange Tabby,4/21/2008,4/22/2016 14:25,2016-04-22T14:25:00,,Partner,Transfer,Intact Male,30.37348254,-97.48765347,417.6572421
45,6 years,A674774,Dog,German Shepherd Labrador Retriever,Brown/Black,3/18/2008,3/19/2014 17:06,2014-03-19T17:06:00,Brownie,,Return to Owner,Neutered Male,30.65866278,-97.58143998,313.2446429
46,1 month,A683445,Cat,Domestic Shorthair Mix,Orange Tabby/White,6/3/2014,7/17/2014 7:55,2014-07-17T07:55:00,*Blynn,In Kennel,Died,Intact Male,30.49484256,-97.45888531,6.332837302
47,3 years,A672401,Dog,Siberian Husky Mix,Red/White,2/9/2011,2/9/2014 18:36,2014-02-09T18:36:00,Ziegen,,Return to Owner,Neutered Male,30.57311361,-97.43700345,156.6821429
48,1 year,A689217,Dog,Australian Cattle Dog Beagle,White/Red,9/30/2013,10/11/2014 19:10,2014-10-11T19:10:00,Hot Dog,,Adoption,Spayed Female,30.37078405,-97.37787508,53.82837302
49,8 years,A742234,Dog,Yorkshire Terrier Mix,Brown/Black,1/18/2009,1/28/2017 11:17,2017-01-28T11:17:00,Coco,,Return to Owner,Neutered Male,30.35717928,-97.54670925,418.9243056
50,2 years,A721406,Dog,Labrador Retriever Mix,Cream/White,2/26/2014,5/4/2016 0:00,2016-05-04T00:00:00,Lanie,,Adoption,Spayed Female,30.40951713,-97.41467687,114
51,2 years,A680890,Dog,Miniature Poodle,White,6/9/2012,6/9/2014 18:21,2014-06-09T18:21:00,,Suffering,Euthanasia,Intact Female,30.33199033,-97.55681744,104.3949405
52,1 weeks,A723050,Cat,Domestic Shorthair Mix,Brown Tabby,3/12/2016,3/25/2016 18:49,2016-03-25T18:49:00,,Partner,Transfer,Intact Male,30.35572526,-97.57433007,1.969146825
53,4 weeks,A752695,Cat,Domestic Shorthair Mix,Brown Tabby/White,5/26/2017,6/27/2017 15:07,2017-06-27T15:07:00,,Partner,Transfer,Intact Male,30.34659316,-97.31040717,4.66140873
54,1 year,A715512,Cat,Domestic Shorthair Mix,Orange Tabby,11/5/2014,1/4/2016 0:00,2016-01-04T00:00:00,*Lola,Partner,Transfer,Spayed Female,30.56026105,-97.29812215,60.71428571
55,6 years,A699222,Dog,Beagle Mix,Tricolor,6/14/2009,6/19/2015 18:43,2015-06-19T18:43:00,Scruffy,Partner,Transfer,Neutered Male,30.75399569,-97.64060954,313.8256944
56,1 month,A728660,Cat,Domestic Shorthair Mix,Brown Tabby,5/5/2016,6/30/2016 13:25,2016-06-30T13:25:00,Misty,,Adoption,Intact Female,30.3384119,-97.50993768,8.079861111
57,7 years,A754845,Dog,Chow Chow Mix,Tan,8/12/2010,8/17/2017 16:03,2017-08-17T16:03:00,Coco,,Rto-Adopt,Spayed Female,30.54990388,-97.7055343,366.0955357
58,1 year,A730275,Dog,Chinese Sharpei Mix,Brown,7/1/2015,7/9/2016 17:53,2016-07-09T17:53:00,Chai,,Adoption,Spayed Female,30.58131511,-97.6206629,53.53501984
59,4 years,A689501,Dog,Chinese Crested Mix,Black/White,10/4/2010,10/9/2014 17:20,2014-10-09T17:20:00,*Ping,,Adoption,Neutered Male,30.67946692,-97.57340233,209.531746
60,2 months,A716822,Dog,Dachshund Mix,Red/White,9/18/2015,11/30/2015 16:53,2015-11-30T16:53:00,*Sally,,Adoption,Spayed Female,30.52057505,-97.29186282,10.52906746
61,1 year,A751029,Dog,Staffordshire Mix,Blue/White,6/3/2016,6/9/2017 18:23,2017-06-09T18:23:00,,,Adoption,Spayed Female,30.31964759,-97.57250821,53.1094246
62,1 year,A669824,Dog,Labrador Retriever Mix,Black,7/27/2013,11/15/2014 15:19,2014-11-15T15:19:00,Jackson,Partner,Transfer,Neutered Male,30.61943385,-97.65793522,68.09117063
63,2 years,A728144,Dog,Border Collie Queensland Heeler,Black/White,5/31/2014,6/5/2016 15:43,2016-06-05T15:43:00,Lilly,,Adoption,Spayed Female,30.2947529,-97.42794279,105.2364087
64,1 year,A708999,Dog,Australian Cattle Dog Mix,Brown Brindle/White,11/3/2014,12/15/2015 11:00,2015-12-15T11:00:00,*Daisy,Foster,Adoption,Spayed Female,30.47034592,-97.68516405,58.20833333
65,10 years,A671822,Dog,German Shepherd Mix,Black/Tan,1/31/2006,10/11/2016 10:03,2016-10-11T10:03:00,*Milo,Foster,Adoption,Neutered Male,30.71187663,-97.29993658,558.0598214
66,6 months,A713150,Cat,Domestic Medium Hair Mix,Blue/White,4/3/2015,10/4/2015 9:00,2015-10-04T09:00:00,,SCRP,Transfer,Unknown,30.64900565,-97.30064327,26.33928571
67,12 years,A745946,Dog,Chihuahua Shorthair,White/Tan,3/29/2005,8/7/2017 12:47,2017-08-07T12:47:00,*Toodles,Foster,Adoption,Neutered Male,30.70033509,-97.57274898,644.9332341
68,4 years,A752436,Dog,Yorkshire Terrier Mix,Tricolor,6/22/2013,6/23/2017 16:48,2017-06-23T16:48:00,Rylie,,Return to Owner,Neutered Male,30.5804325,-97.54040821,208.9571429
69,3 years,A725549,Cat,Domestic Shorthair Mix,Brown Tabby/White,4/30/2013,6/12/2016 18:13,2016-06-12T18:13:00,Diz,,Adoption,Spayed Female,30.3496663,-97.33311828,162.8227183
70,3 months,A683276,Other,Raccoon Mix,Black/Gray,4/8/2014,7/9/2014 8:52,2014-07-09T08:52:00,,Rabies Risk,Euthanasia,Unknown,30.51067461,-97.2826788,13.19563492
71,2 years,A762414,Other,Raccoon,Gray/Black,11/20/2015,11/21/2017 8:20,2017-11-21T08:20:00,,Suffering,Euthanasia,Unknown,30.37189262,-97.47742722,104.6210317
72,1 year,A712292,Dog,Chihuahua Shorthair Mix,Tan/White,9/20/2014,9/21/2015 12:18,2015-09-21T12:18:00,Peanut,,Return to Owner,Spayed Female,30.76455889,-97.63048225,52.35892857
73,2 months,A666065,Cat,Domestic Shorthair Mix,Brown Tabby/White,8/26/2013,11/9/2013 18:14,2013-11-09T18:14:00,Sandy,,Adoption,Spayed Female,30.54302876,-97.68624353,10.82281746
74,9 years,A582826,Dog,Beagle,Tricolor,8/26/2005,8/18/2015 11:11,2015-08-18T11:11:00,Charlie,,Return to Owner,Neutered Male,30.33616352,-97.45077998,520.637996
75,5 months,A734883,Cat,Domestic Shorthair Mix,Blue Tabby/White,4/14/2016,9/27/2016 22:24,2016-09-27T22:24:00,,,Adoption,Neutered Male,30.49847798,-97.59303322,23.84761905
76,10 months,A703777,Cat,Domestic Shorthair Mix,Black Smoke,4/21/2015,3/11/2016 11:10,2016-03-11T11:10:00,Whisper,Foster,Adoption,Spayed Female,30.44457432,-97.30198317,46.49503968
77,4 years,A756786,Dog,Chihuahua Longhair Yorkshire Terrier,White/Tan,8/25/2013,8/28/2017 19:08,2017-08-28T19:08:00,Bebe,,Adoption,Neutered Male,30.47382989,-97.56716593,209.256746
78,1 year,A690377,Dog,Pit Bull Mix,Black/White,10/19/2013,2/20/2015 15:07,2015-02-20T15:07:00,*Pagani,,Adoption,Neutered Male,30.58040417,-97.34413054,69.94712302
79,4 weeks,A674079,Other,Bat,Brown/Black,2/7/2014,3/7/2014 10:46,2014-03-07T10:46:00,,Rabies Risk,Euthanasia,Unknown,30.76078922,-97.70866883,4.064087302
80,4 months,A687309,Dog,Miniature Poodle Mix,Cream,5/3/2014,9/7/2014 16:48,2014-09-07T16:48:00,,Partner,Transfer,Neutered Male,30.34981432,-97.33557631,18.24285714
81,11 months,A678782,Cat,Domestic Shorthair Mix,Black,3/28/2014,3/2/2015 15:10,2015-03-02T15:10:00,Fred,Partner,Transfer,Neutered Male,30.29583866,-97.55849055,48.51884921
82,3 years,A723765,Dog,Queensland Heeler Mix,White/Red Merle,4/6/2013,4/6/2016 16:50,2016-04-06T16:50:00,Dewie,,Return to Owner,Spayed Female,30.27694519,-97.31492229,156.671627
83,4 years,A738497,Cat,Domestic Shorthair Mix,Brown Tabby,11/16/2012,12/22/2016 13:35,2016-12-22T13:35:00,*Kyleigh,Partner,Transfer,Spayed Female,30.68063452,-97.66787545,213.937996
84,1 year,A704521,Cat,Domestic Shorthair Mix,Orange Tabby,6/5/2014,6/24/2015 16:41,2015-06-24T16:41:00,*Goldie,Partner,Transfer,Spayed Female,30.49896344,-97.67515706,54.95644841
85,11 years,A323668,Dog,Australian Cattle Dog Mix,Tricolor,5/15/2003,3/6/2015 17:36,2015-03-06T17:36:00,Ringo,,Return to Owner,Neutered Male,30.50798908,-97.55348875,616.247619
86,6 years,A724022,Dog,Chihuahua Shorthair Mix,Tan/Red,4/10/2011,5/24/2017 16:15,2017-05-24T16:15:00,Pepe,,Return to Owner,Neutered Male,30.40541623,-97.5924478,319.5252976
87,1 year,A724478,Dog,Flat Coat Retriever Mix,Black,4/18/2015,5/4/2016 16:45,2016-05-04T16:45:00,Shadow,,Adoption,Neutered Male,30.52659064,-97.64024461,54.67113095
88,7 years,A663438,Dog,Labrador Retriever Mix,Sable,9/18/2006,6/14/2014 16:40,2014-06-14T16:40:00,Bonny,,Adoption,Spayed Female,30.71339193,-97.30775521,403.8134921
89,1 year,A724814,Cat,Domestic Shorthair Mix,Black,4/22/2015,6/28/2016 0:00,2016-06-28T00:00:00,*Oaxaca,,Adoption,Spayed Female,30.44652034,-97.67756338,61.85714286
90,4 months,A765965,Dog,Pointer Mix,Chocolate/White,9/30/2017,2/1/2018 16:11,2018-02-01T16:11:00,Coco,,Adoption,Spayed Female,30.31972316,-97.25627018,17.81061508
91,14 years,A724729,Cat,Domestic Longhair Mix,Calico,4/21/2002,4/24/2016 15:52,2016-04-24T15:52:00,Victoria,,Return to Owner,Spayed Female,30.42510298,-97.64833639,731.0944444
92,2 years,A725343,Dog,Pit Bull Mix,Brown Brindle/White,4/28/2014,7/13/2016 18:13,2016-07-13T18:13:00,Luna,,Adoption,Spayed Female,30.42835987,-97.35458626,115.3941468
93,2 months,A707888,Cat,Domestic Shorthair Mix,Brown Tabby/White,5/4/2015,7/25/2015 12:01,2015-07-25T12:01:00,Sammy,,Adoption,Neutered Male,30.34820438,-97.35051545,11.78581349
94,2 months,A682638,Cat,Domestic Shorthair Mix,Brown Tabby,5/15/2014,7/18/2014 17:08,2014-07-18T17:08:00,Marie,,Adoption,Spayed Female,30.32132108,-97.3396321,9.24484127
95,1 year,A742473,Cat,Domestic Shorthair Mix,Brown Tabby/Brown,1/22/2016,1/23/2017 9:00,2017-01-23T09:00:00,,SCRP,Transfer,Spayed Female,30.64241024,-97.52576656,52.48214286
96,4 months,A742468,Cat,Domestic Shorthair Mix,Black,9/22/2016,1/28/2017 16:57,2017-01-28T16:57:00,Jiji,,Adoption,Spayed Female,30.63338637,-97.4648295,18.38660714
97,2 weeks,A694902,Dog,Pit Bull Mix,White/Tricolor,12/22/2014,1/8/2015 12:39,2015-01-08T12:39:00,,,Return to Owner,Intact Female,30.6508855,-97.49358322,2.503869048
98,10 months,A761936,Dog,Scottish Terrier Mix,Brown Brindle,1/12/2017,11/16/2017 12:54,2017-11-16T12:54:00,,Partner,Transfer,Intact Male,30.61119534,-97.42060967,44.07678571
99,1 year,A679645,Dog,Boxer Queensland Heeler,White/Black,5/24/2013,6/17/2014 18:18,2014-06-17T18:18:00,*Calvin,Behavior,Euthanasia,Neutered Male,30.49388078,-97.37954544,55.68035714
100,2 months,A665579,Cat,Domestic Shorthair Mix,Black,8/19/2013,11/4/2013 15:09,2013-11-04T15:09:00,*Candy,Partner,Transfer,Neutered Male,30.62338383,-97.67180824,11.09017857
101,1 year,A734988,Dog,Catahoula Mix,Brown Brindle/White,9/16/2015,1/3/2017 16:15,2017-01-03T16:15:00,*Avalon,,Adoption,Spayed Female,30.59386336,-97.29242243,67.95386905
102,4 months,A664597,Dog,Pit Bull Mix,Blue/White,6/5/2013,10/11/2013 14:00,2013-10-11T14:00:00,Phoebe,Partner,Transfer,Intact Female,30.35627644,-97.39334418,18.36904762
103,5 years,A763871,Dog,Great Pyrenees Mix,Cream,6/18/2012,12/18/2017 16:00,2017-12-18T16:00:00,Guardian,,Return to Owner,Intact Male,30.35206139,-97.71263714,287.0952381
104,2 years,A717889,Dog,Pit Bull Mix,White/Black,12/17/2013,1/21/2016 19:18,2016-01-21T19:18:00,Lulu,,Adoption,Spayed Female,30.31064806,-97.32099504,109.4005952
105,3 years,A705317,Dog,Boxer Mix,Brown Brindle/White,6/16/2012,6/23/2015 17:54,2015-06-23T17:54:00,*Gretel,,Adoption,Spayed Female,30.66172858,-97.27452998,157.535119
106,5 years,A722207,Dog,Labrador Retriever Mix,Red,3/12/2011,3/12/2016 18:11,2016-03-12T18:11:00,Honey,,Return to Owner,Spayed Female,30.47977633,-97.55793438,261.1082341
107,1 year,A681101,Cat,Domestic Shorthair Mix,Brown Tabby,6/12/2013,6/19/2014 14:36,2014-06-19T14:36:00,Spaghetti,Partner,Transfer,Spayed Female,30.59178052,-97.73211734,53.2297619
108,2 years,A732772,Cat,Domestic Shorthair Mix,Black/White,8/13/2014,8/13/2016 16:44,2016-08-13T16:44:00,,Partner,Transfer,Intact Female,30.50725261,-97.5041827,104.5281746
109,3 weeks,A736742,Cat,Domestic Shorthair Mix,Black Tabby,9/24/2016,10/16/2016 17:45,2016-10-16T17:45:00,,Partner,Transfer,Unknown,30.44043841,-97.71263698,3.248511905
110,7 months,A735432,Cat,Domestic Shorthair,White/Brown Tabby,3/23/2016,11/11/2016 12:39,2016-11-11T12:39:00,*Ninfa,,Adoption,Spayed Female,30.46077836,-97.68553695,33.3610119
111,6 years,A729315,Dog,Chihuahua Shorthair Mix,Tricolor,1/16/2010,6/20/2016 0:00,2016-06-20T00:00:00,Abby,Partner,Transfer,Spayed Female,30.51642112,-97.72124964,335.2857143
112,1 year,A748631,Dog,Chihuahua Shorthair Mix,Black,5/4/2016,5/8/2017 17:01,2017-05-08T17:01:00,,,Adoption,Spayed Female,30.68789573,-97.24791016,52.8155754
113,3 years,A669295,Dog,Labrador Retriever Mix,Brown,12/18/2010,4/4/2014 18:37,2014-04-04T18:37:00,Niko,,Adoption,Neutered Male,30.74707663,-97.26533295,171.9679563
114,10 months,A704099,Dog,American Bulldog Mix,White/Brown,8/1/2014,6/11/2015 16:48,2015-06-11T16:48:00,*Sarah,,Adoption,Spayed Female,30.69532699,-97.71059371,44.95714286
115,5 months,A673387,Cat,Domestic Shorthair Mix,Brown Tabby/White,9/23/2013,3/2/2014 16:43,2014-03-02T16:43:00,Alex,,Adoption,Neutered Male,30.33977396,-97.49226594,22.95664683
116,2 years,A723147,Dog,Pit Bull Mix,Brown/Black,3/27/2014,4/6/2016 16:47,2016-04-06T16:47:00,Major,,Return to Owner,Spayed Female,30.32836625,-97.34589456,105.9570437
117,2 years,A718636,Dog,Pit Bull Mix,Brown Brindle/White,1/3/2014,4/1/2016 15:06,2016-04-01T15:06:00,*Hans Knut,,Adoption,Neutered Male,30.66066978,-97.67683189,117.089881
118,1 year,A685713,Other,Armadillo Mix,Gray,8/11/2013,8/12/2014 10:36,2014-08-12T10:36:00,,Medical,Euthanasia,Unknown,30.52182784,-97.25263933,52.34880952
119,2 months,A706329,Cat,Domestic Shorthair Mix,Brown Tabby,6/5/2015,8/30/2015 16:24,2015-08-30T16:24:00,*Flopsy,Offsite,Adoption,Spayed Female,30.64848189,-97.69971671,12.38333333
120,7 years,A743006,Dog,Dachshund Longhair Mix,Blue Tick,2/2/2010,2/2/2017 18:53,2017-02-02T18:53:00,Elmer,,Return to Owner,Intact Male,30.38624168,-97.36200488,365.3981151
121,5 months,A750619,Dog,Labrador Retriever Mix,Blue,12/7/2016,6/2/2017 18:26,2017-06-02T18:26:00,Carrie,,Adoption,Spayed Female,30.31434761,-97.68780188,25.39543651
122,6 years,A740541,Cat,Domestic Medium Hair Mix,Black/White,12/19/2010,12/19/2016 18:44,2016-12-19T18:44:00,Georgie Boy,,Return to Owner,Neutered Male,30.58501204,-97.49484296,313.2543651
123,1 year,A669638,Dog,Pit Bull Mix,Tan/White,12/23/2012,7/29/2014 12:58,2014-07-29T12:58:00,Rufus,Partner,Transfer,Neutered Male,30.27938659,-97.3127575,83.36289683
124,4 years,A549989,Cat,Domestic Shorthair Mix,Black/White,5/9/2009,10/12/2013 18:58,2013-10-12T18:58:00,Bert,,Adoption,Neutered Male,30.65917154,-97.65202046,231.1128968
125,1 year,A710766,Other,Bat Mix,Brown,8/27/2014,8/27/2015 14:23,2015-08-27T14:23:00,,Rabies Risk,Euthanasia,Unknown,30.36045071,-97.72157978,52.22847222
126,2 years,A691714,Dog,Chihuahua Shorthair Mix,Tricolor,11/8/2012,2/23/2015 13:25,2015-02-23T13:25:00,Archer,Partner,Transfer,Neutered Male,30.71708329,-97.55459904,119.6512897
127,6 years,A645075,Dog,Labrador Retriever Mix,Chocolate,1/2/2008,11/25/2014 10:40,2014-11-25T10:40:00,Bear,Aggressive,Euthanasia,Intact Male,30.29971277,-97.277658,359.9206349
128,2 years,A731542,Dog,Pit Bull Mix,Brown Brindle/White,7/23/2014,9/2/2016 17:49,2016-09-02T17:49:00,Roscoe,,Return to Owner,Neutered Male,30.54334757,-97.73988026,110.3917659
129,1 month,A745619,Dog,English Bulldog Mix,Black/White,1/21/2017,3/23/2017 16:08,2017-03-23T16:08:00,,Partner,Transfer,Intact Female,30.73843869,-97.3251826,8.81031746
130,2 years,A705676,Dog,Chihuahua Shorthair Mix,White/Tan,6/20/2013,7/4/2015 13:31,2015-07-04T13:31:00,*Lacey,,Adoption,Spayed Female,30.62075983,-97.30352288,106.3661706
131,1 year,A692656,Dog,Labrador Retriever Mix,Yellow,11/24/2013,12/4/2014 17:26,2014-12-04T17:26:00,Gordo,Partner,Transfer,Neutered Male,30.70002536,-97.45803038,53.67519841
132,2 years,A684391,Dog,Jack Russell Terrier Mix,White/Black,7/22/2012,8/22/2014 18:25,2014-08-22T18:25:00,,,Adoption,Neutered Male,30.70276111,-97.26885632,108.8239087
133,2 years,A753658,Dog,Beagle Mix,Red,7/9/2015,7/11/2017 11:49,2017-07-11T11:49:00,,Partner,Transfer,Intact Female,30.56228725,-97.58571392,104.784623
134,3 years,A731736,Dog,Pit Bull Mix,White,7/26/2013,3/2/2017 13:06,2017-03-02T13:06:00,Novah,Partner,Transfer,Spayed Female,30.28601105,-97.39748006,187.935119
135,2 months,A688274,Dog,Chihuahua Shorthair Mix,Sable/White,7/17/2014,9/20/2014 15:33,2014-09-20T15:33:00,,Offsite,Adoption,Spayed Female,30.50137197,-97.52907822,9.37827381
136,2 years,A750398,Dog,Chihuahua Shorthair Mix,White/Tan,5/26/2015,5/30/2017 18:04,2017-05-30T18:04:00,,,Adoption,Neutered Male,30.73005867,-97.42570446,105.1075397
137,2 years,A765203,Other,Fox Mix,Brown,1/15/2016,1/17/2018 8:35,2018-01-17T08:35:00,,,Euthanasia,Unknown,30.70631818,-97.63959111,104.765377
138,4 months,A721005,Dog,Labrador Retriever Mix,Black,10/19/2015,2/23/2016 17:00,2016-02-23T17:00:00,,,Adoption,Spayed Female,30.27628227,-97.54219909,18.24404762
139,6 months,A690312,Cat,Domestic Shorthair Mix,Blue Tabby,4/18/2014,10/20/2014 9:00,2014-10-20T09:00:00,,SCRP,Transfer,Intact Female,30.52814344,-97.60996465,26.48214286
140,3 years,A759566,Dog,Chihuahua Shorthair Rat Terrier,Cream,4/3/2014,10/21/2017 11:35,2017-10-21T11:35:00,Hiro,,Adoption,Neutered Male,30.54029858,-97.46834848,185.3546627
141,10 months,A693176,Dog,Beagle Mix,Tan/White,2/3/2014,12/7/2014 17:06,2014-12-07T17:06:00,Dakota,,Adoption,Spayed Female,30.59818808,-97.35274981,43.95892857
142,13 years,A634994,Cat,Domestic Shorthair Mix,Brown Tabby/White,4/30/2004,4/30/2017 15:50,2017-04-30T15:50:00,Jolie,,Return to Owner,Spayed Female,30.6803902,-97.24908104,678.3799603
143,8 years,A710709,Dog,Australian Kelpie Mix,Black/Tan,8/26/2007,9/13/2015 16:02,2015-09-13T16:02:00,*Gwen,,Adoption,Spayed Female,30.32102391,-97.26504888,420.0954365
144,7 years,A726589,Cat,Domestic Shorthair Mix,Black/White,5/19/2009,11/12/2016 14:56,2016-11-12T14:56:00,Kramer,Foster,Adoption,Neutered Male,30.3459586,-97.26629977,390.6603175
145,2 months,A726388,Cat,Domestic Longhair Mix,Blue Tabby/White,4/10/2016,6/28/2016 16:50,2016-06-28T16:50:00,*Cobalt,,Adoption,Spayed Female,30.36481523,-97.3592239,11.3859127
146,3 months,A682162,Cat,Domestic Shorthair Mix,Calico,3/25/2014,7/13/2014 11:25,2014-07-13T11:25:00,Khalesi,Foster,Adoption,Spayed Female,30.51352275,-97.2540721,15.78224206
147,2 years,A663015,Dog,Miniature Pinscher Mix,Black/Tan,9/11/2011,7/15/2014 17:10,2014-07-15T17:10:00,Bugs,,Adoption,Neutered Male,30.37585681,-97.30292432,148.3878968
148,1 year,A691834,Dog,Miniature Schnauzer Jack Russell Terrier,Brown/Black,11/10/2013,1/20/2015 18:53,2015-01-20T18:53:00,Fifi,,Return to Owner,Spayed Female,30.62604312,-97.71655576,62.39811508
149,12 years,A716224,Dog,Australian Shepherd Mix,Brown/Red Tick,11/17/2003,11/17/2015 16:45,2015-11-17T16:45:00,Skylos,,Return to Owner,Neutered Male,30.7187957,-97.59758949,626.2425595
150,8 years,A697686,Cat,Domestic Longhair Mix,Black/White,2/26/2007,8/12/2015 12:02,2015-08-12T12:02:00,*Remy,Suffering,Euthanasia,Spayed Female,30.33585544,-97.52633892,441.3573413
151,2 months,A749815,Cat,Domestic Medium Hair Mix,Black,4/20/2017,7/6/2017 16:01,2017-07-06T16:01:00,,Foster,Adoption,Spayed Female,30.45894011,-97.3632575,11.0953373
152,2 years,A716434,Dog,Blue Lacy,Brown/White,11/19/2013,11/27/2015 18:58,2015-11-27T18:58:00,*Bonnie,,Adoption,Spayed Female,30.44966548,-97.72840732,105.5414683
153,3 months,A749370,Cat,Domestic Medium Hair Mix,Tortie,2/11/2017,5/18/2017 17:37,2017-05-18T17:37:00,,,Adoption,Spayed Female,30.27288419,-97.54763633,13.81914683
154,3 years,A665831,Dog,Labrador Retriever Pit Bull,Red,3/23/2013,11/18/2016 19:13,2016-11-18T19:13:00,Smokey,,Return to Owner,Neutered Male,30.60684677,-97.73914785,190.9715278
155,4 months,A751678,Dog,Chihuahua Shorthair Mix,Cream,2/11/2017,6/22/2017 18:45,2017-06-22T18:45:00,Canela,,Adoption,Spayed Female,30.73370713,-97.24483533,18.82589286
156,1 weeks,A687008,Cat,Domestic Shorthair Mix,Black/White,8/20/2014,8/30/2014 12:58,2014-08-30T12:58:00,,Partner,Transfer,Intact Male,30.71226628,-97.61046441,1.505753968
157,2 weeks,A677571,Cat,Domestic Medium Hair Mix,Blue Tabby/White,4/6/2014,4/26/2014 15:25,2014-04-26T15:25:00,,Partner,Transfer,Intact Male,30.61467282,-97.59343759,2.94890873
158,7 months,A662943,Cat,Domestic Shorthair Mix,Black,3/10/2013,10/13/2013 18:25,2013-10-13T18:25:00,*Harry,,Adoption,Neutered Male,30.33746674,-97.33105616,31.10962302
159,4 years,A703522,Dog,Miniature Schnauzer Mix,White,12/25/2010,6/8/2015 17:03,2015-06-08T17:03:00,Bella,,Adoption,Spayed Female,30.43781327,-97.73869907,232.3872024
160,1 year,A703739,Other,Rex Mix,Brown/White,5/28/2014,6/3/2015 9:37,2015-06-03T09:37:00,,In Kennel,Died,Unknown,30.65261266,-97.61244559,53.05724206
161,2 years,A696155,Dog,Pit Bull Mix,Red,1/30/2013,12/5/2015 12:30,2015-12-05T12:30:00,Brurdaoex,,Return to Owner,Neutered Male,30.4738122,-97.72393135,148.5029762
162,2 months,A675365,Dog,Labrador Retriever Mix,Cream,12/30/2013,3/30/2014 18:16,2014-03-30T18:16:00,,,Adoption,Spayed Female,30.74723691,-97.55756004,12.96587302
163,11 months,A659830,Dog,Labrador Retriever Doberman Pinsch,Black,7/23/2013,6/25/2014 13:29,2014-06-25T13:29:00,*Harry,Foster,Adoption,Neutered Male,30.537151,-97.39774578,48.22311508
164,1 weeks,A680705,Cat,Domestic Shorthair Mix,Black/White,5/28/2014,6/6/2014 14:39,2014-06-06T14:39:00,,Partner,Transfer,Intact Male,30.31091243,-97.34131021,1.372916667
165,3 years,A749468,Cat,Domestic Shorthair Mix,Orange Tabby,5/15/2014,5/26/2017 18:56,2017-05-26T18:56:00,,Snr,Transfer,Neutered Male,30.6481838,-97.29247126,158.2555556
166,2 years,A742094,Other,Bat Mix,Brown,1/14/2015,1/15/2017 8:57,2017-01-15T08:57:00,,Rabies Risk,Euthanasia,Unknown,30.76216703,-97.34025935,104.6247024
167,3 years,A715876,Dog,German Shepherd Mix,Black/Tan,11/11/2012,11/25/2015 11:49,2015-11-25T11:49:00,Precious,,Adoption,Spayed Female,30.46232364,-97.49213469,158.4989087
168,1 year,A709833,Cat,Domestic Shorthair Mix,Blue/White,8/13/2014,8/14/2015 9:00,2015-08-14T09:00:00,,SCRP,Transfer,Unknown,30.27863656,-97.37947218,52.33928571
169,2 months,A706256,Dog,German Shepherd Mix,Tan,4/30/2015,7/2/2015 17:40,2015-07-02T17:40:00,*Groot,,Adoption,Neutered Male,30.28475734,-97.32908816,9.10515873
170,4 months,A732728,Cat,Domestic Shorthair Mix,Black,4/12/2016,8/13/2016 16:42,2016-08-13T16:42:00,,Partner,Transfer,Intact Male,30.39929667,-97.28174277,17.67083333
171,5 months,A711243,Cat,Domestic Shorthair Mix,Cream Tabby,4/4/2015,9/5/2015 9:00,2015-09-05T09:00:00,,SCRP,Transfer,Intact Male,30.53490013,-97.27882834,22.05357143
172,1 month,A692638,Dog,Australian Cattle Dog Mix,Blue Merle,10/13/2014,12/8/2014 18:30,2014-12-08T18:30:00,,Foster,Adoption,Spayed Female,30.67333994,-97.62242819,8.110119048
173,1 year,A684424,Cat,Domestic Shorthair Mix,Black,7/23/2013,7/26/2014 11:43,2014-07-26T11:43:00,Midnight,Partner,Transfer,Intact Female,30.28629453,-97.36099559,52.64117063
174,2 months,A680005,Dog,Australian Kelpie Mix,Tan/Black,3/29/2014,6/1/2014 18:16,2014-06-01T18:16:00,,,Adoption,Neutered Male,30.33304315,-97.39934116,9.251587302
175,2 years,A622351,Dog,Chihuahua Shorthair Mix,Brown,8/19/2011,2/24/2014 11:17,2014-02-24T11:17:00,Alvin,Partner,Transfer,Intact Male,30.28053463,-97.72932469,131.4957341
176,7 years,A565498,Dog,Rottweiler Labrador Retriever,Black/Tan,1/25/2007,2/5/2014 15:49,2014-02-05T15:49:00,Dukey,,Return to Owner,Neutered Male,30.33252145,-97.34082276,366.9512897
177,1 year,A673261,Dog,German Shepherd Doberman Pinsch,Black/Tan,2/21/2013,4/27/2014 16:02,2014-04-27T16:02:00,Danny,,Adoption,Neutered Male,30.44358528,-97.24672573,61.52400794
178,1 month,A752260,Other,Raccoon Mix,Gray/Black,4/20/2017,6/20/2017 14:06,2017-06-20T14:06:00,,Medical,Euthanasia,Unknown,30.52088368,-97.38291113,8.798214286
179,2 months,A694422,Cat,Domestic Shorthair Mix,Calico,11/15/2014,1/24/2015 11:39,2015-01-24T11:39:00,*Calla,Partner,Transfer,Spayed Female,30.39964529,-97.67599041,10.06934524
180,5 years,A661631,Dog,Yorkshire Terrier Yorkshire Terrier,Brown,8/22/2011,3/4/2017 18:14,2017-03-04T18:14:00,Peke,,Adoption,Neutered Male,30.52787152,-97.52451282,288.8228175
181,2 months,A702839,Cat,Domestic Shorthair Mix,Tortie,4/18/2015,7/18/2015 16:47,2015-07-18T16:47:00,*Tort,Foster,Adoption,Spayed Female,30.40128963,-97.26853051,13.09990079
182,1 year,A755069,Other,Bat,Brown,7/28/2016,7/31/2017 9:48,2017-07-31T09:48:00,,Rabies Risk,Euthanasia,Unknown,30.35055168,-97.62907391,52.6297619
183,2 years,A743493,Dog,Great Dane Mix,Black,6/2/2014,2/11/2017 15:18,2017-02-11T15:18:00,King,,Return to Owner,Neutered Male,30.28973518,-97.30774743,140.8053571
184,1 month,A751734,Cat,Domestic Shorthair Mix,Blue,5/5/2017,6/18/2017 17:24,2017-06-18T17:24:00,*Hannah,Partner,Transfer,Intact Female,30.64536484,-97.47681018,6.389285714
185,2 years,A716081,Dog,Pomeranian Mix,Buff,11/13/2013,12/2/2015 0:00,2015-12-02T00:00:00,Baby Bear,Partner,Transfer,Intact Male,30.52456379,-97.40271571,107
186,2 years,A686576,Dog,Labrador Retriever Mix,Buff,8/23/2012,8/27/2014 16:04,2014-08-27T16:04:00,,Partner,Transfer,Spayed Female,30.61499082,-97.44035894,104.9527778
187,1 year,A705201,Dog,Cardigan Welsh Corgi Mix,White,6/14/2014,6/28/2015 17:51,2015-06-28T17:51:00,Daisy,,Adoption,Spayed Female,30.59353476,-97.60560951,54.24910714
188,3 years,A733000,Other,Bat,Brown,8/16/2013,8/16/2016 9:03,2016-08-16T09:03:00,,Rabies Risk,Euthanasia,Unknown,30.65727471,-97.49923897,156.6252976
189,1 year,A719360,Dog,Labrador Retriever Mix,Black/White,11/18/2015,7/16/2017 23:09,2017-07-16T23:09:00,Champ,,Adoption,Neutered Male,30.31503893,-97.6910306,86.70922619
190,7 years,A726037,Dog,Chinese Sharpei Mix,Brown Brindle,5/5/2009,5/5/2016 13:37,2016-05-05T13:37:00,Rocca,,Return to Owner,Spayed Female,30.70041254,-97.25586156,365.3667659
191,8 months,A736057,Cat,Domestic Shorthair Mix,Blue Tabby,3/3/2016,11/26/2016 14:27,2016-11-26T14:27:00,Devin,Partner,Transfer,Neutered Male,30.32222733,-97.57932021,38.37172619
192,3 years,A684915,Dog,Maltese Mix,White,7/30/2011,8/6/2014 18:50,2014-08-06T18:50:00,*Yogi,,Adoption,Neutered Male,30.43146859,-97.41990509,157.6835317
193,2 months,A728227,Dog,Pit Bull Mix,Brown,4/1/2016,6/6/2016 15:04,2016-06-06T15:04:00,,,Adoption,Spayed Female,30.72935849,-97.64203111,9.518253968
194,1 year,A686233,Cat,Domestic Shorthair Mix,Blue Tabby/White,2/18/2013,10/14/2014 14:52,2014-10-14T14:52:00,Marvin,Partner,Transfer,Neutered Male,30.61534186,-97.67269395,86.23134921
195,1 year,A763060,Dog,Pit Bull Mix,White,12/2/2016,1/9/2018 17:46,2018-01-09T17:46:00,*Cambria,Foster,Adoption,Spayed Female,30.32705511,-97.6846677,57.67718254
196,1 year,A750139,Cat,Domestic Shorthair Mix,Black,11/23/2015,6/9/2017 12:52,2017-06-09T12:52:00,,Partner,Transfer,Neutered Male,30.52836194,-97.54050738,80.64801587
197,2 years,A758439,Dog,Staffordshire Mix,Fawn,9/16/2015,11/16/2017 11:10,2017-11-16T11:10:00,Bae,,Adoption,Spayed Female,30.50737861,-97.44443933,113.2093254
198,8 years,A758897,Dog,Miniature Pinscher Mix,Black,9/23/2009,9/24/2017 14:50,2017-09-24T14:50:00,Dumpling,Partner,Transfer,Intact Female,30.42744025,-97.6948322,417.6597222
199,2 years,A675506,Cat,Domestic Shorthair Mix,Black,3/28/2012,4/1/2014 13:21,2014-04-01T13:21:00,Justice,,Return to Owner,Neutered Male,30.55214211,-97.52728008,104.9366071
200,5 years,A765802,Cat,Domestic Longhair Mix,Black/White,1/27/2013,1/31/2018 18:05,2018-01-31T18:05:00,,Snr,Transfer,Neutered Male,30.73704834,-97.59023938,261.5362103
201,6 years,A548770,Cat,Domestic Shorthair Mix,Orange Tabby/White,7/5/2007,11/5/2013 15:19,2013-11-05T15:19:00,Firecat,Rabies Risk,Euthanasia,Neutered Male,30.36032346,-97.38523969,330.8054563
202,1 year,A739227,Cat,Domestic Shorthair Mix,Gray/White,11/29/2015,11/30/2016 9:00,2016-11-30T09:00:00,,SCRP,Transfer,Intact Female,30.57220289,-97.59333187,52.48214286
203,5 years,A670612,Dog,Beagle,Brown/White,9/4/2011,11/18/2016 14:08,2016-11-18T14:08:00,Sheila,,Return to Owner,Intact Female,30.269928,-97.71110784,271.7984127
204,3 years,A675567,Dog,Siberian Husky Mix,Black/White,11/24/2010,3/30/2014 8:56,2014-03-30T08:56:00,Lola,,Return to Owner,Spayed Female,30.53735617,-97.50347425,174.6246032
205,2 months,A707763,Cat,Domestic Shorthair Mix,Cream Tabby,4/26/2015,7/19/2015 13:48,2015-07-19T13:48:00,Tinkerbell,Foster,Adoption,Spayed Female,30.31920515,-97.61177001,12.08214286
206,1 year,A733433,Other,Bat,Black/Brown,8/21/2015,8/21/2016 16:42,2016-08-21T16:42:00,,Rabies Risk,Euthanasia,Unknown,30.27045784,-97.65667539,52.38511905
207,4 weeks,A679691,Other,Bat,Brown/Black,4/24/2014,5/25/2014 9:38,2014-05-25T09:38:00,,In Kennel,Died,Unknown,30.36881794,-97.65976702,4.485912698
208,1 year,A762373,Dog,Pit Bull Mix,Brown Brindle/Black,11/19/2016,11/19/2017 14:29,2017-11-19T14:29:00,Tiny,,Return to Owner,Intact Female,30.36235403,-97.25965426,52.22906746
209,5 years,A718671,Cat,Domestic Shorthair Mix,Blue Tabby,1/4/2011,1/11/2016 18:49,2016-01-11T18:49:00,Boris,,Adoption,Neutered Male,30.4085971,-97.26382992,261.9691468
210,3 years,A707346,Dog,Chihuahua Shorthair Mix,Chocolate/White,7/11/2012,7/15/2015 12:12,2015-07-15T12:12:00,*Elsie,,Adoption,Spayed Female,30.30499726,-97.3410131,157.072619
211,1 year,A713751,Cat,Domestic Medium Hair Mix,Brown Tabby,10/12/2014,10/21/2015 13:37,2015-10-21T13:37:00,Big Boy,Partner,Transfer,Neutered Male,30.49858975,-97.72092239,53.50962302
212,2 years,A761025,Dog,Catahoula Mix,Tan/Black,10/27/2015,1/14/2018 17:15,2018-01-14T17:15:00,*Glacier,,Adoption,Neutered Male,30.66618673,-97.62632748,115.8169643
213,1 year,A670923,Dog,Pit Bull Mix,Brown Brindle,3/22/2012,2/6/2014 14:01,2014-02-06T14:01:00,Kayna,Behavior,Euthanasia,Spayed Female,30.73863238,-97.66435679,98.08343254
214,10 months,A669721,Cat,Domestic Shorthair Mix,Calico,2/26/2013,12/30/2013 16:30,2013-12-30T16:30:00,*Peach,,Adoption,Spayed Female,30.44043887,-97.54281088,43.95535714
215,4 days,A697914,Cat,Domestic Shorthair Mix,Black/White,2/27/2015,3/3/2015 17:08,2015-03-03T17:08:00,,Partner,Transfer,Unknown,30.42335024,-97.66366488,0.673412698
216,1 year,A694785,Dog,German Shepherd Mix,Tan,1/11/2014,2/11/2015 12:32,2015-02-11T12:32:00,Zazu,Partner,Transfer,Neutered Male,30.28138213,-97.2744914,56.64603175
217,3 years,A759872,Cat,Domestic Shorthair Mix,White/Brown Tabby,10/8/2014,10/13/2017 19:09,2017-10-13T19:09:00,,Snr,Transfer,Spayed Female,30.3997136,-97.54256116,157.3997024
218,2 months,A687188,Dog,Pit Bull Mix,White,6/17/2014,9/6/2014 18:10,2014-09-06T18:10:00,*Miss Sally,,Adoption,Spayed Female,30.53753481,-97.59482018,11.67956349
219,3 months,A751403,Cat,Domestic Shorthair Mix,Blue Tabby,3/7/2017,7/1/2017 17:16,2017-07-01T17:16:00,*Genevieve,,Adoption,Spayed Female,30.30693765,-97.71769557,16.67420635
220,2 months,A752614,Cat,Domestic Shorthair Mix,Orange Tabby/White,5/9/2017,8/7/2017 18:14,2017-08-07T18:14:00,*Matt,,Adoption,Neutered Male,30.45569098,-97.25727152,12.9656746
221,2 years,A706341,Dog,Chihuahua Shorthair Mix,Black/White,6/27/2013,7/8/2015 15:14,2015-07-08T15:14:00,*Meg,Partner,Transfer,Intact Female,30.62645852,-97.54006587,105.9478175
222,2 years,A741975,Dog,Dachshund Mix,Brown/White,1/12/2015,1/13/2017 14:08,2017-01-13T14:08:00,Major,,Return to Owner,Neutered Male,30.47487031,-97.28914783,104.6555556
223,2 years,A667041,Dog,Carolina Dog Mix,White/Black,11/11/2011,2/3/2014 12:45,2014-02-03T12:45:00,Ethyl,,Adoption,Spayed Female,30.44616661,-97.47497993,116.5044643
224,2 years,A664931,Dog,Rat Terrier Mix,White/Brown,10/11/2012,12/4/2014 15:43,2014-12-04T15:43:00,Chester,,Return to Owner,Neutered Male,30.67528029,-97.55918827,112.0935516
225,2 years,A760262,Dog,Chihuahua Shorthair Mix,Black/Brown,10/15/2015,10/20/2017 10:04,2017-10-20T10:04:00,*Betty,Partner,Transfer,Spayed Female,30.57680811,-97.54059793,105.2027778
226,1 month,A682578,Dog,Miniature Poodle Mix,Black/White,6/16/2014,7/23/2014 16:02,2014-07-23T16:02:00,,Partner,Transfer,Intact Female,30.35922992,-97.32395515,5.381150794
227,2 months,A694291,Cat,Domestic Shorthair Mix,Orange Tabby,10/24/2014,1/9/2015 13:27,2015-01-09T13:27:00,*Larry,Partner,Transfer,Intact Male,30.71572076,-97.31447301,11.08005952
228,4 days,A686621,Cat,Domestic Shorthair Mix,Black/White,8/20/2014,8/24/2014 15:42,2014-08-24T15:42:00,,Partner,Transfer,Intact Female,30.482402,-97.24619396,0.664880952
229,1 year,A669415,Dog,Chihuahua Shorthair Mix,Brown/White,6/20/2012,12/29/2013 13:39,2013-12-29T13:39:00,,,Adoption,Neutered Male,30.64852616,-97.69994254,79.65267857
230,1 year,A720018,Dog,Pit Bull Mix,Brown Brindle/White,2/1/2015,2/16/2016 17:10,2016-02-16T17:10:00,Ripley,,Adoption,Intact Female,30.7561854,-97.45821165,54.38789683
231,3 weeks,A702969,Cat,Domestic Shorthair Mix,Black/White,4/27/2015,5/22/2015 14:19,2015-05-22T14:19:00,*Briana,Partner,Transfer,Intact Female,30.43026234,-97.71861007,3.656646825
232,1 month,A747673,Cat,Domestic Shorthair Mix,Brown Tabby,3/20/2017,4/25/2017 15:38,2017-04-25T15:38:00,*Benny,Partner,Transfer,Intact Male,30.5196423,-97.30401013,5.235912698
233,9 months,A700847,Dog,German Shepherd Mix,Brown/Black,7/20/2014,4/25/2015 16:29,2015-04-25T16:29:00,,Partner,Transfer,Intact Female,30.42391147,-97.4399382,39.95525794
234,2 years,A734683,Dog,Golden Retriever,Red,9/11/2014,9/15/2016 11:24,2016-09-15T11:24:00,Sapphire,Partner,Transfer,Spayed Female,30.48611496,-97.26911619,105.0678571
235,2 months,A669543,Dog,Labrador Retriever German Shepherd,Chocolate,10/22/2013,12/24/2013 15:41,2013-12-24T15:41:00,Harley,,Adoption,Neutered Male,30.57207233,-97.59607345,9.093353175
236,2 months,A693174,Cat,Domestic Shorthair Mix,Torbie/White,9/18/2014,12/13/2014 17:28,2014-12-13T17:28:00,*Sally,,Adoption,Intact Female,30.30521851,-97.63288134,12.38968254
237,2 months,A726753,Cat,Domestic Shorthair Mix,Brown Tabby,3/14/2016,5/28/2016 15:43,2016-05-28T15:43:00,*Bobby,Partner,Transfer,Neutered Male,30.62759528,-97.54437515,10.8078373
238,6 months,A749267,Dog,Whippet Plott Hound,Brown Brindle,11/12/2016,5/19/2017 15:34,2017-05-19T15:34:00,*Kewi,Partner,Transfer,Spayed Female,30.28399125,-97.488195,26.94980159
239,6 years,A739522,Dog,Pekingese Mix,Cream/White,8/14/2010,12/14/2016 18:02,2016-12-14T18:02:00,Pudgie,,Return to Owner,Neutered Male,30.45747484,-97.70847253,330.6787698
240,2 years,A738335,Cat,Domestic Shorthair Mix,Brown Tabby,11/13/2014,12/9/2016 15:59,2016-12-09T15:59:00,Newman,Partner,Transfer,Neutered Male,30.3297663,-97.35046539,108.237996
241,1 year,A744242,Dog,Miniature Schnauzer Mix,White,2/25/2016,3/8/2017 12:36,2017-03-08T12:36:00,Jack,,Return to Owner,Intact Male,30.31817813,-97.28184102,53.93214286
242,1 year,A690158,Cat,Domestic Shorthair Mix,Blue,10/15/2013,10/20/2014 9:00,2014-10-20T09:00:00,,SCRP,Transfer,Intact Male,30.42936457,-97.27572499,52.91071429
243,8 months,A756917,Dog,Labrador Retriever Mix,Black/White,12/27/2016,9/7/2017 14:37,2017-09-07T14:37:00,Kellsie,,Adoption,Spayed Female,30.45787113,-97.38934098,36.37271825
244,2 years,A707614,Dog,Pit Bull Mix,Black/White,7/15/2013,7/24/2015 17:34,2015-07-24T17:34:00,Cayenne,,Return to Owner,Neutered Male,30.63312479,-97.54884758,105.6759921
245,2 years,A736385,Dog,Brittany Mix,Tan/White,10/9/2014,10/10/2016 12:52,2016-10-10T12:52:00,Beretta,,Return to Owner,Spayed Female,30.62748951,-97.48956012,104.6480159
246,2 months,A734600,Cat,Domestic Shorthair Mix,Brown Tabby,8/24/2016,11/11/2016 18:45,2016-11-11T18:45:00,*Denny,,Adoption,Neutered Male,30.63881629,-97.29372611,11.39732143
247,2 years,A744959,Dog,Chihuahua Shorthair Mix,Tan,3/10/2015,4/3/2017 16:01,2017-04-03T16:01:00,*George,Partner,Transfer,Neutered Male,30.59797959,-97.49705293,107.9524802
248,1 year,A760012,Cat,Domestic Shorthair Mix,Calico,10/11/2016,10/16/2017 12:45,2017-10-16T12:45:00,,Snr,Transfer,Intact Female,30.71355426,-97.29844529,52.93303571
249,7 years,A666693,Dog,American Bulldog,White/Brown Brindle,11/6/2006,2/17/2014 12:38,2014-02-17T12:38:00,Daisy,,Adoption,Spayed Female,30.57789901,-97.41832976,380.0751984
250,14 years,A748160,Dog,Labrador Retriever Mix,Black/White,5/2/2003,5/2/2017 14:52,2017-05-02T14:52:00,Applez,,Return to Owner,Spayed Female,30.48710107,-97.60891707,730.6599206
251,4 months,A664583,Cat,Domestic Medium Hair Mix,Black/White,6/5/2013,10/7/2013 16:01,2013-10-07T16:01:00,,SCRP,Transfer,Unknown,30.37032522,-97.37709849,17.80962302
252,2 years,A742114,Cat,Domestic Shorthair Mix,Brown Tabby,1/15/2015,7/1/2017 11:44,2017-07-01T11:44:00,Jones,,Adoption,Neutered Male,30.56636584,-97.72321903,128.3555556
253,3 months,A733428,Cat,Domestic Medium Hair Mix,Blue Tabby,5/30/2016,9/17/2016 14:10,2016-09-17T14:10:00,*Hamilton,,Adoption,Neutered Male,30.64270548,-97.53963927,15.79861111
254,1 year,A736336,Dog,Siberian Husky Mix,White/Black,10/9/2015,10/9/2016 15:29,2016-10-09T15:29:00,Sasha,,Return to Owner,Intact Female,30.41347943,-97.67194477,52.37787698
255,1 year,A737044,Dog,Siberian Husky Mix,Sable/White,10/21/2015,10/26/2016 0:00,2016-10-26T00:00:00,,Partner,Transfer,Spayed Female,30.53019475,-97.47912226,53
256,3 years,A717863,Dog,German Shepherd Mix,Brown,12/16/2012,12/20/2015 0:00,2015-12-20T00:00:00,*Lucky,Partner,Transfer,Intact Male,30.59827441,-97.70125789,157
257,2 years,A699381,Other,Bat Mix,Brown,3/26/2013,3/27/2015 8:07,2015-03-27T08:07:00,,Rabies Risk,Euthanasia,Unknown,30.34354659,-97.43922233,104.4768849
258,1 month,A676320,Dog,Australian Cattle Dog Mix,Tricolor,3/21/2014,5/21/2014 17:10,2014-05-21T17:10:00,Tucker,Foster,Adoption,Neutered Male,30.75601877,-97.28668171,8.816468254
259,7 years,A750405,Dog,Labrador Retriever Mix,Chocolate,5/31/2010,6/24/2017 13:29,2017-06-24T13:29:00,*Lincoln,Offsite,Adoption,Neutered Male,30.34244812,-97.45019709,368.7945437
260,1 year,A738800,Dog,Scottish Terrier,Black/Black,11/21/2015,11/22/2016 16:19,2016-11-22T16:19:00,Walter,,Return to Owner,Neutered Male,30.70485705,-97.36059859,52.52569444
261,3 weeks,A711058,Cat,Domestic Shorthair Mix,Brown Tabby/White,8/10/2015,9/1/2015 14:05,2015-09-01T14:05:00,,Partner,Transfer,Unknown,30.39802759,-97.57146108,3.226686508
262,1 year,A673269,Cat,Domestic Shorthair Mix,Black,2/21/2013,3/15/2014 18:24,2014-03-15T18:24:00,*Curtis,,Adoption,Neutered Male,30.57894099,-97.7159025,55.3952381
263,6 years,A727193,Dog,Rhod Ridgeback Mix,Brown/Black,5/19/2010,5/19/2016 17:16,2016-05-19T17:16:00,Gigi,,Return to Owner,Spayed Female,30.3272849,-97.40393646,313.2456349
264,14 years,A381173,Dog,Labrador Retriever Mix,Brown/White,8/6/2000,8/6/2014 17:12,2014-08-06T17:12:00,Pepper,,Return to Owner,Spayed Female,30.73002362,-97.41468912,730.5309524
265,1 year,A669794,Dog,Rottweiler Mix,Black/Tan,12/27/2012,12/27/2013 15:46,2013-12-27T15:46:00,Nikita,,Return to Owner,Spayed Female,30.39880741,-97.68168599,52.23670635
266,9 years,A433746,Dog,Australian Shepherd Mix,White/Brown,4/9/2006,11/4/2015 0:00,2015-11-04T00:00:00,Evette,Partner,Transfer,Spayed Female,30.70514106,-97.68831966,499.4285714
267,3 years,A734651,Dog,Catahoula Mix,White/Black,9/10/2013,9/17/2016 15:25,2016-09-17T15:25:00,*Sheba,,Adoption,Spayed Female,30.74464231,-97.2666277,157.6631944
268,2 years,A719006,Dog,Dachshund Chihuahua Shorthair,Chocolate,1/11/2014,1/25/2016 17:44,2016-01-25T17:44:00,Pablo,,Adoption,Neutered Male,30.73520206,-97.68745988,106.3912698
269,5 years,A665629,Dog,Australian Cattle Dog Chow Chow,Red Merle/White,10/20/2009,7/31/2015 14:29,2015-07-31T14:29:00,Baby Boy,Partner,Transfer,Neutered Male,30.28781222,-97.62995379,301.5147817
270,3 years,A688427,Dog,American Bulldog Mix,White,9/19/2011,10/4/2014 18:46,2014-10-04T18:46:00,,Partner,Transfer,Neutered Male,30.35889068,-97.52291095,158.8259921
271,2 years,A716150,Dog,Miniature Schnauzer Mix,Silver/Black,11/15/2013,11/20/2015 17:53,2015-11-20T17:53:00,*Pancho,,Adoption,Neutered Male,30.64319715,-97.28766459,105.1064484
272,3 years,A734180,Dog,Labrador Retriever Mix,Black/White,9/2/2013,10/15/2016 17:08,2016-10-15T17:08:00,Jax,,Adoption,Neutered Male,30.59284969,-97.34071516,162.8162698
273,1 year,A760464,Dog,French Bulldog,Fawn,10/20/2016,10/20/2017 12:14,2017-10-20T12:14:00,Klaus,,Return to Owner,Neutered Male,30.5219079,-97.53911633,52.2156746
274,2 months,A712421,Cat,Domestic Shorthair Mix,White/Blue Tabby,8/15/2015,11/11/2015 13:53,2015-11-11T13:53:00,*Cameron,Foster,Adoption,Neutered Male,30.43864718,-97.58484507,12.65406746
275,2 years,A676777,Dog,Dutch Shepherd Mix,Brown Brindle,4/16/2012,4/25/2014 11:14,2014-04-25T11:14:00,Remy,,Return to Owner,Spayed Female,30.40959309,-97.54957682,105.6382937
276,3 months,A732255,Dog,Great Pyrenees Pointer,White/Black,5/4/2016,8/10/2016 18:02,2016-08-10T18:02:00,*Benjamin,,Adoption,Neutered Male,30.57505268,-97.49627667,14.10734127
277,4 years,A693283,Dog,Pit Bull Mix,Tan/White,12/5/2012,11/23/2017 16:07,2017-11-23T16:07:00,Maximus,,Return to Owner,Neutered Male,30.28147008,-97.38396593,259.2387897
278,4 weeks,A709285,Other,Bat,Red,7/7/2015,8/7/2015 8:38,2015-08-07T08:38:00,,Rabies Risk,Euthanasia,Unknown,30.66551278,-97.41447724,4.479960317
279,11 months,A724073,Cat,Domestic Shorthair Mix,Calico,5/11/2015,4/16/2016 12:59,2016-04-16T12:59:00,Lily,,Adoption,Spayed Female,30.36530247,-97.55233245,48.79156746
280,6 years,A674453,Dog,Wire Hair Fox Terrier Mix,White/Tan,3/13/2008,3/14/2014 11:00,2014-03-14T11:00:00,Lana,Partner,Transfer,Spayed Female,30.65716771,-97.34722536,313.2083333
281,2 months,A738016,Cat,Domestic Shorthair Mix,Brown Tabby/White,8/24/2016,11/20/2016 15:54,2016-11-20T15:54:00,*Friday,,Adoption,Spayed Female,30.32701414,-97.61092494,12.66607143
282,12 years,A686683,Dog,German Shepherd Mix,White,8/25/2002,8/25/2014 15:09,2014-08-25T15:09:00,Ira,Suffering,Euthanasia,Intact Male,30.46368417,-97.4177712,626.2330357
283,2 months,A760662,Cat,Domestic Shorthair Mix,Black,10/8/2017,12/12/2017 9:40,2017-12-12T09:40:00,,Foster,Adoption,Neutered Male,30.45037121,-97.51546113,9.343253968
284,4 years,A687604,Cat,Domestic Shorthair Mix,Black,9/7/2010,9/7/2014 14:45,2014-09-07T14:45:00,,Suffering,Euthanasia,Intact Male,30.67378853,-97.31582528,208.8020833
285,8 years,A739719,Dog,Labrador Retriever Mix,Chocolate,12/6/2008,1/2/2017 17:39,2017-01-02T17:39:00,Chubs,Foster,Adoption,Neutered Male,30.32364885,-97.48768809,421.3907738
286,1 year,A735601,Dog,Labrador Retriever Mix,Black,9/26/2015,2/16/2017 13:23,2017-02-16T13:23:00,Olivia,,Return to Owner,Spayed Female,30.53097641,-97.4744857,72.79394841
287,1 year,A712665,Dog,Pit Bull Mix,Fawn/White,9/26/2014,11/17/2015 18:26,2015-11-17T18:26:00,*Jack Nick,,Return to Owner,Neutered Male,30.46471898,-97.69015351,59.68115079
288,3 years,A705339,Dog,Pit Bull Mix,Brown Brindle,6/16/2012,6/17/2015 11:06,2015-06-17T11:06:00,Queenie,,Return to Owner,Spayed Female,30.38388215,-97.68677216,156.6375
289,9 months,A669177,Dog,Labrador Retriever Staffordshire,Black/White,3/16/2013,12/24/2013 14:43,2013-12-24T14:43:00,Ally,,Adoption,Intact Female,30.33450302,-97.64054046,40.51617063
290,1 year,A675047,Dog,Labrador Retriever Mix,Black/White,3/22/2013,3/30/2014 18:37,2014-03-30T18:37:00,Reggie,,Adoption,Neutered Male,30.38175792,-97.45185427,53.39652778
291,2 months,A681978,Cat,Domestic Shorthair Mix,Blue Tabby/White,4/7/2014,6/26/2014 17:15,2014-06-26T17:15:00,,Partner,Transfer,Intact Female,30.54756296,-97.3398629,11.53125
292,2 years,A642946,Cat,Domestic Shorthair Mix,Brown Tabby/White,7/17/2012,12/7/2014 13:31,2014-12-07T13:31:00,Zooey,,Adoption,Spayed Female,30.56926315,-97.39612953,124.7947421
293,3 years,A743073,Dog,Labrador Retriever Australian Cattle Dog,White/Brown,2/3/2014,2/10/2017 13:32,2017-02-10T13:32:00,*Mika,,Adoption,Spayed Female,30.69190354,-97.56635977,157.6519841
294,5 years,A720472,Dog,Redbone Hound Mix,Red/Black,2/10/2011,2/10/2016 11:46,2016-02-10T11:46:00,Ladybird,,Return to Owner,Spayed Female,30.42922054,-97.56709988,260.9271825
295,2 years,A680319,Cat,Domestic Shorthair Mix,Brown Tabby/White,6/1/2012,6/1/2014 8:00,2014-06-01T08:00:00,,SCRP,Transfer,Intact Male,30.57644842,-97.68256957,104.3333333
296,4 years,A641779,Dog,Pit Bull Mix,White/Black,11/13/2011,7/26/2016 12:58,2016-07-26T12:58:00,Tonii Yayo,,Return to Owner,Spayed Female,30.68513776,-97.41724023,245.3628968
297,2 months,A710129,Cat,Domestic Shorthair Mix,Orange Tabby,6/18/2015,9/6/2015 12:31,2015-09-06T12:31:00,*Safiya,Partner,Transfer,Intact Female,30.57279027,-97.62591273,11.5030754
298,2 years,A700218,Cat,Domestic Shorthair Mix,Brown Tabby/Black,4/10/2013,4/10/2015 15:13,2015-04-10T15:13:00,,Suffering,Euthanasia,Neutered Male,30.38693675,-97.58771082,104.3762897
299,1 year,A668106,Bird,Rhode Island Mix,Yellow/Black,11/27/2012,12/1/2013 3:15,2013-12-01T03:15:00,,Suffering,Euthanasia,Intact Male,30.53004273,-97.54861452,52.73363095
300,2 months,A731911,Dog,Australian Cattle Dog German Shepherd,Black/Tan,5/14/2016,8/10/2016 13:04,2016-08-10T13:04:00,Cory,,Return to Owner,Intact Male,30.67518205,-97.32797727,12.64920635
301,3 years,A686606,Dog,Australian Shepherd Mix,Brown Merle/Tan,8/24/2011,8/31/2014 13:14,2014-08-31T13:14:00,Junior,Partner,Transfer,Neutered Male,30.62892779,-97.59013451,157.6501984
302,1 year,A714666,Dog,Chihuahua Longhair Mix,Tan/White,10/26/2014,10/29/2015 18:38,2015-10-29T18:38:00,Sandy,,Return to Owner,Intact Female,30.47054303,-97.62337269,52.68234127
303,5 years,A698959,Dog,Labrador Retriever Mix,Black,3/20/2010,3/20/2015 17:25,2015-03-20T17:25:00,Addy,,Return to Owner,Intact Female,30.70523917,-97.60692464,260.9608135
304,13 years,A358879,Dog,German Shepherd,Brown/Black,8/13/2002,9/15/2015 16:22,2015-09-15T16:22:00,Simba,Suffering,Euthanasia,Neutered Male,30.44999948,-97.61854919,683.0974206
305,2 years,A711357,Cat,Domestic Shorthair Mix,Torbie,9/5/2013,9/6/2015 9:00,2015-09-06T09:00:00,,SCRP,Transfer,Unknown,30.74147147,-97.34098349,104.4821429
306,1 year,A708460,Cat,Domestic Shorthair,Cream Tabby,7/28/2014,7/29/2015 9:00,2015-07-29T09:00:00,,SCRP,Transfer,Unknown,30.33059504,-97.39188138,52.33928571
307,1 year,A742169,Dog,Pit Bull,Blue/White,1/16/2016,12/15/2017 18:26,2017-12-15T18:26:00,*Pearl,,Adoption,Spayed Female,30.74080553,-97.35470709,99.96686508
308,3 months,A692031,Cat,Domestic Shorthair Mix,Black/White,10/13/2014,2/1/2015 17:55,2015-02-01T17:55:00,T-Rex,,Adoption,Neutered Male,30.52380179,-97.49676402,15.96378968
309,8 months,A719793,Dog,Pit Bull Mix,White/Tan,6/1/2015,2/1/2016 14:32,2016-02-01T14:32:00,Cece,,Return to Owner,Spayed Female,30.49900688,-97.46171286,35.08650794
310,6 months,A734240,Other,Rabbit Sh Mix,White/Black,3/3/2016,9/18/2016 10:41,2016-09-18T10:41:00,,,Adoption,Intact Female,30.63861327,-97.25858005,28.4921627
311,9 months,A708456,Other,Opossum,Gray,9/28/2014,7/29/2015 12:11,2015-07-29T12:11:00,,Suffering,Euthanasia,Unknown,30.54076691,-97.3546943,43.50109127
312,2 years,A698767,Dog,Bull Terrier Mix,White,3/17/2014,2/6/2017 17:46,2017-02-06T17:46:00,Polo,,Adoption,Neutered Male,30.58248764,-97.50169355,151.105754
313,3 months,A758948,Other,Squirrel Mix,Brown,6/24/2017,9/27/2017 19:18,2017-09-27T19:18:00,,Rabies Risk,Euthanasia,Unknown,30.53960733,-97.30992939,13.68630952
314,2 years,A671428,Dog,Swiss Hound Pit Bull,Tan/White,10/24/2012,11/12/2014 19:32,2014-11-12T19:32:00,Little Foot,,Return to Owner,Neutered Male,30.69918144,-97.39776325,107.1162698
315,3 years,A678393,Dog,Miniature Poodle Mix,White/Apricot,5/8/2011,5/9/2014 17:54,2014-05-09T17:54:00,Bebe,,Return to Owner,Spayed Female,30.42929933,-97.61617323,156.8208333
316,8 months,A749157,Bird,Duck,Yellow,9/11/2016,5/15/2017 9:32,2017-05-15T09:32:00,,Foster,Adoption,Unknown,30.44222708,-97.56628656,35.19960317
317,2 months,A691775,Cat,Domestic Shorthair Mix,Orange Tabby,9/9/2014,11/14/2014 13:43,2014-11-14T13:43:00,Nugget,Partner,Transfer,Neutered Male,30.50911472,-97.4528579,9.510218254
318,1 month,A729618,Cat,Domestic Shorthair Mix,Calico,5/14/2016,6/24/2016 7:33,2016-06-24T07:33:00,*Apple,Partner,Transfer,Intact Female,30.52220932,-97.43950969,5.902083333
319,2 years,A755247,Dog,Pit Bull Mix,Black/White,7/31/2015,1/9/2018 17:52,2018-01-09T17:52:00,Dobie,,Adoption,Neutered Male,30.57952553,-97.59938229,127.6777778
320,3 years,A720636,Cat,Domestic Shorthair Mix,Black,2/13/2013,2/22/2016 16:00,2016-02-22T16:00:00,,SCRP,Transfer,Unknown,30.6319987,-97.64395162,157.8095238
321,4 years,A609335,Dog,Pit Bull Mix,White/Tan,9/7/2009,12/16/2013 15:31,2013-12-16T15:31:00,*Churley,,Adoption,Neutered Male,30.66957023,-97.64158647,223.0923611
322,2 years,A756323,Dog,Pit Bull Mix,White/Black,8/17/2015,8/19/2017 16:44,2017-08-19T16:44:00,Bongo,,Adoption,Neutered Male,30.35743329,-97.39929939,104.8138889
323,8 years,A688353,Dog,Boston Terrier,Black/White,9/18/2006,9/19/2014 16:42,2014-09-19T16:42:00,Rupert,,Return to Owner,Neutered Male,30.42762622,-97.33888805,417.6708333
324,2 months,A702633,Dog,Labrador Retriever Mix,Black/White,3/16/2015,5/20/2015 17:04,2015-05-20T17:04:00,,,Adoption,Neutered Male,30.51866115,-97.35703441,9.387301587
325,2 years,A711168,Dog,American Pit Bull Terrier Mix,Sable/White,9/3/2013,9/3/2015 11:41,2015-09-03T11:41:00,Chucho,,Return to Owner,Intact Male,30.66965664,-97.62683029,104.3552579
326,2 weeks,A735260,Cat,Domestic Shorthair Mix,Brown Tabby,9/6/2016,9/21/2016 14:16,2016-09-21T14:16:00,,Partner,Transfer,Unknown,30.43234531,-97.64653482,2.227777778
327,2 months,A759505,Dog,Labrador Retriever Mix,White,8/2/2017,10/4/2017 15:42,2017-10-04T15:42:00,,,Return to Owner,Intact Female,30.36362807,-97.33347233,9.093452381
328,1 year,A734612,Dog,Pit Bull Mix,Black/White,9/19/2015,9/20/2016 19:12,2016-09-20T19:12:00,Beans,,Return to Owner,Neutered Male,30.62793864,-97.48936581,52.54285714
329,7 years,A534502,Dog,Boxer Mix,Black Brindle/Brown,11/17/2008,9/23/2016 17:10,2016-09-23T17:10:00,Will,,Return to Owner,Neutered Male,30.44412798,-97.47657935,409.6736111
330,2 months,A692955,Cat,Domestic Shorthair Mix,Black/White,10/29/2014,1/24/2015 11:27,2015-01-24T11:27:00,*Maria,Foster,Adoption,Spayed Female,30.42562437,-97.29896471,12.49672619
331,2 months,A726249,Cat,Domestic Shorthair Mix,Torbie/White,4/5/2016,6/11/2016 13:41,2016-06-11T13:41:00,*Myrtle,Foster,Adoption,Spayed Female,30.7413759,-97.62676239,9.652876984
332,1 month,A751736,Cat,Domestic Shorthair Mix,Tortie,4/27/2017,6/18/2017 17:25,2017-06-18T17:25:00,*Jessa,Partner,Transfer,Intact Female,30.40702473,-97.35570444,7.532242063
333,5 years,A739113,Dog,Anatol Shepherd Mix,White/Tan,11/28/2011,11/28/2016 14:37,2016-11-28T14:37:00,Gus,,Return to Owner,Neutered Male,30.44630847,-97.57645876,261.087004
334,1 year,A675124,Other,Raccoon Mix,Black/Gray,3/23/2013,3/23/2014 17:30,2014-03-23T17:30:00,,Suffering,Euthanasia,Unknown,30.39729229,-97.30530039,52.24702381
335,2 months,A746862,Dog,Great Dane Mix,Black/White,1/14/2017,4/14/2017 17:13,2017-04-14T17:13:00,Harley,,Adoption,Spayed Female,30.41050771,-97.65025213,12.95962302
336,2 months,A758584,Cat,American Shorthair Mix,Orange Tabby/White,9/9/2017,11/26/2017 11:37,2017-11-26T11:37:00,,,Adoption,Neutered Male,30.34914086,-97.47932913,11.21200397
337,2 years,A693651,Other,Bat Mix,Brown,12/12/2012,12/13/2014 8:19,2014-12-13T08:19:00,,Rabies Risk,Euthanasia,Unknown,30.28919326,-97.54597155,104.4780754
338,1 year,A700824,Dog,Chihuahua Shorthair Mix,Brown/White,10/20/2013,4/24/2015 11:40,2015-04-24T11:40:00,Greta,,Adoption,Spayed Female,30.76500329,-97.62097274,78.78373016
339,3 months,A728158,Cat,Domestic Shorthair Mix,Orange Tabby/White,5/1/2016,8/5/2016 8:38,2016-08-05T08:38:00,*Pete,Foster,Adoption,Neutered Male,30.51711047,-97.52339657,13.7656746
340,2 years,A754340,Other,Bat Mix,Brown,7/19/2015,7/20/2017 9:10,2017-07-20T09:10:00,,Enroute,Died,Unknown,30.56811652,-97.2793448,104.6259921
341,8 years,A747978,Dog,Mastiff Plott Hound,Red,4/27/2009,5/1/2017 8:38,2017-05-01T08:38:00,,Suffering,Euthanasia,Intact Female,30.47193924,-97.4471395,418.0513889
342,2 months,A680314,Dog,Australian Kelpie Mix,Chocolate/Tan,6/1/2014,8/10/2014 17:54,2014-08-10T17:54:00,*Lil Sis,Offsite,Adoption,Spayed Female,30.74441987,-97.55133064,10.10654762
343,2 years,A670897,Dog,Australian Cattle Dog German Shorthair Pointer,White/Tricolor,1/15/2012,1/17/2014 17:57,2014-01-17T17:57:00,Toby,,Return to Owner,Neutered Male,30.37293458,-97.50450716,104.821131
344,4 months,A749888,Cat,Domestic Shorthair Mix,Black,4/14/2017,8/22/2017 17:23,2017-08-22T17:23:00,*Chocolate,,Adoption,Neutered Male,30.28359219,-97.55643172,18.67490079
345,2 years,A721221,Dog,Border Collie Mix,Black/White,2/23/2014,3/13/2016 14:51,2016-03-13T14:51:00,Gypsy,,Return to Owner,Spayed Female,30.58438744,-97.46783257,107.0883929
346,4 years,A616906,Cat,Maine Coon Mix,Brown Tabby/White,7/1/2010,6/30/2014 14:39,2014-06-30T14:39:00,Estrella,Partner,Transfer,Spayed Female,30.27311349,-97.32191801,208.658631
347,2 months,A705590,Dog,Australian Shepherd Labrador Retriever,Black Brindle,4/12/2015,6/27/2015 13:19,2015-06-27T13:19:00,,,Adoption,Neutered Male,30.70831791,-97.39246682,10.93640873
348,2 weeks,A714703,Cat,Domestic Medium Hair Mix,Black,10/12/2015,10/27/2015 12:19,2015-10-27T12:19:00,,Partner,Transfer,Intact Male,30.31009011,-97.38398844,2.216170635
349,2 years,A703203,Dog,Chihuahua Shorthair Mix,White/Brown,5/21/2013,5/24/2015 17:59,2015-05-24T17:59:00,Chloe,,Return to Owner,Spayed Female,30.37821894,-97.41708451,104.8213294
350,13 years,A306362,Dog,Labrador Retriever Chow Chow,Black,7/13/2002,7/18/2015 16:40,2015-07-18T16:40:00,Zoey,,Return to Owner,Spayed Female,30.64589194,-97.69086273,679.0992063
351,2 months,A744559,Dog,Labrador Retriever Mix,Chocolate/White,2/8/2017,5/4/2017 10:41,2017-05-04T10:41:00,,Foster,Adoption,Neutered Male,30.36049561,-97.55239038,12.20644841
352,1 month,A745920,Dog,Labrador Retriever Mix,Chocolate/Tan,2/4/2017,3/30/2017 18:50,2017-03-30T18:50:00,,,Adoption,Neutered Male,30.34323616,-97.31946851,7.826388889
353,3 months,A760023,Dog,Labrador Retriever Mix,Brown,7/11/2017,10/22/2017 18:28,2017-10-22T18:28:00,Max,,Return to Owner,Neutered Male,30.70044169,-97.40825875,14.82420635
354,3 years,A683204,Cat,Domestic Shorthair Mix,Orange Tabby,7/9/2011,8/2/2014 15:03,2014-08-02T15:03:00,*Spencer,Partner,Transfer,Neutered Male,30.46415261,-97.5021407,160.0895833
355,2 months,A725797,Cat,Domestic Shorthair Mix,Blue Tabby,3/3/2016,5/8/2016 13:37,2016-05-08T13:37:00,Pistachio,,Adoption,Intact Female,30.44745311,-97.38894972,9.509623016
356,1 year,A742079,Dog,Chihuahua Shorthair Mix,Black/Tan,1/14/2016,1/18/2017 18:22,2017-01-18T18:22:00,,,Adoption,Neutered Male,30.59314505,-97.65778464,52.96646825
357,5 months,A703811,Dog,Black Mouth Cur Blue Lacy,Sable,12/29/2014,6/2/2015 16:40,2015-06-02T16:40:00,,,Adoption,Spayed Female,30.5435113,-97.68192853,22.24206349
358,6 years,A602693,Dog,Shih Tzu Border Terrier,Tan/Black,11/4/2010,11/22/2016 16:19,2016-11-22T16:19:00,Wilma,,Return to Owner,Spayed Female,30.42607056,-97.4428018,315.8114087
359,8 years,A756165,Dog,Labrador Retriever Mix,Black/White,8/15/2009,8/17/2017 11:49,2017-08-17T11:49:00,Millo,,Return to Owner,Neutered Male,30.41694709,-97.31286544,417.784623
360,1 month,A750195,Cat,Domestic Shorthair Mix,Torbie,4/9/2017,5/27/2017 15:50,2017-05-27T15:50:00,Rusty,,Adoption,Intact Female,30.41057877,-97.66632914,6.951388889
361,3 years,A745093,Other,Bat Mix,Brown,3/12/2014,3/12/2017 18:07,2017-03-12T18:07:00,,Rabies Risk,Euthanasia,Unknown,30.30167847,-97.45249335,156.6792659
362,8 months,A689081,Dog,Australian Cattle Dog Mix,Red Merle,1/29/2014,10/4/2014 17:18,2014-10-04T17:18:00,*Becca,,Adoption,Spayed Female,30.31753828,-97.37923051,35.53154762
363,10 years,A671864,Dog,Golden Retriever Mix,Gold/White,1/31/2004,1/31/2014 16:37,2014-01-31T16:37:00,Krash,,Return to Owner,Neutered Male,30.30940417,-97.5465731,521.9560516
364,3 years,A755458,Dog,Rat Terrier Mix,Tricolor,8/4/2014,8/10/2017 11:00,2017-08-10T11:00:00,Chiquis,Partner,Transfer,Spayed Female,30.38352494,-97.30269324,157.4940476
365,2 months,A664113,Dog,German Shepherd Mix,Black/Tan,7/29/2013,10/3/2013 17:39,2013-10-03T17:39:00,Wrigley,,Adoption,Neutered Male,30.40143439,-97.39501919,9.533630952
366,2 years,A719167,Dog,Miniature Pinscher Mix,Black/Brown,1/14/2014,1/19/2016 16:58,2016-01-19T16:58:00,*Toby,,Adoption,Neutered Male,30.5213086,-97.27914542,105.1009921
367,2 months,A728626,Cat,Domestic Longhair Mix,White/Black,5/8/2016,7/25/2016 17:17,2016-07-25T17:17:00,Snowball,,Adoption,Spayed Female,30.71031361,-97.46453443,11.24573413
368,4 weeks,A684341,Cat,Snowshoe Mix,Seal Point,6/22/2014,7/23/2014 14:35,2014-07-23T14:35:00,Apple,Partner,Transfer,Intact Female,30.63626959,-97.57193569,4.515376984
369,3 years,A723814,Cat,Domestic Shorthair Mix,Brown Tabby,4/7/2013,7/2/2016 16:31,2016-07-02T16:31:00,Chiquita,,Adoption,Spayed Female,30.51248262,-97.27871412,168.9554563
370,4 years,A758041,Cat,Domestic Shorthair Mix,White/Blue,9/10/2013,9/10/2017 19:06,2017-09-10T19:06:00,,Suffering,Euthanasia,Neutered Male,30.55547012,-97.59647588,208.8279762
371,2 months,A692444,Cat,Domestic Medium Hair Mix,Black/White,8/29/2014,11/21/2014 12:03,2014-11-21T12:03:00,,Medical,Euthanasia,Intact Male,30.35828019,-97.67377784,12.07172619
372,9 years,A663149,Cat,Domestic Shorthair Mix,Brown Tabby/White,9/13/2004,1/18/2014 16:08,2014-01-18T16:08:00,Princess,Foster,Adoption,Spayed Female,30.47810249,-97.27304921,487.8103175
373,2 months,A679430,Cat,Domestic Shorthair Mix,Cream Tabby/White,4/14/2014,6/19/2014 14:41,2014-06-19T14:41:00,Four,,Adoption,Neutered Male,30.44006815,-97.56006211,9.515972222
374,5 months,A709312,Dog,Miniature Schnauzer Mix,Black/Brown,3/7/2015,8/11/2015 18:04,2015-08-11T18:04:00,,,Adoption,Spayed Female,30.47426121,-97.48262897,22.53611111
375,5 months,A719249,Dog,German Shepherd Mix,Black/Brown,8/16/2015,1/20/2016 18:07,2016-01-20T18:07:00,*Miso,,Adoption,Spayed Female,30.55244068,-97.30811783,22.53640873
376,7 years,A742958,Cat,Domestic Shorthair Mix,Blue/White,2/6/2010,2/11/2017 9:50,2017-02-11T09:50:00,*Saints,Partner,Transfer,Neutered Male,30.32047534,-97.36965558,366.0585317
377,4 years,A692079,Cat,Domestic Shorthair Mix,Calico,11/14/2010,11/14/2014 12:24,2014-11-14T12:24:00,,Suffering,Euthanasia,Intact Female,30.53971021,-97.47882939,208.7880952
378,3 weeks,A757236,Cat,Domestic Medium Hair Mix,Black,8/9/2017,8/31/2017 0:00,2017-08-31T00:00:00,,Partner,Transfer,Unknown,30.47757563,-97.71461143,3.142857143
379,2 years,A687505,Dog,Chihuahua Shorthair Mix,Black,9/5/2012,9/10/2014 17:21,2014-09-10T17:21:00,Lucky,,Return to Owner,Spayed Female,30.45443121,-97.7203507,105.1032738
380,2 years,A715041,Dog,Pit Bull Mix,Chocolate/White,10/30/2013,11/9/2015 11:44,2015-11-09T11:44:00,Coco,,Return to Owner,Spayed Female,30.54710522,-97.60083662,105.784127
381,1 month,A736066,Dog,Labrador Retriever Mix,Tan,8/3/2016,10/3/2016 17:17,2016-10-03T17:17:00,,,Return to Owner,Intact Female,30.5045429,-97.39660932,8.817162698
382,5 years,A688773,Dog,Shih Tzu Mix,White/Brown,9/23/2009,9/24/2014 16:46,2014-09-24T16:46:00,Chubs,,Return to Owner,Neutered Male,30.67868688,-97.74057241,261.0998016
383,2 months,A730192,Cat,Domestic Longhair Mix,Black,4/30/2016,7/1/2016 12:39,2016-07-01T12:39:00,Sirius,,Adoption,Intact Male,30.50904806,-97.42065436,8.932440476
384,3 years,A624949,Dog,German Shepherd Mix,Black/Tan,9/1/2010,4/30/2014 16:25,2014-04-30T16:25:00,Axle,Aggressive,Euthanasia,Neutered Male,30.47727436,-97.55473012,191.0977183
385,1 month,A668178,Cat,Domestic Shorthair Mix,Blue,11/9/2013,1/2/2014 18:37,2014-01-02T18:37:00,*Owen,Foster,Adoption,Neutered Male,30.49203277,-97.45378011,7.825099206
386,2 months,A729678,Cat,Domestic Shorthair Mix,Orange Tabby,4/22/2016,6/26/2016 17:19,2016-06-26T17:19:00,,,Adoption,Neutered Male,30.58580564,-97.62575006,9.388789683
387,4 weeks,A710686,Cat,Domestic Shorthair Mix,Brown Tabby,7/26/2015,8/29/2015 14:15,2015-08-29T14:15:00,*Legolas,Partner,Transfer,Intact Male,30.47801075,-97.57938028,4.941964286
388,2 years,A743329,Dog,Border Collie Great Pyrenees,Tan/White,2/8/2015,2/20/2017 0:00,2017-02-20T00:00:00,Sobeck,Partner,Transfer,Neutered Male,30.56197735,-97.58235584,106.1428571
389,4 months,A725727,Dog,Pit Bull Mix,Tan/White,1/2/2016,5/10/2016 18:36,2016-05-10T18:36:00,*Lucinda,,Adoption,Spayed Female,30.4994079,-97.58532838,18.53928571
390,6 days,A674754,Cat,Domestic Shorthair Mix,Orange Tabby,3/12/2014,3/18/2014 11:47,2014-03-18T11:47:00,,Partner,Transfer,Intact Male,30.75775868,-97.70220778,0.927281746
391,6 months,A669598,Cat,Domestic Shorthair Mix,Black,6/24/2013,12/28/2013 14:37,2013-12-28T14:37:00,Mugen,,Adoption,Intact Male,30.54528554,-97.45907176,26.80128968
392,3 years,A719466,Dog,Australian Kelpie Mix,Blue,1/20/2013,1/20/2016 16:20,2016-01-20T16:20:00,Raymond,,Return to Owner,Neutered Male,30.68105945,-97.48333417,156.5257937
393,14 years,A657188,Cat,Domestic Shorthair Mix,Brown Tabby/White,6/24/1999,1/26/2014 16:24,2014-01-26T16:24:00,Tommy,Foster,Adoption,Neutered Male,30.67451989,-97.30652714,761.5261905
394,2 years,A716519,Cat,Domestic Medium Hair Mix,Orange Tabby/White,11/20/2013,11/24/2015 19:30,2015-11-24T19:30:00,,SCRP,Transfer,Unknown,30.58896019,-97.51800753,104.9732143
395,2 years,A686082,Dog,Siberian Husky Mix,Red/White,8/16/2012,8/20/2014 18:40,2014-08-20T18:40:00,,,Adoption,Spayed Female,30.63800756,-97.48798493,104.968254
396,3 years,A746407,Cat,Domestic Shorthair Mix,Blue Tabby,4/2/2014,6/24/2017 15:45,2017-06-24T15:45:00,Milo,Foster,Adoption,Neutered Male,30.30618647,-97.2703283,168.5223214
397,8 months,A739122,Cat,Domestic Shorthair Mix,Brown Tabby,3/28/2016,11/29/2016 9:00,2016-11-29T09:00:00,,SCRP,Transfer,Neutered Male,30.69276198,-97.28944563,35.19642857
398,1 month,A720525,Dog,Labrador Retriever Mix,Black/White,12/17/2015,2/13/2016 18:22,2016-02-13T18:22:00,*Merida,,Adoption,Spayed Female,30.63074487,-97.424171,8.395039683
399,3 weeks,A708416,Cat,Domestic Shorthair Mix,Orange Tabby,7/5/2015,7/27/2015 15:38,2015-07-27T15:38:00,,Partner,Transfer,Unknown,30.7295441,-97.28724873,3.235912698
400,11 months,A681819,Dog,German Shepherd,Black,7/15/2013,7/2/2014 16:40,2014-07-02T16:40:00,Ashes,,Return to Owner,Spayed Female,30.50251693,-97.51734361,50.38492063
401,2 months,A664033,Dog,German Shepherd Mix,Tan/White,7/27/2013,10/2/2013 18:40,2013-10-02T18:40:00,*Billy,,Adoption,Neutered Male,30.41143715,-97.40334426,9.682539683
402,2 months,A728008,Cat,Domestic Shorthair Mix,Torbie,4/14/2016,6/22/2016 18:13,2016-06-22T18:13:00,,Medical,Euthanasia,Intact Female,30.60325506,-97.26111838,9.965575397
403,2 months,A684235,Cat,Domestic Longhair Mix,Brown Tabby/White,4/29/2014,7/22/2014 9:00,2014-07-22T09:00:00,,SCRP,Transfer,Intact Male,30.32172001,-97.24612259,12.05357143
404,6 months,A728040,Dog,Plott Hound Mix,Chocolate/White,11/30/2015,6/3/2016 17:40,2016-06-03T17:40:00,Nikola,,Adoption,Neutered Male,30.30327714,-97.70394871,26.6765873
405,1 year,A694186,Dog,Pit Bull Mix,Blue/White,6/22/2013,12/24/2014 17:22,2014-12-24T17:22:00,Fossa,,Return to Owner,Neutered Male,30.595904,-97.32384938,78.67480159
406,2 weeks,A753867,Cat,Domestic Medium Hair Mix,Black Smoke,6/27/2017,7/12/2017 14:14,2017-07-12T14:14:00,,Partner,Transfer,Intact Male,30.38365201,-97.28588299,2.227579365
407,3 years,A585131,Cat,Domestic Shorthair Mix,Calico,9/22/2010,6/14/2014 17:25,2014-06-14T17:25:00,Lupe Fleasco,,Return to Owner,Spayed Female,30.4091918,-97.26482169,194.5322421
408,2 years,A711379,Dog,Labrador Retriever Mix,Black/White,9/6/2013,9/6/2015 13:57,2015-09-06T13:57:00,Turbo,,Return to Owner,Neutered Male,30.48121353,-97.34936025,104.36875
409,2 months,A739417,Dog,Dachshund,Brown,10/18/2016,12/20/2016 23:03,2016-12-20T23:03:00,*Tot,Foster,Adoption,Neutered Male,30.50045899,-97.65780531,9.137202381
410,1 month,A707206,Dog,Pit Bull Mix,Black/White,5/13/2015,7/13/2015 11:20,2015-07-13T11:20:00,,Partner,Transfer,Intact Male,30.67569283,-97.55778517,8.781746032
411,1 year,A687934,Other,Bat,Brown,9/12/2013,9/12/2014 11:57,2014-09-12T11:57:00,,Rabies Risk,Euthanasia,Unknown,30.47075246,-97.64202223,52.2139881
412,12 years,A756445,Dog,Yorkshire Terrier Mix,Brown/Tan,8/19/2005,8/20/2017 11:42,2017-08-20T11:42:00,Gizmo,,Return to Owner,Neutered Male,30.29511419,-97.68591906,626.3553571
413,2 years,A681699,Cat,Domestic Longhair Mix,Black,6/19/2012,6/19/2014 18:43,2014-06-19T18:43:00,,Partner,Transfer,Intact Male,30.66532307,-97.27195215,104.397123
414,4 months,A747806,Cat,Domestic Shorthair,Calico,4/11/2017,8/12/2017 13:58,2017-08-12T13:58:00,*Janet,Foster,Adoption,Spayed Female,30.66819999,-97.32970366,17.65456349
415,1 year,A756523,Cat,American Shorthair Mix,Brown Tabby/White,5/21/2016,8/28/2017 16:32,2017-08-28T16:32:00,Bodie,,Adoption,Neutered Male,30.75650255,-97.47995097,66.38412698
416,3 years,A718312,Dog,Pit Bull Mix,Black/White,12/27/2012,1/8/2016 15:21,2016-01-08T15:21:00,Lucky,,Return to Owner,Intact Male,30.53399204,-97.27438979,158.2342262
417,3 years,A679728,Cat,Domestic Shorthair Mix,White,5/25/2011,6/16/2014 12:46,2014-06-16T12:46:00,Jojo,Partner,Transfer,Spayed Female,30.43142747,-97.29160919,159.7902778
418,8 months,A668206,Cat,Domestic Shorthair Mix,Calico,3/29/2013,12/27/2013 15:49,2013-12-27T15:49:00,*Ciara,Partner,Transfer,Spayed Female,30.31433517,-97.50458878,39.09414683
419,1 year,A664613,Dog,Border Collie American Staffordshire Terrier,Black/White,10/6/2012,10/14/2013 11:47,2013-10-14T11:47:00,*Pammy,Partner,Transfer,Intact Female,30.5780649,-97.3774515,53.35585317
420,6 months,A687225,Cat,Domestic Shorthair Mix,Brown Tabby,5/2/2014,11/9/2014 17:40,2014-11-09T17:40:00,*Hope,,Adoption,Spayed Female,30.27764686,-97.38173449,27.39087302
421,2 months,A665694,Dog,German Shepherd Mix,Black/Tan,8/21/2013,10/27/2013 13:20,2013-10-27T13:20:00,,Partner,Transfer,Intact Male,30.7586688,-97.41973583,9.650793651
422,4 years,A621716,Dog,Pit Bull Mix,Chocolate/White,3/11/2010,9/15/2014 18:52,2014-09-15T18:52:00,*Maizy,,Return to Owner,Spayed Female,30.39255455,-97.32242743,235.6837302
423,2 years,A667109,Dog,American Bulldog Labrador Retriever,Black/White,11/12/2011,12/11/2013 12:50,2013-12-11T12:50:00,Hank,,Adoption,Neutered Male,30.48797693,-97.73971023,108.6478175
424,2 months,A749612,Dog,Labrador Retriever Mix,White/Gray,5/16/2017,7/18/2017 12:00,2017-07-18T12:00:00,*Prince,Foster,Adoption,Neutered Male,30.51401387,-97.38220122,9.071428571
425,5 months,A685797,Other,Squirrel Mix,Brown,2/12/2014,8/12/2014 18:10,2014-08-12T18:10:00,,Suffering,Euthanasia,Intact Female,30.42885784,-97.34838949,25.96527778
426,7 years,A525136,Cat,American Shorthair Mix,Calico,10/17/2007,3/20/2015 11:01,2015-03-20T11:01:00,Muneca,Partner,Transfer,Spayed Female,30.3170641,-97.60042881,387.3512897
427,2 months,A702852,Cat,Domestic Shorthair Mix,Orange Tabby,3/3/2015,5/23/2015 11:16,2015-05-23T11:16:00,*Zeke,,Adoption,Neutered Male,30.59757501,-97.72337382,11.63849206
428,1 year,A750022,Cat,Domestic Shorthair Mix,Orange Tabby/White,5/22/2016,6/10/2017 10:54,2017-06-10T10:54:00,*Hudson,Partner,Transfer,Neutered Male,30.55903254,-97.47613024,54.92202381
429,2 years,A722427,Other,Opossum Mix,Gray,3/16/2014,3/16/2016 14:57,2016-03-16T14:57:00,,Rabies Risk,Euthanasia,Unknown,30.50856976,-97.43857279,104.5175595
430,1 year,A666852,Dog,Pit Bull Mix,Chocolate/White,5/8/2012,12/12/2013 15:17,2013-12-12T15:17:00,*Bonnie,Aggressive,Euthanasia,Spayed Female,30.71201254,-97.52294958,83.37668651
431,2 years,A743447,Dog,Chihuahua Shorthair Mix,Tan/White,2/10/2015,2/11/2017 15:25,2017-02-11T15:25:00,Squints,,Return to Owner,Neutered Male,30.6478024,-97.37273147,104.6631944
432,3 years,A674476,Cat,Domestic Shorthair Mix,Brown Tabby,3/13/2011,3/15/2014 17:49,2014-03-15T17:49:00,*Fiona,Suffering,Euthanasia,Intact Female,30.34252784,-97.39646074,156.9631944
433,3 years,A759045,Dog,Pit Bull Mix,White/Tan,9/25/2014,9/27/2017 14:25,2017-09-27T14:25:00,Boss,,Return to Owner,Intact Male,30.53358454,-97.62320062,156.9429563
434,2 years,A726876,Dog,Rottweiler,Black/Brown,5/15/2014,9/22/2016 19:08,2016-09-22T19:08:00,*Reuben,,Adoption,Neutered Male,30.37731165,-97.41899944,123.1138889
435,1 year,A752512,Cat,Domestic Shorthair Mix,Black,6/23/2016,7/3/2017 15:41,2017-07-03T15:41:00,*Lala,Snr,Transfer,Intact Female,30.47493381,-97.31697965,53.66478175
436,3 months,A729002,Cat,Domestic Shorthair Mix,Brown Tabby,3/12/2016,6/12/2016 13:09,2016-06-12T13:09:00,,Suffering,Euthanasia,Intact Male,30.43005535,-97.66464592,13.22113095
437,1 year,A746114,Other,Bat Mix,Brown,3/28/2016,3/29/2017 7:50,2017-03-29T07:50:00,,Rabies Risk,Euthanasia,Unknown,30.44775348,-97.52880096,52.33234127
438,2 weeks,A725791,Other,Opossum,Gray,4/15/2016,5/3/2016 12:38,2016-05-03T12:38:00,,Underage,Euthanasia,Unknown,30.58494844,-97.46288063,2.646626984
439,2 weeks,A680863,Bird,Duck,Yellow/Black,5/25/2014,6/10/2014 0:00,2014-06-10T00:00:00,,Partner,Transfer,Unknown,30.6589808,-97.3750885,2.285714286
440,6 months,A695938,Cat,Domestic Shorthair Mix,Tortie,7/26/2014,1/31/2015 18:19,2015-01-31T18:19:00,Callie,,Adoption,Spayed Female,30.65457534,-97.28139551,27.10902778
441,3 days,A704633,Cat,Domestic Shorthair Mix,White/Blue,6/5/2015,6/8/2015 11:10,2015-06-08T11:10:00,,Partner,Transfer,Unknown,30.58101568,-97.5878691,0.495039683
442,10 years,A762711,Dog,Catahoula Mix,Brown/White,11/25/2007,11/25/2017 15:19,2017-11-25T15:19:00,Willy,,Return to Owner,Neutered Male,30.30002048,-97.3326802,521.9483135
443,9 years,A707335,Dog,Pug Mix,Buff,7/13/2006,7/13/2015 18:03,2015-07-13T18:03:00,Killer,,Return to Owner,Intact Male,30.46007622,-97.3431438,469.678869
444,3 years,A753198,Cat,Domestic Shorthair Mix,Orange Tabby,7/3/2014,7/7/2017 15:48,2017-07-07T15:48:00,,Snr,Transfer,Neutered Male,30.5739625,-97.36072544,157.2369048
445,2 months,A728166,Cat,Domestic Shorthair Mix,Brown Tabby,4/24/2016,7/9/2016 17:54,2016-07-09T17:54:00,*Kelly,Foster,Adoption,Spayed Female,30.75894828,-97.29072227,10.96369048
446,2 years,A725930,Dog,Shih Tzu Mix,White/Buff,5/3/2014,5/7/2016 17:38,2016-05-07T17:38:00,Austin,,Adoption,Neutered Male,30.4958457,-97.44443126,105.1049603
447,3 months,A763045,Cat,Domestic Shorthair Mix,Brown Tabby/White,8/17/2017,12/9/2017 17:09,2017-12-09T17:09:00,Tiger,,Adoption,Intact Male,30.41000745,-97.30275304,16.38779762
448,2 years,A723943,Cat,Siamese Mix,Flame Point,4/9/2014,4/14/2016 19:11,2016-04-14T19:11:00,,SCRP,Transfer,Neutered Male,30.57293589,-97.43694629,105.2570437
449,4 years,A657492,Dog,Pit Bull Mix,White/Black,6/28/2010,9/29/2014 18:34,2014-09-29T18:34:00,Freckles,,Return to Owner,Spayed Female,30.63180354,-97.35248924,222.1105159
450,4 years,A665212,Dog,Labrador Retriever Mix,Brown/White,10/15/2009,12/26/2013 9:56,2013-12-26T09:56:00,*Lonnie,,Adoption,Neutered Male,30.45504918,-97.43219032,219.059127
451,4 months,A698702,Dog,German Shepherd Alaskan Malamute,Sable/White,11/16/2014,3/21/2015 12:37,2015-03-21T12:37:00,,,Adoption,Neutered Male,30.44324744,-97.51224986,17.93224206
452,3 months,A671067,Dog,Miniature Pinscher Mix,Chocolate/Brown,10/17/2013,1/21/2014 17:12,2014-01-21T17:12:00,,,Adoption,Spayed Female,30.59382256,-97.36618562,13.81666667
453,7 months,A658511,Dog,Labrador Retriever Pit Bull,Chocolate,3/11/2013,10/29/2013 9:07,2013-10-29T09:07:00,*Jasper,Foster,Adoption,Neutered Male,30.58080486,-97.71147142,33.19712302
454,1 month,A705436,Cat,Domestic Longhair Mix,Orange Tabby,4/25/2015,6/17/2015 12:14,2015-06-17T12:14:00,,Suffering,Euthanasia,Intact Male,30.52721607,-97.6058551,7.644246032
455,1 month,A713015,Cat,Siamese Mix,Seal Point,9/1/2015,10/11/2015 11:56,2015-10-11T11:56:00,*Cersei,Partner,Transfer,Intact Female,30.75387769,-97.60389732,5.78531746
456,14 years,A691761,Dog,Yorkshire Terrier,Silver/Tan,11/9/2000,11/9/2014 11:10,2014-11-09T11:10:00,Poopy,,Return to Owner,Neutered Male,30.38939506,-97.62746823,730.4950397
457,6 years,A730511,Dog,Pit Bull Mix,White/Brown,10/22/2010,11/30/2016 12:58,2016-11-30T12:58:00,Rocky,Partner,Transfer,Neutered Male,30.47118194,-97.28581242,318.7914683
458,2 months,A701213,Dog,German Shepherd Mix,Brown,2/25/2015,5/2/2015 21:23,2015-05-02T21:23:00,,Offsite,Adoption,Neutered Male,30.66174546,-97.67399273,9.555853175
459,1 month,A685106,Cat,Domestic Shorthair Mix,Brown Tabby,7/6/2014,9/2/2014 18:47,2014-09-02T18:47:00,*Larkspur,,Adoption,Neutered Male,30.40582451,-97.66680812,8.397519841
460,4 months,A716662,Cat,Domestic Shorthair Mix,Blue Tabby/White,7/22/2015,11/29/2015 18:19,2015-11-29T18:19:00,Archer,,Adoption,Neutered Male,30.47835936,-97.5812601,18.68045635
461,3 months,A722347,Dog,Pit Bull Mix,Tan/White,12/15/2015,3/19/2016 17:41,2016-03-19T17:41:00,,,Adoption,Neutered Male,30.35160558,-97.55675551,13.67668651
462,9 years,A663210,Cat,Domestic Shorthair Mix,Black,9/14/2004,4/12/2014 15:32,2014-04-12T15:32:00,Charlie,Foster,Adoption,Neutered Male,30.70615215,-97.66565911,499.6638889
463,1 weeks,A732887,Cat,Domestic Shorthair Mix,Calico,8/4/2016,8/14/2016 19:12,2016-08-14T19:12:00,,Partner,Transfer,Unknown,30.32183632,-97.58168272,1.542857143
464,1 year,A722331,Dog,Pit Bull Mix,Brown Brindle,3/14/2015,3/19/2016 17:26,2016-03-19T17:26:00,*Hendrix,,Adoption,Neutered Male,30.73452137,-97.26480502,53.10376984
465,4 years,A743066,Dog,German Shepherd Mix,White,2/3/2013,2/8/2017 0:00,2017-02-08T00:00:00,Belle,Partner,Transfer,Spayed Female,30.53373558,-97.58107569,209.4285714
466,6 years,A604679,Dog,Chihuahua Shorthair Mix,Cream,12/27/2008,1/1/2015 0:00,2015-01-01T00:00:00,Snowball,Partner,Transfer,Neutered Male,30.61746476,-97.65174648,313.7142857
467,3 weeks,A682131,Cat,Domestic Shorthair Mix,Brown Tabby,6/2/2014,6/24/2014 19:15,2014-06-24T19:15:00,,Partner,Transfer,Intact Male,30.55359804,-97.70401446,3.257440476
468,2 months,A675516,Cat,Domestic Shorthair Mix,Brown Tabby/White,3/21/2014,5/24/2014 15:25,2014-05-24T15:25:00,,,Adoption,Spayed Female,30.45420529,-97.31710859,9.234623016
469,6 years,A740539,Dog,Chihuahua Shorthair Italian Greyhound,Tan/White,12/19/2010,12/22/2016 17:37,2016-12-22T17:37:00,Bella,Partner,Transfer,Spayed Female,30.36977945,-97.37584376,313.6762897
470,2 weeks,A748759,Cat,Domestic Shorthair Mix,Black,4/24/2017,5/9/2017 10:30,2017-05-09T10:30:00,,In Kennel,Died,Intact Male,30.69910677,-97.59274715,2.205357143
471,1 year,A724181,Dog,Queensland Heeler,White/Black,8/13/2015,9/24/2016 11:44,2016-09-24T11:44:00,Blue,,Return to Owner,Neutered Male,30.51564879,-97.58391191,58.35555556
472,1 year,A759132,Dog,Labrador Retriever Mix,White/Brown,9/27/2016,11/21/2017 15:08,2017-11-21T15:08:00,Lucy,,Adoption,Spayed Female,30.70162025,-97.52915578,60.09007937
473,3 years,A679072,Dog,Chihuahua Shorthair Wire Hair Fox Terrier,White/Brown,5/16/2011,5/28/2014 17:55,2014-05-28T17:55:00,Rudy,,Adoption,Neutered Male,30.51087002,-97.27676732,158.3923611
474,6 months,A728751,Dog,Border Collie Mix,Chocolate/White,12/8/2015,7/2/2016 14:02,2016-07-02T14:02:00,Chloe,,Adoption,Spayed Female,30.70452928,-97.45353173,29.65496032
475,6 years,A719194,Dog,Beagle Mix,Tricolor,1/27/2011,4/4/2017 17:27,2017-04-04T17:27:00,Ginger,Partner,Transfer,Spayed Female,30.58885,-97.49213587,322.8181548
476,2 months,A677195,Cat,Domestic Shorthair Mix,Calico,3/23/2014,5/25/2014 18:26,2014-05-25T18:26:00,Rosie,,Adoption,Spayed Female,30.33332968,-97.41560471,9.109722222
477,2 weeks,A692326,Cat,Domestic Shorthair Mix,Blue Tabby,11/3/2014,11/18/2014 17:28,2014-11-18T17:28:00,,Partner,Transfer,Intact Female,30.53817185,-97.65816642,2.246825397
478,2 months,A676728,Cat,Domestic Shorthair Mix,Orange Tabby,4/12/2014,7/12/2014 20:15,2014-07-12T20:15:00,Macduff,Foster,Adoption,Neutered Male,30.54187348,-97.51910127,13.12053571
479,2 months,A755431,Cat,Domestic Shorthair Mix,Brown Tabby,7/3/2017,9/30/2017 9:58,2017-09-30T09:58:00,*Buttercup,Foster,Adoption,Spayed Female,30.54192974,-97.25135943,12.77361111
480,1 month,A692060,Cat,Domestic Shorthair Mix,Black/White,10/6/2014,11/13/2014 18:37,2014-11-13T18:37:00,,Suffering,Euthanasia,Intact Female,30.54699552,-97.24752867,5.539384921
481,1 year,A717535,Dog,Beagle Mix,Tricolor,12/9/2014,12/15/2015 15:31,2015-12-15T15:31:00,Daisy,,Adoption,Spayed Female,30.49533551,-97.51278319,53.09236111
482,1 year,A667409,Cat,Domestic Medium Hair Mix,Black,11/17/2012,11/22/2013 17:17,2013-11-22T17:17:00,Herby,SCRP,Transfer,Neutered Male,30.33222398,-97.44233516,52.96001984
483,2 months,A705802,Dog,Treeing Walker Coonhound Mix,Tricolor,4/6/2015,6/21/2015 17:47,2015-06-21T17:47:00,,Partner,Transfer,Unknown,30.46699669,-97.55440814,10.96299603
484,4 weeks,A690555,Cat,Domestic Shorthair Mix,Black/White,9/22/2014,10/25/2014 10:53,2014-10-25T10:53:00,*Chip,Partner,Transfer,Intact Male,30.40109608,-97.54564459,4.77906746
485,4 years,A696188,Dog,Pit Bull Mix,Blue/White,1/30/2011,2/2/2015 16:16,2015-02-02T16:16:00,Maya,,Return to Owner,Intact Female,30.29159304,-97.56433501,209.2396825
486,1 year,A692350,Cat,Domestic Shorthair Mix,Torbie,11/18/2013,11/25/2014 18:39,2014-11-25T18:39:00,,SCRP,Transfer,Intact Female,30.62231485,-97.55690802,53.25386905
487,3 months,A737550,Cat,Domestic Shorthair Mix,Brown Tabby/White,9/26/2016,1/12/2017 9:36,2017-01-12T09:36:00,Ernie,Foster,Adoption,Neutered Male,30.68798126,-97.52722705,15.48571429
488,2 months,A687998,Cat,Domestic Shorthair Mix,Black,7/13/2014,9/18/2014 16:24,2014-09-18T16:24:00,*Rabbit,,Adoption,Neutered Male,30.35566593,-97.39412419,9.669047619
489,9 years,A517501,Cat,Ragdoll Mix,Calico Point,4/26/2006,10/17/2015 15:44,2015-10-17T15:44:00,Snow Kitty,,Adoption,Spayed Female,30.71748705,-97.25971314,494.5222222
490,5 months,A670634,Dog,Plott Hound Mix,Brown Brindle,8/12/2013,1/28/2014 15:52,2014-01-28T15:52:00,*Eliza,,Adoption,Spayed Female,30.66777859,-97.42687894,24.23730159
491,2 years,A669460,Dog,Pomeranian Border Terrier,Buff,12/21/2011,12/24/2013 15:46,2013-12-24T15:46:00,Pancho,,Adoption,Neutered Male,30.48081225,-97.46033599,104.9509921
492,1 year,A667030,Dog,Dachshund Labrador Retriever,Tan,5/4/2013,5/7/2014 14:04,2014-05-07T14:04:00,*Sugar,,Adoption,Spayed Female,30.68323803,-97.70381942,52.65515873
493,2 years,A705722,Cat,Domestic Shorthair Mix,Brown Tabby/White,6/20/2013,7/27/2015 17:54,2015-07-27T17:54:00,,Foster,Adoption,Spayed Female,30.32553831,-97.5900131,109.6779762
494,2 months,A728536,Cat,Domestic Shorthair Mix,Brown Tabby,5/5/2016,7/9/2016 17:58,2016-07-09T17:58:00,*Tommy,Foster,Adoption,Neutered Male,30.52132759,-97.50078768,9.39265873
495,2 months,A719482,Cat,Domestic Medium Hair Mix,Brown Tabby/White,11/14/2015,1/22/2016 17:37,2016-01-22T17:37:00,,,Adoption,Neutered Male,30.66503354,-97.33113414,9.962003968
496,2 weeks,A725880,Cat,Domestic Shorthair Mix,White/Black,4/18/2016,5/3/2016 15:58,2016-05-03T15:58:00,,Partner,Transfer,Unknown,30.61318979,-97.33009561,2.237896825
497,2 months,A681780,Cat,Domestic Shorthair Mix,Black,4/6/2014,6/27/2014 14:18,2014-06-27T14:18:00,Maybe,,Adoption,Neutered Male,30.54180303,-97.26637225,11.79940476
498,2 years,A756818,Cat,Domestic Shorthair Mix,Tortie,8/25/2015,9/3/2017 16:10,2017-09-03T16:10:00,*Vanillope,,Adoption,Spayed Female,30.57724495,-97.37597261,105.8105159
499,1 year,A694430,Dog,Pit Bull Mix,Brown,12/28/2013,1/26/2015 16:19,2015-01-26T16:19:00,Chica,,Adoption,Spayed Female,30.28045842,-97.32542364,56.3828373
500,1 year,A675587,Other,Raccoon Mix,Black/Gray,3/29/2013,3/30/2014 14:45,2014-03-30T14:45:00,,Rabies Risk,Euthanasia,Unknown,30.6598662,-97.48064348,52.3735119
501,2 weeks,A680857,Bird,Duck,Yellow/Black,5/25/2014,6/10/2014 0:00,2014-06-10T00:00:00,,Partner,Transfer,Unknown,30.68099708,-97.31416586,2.285714286
502,4 months,A659172,Dog,Chihuahua Shorthair Mix,Black/Tan,6/5/2013,10/7/2013 18:00,2013-10-07T18:00:00,Lexi,Foster,Adoption,Spayed Female,30.2953604,-97.54330769,17.82142857
503,1 year,A703381,Cat,Domestic Shorthair Mix,Brown Tabby,5/24/2014,6/2/2015 9:07,2015-06-02T09:07:00,,Suffering,Euthanasia,Intact Female,30.591366,-97.44274385,53.4828373
504,8 years,A759534,Dog,Beagle Mix,Tricolor,10/3/2009,10/4/2017 11:09,2017-10-04T11:09:00,Looloo,,Return to Owner,Intact Female,30.38052846,-97.42752131,417.6377976
505,6 years,A677736,Dog,Miniature Poodle,White,4/28/2008,5/4/2014 18:18,2014-05-04T18:18:00,Curly,Partner,Transfer,Spayed Female,30.37327051,-97.63823534,313.9660714
506,1 year,A698647,Dog,Miniature Pinscher Mix,Black/Brown,1/15/2014,3/29/2015 17:22,2015-03-29T17:22:00,Shadow,,Adoption,Neutered Male,30.4616499,-97.28432733,62.67480159
507,2 weeks,A702814,Cat,Domestic Shorthair Mix,Black,5/3/2015,5/18/2015 13:38,2015-05-18T13:38:00,,Partner,Transfer,Unknown,30.48961233,-97.6707266,2.224007937
508,4 months,A670311,Cat,Domestic Shorthair Mix,Black/White,9/5/2013,1/13/2014 17:55,2014-01-13T17:55:00,*Tim,,Adoption,Neutered Male,30.48122575,-97.50361148,18.6780754
509,1 week,A746690,Cat,Domestic Longhair Mix,Gray/White,3/31/2017,4/7/2017 14:08,2017-04-07T14:08:00,,Partner,Transfer,Unknown,30.27478963,-97.61028368,1.084126984
510,2 months,A683054,Dog,Boxer Mix,Brown/Black,5/6/2014,7/10/2014 18:52,2014-07-10T18:52:00,Shadow,,Adoption,Neutered Male,30.43319788,-97.52942031,9.398015873
511,10 years,A545644,Dog,Miniature Pinscher,Chocolate/Tan,6/5/2007,12/17/2017 16:11,2017-12-17T16:11:00,Lucky,,Adoption,Neutered Male,30.56828834,-97.3148639,549.8106151
512,2 months,A744574,Cat,Domestic Medium Hair Mix,Orange Tabby,12/12/2016,3/3/2017 17:12,2017-03-03T17:12:00,Henry,,Return to Owner,Intact Male,30.68546785,-97.40333875,11.67380952
513,3 months,A731531,Cat,Domestic Shorthair Mix,Black/White,6/16/2016,9/16/2016 0:00,2016-09-16T00:00:00,*Alex,Foster,Adoption,Spayed Female,30.65611078,-97.36109799,13.14285714
514,2 months,A676868,Cat,Domestic Medium Hair Mix,Calico,3/6/2014,5/23/2014 16:43,2014-05-23T16:43:00,*Pinkie Pie,,Adoption,Spayed Female,30.70658333,-97.30753283,11.24236111
515,1 year,A715517,Dog,Labrador Retriever Pit Bull,Chocolate/White,11/5/2014,1/31/2016 16:17,2016-01-31T16:17:00,*Desi,,Adoption,Spayed Female,30.55796074,-97.67686118,64.66835317
516,4 years,A707181,Dog,Labrador Retriever Mix,Tan/White,7/9/2011,9/16/2015 13:05,2015-09-16T13:05:00,Stripe,,Adoption,Neutered Male,30.44514811,-97.61567005,218.6493056
517,2 months,A684373,Cat,Domestic Shorthair Mix,Brown Tabby/White,5/5/2014,7/27/2014 17:11,2014-07-27T17:11:00,*Henry,,Adoption,Neutered Male,30.37799374,-97.38154093,11.9594246
518,7 years,A596202,Dog,Labrador Retriever Mix,Black,4/4/2009,7/28/2016 16:55,2016-07-28T16:55:00,Lucky,,Adoption,Neutered Male,30.4042326,-97.31410238,381.8149802
519,2 years,A717102,Dog,Pit Bull Mix,Blue/White,12/2/2013,3/6/2016 18:13,2016-03-06T18:13:00,*Rufus,,Adoption,Neutered Male,30.41303891,-97.41699078,117.9655754
520,1 year,A750419,Dog,Chihuahua Shorthair Mix,Brown/White,5/27/2016,5/28/2017 13:06,2017-05-28T13:06:00,Sally,,Return to Owner,Spayed Female,30.44472395,-97.53602497,52.36369048
521,2 weeks,A686192,Cat,Domestic Shorthair Mix,Brown Tabby/White,8/3/2014,8/18/2014 14:31,2014-08-18T14:31:00,,Partner,Transfer,Intact Male,30.30137924,-97.7212619,2.229265873
522,1 year,A687200,Dog,Miniature Pinscher Mix,Black/Tan,9/2/2013,9/9/2014 16:34,2014-09-09T16:34:00,*Spring,,Adoption,Spayed Female,30.7131611,-97.31311756,53.24146825
523,2 months,A729274,Cat,Domestic Shorthair Mix,Tortie,4/27/2016,7/9/2016 12:02,2016-07-09T12:02:00,,,Adoption,Spayed Female,30.75881813,-97.5870631,10.50019841
524,1 month,A665447,Cat,Domestic Shorthair Mix,Brown Tabby,9/18/2013,11/9/2013 0:09,2013-11-09T00:09:00,*Hubble,Partner,Transfer,Intact Male,30.75450561,-97.5348698,7.429464286
525,2 years,A729510,Other,Squirrel Mix,Brown/Gray,6/19/2014,7/4/2016 10:40,2016-07-04T10:40:00,,,Disposal,Unknown,30.68562134,-97.48912241,106.6349206
526,3 days,A682465,Cat,Domestic Shorthair Mix,Black/White,6/25/2014,6/28/2014 13:32,2014-06-28T13:32:00,,Partner,Transfer,Intact Female,30.52318326,-97.64131208,0.509126984
527,2 years,A679005,Cat,Domestic Longhair Mix,Orange Tabby,5/15/2012,5/25/2014 17:34,2014-05-25T17:34:00,,SCRP,Transfer,Intact Female,30.62216014,-97.70194511,105.8188492
528,8 months,A695920,Dog,Pit Bull Mix,Brown/White,5/25/2014,1/30/2015 18:14,2015-01-30T18:14:00,*Wanda,,Adoption,Spayed Female,30.62791024,-97.25122785,35.82281746
529,3 months,A703805,Cat,Domestic Shorthair Mix,Brown Tabby/White,5/13/2015,8/29/2015 14:14,2015-08-29T14:14:00,*Bitsie,Offsite,Adoption,Spayed Female,30.31986207,-97.5164347,15.51329365
530,3 months,A692580,Dog,Jack Russell Terrier Mix,Liver/White,8/23/2014,11/29/2014 12:43,2014-11-29T12:43:00,,Partner,Transfer,Intact Female,30.45671918,-97.40963249,14.07569444
531,5 months,A677643,Dog,Yorkshire Terrier Mix,Silver/Tan,11/27/2013,5/2/2014 18:36,2014-05-02T18:36:00,,Partner,Transfer,Neutered Male,30.59490035,-97.59121691,22.39642857
532,6 years,A765126,Dog,Pit Bull Mix,Brown Brindle/White,1/13/2012,1/23/2018 14:01,2018-01-23T14:01:00,*Dottie,,Adoption,Spayed Female,30.65415309,-97.54271051,314.6548611
533,8 months,A664951,Dog,Chihuahua Shorthair Mix,Tricolor,2/15/2013,10/18/2013 16:19,2013-10-18T16:19:00,Twinkle,,Adoption,Spayed Female,30.74706195,-97.65468275,35.09712302
534,1 year,A671534,Cat,Snowshoe,Seal Point/White,1/26/2013,3/31/2014 18:14,2014-03-31T18:14:00,Stella,,Adoption,Spayed Female,30.75145781,-97.43398122,61.39424603
535,2 years,A664812,Dog,Pit Bull Mix,Black/White,4/12/2011,3/7/2014 15:46,2014-03-07T15:46:00,Blue,Aggressive,Euthanasia,Intact Male,30.53711628,-97.4104975,151.5224206
536,1 year,A683157,Cat,Domestic Longhair Mix,Black Smoke,7/7/2013,7/8/2014 9:00,2014-07-08T09:00:00,,SCRP,Transfer,Intact Female,30.35333831,-97.54523747,52.33928571
537,2 years,A763702,Dog,Chihuahua Shorthair Mix,Brown,12/14/2015,12/20/2017 16:57,2017-12-20T16:57:00,Evita,,Adoption,Spayed Female,30.57286582,-97.27865724,105.3866071
538,4 months,A724973,Dog,Labrador Retriever Mix,Black/White,12/23/2015,4/24/2016 17:13,2016-04-24T17:13:00,Sir,,Return to Owner,Neutered Male,30.45151352,-97.26801736,17.67390873
539,3 years,A726718,Dog,Mexican Hairless Mix,Gray,5/13/2013,5/17/2016 18:59,2016-05-17T18:59:00,Iris,,Adoption,Spayed Female,30.34483572,-97.49903742,157.2558532
540,2 months,A683706,Cat,Domestic Longhair Mix,Black/White,6/8/2014,9/1/2014 14:45,2014-09-01T14:45:00,*Gloria,Foster,Adoption,Spayed Female,30.67270933,-97.37063205,12.23065476
541,2 months,A730834,Cat,Domestic Medium Hair Mix,Black,6/21/2016,9/2/2016 18:49,2016-09-02T18:49:00,*Ebony,,Adoption,Spayed Female,30.64893497,-97.45359935,10.5405754
542,2 years,A676098,Dog,Queensland Heeler Mix,Red/Red Tick,4/4/2012,4/28/2014 18:01,2014-04-28T18:01:00,*Cato,,Adoption,Neutered Male,30.58700673,-97.46734917,107.8215278
543,4 years,A632357,Cat,Domestic Shorthair Mix,Calico,3/15/2012,6/29/2016 19:19,2016-06-29T19:19:00,Mischa,,Adoption,Spayed Female,30.64622151,-97.71806547,223.972123
544,4 months,A685000,Dog,Black Mouth Cur,Tan,4/16/2014,8/31/2014 16:20,2014-08-31T16:20:00,Fluffy,,Adoption,Spayed Female,30.28778468,-97.61037347,19.66865079
545,5 months,A665972,Dog,Plott Hound Mix,Brown Brindle,5/25/2013,11/10/2013 18:16,2013-11-10T18:16:00,Simba,,Adoption,Neutered Male,30.57754771,-97.48037229,24.2515873
546,1 year,A694545,Dog,Chihuahua Shorthair Mix,White/Tan,12/30/2013,1/5/2015 16:53,2015-01-05T16:53:00,Rider,,Return to Owner,Neutered Male,30.29827359,-97.57292146,53.10049603
547,7 months,A739373,Cat,Domestic Shorthair Mix,Blue Tabby,5/1/2016,12/24/2016 15:10,2016-12-24T15:10:00,Smokey,,Adoption,Neutered Male,30.51596554,-97.26059906,33.94742063
548,6 years,A703254,Cat,Domestic Shorthair Mix,Black/White,5/22/2009,6/25/2015 16:54,2015-06-25T16:54:00,*Hudson,,Adoption,Neutered Male,30.44269355,-97.5171668,317.9577381
549,6 years,A749092,Dog,Labrador Retriever,Brown,1/12/2011,5/13/2017 17:22,2017-05-13T17:22:00,Lucas,,Return to Owner,Neutered Male,30.28855939,-97.31124215,330.5319444
550,1 year,A680520,Dog,Catahoula Pit Bull,Brown Merle/White,6/3/2013,7/3/2014 15:42,2014-07-03T15:42:00,Cookie,,Adoption,Spayed Female,30.46110994,-97.53374314,56.52202381
551,4 years,A662100,Dog,German Shepherd,Brown/Black,3/1/2010,2/19/2015 12:59,2015-02-19T12:59:00,Beaux,Partner,Transfer,Neutered Male,30.32371576,-97.68786343,259.5058532
552,10 months,A718870,Dog,Rottweiler Mix,Black/Brown,9/8/2015,8/7/2016 13:07,2016-08-07T13:07:00,Samantha,,Return to Owner,Spayed Female,30.672849,-97.47282549,47.79236111
553,1 weeks,A734138,Cat,Domestic Shorthair Mix,Black,8/24/2016,9/1/2016 19:12,2016-09-01T19:12:00,,Partner,Transfer,Intact Female,30.75103786,-97.34330176,1.257142857
554,4 years,A687175,Dog,Labrador Retriever,Black/White,9/2/2010,11/11/2014 13:16,2014-11-11T13:16:00,*Carla,,Adoption,Spayed Female,30.38799523,-97.42729371,218.793254
555,1 day,A688511,Cat,Domestic Shorthair Mix,Calico,9/19/2014,9/20/2014 15:31,2014-09-20T15:31:00,,Partner,Transfer,Unknown,30.49174437,-97.66219543,0.235218254
556,5 days,A728845,Cat,Domestic Shorthair Mix,Blue Tabby,6/6/2016,6/11/2016 17:42,2016-06-11T17:42:00,,Partner,Transfer,Unknown,30.65908021,-97.42920724,0.819642857
557,2 months,A760485,Cat,Domestic Shorthair Mix,Black,9/10/2017,11/24/2017 16:19,2017-11-24T16:19:00,Memow,,Adoption,Neutered Male,30.54587883,-97.27171405,10.81140873
558,8 months,A695615,Dog,German Shepherd Mix,Sable,5/19/2014,1/19/2015 13:22,2015-01-19T13:22:00,Francis,,Return to Owner,Neutered Male,30.61878009,-97.63593754,35.07956349
559,2 years,A752579,Dog,Pit Bull Mix,Blue/White,6/24/2015,1/30/2018 12:56,2018-01-30T12:56:00,Faneto,,Adoption,Neutered Male,30.74297531,-97.48879959,135.934127
560,3 months,A707363,Cat,Domestic Shorthair Mix,Black/White,5/29/2015,9/12/2015 18:12,2015-09-12T18:12:00,*Xane,,Adoption,Neutered Male,30.51442397,-97.65868234,15.25119048
561,8 months,A694478,Dog,Pbgv,Brown,4/29/2014,1/1/2015 18:58,2015-01-01T18:58:00,Trixie,,Adoption,Spayed Female,30.33033092,-97.34016145,35.39861111
562,3 months,A722989,Dog,Pit Bull,Black/White,2/27/2016,6/10/2016 12:27,2016-06-10T12:27:00,,Foster,Adoption,Neutered Male,30.66585861,-97.34512392,14.93125
563,5 years,A698909,Dog,Akita Mix,White/Brown,3/19/2011,7/26/2016 14:51,2016-07-26T14:51:00,Panda,,Return to Owner,Neutered Male,30.34733517,-97.25272094,279.5169643
564,2 years,A760244,Dog,Catahoula Mix,White/Tan,10/15/2015,10/16/2017 17:34,2017-10-16T17:34:00,,Partner,Transfer,Intact Female,30.56502416,-97.67593902,104.6759921
565,1 year,A665548,Other,Rabbit Sh Mix,Tan/White,10/19/2012,10/23/2013 17:03,2013-10-23T17:03:00,Baby,Partner,Transfer,Intact Female,30.70017861,-97.36692429,52.81577381
566,4 months,A731292,Cat,Domestic Shorthair Mix,Orange Tabby,2/19/2016,7/20/2016 9:00,2016-07-20T09:00:00,,SCRP,Transfer,Intact Male,30.49328369,-97.46063148,21.76785714
567,8 years,A682772,Cat,Domestic Shorthair Mix,Black/White,7/2/2006,7/8/2014 11:35,2014-07-08T11:35:00,,Suffering,Euthanasia,Spayed Female,30.46957104,-97.38375099,418.3546627
568,3 years,A647338,Dog,Pit Bull Mix,White/Red,8/8/2012,10/1/2015 12:33,2015-10-01T12:33:00,Pinocchio,Partner,Transfer,Neutered Male,30.46557512,-97.57565709,164.2175595
569,2 months,A698073,Dog,Labrador Retriever Blue Lacy,Blue/White,12/21/2014,3/9/2015 18:51,2015-03-09T18:51:00,Bella,,Adoption,Spayed Female,30.4084386,-97.30139391,11.25505952
570,2 months,A689935,Cat,Domestic Shorthair Mix,Brown Tabby/White,8/11/2014,10/15/2014 19:06,2014-10-15T19:06:00,Happy,,Return to Owner,Spayed Female,30.59160412,-97.73797537,9.399404762
571,2 months,A714104,Dog,Pit Bull Mix,Brown,8/18/2015,10/20/2015 15:49,2015-10-20T15:49:00,*Paisley,Partner,Transfer,Intact Female,30.35532283,-97.52599499,9.094146825
572,5 years,A718648,Dog,Miniature Schnauzer Mix,Gray/White,7/5/2011,12/1/2016 17:04,2016-12-01T17:04:00,Xena,,Return to Owner,Spayed Female,30.68692035,-97.47098284,282.3873016
573,5 months,A705387,Dog,Chihuahua Shorthair Mix,Tan,1/16/2015,6/24/2015 14:00,2015-06-24T14:00:00,Conan,,Adoption,Neutered Male,30.67185152,-97.25792475,22.79761905
574,2 years,A671931,Dog,Pit Bull Mix,Brown Brindle,2/1/2012,3/6/2014 16:26,2014-03-06T16:26:00,*Sophia,,Adoption,Spayed Female,30.4411955,-97.6293119,109.2406746
575,6 months,A757841,Cat,American Shorthair Mix,Black/White,3/7/2017,9/27/2017 15:59,2017-09-27T15:59:00,*Winkin,Partner,Transfer,Spayed Female,30.52955432,-97.37302396,29.23799603
576,3 months,A715879,Cat,Domestic Shorthair Mix,Black,9/11/2015,12/19/2015 14:20,2015-12-19T14:20:00,*Eva,,Adoption,Spayed Female,30.74522856,-97.55720733,14.2281746
577,5 months,A673493,Cat,Domestic Shorthair Mix,Tortie/White,2/25/2014,8/1/2014 10:28,2014-08-01T10:28:00,,Foster,Adoption,Spayed Female,30.70106345,-97.456595,22.49087302
578,4 months,A667061,Cat,Domestic Shorthair,Black,7/12/2013,11/23/2013 14:53,2013-11-23T14:53:00,*Bella,,Adoption,Spayed Female,30.50766269,-97.3614745,19.23144841
579,1 year,A740698,Dog,Pit Bull Mix,Brown/White,3/21/2016,6/26/2017 19:00,2017-06-26T19:00:00,Biggie,,Return to Owner,Intact Male,30.34072459,-97.3801798,66.11309524
580,3 years,A691485,Dog,Boxer Pit Bull,Tricolor,5/5/2013,2/27/2017 12:29,2017-02-27T12:29:00,*Twyla,Partner,Transfer,Spayed Female,30.68692853,-97.60597878,199.2171627
581,6 years,A712018,Dog,Pomeranian Chihuahua Longhair,Buff/White,9/15/2009,9/19/2015 16:37,2015-09-19T16:37:00,,,Return to Owner,Spayed Female,30.76686294,-97.2675031,313.6703373
582,1 year,A751840,Other,Guinea Pig Mix,Gray,6/13/2016,6/16/2017 7:44,2017-06-16T07:44:00,,Partner,Transfer,Intact Male,30.74131182,-97.43006754,52.61746032
583,1 year,A758221,Cat,Domestic Shorthair Mix,Orange Tabby,9/12/2016,10/5/2017 0:00,2017-10-05T00:00:00,*Deb,Partner,Transfer,Spayed Female,30.29463284,-97.36926181,55.42857143
584,4 months,A711793,Cat,Domestic Shorthair Mix,Brown Tabby,5/12/2015,9/12/2015 13:11,2015-09-12T13:11:00,,,Return to Owner,Unknown,30.67146662,-97.28956027,17.64990079
585,5 years,A752044,Dog,Rottweiler Mix,Black/Tan,6/17/2012,6/17/2017 14:20,2017-06-17T14:20:00,Cita,Partner,Transfer,Intact Female,30.4938988,-97.52294325,260.9424603
586,3 months,A723979,Dog,Chihuahua Shorthair Mix,White/Tan,12/30/2015,4/15/2016 0:00,2016-04-15T00:00:00,*Bobby,,Adoption,Neutered Male,30.26857692,-97.71644272,15.28571429
587,1 year,A741918,Dog,Australian Cattle Dog Mix,Black,1/11/2016,1/15/2017 10:05,2017-01-15T10:05:00,,Partner,Transfer,Intact Female,30.45221607,-97.32082612,52.9171627
588,11 years,A705192,Dog,Border Collie,Chocolate/White,6/15/2004,6/15/2015 15:02,2015-06-15T15:02:00,Jaco,,Return to Owner,Neutered Male,30.46061941,-97.49804595,573.946627
589,7 years,A727888,Cat,Domestic Longhair Mix,Blue Tabby,5/31/2009,9/27/2016 9:11,2016-09-27T09:11:00,*Whiskers,Foster,Adoption,Neutered Male,30.41948972,-97.57655963,382.340377
590,2 years,A718094,Dog,German Shepherd Mix,Red,12/21/2013,1/4/2016 14:48,2016-01-04T14:48:00,*Captain,,Adoption,Neutered Male,30.68465519,-97.59138064,106.3738095
591,3 years,A666545,Cat,Domestic Shorthair Mix,Brown Tabby,11/3/2010,11/5/2013 16:17,2013-11-05T16:17:00,,SCRP,Transfer,Intact Female,30.3021622,-97.45390618,156.9540675
592,7 years,A559477,Dog,English Bulldog,Tan/White,4/24/2008,11/12/2015 18:04,2015-11-12T18:04:00,Mento,Partner,Transfer,Intact Male,30.29170426,-97.65558016,394.1075397
593,4 weeks,A727177,Cat,Domestic Shorthair Mix,Seal Point,4/19/2016,5/19/2016 15:01,2016-05-19T15:01:00,,Partner,Transfer,Intact Female,30.40282726,-97.30300109,4.375099206
594,1 year,A738655,Cat,Domestic Shorthair Mix,Blue Tabby,11/19/2015,12/27/2016 15:58,2016-12-27T15:58:00,Skinny,,Adoption,Spayed Female,30.32720233,-97.33984872,57.8093254
595,6 months,A694254,Dog,Manchester Terrier Mix,Black/Brown,6/23/2014,12/28/2014 17:51,2014-12-28T17:51:00,Titan,,Adoption,Neutered Male,30.32136866,-97.59919111,26.96339286
596,2 years,A674872,Dog,Jack Russell Terrier,White/Brown,3/19/2012,3/20/2014 11:10,2014-03-20T11:10:00,Lady,,Return to Owner,Spayed Female,30.64571404,-97.29553743,104.4950397
597,5 months,A727104,Dog,Labrador Retriever Mix,Black,12/18/2015,6/6/2016 15:34,2016-06-06T15:34:00,Goose,,Adoption,Spayed Female,30.3927522,-97.30191503,24.52123016
598,2 months,A762809,Cat,Domestic Shorthair Mix,Brown Tabby,9/20/2017,12/3/2017 18:04,2017-12-03T18:04:00,,,Adoption,Spayed Female,30.61892962,-97.3201891,10.67896825
599,3 weeks,A711600,Cat,Domestic Shorthair Mix,White,8/18/2015,9/9/2015 15:21,2015-09-09T15:21:00,,Partner,Transfer,Intact Male,30.50954535,-97.59685643,3.23422619
600,4 months,A759874,Dog,Miniature Pinscher,Black/Tan,6/8/2017,10/24/2017 17:58,2017-10-24T17:58:00,*Ariel,,Adoption,Spayed Female,30.43992681,-97.65814942,19.82123016
601,6 months,A706030,Dog,Bearded Collie Mix,Blue Merle/White,12/23/2014,6/27/2015 18:35,2015-06-27T18:35:00,Caicos,,Adoption,Spayed Female,30.48671612,-97.51918683,26.68204365
602,6 months,A664384,Other,Raccoon Mix,Brown,4/2/2013,10/2/2013 18:36,2013-10-02T18:36:00,,Rabies Risk,Euthanasia,Unknown,30.71904022,-97.3192666,26.25357143
603,2 years,A702471,Dog,American Pit Bull Terrier Labrador Retriever,Brown Brindle/White,5/14/2013,11/15/2015 18:13,2015-11-15T18:13:00,Simona,,Return to Owner,Spayed Female,30.28250607,-97.70133943,130.8227183
604,5 years,A669801,Dog,Pit Bull Boxer,White/Brown,6/27/2010,5/21/2016 14:00,2016-05-21T14:00:00,Lilly,Partner,Transfer,Spayed Female,30.44406338,-97.63060569,307.9404762
605,1 year,A731082,Dog,Dachshund Mix,White/Tan,7/15/2015,7/20/2016 11:36,2016-07-20T11:36:00,,,Adoption,Neutered Male,30.49685473,-97.52886179,53.06904762
606,9 years,A387083,Dog,Labrador Retriever Mix,Tan,11/27/2004,2/12/2014 11:12,2014-02-12T11:12:00,Goldie,,Return to Owner,Spayed Female,30.42564307,-97.62103706,480.6380952
607,3 years,A673401,Dog,Chihuahua Shorthair Mix,Yellow/White,2/23/2011,2/24/2014 13:50,2014-02-24T13:50:00,,Partner,Transfer,Neutered Male,30.30707922,-97.29446209,156.796627
608,1 month,A756565,Cat,Siamese Mix,Lynx Point,6/28/2017,8/26/2017 15:39,2017-08-26T15:39:00,Mini,,Adoption,Intact Female,30.41612086,-97.51644239,8.52172619
609,3 weeks,A709315,Cat,Domestic Shorthair Mix,Brown Tabby,7/21/2015,8/11/2015 0:00,2015-08-11T00:00:00,,Partner,Transfer,Intact Male,30.45477757,-97.66329125,3
610,1 month,A748667,Cat,Domestic Shorthair Mix,Brown Tabby/White,4/10/2017,6/3/2017 13:59,2017-06-03T13:59:00,Pickle,Foster,Adoption,Neutered Male,30.69661448,-97.44652461,7.797519841
611,2 years,A678639,Dog,Boxer Mix,Brown Brindle/White,11/11/2011,5/22/2014 13:37,2014-05-22T13:37:00,,Partner,Transfer,Spayed Female,30.55819077,-97.64686275,131.9381944
612,3 months,A669114,Cat,Domestic Shorthair Mix,Orange Tabby,9/14/2013,12/23/2013 11:27,2013-12-23T11:27:00,*Joe,Partner,Transfer,Neutered Male,30.73872901,-97.54730294,14.35386905
613,3 years,A762568,Dog,Mastiff Mix,Tan/White,11/21/2014,12/1/2017 13:34,2017-12-01T13:34:00,Saint,,Return to Owner,Intact Male,30.53801187,-97.60867226,158.080754
614,1 year,A744282,Cat,Domestic Shorthair Mix,Brown Tabby,2/26/2016,2/27/2017 9:00,2017-02-27T09:00:00,,SCRP,Transfer,Neutered Male,30.51117605,-97.70173134,52.48214286
615,3 years,A742892,Dog,Pit Bull Mix,Black,1/30/2014,2/11/2017 17:57,2017-02-11T17:57:00,*Finch,,Adoption,Neutered Male,30.76703407,-97.4246126,158.3925595
616,5 months,A684362,Cat,Siamese Mix,Tortie Point,5/26/2014,11/11/2014 17:41,2014-11-11T17:41:00,Bella,,Adoption,Spayed Female,30.34634288,-97.49297299,24.24811508
617,3 years,A670407,Dog,Pit Bull Mix,Brown Brindle/White,1/7/2011,3/13/2014 12:40,2014-03-13T12:40:00,Buster,,Adoption,Neutered Male,30.58824603,-97.31001791,165.9325397
618,3 months,A726717,Cat,Domestic Shorthair Mix,White/Brown,4/1/2016,7/24/2016 17:14,2016-07-24T17:14:00,*Dumpling,Foster,Adoption,Spayed Female,30.52466369,-97.60884959,16.38829365
619,3 years,A702726,Dog,Labrador Retriever Mix,Black,5/20/2012,5/20/2015 18:50,2015-05-20T18:50:00,Mulder,,Return to Owner,Neutered Male,30.53626735,-97.49199913,156.5406746
620,2 years,A691123,Other,Bat Mix,Brown,10/30/2012,10/31/2014 8:16,2014-10-31T08:16:00,,Rabies Risk,Euthanasia,Unknown,30.6978237,-97.49832242,104.4777778
621,2 months,A670154,Dog,Border Collie Mix,Cream/White,10/22/2013,1/6/2014 17:51,2014-01-06T17:51:00,Bevo,,Adoption,Neutered Male,30.34724022,-97.65890418,10.96339286
622,2 years,A741441,Dog,Doberman Pinsch,Blue/Tan,1/4/2015,1/4/2017 14:02,2017-01-04T14:02:00,Deeohgee,,Return to Owner,Intact Male,30.61762909,-97.42492847,104.5121032
623,1 year,A720063,Dog,Chinese Sharpei Mix,Black/Brown,8/2/2014,2/11/2016 12:01,2016-02-11T12:01:00,Kiko,,Return to Owner,Intact Male,30.36459179,-97.47666065,79.78581349
624,1 year,A701947,Dog,Labrador Retriever Mix,Red Tick/White,12/10/2014,1/2/2016 17:59,2016-01-02T17:59:00,Ruffs,Partner,Transfer,Neutered Male,30.33332942,-97.42084658,55.53561508
625,4 months,A699490,Dog,Pit Bull Boxer,Fawn/White,11/28/2014,4/1/2015 19:33,2015-04-01T19:33:00,,,Return to Owner,Neutered Male,30.65554232,-97.48302471,17.83065476
626,4 months,A672437,Dog,American Pit Bull Terrier Mix,Black/White,12/17/2013,4/27/2014 15:30,2014-04-27T15:30:00,Midnight,,Return to Owner,Spayed Female,30.33880494,-97.33533424,18.80654762
627,2 months,A702979,Cat,Domestic Shorthair Mix,Black,4/7/2015,7/3/2015 13:04,2015-07-03T13:04:00,*Jackson,Foster,Adoption,Neutered Male,30.34933405,-97.61256269,12.50634921
628,5 years,A729736,Dog,Pit Bull Mix,Black/White,6/23/2011,6/23/2016 17:47,2016-06-23T17:47:00,Jake,,Return to Owner,Neutered Male,30.39378714,-97.32864797,261.1058532
629,2 years,A695222,Dog,Flat Coat Retriever Mix,Black/White,1/11/2013,1/15/2015 18:19,2015-01-15T18:19:00,Bochy,,Adoption,Neutered Male,30.3577825,-97.58779817,104.9661706
630,10 years,A693181,Cat,Domestic Shorthair Mix,Black/White,12/6/2004,2/6/2015 14:00,2015-02-06T14:00:00,*Gracie Lou,,Adoption,Spayed Female,30.29156893,-97.28683766,530.6547619
631,3 months,A710398,Cat,Domestic Shorthair Mix,Black/White,7/25/2015,11/2/2015 15:56,2015-11-02T15:56:00,*Baxter,Foster,Adoption,Neutered Male,30.7067776,-97.26898553,14.38055556
632,2 years,A752422,Cat,Domestic Shorthair Mix,Black,6/22/2015,8/24/2017 14:46,2017-08-24T14:46:00,Mr. Skittles,Foster,Adoption,Neutered Male,30.46042161,-97.27964344,113.5164683
633,6 months,A733071,Cat,Domestic Shorthair Mix,Calico,2/16/2016,8/20/2016 18:47,2016-08-20T18:47:00,*Alyssia,,Adoption,Spayed Female,30.55331575,-97.41962833,26.68323413
634,1 weeks,A709715,Cat,Domestic Shorthair Mix,Black/White,7/30/2015,8/12/2015 14:24,2015-08-12T14:24:00,,Partner,Transfer,Unknown,30.46665241,-97.66896114,1.942857143
635,2 years,A731563,Cat,Domestic Shorthair Mix,White/Blue,7/24/2014,7/25/2016 9:00,2016-07-25T09:00:00,*Sparkle,SCRP,Transfer,Intact Male,30.46316567,-97.65092373,104.625
636,2 months,A726725,Cat,Domestic Shorthair Mix,Torbie,4/6/2016,6/19/2016 16:35,2016-06-19T16:35:00,*Alex,,Adoption,Spayed Female,30.63479433,-97.50526319,10.67013889
637,1 year,A722209,Cat,Domestic Shorthair Mix,Black/White,3/12/2015,3/21/2016 12:26,2016-03-21T12:26:00,,SCRP,Transfer,Neutered Male,30.58879939,-97.72424724,53.64543651
638,1 month,A760397,Cat,Domestic Shorthair Mix,White/Brown Tabby,9/25/2017,11/6/2017 17:49,2017-11-06T17:49:00,,Partner,Transfer,Intact Female,30.53306848,-97.53641037,6.106051587
639,13 years,A757447,Dog,Chihuahua Shorthair Mix,Brown,9/3/2004,9/3/2017 12:02,2017-09-03T12:02:00,Mr Big,,Return to Owner,Intact Male,30.74110201,-97.51026036,678.3573413
640,5 months,A762680,Dog,Pit Bull Mix,Brown Brindle/White,6/24/2017,12/20/2017 21:13,2017-12-20T21:13:00,*Benny,,Adoption,Neutered Male,30.40983484,-97.25768314,25.69771825
641,13 years,A665244,Dog,Miniature Poodle Mix,Brown,10/15/2000,10/15/2013 17:23,2013-10-15T17:23:00,Latte,Suffering,Euthanasia,Neutered Male,30.37434155,-97.36552154,678.3891865
642,4 years,A755418,Dog,Bulldog,Brown/White,8/3/2013,8/13/2017 12:41,2017-08-13T12:41:00,Sonny,,Return to Owner,Intact Male,30.35821877,-97.49733996,210.2183532
643,7 years,A688425,Dog,Chihuahua Shorthair Mix,Black,9/23/2007,9/24/2014 16:49,2014-09-24T16:49:00,Jingles,,Adoption,Neutered Male,30.65378957,-97.29590869,365.5286706
644,1 year,A669526,Other,Bat Mix,Brown,12/21/2012,12/22/2013 9:20,2013-12-22T09:20:00,,Rabies Risk,Euthanasia,Unknown,30.43337845,-97.61137629,52.34126984
645,1 year,A758197,Dog,Yorkshire Terrier Pomeranian,Red,9/12/2016,9/17/2017 17:04,2017-09-17T17:04:00,Bella,,Adoption,Spayed Female,30.59575131,-97.27711367,52.95873016
646,2 years,A701554,Dog,American Staffordshire Terrier Australian Cattle Dog,Black/White,5/1/2013,1/18/2016 12:22,2016-01-18T12:22:00,Kahlua,Partner,Transfer,Spayed Female,30.2880282,-97.24560241,141.7878968
647,11 months,A655329,Dog,Jack Russell Terrier Mix,White/Tan,11/30/2012,11/15/2013 16:24,2013-11-15T16:24:00,*Frisco,Partner,Transfer,Neutered Male,30.35790756,-97.58567051,50.09761905
648,3 years,A726005,Dog,Boston Terrier Mix,Black/White,5/5/2013,5/5/2016 11:37,2016-05-05T11:37:00,Ace,,Return to Owner,Neutered Male,30.34219702,-97.32819085,156.6405754
649,2 years,A731987,Dog,Labrador Retriever Mix,Black/Brown,7/30/2014,8/3/2016 19:06,2016-08-03T19:06:00,Karma,,Return to Owner,Spayed Female,30.38444006,-97.38760009,105.1136905
650,2 years,A695706,Cat,Domestic Shorthair Mix,Black/White,1/20/2013,1/21/2015 9:00,2015-01-21T09:00:00,,SCRP,Transfer,Unknown,30.39946851,-97.7331137,104.4821429
651,6 years,A644301,Dog,Chihuahua Shorthair Mix,Black,12/23/2007,11/17/2014 11:20,2014-11-17T11:20:00,Cloy,,Return to Owner,Neutered Male,30.28380186,-97.53522185,360.2103175
652,1 weeks,A752193,Other,Opossum Mix,White/Gray,6/10/2017,6/19/2017 16:15,2017-06-19T16:15:00,,Suffering,Euthanasia,Unknown,30.36174335,-97.27095702,1.382440476
653,2 months,A669834,Dog,German Shepherd Mix,Black/Cream,10/21/2013,12/28/2013 14:06,2013-12-28T14:06:00,,Partner,Transfer,Intact Female,30.63447517,-97.6054313,9.798214286
654,2 years,A716628,Cat,Domestic Longhair Mix,Brown Tabby,11/22/2013,11/27/2015 15:00,2015-11-27T15:00:00,Cabbage,,Return to Owner,Spayed Female,30.76362454,-97.539463,105.0892857
655,2 years,A706201,Cat,Siamese Mix,Seal Point,6/26/2013,6/26/2015 13:01,2015-06-26T13:01:00,,Rabies Risk,Euthanasia,Intact Male,30.31535346,-97.45890598,104.3631944
656,1 year,A751270,Dog,Doberman Pinsch Mix,Black/Brown,6/6/2016,6/28/2017 17:51,2017-06-28T17:51:00,Bruce,,Adoption,Neutered Male,30.37239045,-97.65127107,55.39196429
657,1 year,A724769,Cat,Domestic Shorthair Mix,Calico,4/21/2015,4/30/2016 15:00,2016-04-30T15:00:00,*Toula,,Adoption,Spayed Female,30.67003934,-97.36002774,53.66071429
658,1 month,A735963,Cat,Domestic Medium Hair Mix,Black/White,9/2/2016,10/13/2016 0:00,2016-10-13T00:00:00,*Norris,Partner,Transfer,Intact Male,30.57110475,-97.63547457,5.857142857
659,1 year,A666763,Dog,Chihuahua Shorthair,Chocolate/Tan,5/6/2012,11/22/2013 11:33,2013-11-22T11:33:00,*Cocoa,Partner,Transfer,Spayed Female,30.51013552,-97.54456402,80.78303571
660,12 years,A703429,Dog,Labrador Retriever Beagle,Brown/White,5/25/2005,11/1/2017 16:02,2017-11-01T16:02:00,Duke,,Return to Owner,Intact Male,30.48192837,-97.27315644,649.0954365
661,2 years,A681187,Dog,Pit Bull Mix,Black Brindle/White,6/13/2012,7/27/2014 11:18,2014-07-27T11:18:00,*Dalton,Partner,Transfer,Neutered Male,30.47051989,-97.49030832,110.6386905
662,10 years,A701979,Dog,Labrador Retriever Mix,Tan,11/7/2004,9/26/2015 13:37,2015-09-26T13:37:00,Winnie,Foster,Adoption,Spayed Female,30.70561633,-97.28162076,567.9381944
663,4 years,A675521,Cat,Domestic Shorthair Mix,Cream Tabby,3/28/2010,4/1/2014 14:39,2014-04-01T14:39:00,Dismiss,,Return to Owner,Neutered Male,30.32524662,-97.57157166,209.3729167
664,3 months,A705090,Dog,Miniature Schnauzer Mix,Black,2/13/2015,6/13/2015 12:30,2015-06-13T12:30:00,Stormy,,Return to Owner,Intact Female,30.54286656,-97.72202169,17.2172619
665,2 years,A702963,Cat,Domestic Shorthair Mix,Blue Tabby/White,5/19/2013,5/20/2015 9:00,2015-05-20T09:00:00,,SCRP,Transfer,Unknown,30.32069636,-97.34341105,104.4821429
666,2 years,A737423,Cat,Domestic Shorthair Mix,Black/White,10/27/2014,11/7/2016 17:00,2016-11-07T17:00:00,Mint,,Return to Owner,Intact Female,30.72743661,-97.71277975,106.1011905
667,5 months,A763704,Dog,German Shepherd Mix,Black/Cream,7/14/2017,12/19/2017 19:01,2017-12-19T19:01:00,Ophelia,,Adoption,Spayed Female,30.44099424,-97.37551629,22.68462302
668,1 year,A699664,Other,Bat,Brown,3/31/2014,3/31/2015 14:53,2015-03-31T14:53:00,,Rabies Risk,Euthanasia,Unknown,30.43209634,-97.428582,52.23144841
669,3 years,A672396,Dog,Basset Hound Mix,White/Red,1/9/2013,9/26/2016 0:00,2016-09-26T00:00:00,Layla,Partner,Transfer,Spayed Female,30.59298947,-97.48000628,193.7142857
670,1 year,A695539,Cat,Domestic Shorthair Mix,Brown Tabby/White,1/17/2014,1/18/2015 9:00,2015-01-18T09:00:00,,SCRP,Transfer,Intact Male,30.64883594,-97.24626617,52.33928571
671,17 years,A547803,Dog,Cocker Spaniel,White/Brown,10/15/1996,10/15/2013 13:29,2013-10-15T13:29:00,Sheba,Suffering,Euthanasia,Spayed Female,30.67772499,-97.29550409,887.0802579
672,9 months,A736038,Dog,Rat Terrier Mix,Black/Tan,12/9/2015,10/3/2016 17:33,2016-10-03T17:33:00,Tank,,Return to Owner,Neutered Male,30.4983739,-97.6314322,42.81875
673,0 years,A755172,Dog,Chihuahua Shorthair Mix,White/Black,7/30/2017,7/30/2017 16:51,2017-07-30T16:51:00,,Partner,Transfer,Intact Male,30.64035518,-97.30265494,0.100297619
674,1 year,A729819,Cat,Domestic Shorthair Mix,Brown Tabby,6/24/2015,6/25/2016 9:00,2016-06-25T09:00:00,,SCRP,Transfer,Intact Female,30.31051538,-97.38886821,52.48214286
675,2 years,A755091,Dog,Yorkshire Terrier Mix,Tan,7/29/2015,7/29/2017 19:46,2017-07-29T19:46:00,Butters,,Return to Owner,Intact Male,30.31349665,-97.3115568,104.5462302
676,1 month,A704906,Cat,Domestic Shorthair Mix,Black,5/10/2015,6/20/2015 12:28,2015-06-20T12:28:00,*Smokey,In Kennel,Died,Intact Female,30.74303282,-97.5494595,5.931349206
677,3 years,A749514,Cat,Domestic Shorthair Mix,Black,3/19/2014,5/26/2017 11:18,2017-05-26T11:18:00,Indy,,Return to Owner,Neutered Male,30.35338795,-97.39103769,166.3529762
678,4 years,A745232,Other,Bat Mix,Brown,3/15/2013,3/15/2017 10:07,2017-03-15T10:07:00,,Rabies Risk,Euthanasia,Unknown,30.29659347,-97.41558925,208.774504
679,2 weeks,A711076,Cat,Domestic Shorthair Mix,Black,8/17/2015,9/3/2015 14:24,2015-09-03T14:24:00,*Janet,Partner,Transfer,Intact Female,30.74641521,-97.57598363,2.514285714
680,8 months,A759400,Dog,Staffordshire Labrador Retriever,White/Black,2/1/2017,10/6/2017 14:17,2017-10-06T14:17:00,*Goose,Partner,Transfer,Neutered Male,30.72932843,-97.42836898,35.37073413
681,2 months,A759316,Cat,Domestic Shorthair Mix,White/Cream,9/16/2017,11/29/2017 8:47,2017-11-29T08:47:00,*Willie,Foster,Adoption,Neutered Male,30.52550209,-97.47268206,10.62371032
682,6 years,A677838,Cat,Domestic Shorthair Mix,Calico,4/29/2008,7/22/2014 13:23,2014-07-22T13:23:00,Bella,Foster,Adoption,Spayed Female,30.42266356,-97.40021051,325.0796627
683,6 years,A588404,Dog,Chihuahua Shorthair,Tan/Tan,12/28/2009,7/28/2016 15:12,2016-07-28T15:12:00,Campion,Partner,Transfer,Neutered Male,30.33064915,-97.64318892,343.5190476
684,4 months,A706348,Cat,Domestic Shorthair Mix,Brown Tabby,2/27/2015,7/1/2015 16:46,2015-07-01T16:46:00,,,Adoption,Spayed Female,30.73946812,-97.2862287,17.8140873
685,1 year,A709515,Cat,Domestic Shorthair Mix,Brown Tabby,8/10/2014,10/8/2015 13:52,2015-10-08T13:52:00,,,Return to Owner,Spayed Female,30.70307299,-97.59822222,60.65396825
686,1 year,A740771,Dog,Labrador Retriever Mix,Yellow,12/22/2015,7/21/2017 13:02,2017-07-21T13:02:00,*Edmund,,Adoption,Neutered Male,30.42300809,-97.57318442,82.50615079
687,6 months,A722540,Cat,Domestic Shorthair Mix,Calico,9/18/2015,3/29/2016 19:07,2016-03-29T19:07:00,,SCRP,Transfer,Intact Female,30.27256196,-97.37546998,27.68521825
688,5 years,A666498,Cat,Domestic Longhair Mix,Orange Tabby,11/2/2008,11/30/2013 13:10,2013-11-30T13:10:00,Butters,,Adoption,Neutered Male,30.47458734,-97.44000147,264.9355159
689,3 weeks,A725540,Cat,Domestic Shorthair Mix,Brown Tabby/White,4/8/2016,5/2/2016 13:32,2016-05-02T13:32:00,*Tiny,Partner,Transfer,Intact Male,30.31133672,-97.45595583,3.509126984
690,5 years,A757532,Cat,Siamese Mix,Cream/Blue Point,9/3/2012,9/24/2017 17:12,2017-09-24T17:12:00,Gustavo,,Adoption,Neutered Male,30.53603591,-97.47751908,263.9595238
691,2 months,A726250,Cat,Domestic Shorthair Mix,Calico,4/12/2016,6/28/2016 11:50,2016-06-28T11:50:00,*Oblina,,Adoption,Spayed Female,30.57250293,-97.49881007,11.07043651
692,2 months,A748678,Cat,Domestic Shorthair Mix,Brown Tabby/White,4/5/2017,6/17/2017 14:56,2017-06-17T14:56:00,*Maeve,Foster,Adoption,Spayed Female,30.57337686,-97.38899799,10.51746032
693,10 years,A734701,Dog,Maltese Mix,White,9/11/2006,9/21/2016 0:00,2016-09-21T00:00:00,*Snow,Partner,Transfer,Neutered Male,30.42007716,-97.55846971,523.2857143
694,2 years,A714760,Cat,Domestic Medium Hair Mix,Brown Tabby/White,10/27/2013,10/28/2015 9:00,2015-10-28T09:00:00,Aria,SCRP,Transfer,Spayed Female,30.56168778,-97.40121051,104.4821429
695,2 years,A726967,Dog,Jack Russell Terrier Mix,White/Brown,5/17/2014,5/17/2016 18:18,2016-05-17T18:18:00,Sugar,,Return to Owner,Spayed Female,30.43018073,-97.6558486,104.5375
696,1 year,A758294,Dog,Pit Bull,Brown Brindle/White,9/13/2016,10/10/2017 19:45,2017-10-10T19:45:00,*Darcie,Partner,Transfer,Intact Female,30.62313686,-97.46590252,56.11755952
697,2 years,A717547,Dog,American Bulldog Mix,White/Brown Brindle,12/10/2013,8/3/2016 11:54,2016-08-03T11:54:00,Dexter,Foster,Adoption,Neutered Male,30.66239503,-97.43344058,138.2136905
698,3 weeks,A716529,Cat,Domestic Shorthair Mix,Blue,10/29/2015,11/20/2015 15:49,2015-11-20T15:49:00,,Partner,Transfer,Intact Female,30.74634395,-97.32238906,3.237003968
699,5 months,A709048,Dog,Labrador Retriever Mix,Black/White,2/8/2015,8/8/2015 17:58,2015-08-08T17:58:00,*Libby,,Adoption,Intact Female,30.43815923,-97.51687615,25.9640873
700,9 years,A680832,Cat,Domestic Longhair Mix,White/Black,6/8/2005,6/12/2014 14:49,2014-06-12T14:49:00,Katy,Partner,Transfer,Spayed Female,30.71092118,-97.54027575,470.2310516
701,3 weeks,A747515,Cat,Domestic Shorthair Mix,Orange Tabby,3/29/2017,4/20/2017 19:05,2017-04-20T19:05:00,,Partner,Transfer,Intact Female,30.69481596,-97.34114947,3.256448413
702,1 month,A760396,Cat,Domestic Shorthair Mix,White/Brown Tabby,9/25/2017,11/6/2017 17:48,2017-11-06T17:48:00,,Partner,Transfer,Intact Female,30.3066652,-97.52586626,6.105952381
703,1 year,A735218,Dog,Wire Hair Fox Terrier Dachshund,Black/White,9/20/2015,9/24/2016 17:28,2016-09-24T17:28:00,Alexa,,Return to Owner,Intact Female,30.57037062,-97.43799613,52.96111111
704,3 weeks,A760180,Cat,Domestic Shorthair Mix,Black/White,9/22/2017,10/15/2017 12:37,2017-10-15T12:37:00,,Partner,Transfer,Intact Male,30.41521385,-97.40154443,3.360813492
705,1 year,A713180,Cat,Domestic Shorthair Mix,Black/White,1/1/2014,10/7/2015 12:41,2015-10-07T12:41:00,Theodore,Partner,Transfer,Neutered Male,30.34284302,-97.28655201,92.07549603
706,4 years,A682524,Dog,Doberman Pinsch Australian Cattle Dog,Tan/Gray,6/29/2010,7/2/2014 14:16,2014-07-02T14:16:00,Rio,,Return to Owner,Neutered Male,30.74125436,-97.57886829,209.2277778
707,1 year,A682809,Dog,Siberian Husky Mix,Black/White,7/3/2013,7/7/2014 17:55,2014-07-07T17:55:00,,,Adoption,Spayed Female,30.39296627,-97.58632897,52.82093254
708,1 year,A715126,Dog,Rhod Ridgeback Mix,Brown,7/1/2015,10/23/2016 14:29,2016-10-23T14:29:00,Sampson,,Adoption,Neutered Male,30.44141763,-97.71508183,68.65763889
709,9 months,A699789,Dog,Pbgv Mix,White/Blue,7/2/2014,4/2/2015 17:27,2015-04-02T17:27:00,Crystal,Partner,Transfer,Spayed Female,30.29217683,-97.67873845,39.24672619
710,11 years,A686208,Cat,Domestic Shorthair Mix,Brown Tabby,8/18/2003,9/7/2014 18:59,2014-09-07T18:59:00,Jaycup,,Adoption,Neutered Male,30.7606403,-97.61118569,576.9701389
711,1 year,A700984,Cat,Domestic Medium Hair Mix,Torbie,4/22/2014,5/25/2015 15:42,2015-05-25T15:42:00,Minnie,Suffering,Euthanasia,Spayed Female,30.67507043,-97.34659053,56.95059524
712,1 month,A710335,Cat,Domestic Longhair Mix,Blue,7/6/2015,9/5/2015 8:45,2015-09-05T08:45:00,*Rebbie,In Kennel,Died,Intact Male,30.36844171,-97.60827814,8.766369048
713,6 years,A678887,Dog,Siberian Husky Mix,Black/White,5/13/2011,9/28/2017 0:00,2017-09-28T00:00:00,Jax,Partner,Transfer,Intact Male,30.6671992,-97.41915458,332.8571429
714,2 months,A725000,Cat,Domestic Medium Hair Mix,Black,2/24/2016,4/29/2016 16:13,2016-04-29T16:13:00,,,Adoption,Neutered Male,30.36674843,-97.66492942,9.382242063
715,4 years,A664841,Dog,Queensland Heeler Mix,Black/White,10/9/2009,10/13/2013 17:18,2013-10-13T17:18:00,Rusty,,Adoption,Neutered Male,30.38416981,-97.48662998,209.3886905
716,1 month,A708059,Cat,Domestic Shorthair Mix,Black/White,6/7/2015,7/25/2015 12:53,2015-07-25T12:53:00,,Partner,Transfer,Intact Female,30.59072949,-97.44432297,6.933829365
717,2 months,A667593,Dog,Australian Cattle Dog Mix,Red Merle/Black,9/20/2013,11/22/2013 18:34,2013-11-22T18:34:00,Kaya,,Adoption,Spayed Female,30.56415638,-97.50122256,9.110515873
718,5 days,A704820,Other,Bat,Red,6/5/2015,6/10/2015 8:09,2015-06-10T08:09:00,,Rabies Risk,Euthanasia,Unknown,30.63860441,-97.53808063,0.762797619
719,6 years,A744195,Dog,Jack Russell Terrier Mix,White/Black,2/25/2011,3/1/2017 18:52,2017-03-01T18:52:00,Jack,,Adoption,Neutered Male,30.73415946,-97.50206698,313.8265873
720,1 year,A673496,Cat,Domestic Shorthair Mix,Blue Tabby/White,2/25/2013,3/3/2014 15:36,2014-03-03T15:36:00,,Partner,Transfer,Spayed Female,30.66127927,-97.49204362,53.09285714
721,7 months,A725530,Dog,Pit Bull Mix,Brown Brindle/White,10/30/2015,6/9/2016 14:50,2016-06-09T14:50:00,King,,Adoption,Neutered Male,30.30552551,-97.37139626,31.94543651
722,2 years,A749607,Dog,Labrador Retriever Mix,Black,5/17/2015,5/29/2017 15:07,2017-05-29T15:07:00,Maverick,,Adoption,Neutered Male,30.62603633,-97.44351834,106.2328373
723,10 months,A720531,Cat,Domestic Shorthair Mix,Black/White,4/11/2015,2/21/2016 15:48,2016-02-21T15:48:00,*Patrick,,Adoption,Neutered Male,30.41956629,-97.70430427,45.23690476
724,4 months,A675568,Dog,Chihuahua Shorthair Mix,Brown/White,11/18/2013,4/3/2014 17:53,2014-04-03T17:53:00,Buddy,,Adoption,Neutered Male,30.70810643,-97.34992684,19.53501984
725,8 months,A763178,Dog,Chihuahua Shorthair Mix,Sable/White,4/4/2017,12/6/2017 16:09,2017-12-06T16:09:00,Lilly,,Adoption,Spayed Female,30.4613686,-97.38178582,35.2389881
726,2 months,A700104,Dog,Belgian Malinois Mix,Blue/Yellow Brindle,1/24/2015,4/12/2015 17:12,2015-04-12T17:12:00,,,Adoption,Spayed Female,30.58539925,-97.65107754,11.2452381
727,1 year,A760439,Dog,Labrador Retriever Mix,Brown Brindle,10/18/2016,1/5/2018 19:09,2018-01-05T19:09:00,*Mars,,Adoption,Neutered Male,30.32658253,-97.37439177,63.54255952
728,3 months,A753627,Cat,Domestic Shorthair Mix,Black,6/17/2017,9/17/2017 17:53,2017-09-17T17:53:00,*Paddy,,Adoption,Neutered Male,30.49421026,-97.50721747,13.24930556
729,4 years,A743907,Dog,Chihuahua Shorthair Mix,Black/Tan,2/24/2013,2/24/2017 17:03,2017-02-24T17:03:00,*Artemis,,Adoption,Neutered Male,30.5205661,-97.60955628,208.8157738
730,2 years,A720411,Cat,Domestic Shorthair Mix,Black,8/9/2013,2/13/2016 14:15,2016-02-13T14:15:00,Leonard,,Return to Owner,Neutered Male,30.66812176,-97.25381451,131.2276786
731,5 years,A713461,Dog,Labrador Retriever Mix,Chocolate,10/7/2010,12/12/2015 0:00,2015-12-12T00:00:00,*Mary,Partner,Transfer,Spayed Female,30.39065143,-97.60127217,270.2857143
732,2 years,A749782,Dog,Labrador Retriever Mix,Tan/White,5/19/2015,7/25/2017 14:59,2017-07-25T14:59:00,*Catalina,,Return to Owner,Intact Female,30.61383106,-97.57521649,114.0891865
733,2 weeks,A749502,Cat,Domestic Shorthair Mix,Blue Tabby,4/30/2017,5/15/2017 19:18,2017-05-15T19:18:00,,Partner,Transfer,Unknown,30.62558023,-97.29199618,2.257738095
734,2 years,A667779,Dog,Pit Bull Pug,White/Black,11/22/2011,12/23/2013 12:50,2013-12-23T12:50:00,Dottie,,Adoption,Spayed Female,30.58037857,-97.64816768,108.9335317
735,4 years,A754963,Dog,Shih Tzu Mix,Tan/Black,7/27/2013,7/28/2017 17:06,2017-07-28T17:06:00,Tootsie,Partner,Transfer,Intact Female,30.35809065,-97.31255851,208.9589286
736,6 months,A753276,Cat,Domestic Shorthair Mix,Black,12/4/2016,7/4/2017 13:33,2017-07-04T13:33:00,Chopin,,Return to Owner,Neutered Male,30.53269444,-97.68618257,30.36636905
737,2 months,A694472,Cat,Domestic Shorthair Mix,Brown Tabby,12/26/2014,3/26/2015 7:36,2015-03-26T07:36:00,*Thing 3,Foster,Adoption,Spayed Female,30.65008384,-97.60509027,12.90238095
738,2 months,A727427,Cat,Domestic Shorthair Mix,Black,4/26/2016,7/9/2016 17:26,2016-07-09T17:26:00,*Baxter,Foster,Adoption,Neutered Male,30.33520052,-97.72880473,10.67519841
739,3 months,A730891,Cat,Domestic Medium Hair Mix,Orange Tabby,3/28/2016,7/15/2016 18:26,2016-07-15T18:26:00,Crush,,Adoption,Neutered Male,30.3968652,-97.52549991,15.68115079
740,10 years,A564617,Dog,Akita Mix,Brown/Black,1/11/2005,7/20/2015 15:09,2015-07-20T15:09:00,Bella,Partner,Transfer,Spayed Female,30.64900376,-97.55000721,548.9473214
741,4 months,A700918,Dog,Chihuahua Shorthair Dachshund,Brown Brindle,11/29/2014,4/21/2015 15:16,2015-04-21T15:16:00,Stephon,,Return to Owner,Neutered Male,30.43680119,-97.67518218,20.51944444
742,1 year,A736089,Dog,Chihuahua Shorthair Rat Terrier,Tricolor,10/3/2015,10/10/2016 15:30,2016-10-10T15:30:00,*Ramona,,Adoption,Spayed Female,30.68519201,-97.52265041,53.37797619
743,1 year,A714551,Cat,Domestic Shorthair Mix,Black,9/19/2015,4/2/2017 16:13,2017-04-02T16:13:00,Squish,,Adoption,Neutered Male,30.64002377,-97.42653599,80.23938492
744,1 year,A686863,Other,Raccoon,Gray/Black,8/28/2013,8/28/2014 10:24,2014-08-28T10:24:00,,Medical,Euthanasia,Unknown,30.57999578,-97.58173748,52.2047619
745,1 year,A732802,Cat,Domestic Shorthair Mix,Black,6/25/2016,8/14/2017 19:15,2017-08-14T19:15:00,*Radar,,Adoption,Neutered Male,30.72498587,-97.30428851,59.40029762
746,1 year,A718805,Other,Bat Mix,Brown,1/7/2015,1/7/2016 15:44,2016-01-07T15:44:00,,Rabies Risk,Euthanasia,Unknown,30.52174999,-97.68628165,52.23650794
747,1 year,A689658,Dog,Miniature Poodle Mix,Gray,10/7/2013,10/11/2014 19:06,2014-10-11T19:06:00,,,Adoption,Spayed Female,30.67542028,-97.60582002,52.82797619
748,2 years,A752657,Dog,Tibetan Spaniel Mix,Red,6/25/2015,6/29/2017 16:10,2017-06-29T16:10:00,Bella,,Adoption,Spayed Female,30.52502079,-97.62979524,105.0962302
749,3 years,A684115,Cat,Domestic Shorthair Mix,Cream Tabby/White,7/19/2011,8/11/2014 15:17,2014-08-11T15:17:00,*Snowcream,Partner,Transfer,Neutered Male,30.46726785,-97.57643073,159.9481151
750,6 months,A700807,Other,Bat,Brown,10/19/2014,4/20/2015 10:16,2015-04-20T10:16:00,,Rabies Risk,Euthanasia,Unknown,30.36051568,-97.47403369,26.20396825
751,2 months,A664185,Cat,Domestic Shorthair Mix,Black,8/12/2013,11/9/2013 15:32,2013-11-09T15:32:00,Sparky,,Adoption,Neutered Male,30.33820126,-97.36432696,12.80674603
752,2 years,A689279,Dog,Rat Terrier Mix,White/Brown,4/1/2013,8/5/2015 16:29,2015-08-05T16:29:00,Wren,,Return to Owner,Spayed Female,30.30481259,-97.57504118,122.3838294
753,2 weeks,A751930,Cat,Domestic Shorthair Mix,Blue,5/31/2017,6/17/2017 14:58,2017-06-17T14:58:00,,Partner,Transfer,Intact Female,30.29073495,-97.65525279,2.51765873
754,2 days,A721164,Cat,Domestic Shorthair Mix,Black/White,2/20/2016,2/22/2016 15:36,2016-02-22T15:36:00,,Partner,Transfer,Unknown,30.48002996,-97.29734343,0.378571429
755,5 days,A731853,Cat,Domestic Shorthair Mix,Black/White,7/23/2016,7/28/2016 14:42,2016-07-28T14:42:00,,Partner,Transfer,Unknown,30.28389484,-97.27374272,0.801785714
756,5 years,A742105,Dog,American Eskimo Alaskan Husky,White,1/14/2012,1/15/2017 12:34,2017-01-15T12:34:00,Sky,,Return to Owner,Spayed Female,30.63772223,-97.50579237,261.2176587
757,2 weeks,A757053,Cat,Domestic Shorthair Mix,Black,8/14/2017,8/29/2017 0:00,2017-08-29T00:00:00,,Partner,Transfer,Intact Male,30.337649,-97.3324937,2.142857143
758,12 years,A682982,Dog,Miniature Schnauzer Miniature Poodle,Gray,8/9/2002,9/6/2014 14:44,2014-09-06T14:44:00,*Eleanor,Foster,Adoption,Spayed Female,30.56520296,-97.35434945,630.2305556
759,8 years,A555413,Dog,Dachshund Mix,Brown,5/18/2007,6/4/2015 16:46,2015-06-04T16:46:00,Peewee,,Return to Owner,Neutered Male,30.70917407,-97.49542301,419.9569444
760,2 years,A679473,Dog,Labrador Retriever Mix,Yellow,5/21/2012,5/23/2014 15:18,2014-05-23T15:18:00,Thor,,Return to Owner,Neutered Male,30.39770858,-97.61312862,104.6625
761,4 years,A679583,Cat,Domestic Shorthair Mix,Tortie,5/23/2010,5/29/2014 19:08,2014-05-29T19:08:00,Fanny,SCRP,Transfer,Intact Female,30.63573723,-97.60147528,209.6853175
762,2 years,A741404,Dog,Pit Bull Mix,Blue/White,1/1/2015,1/3/2017 18:10,2017-01-03T18:10:00,Squishy,,Return to Owner,Neutered Male,30.76263751,-97.53234777,104.8224206
763,1 year,A693856,Dog,Pit Bull Mix,Black/Tan,12/15/2013,12/18/2014 18:45,2014-12-18T18:45:00,Jizzle,,Return to Owner,Neutered Male,30.31855756,-97.54448288,52.68303571
764,1 year,A758011,Other,Guinea Pig,White/Brown,9/10/2016,9/14/2017 15:26,2017-09-14T15:26:00,,Partner,Transfer,Unknown,30.43456255,-97.58503347,52.80615079
765,5 days,A746936,Dog,Chihuahua Shorthair Mix,Brown/White,4/6/2017,4/11/2017 18:06,2017-04-11T18:06:00,,Partner,Transfer,Intact Male,30.61571492,-97.62492784,0.82202381
766,9 years,A756945,Dog,Border Collie Mix,Tricolor/Black,8/28/2008,9/8/2017 11:56,2017-09-08T11:56:00,Pepper,,Return to Owner,Spayed Female,30.44113157,-97.48707425,471.2138889
767,1 month,A727029,Cat,Domestic Shorthair Mix,Black Tabby,4/17/2016,6/1/2016 1:00,2016-06-01T01:00:00,*Charlie,Suffering,Euthanasia,Intact Male,30.59480023,-97.43128194,6.43452381
768,2 years,A736148,Dog,Chihuahua Shorthair Mix,Tan/White,3/28/2014,10/7/2016 18:14,2016-10-07T18:14:00,Cinnabon,,Return to Owner,Spayed Female,30.48838308,-97.69686094,132.1085317
769,3 months,A731419,Cat,Domestic Longhair Mix,Black/White,7/7/2016,10/21/2016 11:24,2016-10-21T11:24:00,*Migas,Foster,Adoption,Neutered Male,30.72449113,-97.52717757,15.21071429
770,10 months,A684921,Dog,Irish Terrier Labrador Retriever,Brown/White,9/30/2013,8/6/2014 15:27,2014-08-06T15:27:00,,,Adoption,Spayed Female,30.42538991,-97.41820683,44.37767857
771,2 months,A706705,Dog,Anatol Shepherd Mix,Tan/White,5/2/2015,7/6/2015 19:08,2015-07-06T19:08:00,Hunter,,Adoption,Spayed Female,30.48414526,-97.55987838,9.399603175
772,4 years,A684222,Dog,Pit Bull Mix,Brown/White,7/21/2011,1/13/2016 15:02,2016-01-13T15:02:00,Brownie,,Return to Owner,Intact Male,30.68401111,-97.26351836,233.946627
773,6 months,A676510,Dog,Pit Bull Mix,Black/White,10/11/2013,4/16/2014 17:05,2014-04-16T17:05:00,,Partner,Transfer,Intact Male,30.7476238,-97.639939,26.81597222
774,10 months,A714989,Other,Netherlnd Dwarf Mix,Gray,12/29/2014,10/30/2015 17:08,2015-10-30T17:08:00,Timmy,Partner,Transfer,Unknown,30.45143022,-97.7324568,43.6734127
775,2 years,A668213,Dog,Miniature Poodle Mix,White,11/30/2011,12/8/2013 14:30,2013-12-08T14:30:00,Camilla,Partner,Transfer,Spayed Female,30.64825154,-97.5601866,105.6577381
776,2 years,A760532,Dog,Catahoula Mix,Blue Merle,10/19/2015,11/26/2017 16:54,2017-11-26T16:54:00,Luna,,Adoption,Spayed Female,30.58413865,-97.38182954,109.9577381
777,2 years,A733880,Cat,Domestic Shorthair Mix,Brown Tabby,8/28/2014,8/29/2016 9:00,2016-08-29T09:00:00,,SCRP,Transfer,Spayed Female,30.29273992,-97.59855802,104.625
778,1 year,A735500,Cat,Domestic Shorthair Mix,Brown Tabby/White,3/29/2015,12/19/2016 11:55,2016-12-19T11:55:00,Susie,,Adoption,Spayed Female,30.72440649,-97.56301103,90.21378968
779,1 year,A667977,Other,Bat Mix,Gray,11/25/2012,11/25/2013 19:51,2013-11-25T19:51:00,,,Disposal,Unknown,30.60289719,-97.52323265,52.2610119
780,2 years,A705299,Dog,Pit Bull Mix,Blue/White,6/15/2013,8/9/2015 13:07,2015-08-09T13:07:00,Dexter,,Adoption,Neutered Male,30.35785758,-97.70343141,112.2209325
781,11 years,A468181,Dog,Boxer Pit Bull,Tan/White,10/17/2005,12/27/2016 9:19,2016-12-27T09:19:00,Marley,,Return to Owner,Neutered Male,30.50321712,-97.71976716,584.1983135
782,2 years,A708081,Cat,Domestic Shorthair Mix,Blue Tabby/White,1/22/2013,8/6/2015 18:27,2015-08-06T18:27:00,Nickels,,Adoption,Neutered Male,30.76007096,-97.38172886,132.3955357
783,6 months,A734987,Dog,Catahoula Mix,Brown Merle,3/16/2016,9/20/2016 17:29,2016-09-20T17:29:00,,,Adoption,Spayed Female,30.54538955,-97.6567287,26.96121032
784,10 months,A730406,Dog,Manchester Terrier Mix,Tricolor,9/4/2015,7/11/2016 18:04,2016-07-11T18:04:00,*Bert,,Adoption,Spayed Female,30.39836108,-97.58774491,44.53611111
785,3 years,A747310,Cat,Domestic Shorthair Mix,Orange Tabby/White,4/18/2014,4/26/2017 13:41,2017-04-26T13:41:00,Mikey,,Adoption,Neutered Male,30.7649056,-97.61373878,157.7957341
786,15 years,A700009,Dog,Yorkshire Terrier Mix,Silver/Tan,4/9/2000,4/10/2015 15:47,2015-04-10T15:47:00,,Partner,Transfer,Intact Female,30.33825649,-97.57098682,782.8082341
787,4 years,A638342,Dog,Staffordshire Mix,Black/White,4/29/2012,6/10/2016 11:14,2016-06-10T11:14:00,*Kirby,,Return to Owner,Neutered Male,30.46419538,-97.36271911,214.7811508
788,1 month,A726500,Cat,Domestic Medium Hair Mix,Blue Tabby,3/16/2016,5/16/2016 18:53,2016-05-16T18:53:00,Scooter,,Adoption,Neutered Male,30.43518808,-97.30533566,8.826686508
789,4 months,A716844,Cat,Domestic Shorthair Mix,Blue,7/26/2015,11/30/2015 17:57,2015-11-30T17:57:00,Shadow,,Adoption,Neutered Male,30.59865931,-97.43247455,18.24970238
790,6 months,A729083,Cat,Domestic Shorthair Mix,Brown Tabby/White,12/13/2015,6/19/2016 19:12,2016-06-19T19:12:00,,Partner,Transfer,Spayed Female,30.63343958,-97.43061273,27.11428571
791,2 weeks,A674637,Cat,Domestic Shorthair Mix,Brown Tabby,3/1/2014,3/16/2014 14:37,2014-03-16T14:37:00,,Partner,Transfer,Intact Male,30.45446962,-97.34767414,2.229861111
792,3 years,A664436,Dog,Chihuahua Shorthair Mix,Black,9/5/2012,11/30/2015 17:15,2015-11-30T17:15:00,Lucky,,Return to Owner,Spayed Female,30.57597973,-97.66943734,168.8169643
793,5 months,A699872,Cat,Domestic Shorthair Mix,Black/White,5/3/2013,10/3/2013 15:33,2013-10-03T15:33:00,,SCRP,Transfer,Intact Male,30.46344441,-97.39192016,21.94970238
794,2 weeks,A700694,Cat,Domestic Shorthair Mix,Blue,3/19/2015,4/3/2015 16:46,2015-04-03T16:46:00,,Partner,Transfer,Intact Female,30.64937386,-97.55223332,2.24265873
795,3 months,A721744,Cat,Domestic Shorthair Mix,Blue Tabby,3/18/2015,6/20/2015 12:36,2015-06-20T12:36:00,*Ashes,Foster,Adoption,Spayed Female,30.74737173,-97.66247416,13.50357143
796,8 years,A750191,Cat,Domestic Medium Hair Mix,Tortie,3/3/2008,3/5/2016 17:37,2016-03-05T17:37:00,Muchacha,,Adoption,Spayed Female,30.42373806,-97.46712613,417.8191468
797,2 years,A699754,Dog,Pit Bull Mix,White,5/24/2015,11/24/2017 14:57,2017-11-24T14:57:00,*Sheba,,Adoption,Spayed Female,30.63094851,-97.63956528,130.8032738
798,3 years,A706447,Dog,Chihuahua Shorthair Mix,White/Chocolate,4/3/2012,4/6/2015 17:51,2015-04-06T17:51:00,,,Adoption,Neutered Male,30.3743586,-97.41266389,156.9633929
799,2 months,A665551,Cat,Domestic Shorthair Mix,Brown Tabby,5/7/2015,7/30/2015 19:12,2015-07-30T19:12:00,Luna,,Adoption,Intact Female,30.63496037,-97.25566183,12.11428571
800,1 year,A682221,Cat,Domestic Shorthair Mix,Black/White,10/19/2012,12/12/2013 13:11,2013-12-12T13:11:00,*Aggie,Partner,Transfer,Spayed Female,30.75693337,-97.45989868,59.93561508
801,6 years,A755664,Dog,Great Pyrenees Mix,White,6/25/2008,8/3/2014 19:00,2014-08-03T19:00:00,Geo,,Adoption,Neutered Male,30.65125448,-97.40324879,318.6845238
802,4 months,A725679,Cat,Domestic Shorthair Mix,Black,4/7/2017,8/11/2017 13:39,2017-08-11T13:39:00,,Partner,Transfer,Unknown,30.73761927,-97.47935421,18.08125
803,6 months,A741110,Cat,Domestic Shorthair Mix,Calico,4/1/2016,10/24/2016 18:38,2016-10-24T18:38:00,*Maddie,Foster,Adoption,Spayed Female,30.65624397,-97.45608292,29.53948413
804,3 months,A718285,Cat,Domestic Shorthair Mix,Brown Tabby,11/13/2016,3/13/2017 17:04,2017-03-13T17:04:00,*Emma,Foster,Adoption,Spayed Female,30.67518783,-97.61769805,17.24444444
805,3 months,A681270,Dog,Chihuahua Shorthair Mix,Yellow,9/26/2015,1/2/2016 17:28,2016-01-02T17:28:00,Biscuit,,Return to Owner,Neutered Male,30.4249576,-97.38871146,14.10396825
806,3 years,A619084,Dog,Cairn Terrier Yorkshire Terrier,Brown Brindle,6/14/2011,6/19/2014 14:44,2014-06-19T14:44:00,*Samba,Partner,Transfer,Spayed Female,30.63131605,-97.71614816,157.3734127
807,9 months,A678367,Dog,Labrador Retriever Mix,Black,9/9/2014,6/10/2015 13:30,2015-06-10T13:30:00,Dude,,Return to Owner,Neutered Male,30.66127952,-97.31426083,39.22321429
808,3 years,A694981,Cat,Angora Mix,Calico,5/8/2011,8/12/2014 13:39,2014-08-12T13:39:00,Daisy,Partner,Transfer,Spayed Female,30.39301517,-97.6657086,170.3669643
809,3 months,A615920,Dog,Labrador Retriever Mix,Black/White,10/7/2014,1/12/2015 13:16,2015-01-12T13:16:00,,,Adoption,Spayed Female,30.45116389,-97.54708231,13.93611111
810,6 years,A724642,Dog,American Staffordshire Terrier Mix,Blue/White,6/14/2010,4/4/2017 10:05,2017-04-04T10:05:00,Bluebelle,,Return to Owner,Spayed Female,30.4955688,-97.37222013,355.202877
811,1 year,A753595,Dog,Pit Bull Mix,Blue,4/19/2015,4/20/2016 16:17,2016-04-20T16:17:00,Chief,,Return to Owner,Intact Male,30.57770696,-97.33758259,52.52549603
812,3 months,A679990,Other,Raccoon,Gray,4/8/2017,7/9/2017 14:56,2017-07-09T14:56:00,,Suffering,Euthanasia,Unknown,30.45175875,-97.67790384,13.23174603
813,3 months,A673840,Cat,Domestic Longhair,Black,4/13/2014,7/28/2014 18:41,2014-07-28T18:41:00,Chui,,Adoption,Neutered Male,30.50809051,-97.42592424,15.25406746
814,3 years,A745111,Other,Bat Mix,Brown,3/3/2011,3/3/2014 16:54,2014-03-03T16:54:00,,,Euthanasia,Unknown,30.56398967,-97.6560865,156.6720238
815,1 month,A750925,Cat,Domestic Medium Hair Mix,Black,2/13/2017,3/21/2017 13:27,2017-03-21T13:27:00,*Midnight,In Foster,Died,Intact Female,30.47384777,-97.28698176,5.222916667
816,2 years,A699262,Dog,Pit Bull Mix,Blue,6/2/2015,6/2/2017 15:34,2017-06-02T15:34:00,,Partner,Transfer,Intact Male,30.51693122,-97.58053027,104.5212302
817,3 years,A623561,Dog,Staffordshire Mix,White/Black,3/24/2012,11/21/2015 13:47,2015-11-21T13:47:00,Mika,,Adoption,Spayed Female,30.57184663,-97.64943509,191.0820437
818,6 years,A740785,Dog,Pit Bull Mix,Blue/White,4/3/2009,4/28/2015 17:33,2015-04-28T17:33:00,Marley,,Return to Owner,Neutered Male,30.51053579,-97.28783429,316.6758929
819,2 years,A713464,Cat,Domestic Shorthair Mix,Black/White,12/22/2014,12/31/2016 16:12,2016-12-31T16:12:00,Purl,,Adoption,Spayed Female,30.67198554,-97.33389618,105.8107143
820,3 years,A712304,Dog,Maltese Mix,Black/White,10/7/2012,10/12/2015 17:27,2015-10-12T17:27:00,,,Adoption,Spayed Female,30.28926377,-97.33714753,157.2467262
821,3 years,A753672,Other,Bat Mix,Brown,9/21/2012,9/22/2015 8:12,2015-09-22T08:12:00,,Rabies Risk,Euthanasia,Unknown,30.45245997,-97.47512097,156.6202381
822,3 weeks,A677627,Dog,Beagle Mix,Brown,6/18/2017,7/11/2017 11:52,2017-07-11T11:52:00,,Partner,Transfer,Intact Female,30.46546889,-97.73585267,3.356349206
823,2 years,A666559,Cat,Domestic Shorthair Mix,Brown Tabby/White,3/22/2014,9/24/2016 13:28,2016-09-24T13:28:00,*Charlie,Partner,Transfer,Neutered Male,30.61077099,-97.26863168,131.0801587
824,5 years,A739233,Cat,Domestic Shorthair Mix,Black/White,11/4/2008,12/20/2013 14:24,2013-12-20T14:24:00,*Shelby,,Adoption,Intact Female,30.39165932,-97.39098131,267.5142857
825,4 months,A700825,Dog,Labrador Retriever Mix,Tan/Brown,7/29/2016,12/10/2016 17:58,2016-12-10T17:58:00,Timo,,Return to Owner,Neutered Male,30.32771257,-97.64375561,19.24980159
826,6 years,A701323,Dog,Shih Tzu Mix,Gray/White,4/20/2009,4/21/2015 12:01,2015-04-21T12:01:00,Rocky,Partner,Transfer,Neutered Male,30.66872013,-97.46746032,313.2143849
827,1 year,A703770,Cat,Domestic Shorthair Mix,Black,4/27/2014,4/28/2015 11:10,2015-04-28T11:10:00,Sheba,,Return to Owner,Spayed Female,30.38807758,-97.64585956,52.35218254
828,2 months,A719736,Cat,Domestic Shorthair Mix,Brown Tabby,4/28/2015,7/19/2015 19:48,2015-07-19T19:48:00,*Mia,Foster,Adoption,Spayed Female,30.28693483,-97.64344939,11.83214286
829,10 months,A725915,Dog,Pit Bull Mix,Blue/White,3/26/2015,1/30/2016 15:10,2016-01-30T15:10:00,Bevo,,Return to Owner,Intact Male,30.67599535,-97.3813215,44.37599206
830,19 years,A704496,Cat,Domestic Shorthair Mix,Black,5/3/1997,5/5/2016 12:22,2016-05-05T12:22:00,Snagglepuss,Suffering,Euthanasia,Neutered Male,30.44516134,-97.72659362,991.7878968
831,1 month,A710130,Dog,Labrador Retriever Plott Hound,Black/White,4/28/2015,6/5/2015 16:04,2015-06-05T16:04:00,,Partner,Transfer,Intact Male,30.29320475,-97.54388433,5.524206349
832,4 months,A680421,Cat,Domestic Shorthair Mix,Black,6/18/2015,11/11/2015 19:17,2015-11-11T19:17:00,Tango,,Adoption,Neutered Male,30.64712097,-97.46582907,20.9719246
833,6 months,A758114,Dog,German Shepherd Mix,Tan,12/2/2013,6/29/2014 18:54,2014-06-29T18:54:00,*Dori,,Adoption,Spayed Female,30.5850105,-97.51167068,29.96964286
834,5 months,A696413,Cat,Domestic Shorthair Mix,Brown Tabby,4/12/2017,9/16/2017 22:04,2017-09-16T22:04:00,*Libby,,Adoption,Spayed Female,30.70741804,-97.52714667,22.55992063
835,8 months,A761473,Cat,Domestic Shorthair Mix,Cream Tabby,6/4/2014,2/5/2015 9:00,2015-02-05T09:00:00,Tony,SCRP,Transfer,Neutered Male,30.67892309,-97.42830532,35.19642857
836,2 months,A735889,Cat,Siamese Mix,Lynx Point,10/8/2017,12/15/2017 7:47,2017-12-15T07:47:00,,Foster,Adoption,Neutered Male,30.39547622,-97.57213209,9.760615079
837,2 years,A729076,Dog,Pit Bull Mix,White/Black,10/1/2014,10/2/2016 13:08,2016-10-02T13:08:00,,,Return to Owner,Intact Male,30.76446179,-97.70687458,104.6496032
838,3 weeks,A756670,Cat,Domestic Medium Hair Mix,Black,5/22/2016,6/13/2016 14:07,2016-06-13T14:07:00,,Partner,Transfer,Unknown,30.37228761,-97.62485072,3.226884921
839,6 years,A726104,Dog,Pomeranian Cocker Spaniel,Red,8/23/2011,8/24/2017 13:01,2017-08-24T13:01:00,Cooper,Partner,Transfer,Neutered Male,30.51433061,-97.39820329,313.3631944
840,1 year,A712909,Bird,Grackle Mix,Black,5/6/2015,5/6/2016 13:39,2016-05-06T13:39:00,,Suffering,Euthanasia,Unknown,30.56176897,-97.69365798,52.36696429
841,2 years,A736590,Cat,Domestic Shorthair Mix,Orange Tabby,9/29/2013,9/30/2015 9:00,2015-09-30T09:00:00,,SCRP,Transfer,Intact Male,30.74867606,-97.62633904,104.4821429
842,6 years,A680409,Dog,Jack Russell Terrier Mix,White/Brown,1/30/2010,11/5/2016 13:53,2016-11-05T13:53:00,Buddy,,Adoption,Neutered Male,30.46625907,-97.54835129,353.0826389
843,1 month,A754142,Cat,Siamese Mix,Flame Point,5/2/2014,6/9/2014 15:50,2014-06-09T15:50:00,Lark,Partner,Transfer,Intact Female,30.30423023,-97.36017905,5.52281746
844,3 months,A672005,Cat,Domestic Shorthair Mix,Black/White,5/1/2017,8/9/2017 13:02,2017-08-09T13:02:00,*Gogo,Partner,Transfer,Intact Male,30.33590979,-97.57574536,14.36329365
845,1 year,A716891,Dog,Labrador Retriever Pointer,Chocolate/White,2/2/2013,2/7/2014 15:00,2014-02-07T15:00:00,Hazel,Partner,Transfer,Intact Female,30.73394915,-97.65088082,52.94642857
846,2 years,A757628,Dog,Pit Bull Mix,Brown/White,11/27/2013,11/27/2015 16:55,2015-11-27T16:55:00,Nala,,Return to Owner,Spayed Female,30.39866758,-97.29542456,104.3864087
847,3 years,A746786,Dog,Basset Hound Mix,Tan,9/4/2014,9/15/2017 14:24,2017-09-15T14:24:00,128,Partner,Transfer,Intact Male,30.41013114,-97.57464067,158.2285714
848,5 days,A671526,Cat,Domestic Shorthair Mix,Brown Tabby,4/4/2017,4/9/2017 16:41,2017-04-09T16:41:00,,Partner,Transfer,Intact Female,30.61234584,-97.66571437,0.81359127
849,12 years,A700344,Dog,Labrador Retriever Mix,Yellow,1/26/2002,2/1/2014 18:30,2014-02-01T18:30:00,Ethal,,Adoption,Spayed Female,30.68145431,-97.26239953,627.110119
850,1 day,A758605,Cat,Domestic Shorthair Mix,Brown Tabby,4/11/2015,4/12/2015 13:41,2015-04-12T13:41:00,,Partner,Transfer,Unknown,30.34454377,-97.68848804,0.224305556
851,2 weeks,A735834,Cat,American Shorthair Mix,Brown Tabby/Black,9/5/2017,9/19/2017 18:37,2017-09-19T18:37:00,,Partner,Transfer,Intact Female,30.57645027,-97.25701792,2.110813492
852,3 months,A742653,Dog,Pit Bull Mix,Blue/White,6/30/2016,10/4/2016 19:00,2016-10-04T19:00:00,,,Adoption,Neutered Male,30.60311318,-97.40734018,13.82738095
853,1 year,A757808,Dog,Yorkshire Terrier Mix,Brown/Black,1/25/2016,1/25/2017 16:51,2017-01-25T16:51:00,Lilly,,Return to Owner,Spayed Female,30.40579897,-97.67128291,52.3860119
854,1 year,A748855,Dog,Pit Bull Mix,Blue,9/7/2016,12/27/2017 18:39,2017-12-27T18:39:00,Peter,,Return to Owner,Intact Male,30.35609559,-97.51640672,68.1110119
855,8 months,A757584,Cat,Domestic Shorthair Mix,Blue/White,3/23/2017,12/15/2017 7:51,2017-12-15T07:51:00,,Foster,Adoption,Neutered Male,30.55167239,-97.60068323,38.18958333
856,6 months,A668177,Dog,Labrador Retriever Mix,Tan/White,3/4/2017,9/9/2017 14:12,2017-09-09T14:12:00,Paloma,,Rto-Adopt,Spayed Female,30.42925114,-97.70016414,27.08452381
857,2 months,A732519,Cat,Domestic Shorthair Mix,Blue Tabby,11/9/2013,1/19/2014 17:02,2014-01-19T17:02:00,Dash,Offsite,Adoption,Neutered Male,30.76365437,-97.7181046,10.24424603
858,7 months,A754724,Dog,Boxer Mix,Brown/White,7/3/2016,2/12/2017 16:58,2017-02-12T16:58:00,Max,,Adoption,Neutered Male,30.32820883,-97.69024377,32.10099206
859,2 years,A752353,Bird,Hawk,Brown/White,7/23/2015,7/23/2017 15:53,2017-07-23T15:53:00,,Medical,Euthanasia,Unknown,30.60778441,-97.57696554,104.5231151
860,6 years,A727033,Dog,Bichon Frise Mix,White,12/21/2010,6/25/2017 12:42,2017-06-25T12:42:00,Gunner,,Return to Owner,Neutered Male,30.41917204,-97.31070593,339.789881
861,2 months,A544916,Dog,Labrador Retriever Mix,White/White,3/2/2016,5/20/2016 17:40,2016-05-20T17:40:00,Mona,,Return to Owner,Spayed Female,30.45313146,-97.59987293,11.39087302
862,13 years,A755213,Dog,Pit Bull,Blue,5/29/2001,2/19/2015 15:04,2015-02-19T15:04:00,Blue,Suffering,Euthanasia,Intact Male,30.67648415,-97.36070986,716.3753968
863,2 years,A755577,Dog,Pit Bull Mix,Blue/White,7/31/2015,10/8/2017 13:06,2017-10-08T13:06:00,Jinx,,Adoption,Spayed Female,30.34222586,-97.52968778,114.3636905
864,6 years,A730713,Dog,Rat Terrier Mix,Black/Gray,8/5/2011,8/10/2017 0:00,2017-08-10T00:00:00,Peanut,Partner,Transfer,Neutered Male,30.37875192,-97.65426823,313.8571429
865,5 years,A688785,Dog,Great Pyrenees Mix,White,7/16/2011,7/18/2016 19:05,2016-07-18T19:05:00,*Kip,,Adoption,Neutered Male,30.28014067,-97.72770317,261.3993056
866,2 years,A714071,Dog,American Bulldog Mix,Brown/White,9/23/2012,9/30/2014 8:16,2014-09-30T08:16:00,,Aggressive,Euthanasia,Intact Male,30.41900076,-97.66404709,105.3349206
867,2 months,A759517,Cat,Domestic Shorthair Mix,Calico/White,9/17/2015,12/16/2015 11:28,2015-12-16T11:28:00,*Earth,Foster,Adoption,Spayed Female,30.66862956,-97.55903367,12.92539683
868,5 months,A672587,Dog,Chihuahua Shorthair Mix,Brown/White,5/3/2017,10/6/2017 17:55,2017-10-06T17:55:00,Kya,,Adoption,Spayed Female,30.51459548,-97.46745358,22.39236111
869,2 years,A765393,Cat,Domestic Shorthair British Shorthair,Torbie,2/13/2012,2/14/2014 14:21,2014-02-14T14:21:00,,SCRP,Transfer,Intact Female,30.74676855,-97.42777094,104.6568452
870,2 years,A684839,Dog,Cardigan Welsh Corgi,Tricolor,1/19/2016,1/19/2018 14:32,2018-01-19T14:32:00,Pete,,Return to Owner,Intact Male,30.52375038,-97.4065795,104.5150794
871,1 year,A710454,Cat,Domestic Shorthair Mix,Brown Tabby/White,7/29/2013,7/30/2014 9:00,2014-07-30T09:00:00,,SCRP,Transfer,Intact Female,30.7632932,-97.53959349,52.33928571
872,1 year,A733732,Other,Raccoon,Gray/Black,8/23/2014,8/25/2015 10:27,2015-08-25T10:27:00,,Rabies Risk,Euthanasia,Unknown,30.48246458,-97.69553082,52.49077381
873,1 year,A680536,Cat,Domestic Medium Hair Mix,Black,8/26/2015,2/2/2017 0:00,2017-02-02T00:00:00,*Berenice,Partner,Transfer,Spayed Female,30.50062352,-97.70110281,75.14285714
874,1 month,A755410,Cat,Domestic Shorthair Mix,Blue Tabby/White,5/20/2014,7/12/2014 13:56,2014-07-12T13:56:00,Lilly,,Adoption,Intact Female,30.28367855,-97.25283153,7.654365079
875,4 months,A710541,Cat,Domestic Shorthair Mix,Blue/White,4/3/2017,8/13/2017 17:51,2017-08-13T17:51:00,*Judy,,Adoption,Spayed Female,30.34811748,-97.57930602,18.96339286
876,2 months,A752995,Cat,Domestic Shorthair Mix,Blue/White,8/14/2015,10/17/2015 14:43,2015-10-17T14:43:00,*Alex,,Adoption,Neutered Male,30.29143886,-97.24844027,9.230456349
877,2 months,A733873,Dog,Labrador Retriever Basset Hound,Black,4/15/2017,7/3/2017 17:37,2017-07-03T17:37:00,,,Adoption,Neutered Male,30.56683409,-97.51597296,11.3905754
878,2 months,A685631,Dog,Dalmatian Mix,Black/White,6/16/2016,9/1/2016 17:17,2016-09-01T17:17:00,,,Adoption,Spayed Female,30.53302397,-97.63206321,11.10287698
879,10 months,A593537,Cat,Domestic Shorthair Mix,Black/White,10/10/2013,8/11/2014 9:00,2014-08-11T09:00:00,,SCRP,Transfer,Intact Male,30.57842465,-97.65208904,43.625
880,6 years,A762861,Dog,Labrador Retriever Mix,Black,2/13/2009,3/4/2015 18:14,2015-03-04T18:14:00,Chacha,,Return to Owner,Spayed Female,30.52468662,-97.37340852,315.8228175
881,2 years,A744032,Dog,Great Pyrenees Mix,Cream,11/28/2015,12/10/2017 15:00,2017-12-10T15:00:00,*Snow,,Adoption,Spayed Female,30.29058423,-97.38259049,106.2321429
882,4 weeks,A731668,Cat,Domestic Shorthair Mix,White,1/22/2017,2/22/2017 13:58,2017-02-22T13:58:00,,Partner,Transfer,Intact Male,30.50377116,-97.5777837,4.511706349
883,7 years,A653765,Dog,Australian Cattle Dog Mix,Tan/White,6/12/2009,7/27/2016 11:45,2016-07-27T11:45:00,Harry Hound,,Return to Owner,Neutered Male,30.68582727,-97.60677608,371.7842262
884,3 years,A716871,Dog,Border Collie Mix,White/Black,5/10/2010,3/14/2014 17:53,2014-03-14T17:53:00,Max,,Return to Owner,Neutered Male,30.63318923,-97.61705697,200.677877
885,10 years,A736489,Cat,Domestic Longhair Mix,Tortie,12/2/2005,1/29/2016 11:50,2016-01-29T11:50:00,Tori,,Adoption,Spayed Female,30.72119008,-97.41484882,530.0704365
886,2 years,A751491,Dog,Labrador Retriever Mix,Black/White,10/11/2014,10/23/2016 16:23,2016-10-23T16:23:00,*Leon,,Adoption,Neutered Male,30.6092267,-97.68158716,106.240377
887,1 year,A673693,Cat,Domestic Shorthair Mix,Torbie,6/8/2016,6/12/2017 0:00,2017-06-12T00:00:00,,Snr,Transfer,Spayed Female,30.63016477,-97.39228033,52.71428571
888,8 years,A750351,Cat,Domestic Medium Hair Mix,White,2/28/2006,2/28/2014 17:02,2014-02-28T17:02:00,,Suffering,Euthanasia,Intact Female,30.67316438,-97.70541838,417.5299603
889,4 years,A709622,Dog,Chihuahua Shorthair Mix,Tricolor,5/26/2013,5/31/2017 12:18,2017-05-31T12:18:00,,Partner,Transfer,Neutered Male,30.34805573,-97.51965651,209.5017857
890,1 year,A761409,Other,Lionhead,Black,8/11/2014,8/11/2015 15:29,2015-08-11T15:29:00,,Partner,Transfer,Intact Male,30.67681617,-97.51171058,52.23501984
891,1 year,A697260,Dog,Pit Bull Mix,Blue/White,11/4/2015,4/14/2017 18:17,2017-04-14T18:17:00,Buster,,Adoption,Neutered Male,30.74667273,-97.61473771,75.39454365
892,4 months,A405494,Dog,Labrador Retriever Mix,Chocolate/White,10/20/2014,2/20/2015 19:06,2015-02-20T19:06:00,,Partner,Transfer,Intact Male,30.5469577,-97.62601487,17.68511905
893,8 years,A704254,Dog,Siberian Husky Mix,Black/Cream,8/13/2005,5/20/2014 11:44,2014-05-20T11:44:00,Kaila,,Return to Owner,Spayed Female,30.42779036,-97.38401532,457.4984127
894,6 months,A726765,Other,Bat,Brown,12/2/2014,6/3/2015 11:21,2015-06-03T11:21:00,,,Died,Unknown,30.43617238,-97.25266252,26.21041667
895,1 week,A749325,Cat,Domestic Shorthair Mix,Brown Tabby/White,5/7/2016,5/14/2016 17:07,2016-05-14T17:07:00,,Partner,Transfer,Unknown,30.29558283,-97.45216777,1.101884921
896,1 year,A754193,Dog,Pit Bull Mix,Brown,5/13/2016,5/17/2017 17:18,2017-05-17T17:18:00,Gisele,,Adoption,Spayed Female,30.32032524,-97.53207521,52.8172619
897,4 years,A675222,Dog,Yorkshire Terrier Mix,Tan,7/17/2013,7/17/2017 0:00,2017-07-17T00:00:00,,Partner,Transfer,Unknown,30.5477391,-97.30935938,208.7142857
898,1 year,A734652,Cat,Domestic Shorthair Mix,Black,3/25/2013,3/26/2014 15:55,2014-03-26T15:55:00,,SCRP,Transfer,Intact Female,30.42520633,-97.32755581,52.38045635
899,1 year,A674816,Cat,Domestic Medium Hair Mix,White/Orange,9/10/2015,9/13/2016 12:36,2016-09-13T12:36:00,Ricky,Partner,Transfer,Intact Male,30.27132126,-97.27539847,52.78928571
900,2 years,A727844,Dog,Pit Bull Boxer,Brown Brindle,7/18/2013,5/13/2016 14:49,2016-05-13T14:49:00,Bruce,,Return to Owner,Neutered Male,30.40494724,-97.37702209,147.2310516
901,1 year,A664814,Dog,Beagle Mix,Tricolor,5/26/2015,5/29/2016 14:34,2016-05-29T14:34:00,Daisy,,Adoption,Spayed Female,30.61642077,-97.33951853,52.80099206
902,1 year,A712212,Dog,Chihuahua Shorthair Rat Terrier,White/Brown,10/9/2012,12/17/2013 16:40,2013-12-17T16:40:00,,,Adoption,Spayed Female,30.31560656,-97.32880379,62.09920635
903,3 years,A717928,Cat,Domestic Shorthair Mix,White/Brown Tabby,9/19/2012,10/5/2015 18:13,2015-10-05T18:13:00,Luna,,Adoption,Neutered Male,30.29820537,-97.58780345,158.8227183
904,3 months,A751904,Cat,Domestic Shorthair Mix,Calico,9/17/2015,12/22/2015 13:49,2015-12-22T13:49:00,Marley,,Adoption,Intact Female,30.27313646,-97.43895083,13.79652778
905,2 years,A715357,Cat,Domestic Shorthair Mix,Black,6/15/2015,8/19/2017 12:03,2017-08-19T12:03:00,Shasta,,Adoption,Spayed Female,30.6094777,-97.40212881,113.7860119
906,1 year,A665959,Dog,Labrador Retriever Pembroke Welsh Corgi,Black,11/4/2014,11/8/2015 0:00,2015-11-08T00:00:00,*Roxy,Partner,Transfer,Intact Female,30.39378945,-97.29084081,52.71428571
907,14 years,A688239,Dog,Siberian Husky Mix,Black/White,12/27/1998,10/29/2013 11:32,2013-10-29T11:32:00,*Moomoo,,Return to Owner,Spayed Female,30.54913574,-97.57433043,774.3543651
908,1 year,A752332,Cat,Domestic Shorthair Mix,Blue,9/16/2013,9/18/2014 9:00,2014-09-18T09:00:00,,SCRP,Transfer,Intact Male,30.58149303,-97.54377224,52.48214286
909,2 months,A741279,Dog,Australian Shepherd Mix,Brown/White,4/6/2017,6/25/2017 17:32,2017-06-25T17:32:00,,,Adoption,Spayed Female,30.73605442,-97.48678606,11.53293651
910,2 months,A717255,Cat,Domestic Medium Hair Mix,Black/White,10/30/2016,1/3/2017 12:00,2017-01-03T12:00:00,Nora,,Adoption,Intact Female,30.50445726,-97.53180044,9.357142857
911,2 months,A713683,Dog,Border Collie Mix,Brown Brindle/White,10/4/2015,12/7/2015 15:59,2015-12-07T15:59:00,Ohana,,Adoption,Neutered Male,30.52102431,-97.55729499,9.237996032
912,6 months,A693854,Dog,Australian Cattle Dog Mix,Blue Tick,4/26/2015,11/2/2015 18:47,2015-11-02T18:47:00,Garth,Foster,Adoption,Neutered Male,30.48529568,-97.25392406,27.2546627
913,1 year,A701536,Other,New Zealand Wht Mix,White,12/15/2013,12/24/2014 15:18,2014-12-24T15:18:00,,Partner,Transfer,Intact Male,30.52564368,-97.26221364,53.51964286
914,2 years,A699175,Other,Bat Mix,Brown,5/1/2013,5/1/2015 11:57,2015-05-01T11:57:00,,Rabies Risk,Euthanasia,Unknown,30.45543364,-97.5491811,104.3568452
915,4 years,A743288,Dog,Boerboel Mix,Tan/White,3/23/2011,4/30/2015 16:41,2015-04-30T16:41:00,Mojo,Aggressive,Euthanasia,Neutered Male,30.32774527,-97.70162351,214.2421627
916,5 years,A748451,Dog,Cairn Terrier Mix,Tan,2/7/2012,2/11/2017 13:41,2017-02-11T13:41:00,,Partner,Transfer,Intact Female,30.59882805,-97.34663475,261.652877
917,10 years,A743477,Dog,Boxer Mix,Brown/White,5/3/2007,5/15/2017 12:53,2017-05-15T12:53:00,*Magpie,,Adoption,Spayed Female,30.55026045,-97.51658388,523.6481151
918,1 year,A714347,Cat,Domestic Shorthair Mix,Black/White,2/11/2016,2/12/2017 9:00,2017-02-12T09:00:00,,SCRP,Transfer,Intact Male,30.4288671,-97.32730202,52.48214286
919,4 months,A656471,Dog,Basset Hound Mix,Tricolor,6/7/2015,10/31/2015 12:50,2015-10-31T12:50:00,Dexter,,Adoption,Neutered Male,30.29810002,-97.72099974,20.93353175
920,12 years,A747200,Dog,Boxer Mix,Apricot,6/15/2001,1/25/2014 16:10,2014-01-25T16:10:00,Sirius,Foster,Adoption,Neutered Male,30.57057198,-97.48802913,658.2390873
921,2 months,A729322,Cat,Domestic Shorthair Mix,Cream/White,4/1/2017,6/30/2017 12:15,2017-06-30T12:15:00,*Toffeekins,,Adoption,Neutered Male,30.47713506,-97.61642922,12.93005952
922,1 year,A699258,Dog,Cairn Terrier Mix,Black/White,6/16/2015,6/21/2016 15:59,2016-06-21T15:59:00,*Parker,Partner,Transfer,Intact Male,30.39415793,-97.38903694,53.09513889
923,1 year,A652270,Other,Bat,Black/Brown,3/24/2014,3/24/2015 17:28,2015-03-24T17:28:00,,Rabies Risk,Euthanasia,Unknown,30.61749655,-97.55929526,52.2468254
924,9 months,A702450,Dog,Rhod Ridgeback Mix,Brown,2/22/2013,12/19/2013 11:35,2013-12-19T11:35:00,Lila,Partner,Transfer,Spayed Female,30.69683663,-97.48604614,42.92609127
925,1 year,A734284,Dog,Black Mouth Cur Mix,Tan/White,5/13/2014,5/17/2015 16:51,2015-05-17T16:51:00,Jamie,,Return to Owner,Spayed Female,30.31861932,-97.72299353,52.81458333
926,2 months,A669185,Cat,Domestic Medium Hair Mix,Brown Tabby,7/28/2016,10/21/2016 8:08,2016-10-21T08:08:00,*Rebbie J.,Foster,Adoption,Spayed Female,30.55875721,-97.59875197,12.19126984
927,2 months,A683208,Dog,Labrador Retriever Mix,Tan/White,10/16/2013,12/18/2013 18:27,2013-12-18T18:27:00,,,Adoption,Spayed Female,30.51913797,-97.32276685,9.109821429
928,1 year,A683245,Cat,Domestic Shorthair Mix,Blue Tabby/White,7/8/2013,7/21/2014 10:40,2014-07-21T10:40:00,X,Partner,Transfer,Spayed Female,30.31393797,-97.27419436,54.06349206
929,6 years,A721607,Cat,Domestic Shorthair Mix,Cream Tabby,7/9/2008,7/24/2014 12:47,2014-07-24T12:47:00,X,Partner,Transfer,Neutered Male,30.66095087,-97.73052131,315.2189484
930,5 years,A664661,Dog,Beagle Mix,Tricolor,3/1/2011,3/2/2016 17:58,2016-03-02T17:58:00,Dwight,Partner,Transfer,Neutered Male,30.39858402,-97.38735189,261.2498016
931,2 months,A666882,Cat,Domestic Shorthair Mix,Black/White,8/7/2013,10/13/2013 17:04,2013-10-13T17:04:00,Lily,,Adoption,Spayed Female,30.51615732,-97.31841571,9.673015873
932,3 years,A691324,Dog,Great Pyrenees Mix,White,11/8/2010,12/1/2013 18:09,2013-12-01T18:09:00,Zeus,,Adoption,Neutered Male,30.48219225,-97.66171877,159.9651786
933,14 years,A734241,Dog,Labrador Retriever Mix,Black/White,11/3/2000,1/17/2015 20:42,2015-01-17T20:42:00,Dante,Offsite,Adoption,Neutered Male,30.74401581,-97.64873604,741.2660714
934,6 months,A762687,Other,Rabbit Sh Mix,Sable/Brown,3/3/2016,9/10/2016 13:15,2016-09-10T13:15:00,,In Kennel,Died,Intact Female,30.3717012,-97.63267201,27.36458333
935,2 years,A742492,Dog,Black Tan Hound Mix,Brown/White,11/24/2015,12/30/2017 13:08,2017-12-30T13:08:00,*Ajax,,Adoption,Neutered Male,30.70428255,-97.62647386,109.6496032
936,2 months,A686210,Dog,Pointer Mix,White/Black,12/22/2016,2/24/2017 8:13,2017-02-24T08:13:00,,Foster,Adoption,Neutered Male,30.3803218,-97.34897535,9.191765873
937,13 years,A721019,Cat,Pixiebob Shorthair Mix,Brown Tabby,8/18/2001,6/13/2015 14:08,2015-06-13T14:08:00,Kya,Foster,Adoption,Spayed Female,30.42637131,-97.47538123,721.084127
938,1 year,A685260,Dog,English Coonhound,Black/Brown,2/19/2015,11/26/2016 18:50,2016-11-26T18:50:00,*Ziggy,,Adoption,Spayed Female,30.52171683,-97.30689006,92.39781746
939,6 months,A696485,Dog,Pointer Border Collie,Black/White,2/17/2014,8/30/2014 13:33,2014-08-30T13:33:00,Sweetie,,Adoption,Spayed Female,30.40536433,-97.3618006,27.79494048
940,9 months,A668533,Dog,Blue Lacy Mix,Blue/White,5/5/2014,2/12/2015 14:42,2015-02-12T14:42:00,*Imelda,,Adoption,Spayed Female,30.43034282,-97.43455616,40.51607143
941,2 months,A651860,Dog,Australian Shepherd Mix,Tricolor,10/4/2013,12/6/2013 16:34,2013-12-06T16:34:00,*Faith,Partner,Transfer,Intact Female,30.66225658,-97.67508486,9.098611111
942,13 years,A732284,Dog,Labrador Retriever Vizsla,Tan,4/16/2003,4/20/2016 11:38,2016-04-20T11:38:00,Chase,,Return to Owner,Neutered Male,30.34111213,-97.45554932,679.069246
943,1 year,A668209,Other,Bat,Black/Brown,8/5/2015,8/5/2016 13:15,2016-08-05T13:15:00,,Rabies Risk,Euthanasia,Unknown,30.63465008,-97.70315059,52.36458333
944,3 years,A748820,Dog,Yorkshire Terrier Chihuahua Longhair,Gray/Black,11/29/2010,12/11/2013 12:14,2013-12-11T12:14:00,Cindi Lou,Partner,Transfer,Intact Female,30.38122792,-97.67270586,158.3585317
945,1 month,A725593,Cat,Domestic Shorthair Mix,Brown Tabby/White,4/4/2017,6/2/2017 17:55,2017-06-02T17:55:00,Izzy,Foster,Adoption,Spayed Female,30.48338289,-97.64255049,8.535218254
946,8 years,A704718,Cat,Domestic Shorthair Mix,Blue Tabby/White,4/30/2008,5/6/2016 13:58,2016-05-06T13:58:00,Dooley,,Adoption,Neutered Male,30.74240515,-97.46616327,418.3688492
947,6 months,A704398,Cat,Domestic Shorthair Mix,White/Black,5/8/2015,11/25/2015 7:29,2015-11-25T07:29:00,*Paulie,Foster,Adoption,Neutered Male,30.49160787,-97.54414634,28.75882937
948,1 year,A706697,Other,Lop English Mix,Silver,6/4/2014,6/22/2015 18:33,2015-06-22T18:33:00,,Partner,Transfer,Intact Male,30.52719184,-97.54861705,54.82470238
949,5 months,A749615,Cat,Domestic Shorthair Mix,Orange Tabby,4/10/2015,9/19/2015 19:02,2015-09-19T19:02:00,*Toby,,Adoption,Neutered Male,30.40682036,-97.71991369,23.25615079
950,2 months,A669859,Dog,Labrador Retriever Mix,Tricolor,5/16/2017,8/2/2017 11:59,2017-08-02T11:59:00,*Frankie,Foster,Adoption,Neutered Male,30.70852473,-97.54171213,11.21418651
951,2 years,A727627,Dog,Pit Bull Mix,Red/White,12/28/2011,1/8/2014 16:10,2014-01-08T16:10:00,*Mack,Behavior,Euthanasia,Intact Male,30.30688104,-97.40802549,106.0962302
952,1 year,A690192,Dog,Pit Bull Mix,Brown Brindle/White,5/23/2015,5/26/2016 17:13,2016-05-26T17:13:00,Cesar,,Return to Owner,Neutered Male,30.45998533,-97.64430015,52.81676587
953,1 month,A687108,Dog,Plott Hound Mix,Black,8/31/2014,10/16/2014 16:55,2014-10-16T16:55:00,,Partner,Transfer,Intact Male,30.49835061,-97.35689425,6.672123016
954,1 year,A624126,Dog,Boxer,Brown Brindle/White,10/1/2013,10/26/2014 12:28,2014-10-26T12:28:00,Jace,,Return to Owner,Intact Male,30.61729308,-97.26085652,55.78849206
955,1 year,A686300,Dog,Pit Bull Mix,Blue Tiger/White,1/28/2012,11/19/2013 12:26,2013-11-19T12:26:00,Blue,,Return to Owner,Neutered Male,30.42549481,-97.55937597,94.50257937
956,1 year,A706331,Dog,Pit Bull Mix,White/Chocolate,2/20/2013,8/21/2014 18:05,2014-08-21T18:05:00,Titus,,Return to Owner,Neutered Male,30.5801046,-97.49869668,78.25049603
957,2 months,A671064,Cat,Domestic Shorthair Mix,Black,6/5/2015,8/29/2015 14:37,2015-08-29T14:37:00,*Peter,Offsite,Adoption,Neutered Male,30.34207603,-97.56748745,12.22986111
958,2 years,A701495,Cat,Domestic Medium Hair Mix,Black,1/17/2012,6/23/2014 20:20,2014-06-23T20:20:00,*Marie,Foster,Adoption,Spayed Female,30.39249954,-97.45547087,126.9781746
959,5 years,A689177,Dog,Pit Bull Mix,Blue/White,4/30/2010,12/19/2015 10:01,2015-12-19T10:01:00,Bella,Foster,Adoption,Spayed Female,30.26954665,-97.69985131,294.2024802
960,1 month,A746658,Dog,Golden Retriever Mix,Brown,8/30/2014,10/22/2014 15:56,2014-10-22T15:56:00,,Foster,Adoption,Neutered Male,30.58857154,-97.46655312,7.666269841
961,2 years,A693120,Dog,Akita Mix,Red,10/6/2014,4/30/2017 16:37,2017-04-30T16:37:00,Henry,,Adoption,Neutered Male,30.33631569,-97.28157252,133.9560516
962,7 years,A755178,Dog,Golden Retriever Mix,Gold,12/2/2007,12/4/2014 18:51,2014-12-04T18:51:00,Rex,Partner,Transfer,Neutered Male,30.55310274,-97.4993115,365.683631
963,1 month,A760903,Dog,Labrador Retriever Mix,Black/White,5/30/2017,7/30/2017 16:07,2017-07-30T16:07:00,,Partner,Transfer,Intact Male,30.75763616,-97.63543574,8.810218254
964,5 months,A718864,Cat,Domestic Shorthair Mix,Black,5/25/2017,11/7/2017 18:28,2017-11-07T18:28:00,*Donnie,,Adoption,Neutered Male,30.64550344,-97.34880858,23.82420635
965,1 year,A746625,Dog,Pit Bull Mix,Brown Brindle,1/8/2015,2/7/2016 15:13,2016-02-07T15:13:00,*Wilma,,Adoption,Spayed Female,30.45850505,-97.36401797,56.51914683
966,3 years,A695911,Dog,Pit Bull Mix,Blue,4/5/2014,1/10/2018 15:27,2018-01-10T15:27:00,Blue,,Return to Owner,Intact Male,30.45924879,-97.62234939,196.6633929
967,8 months,A681455,Dog,Labrador Retriever Mix,Black/White,5/25/2014,1/31/2015 13:46,2015-01-31T13:46:00,Jordy,,Adoption,Neutered Male,30.58302626,-97.37348518,35.9390873
968,4 months,A665655,Dog,Labrador Retriever Mix,Brown/White,2/16/2014,6/22/2014 17:47,2014-06-22T17:47:00,,,Adoption,Spayed Female,30.38651266,-97.43785857,18.10585317
969,2 months,A709069,Cat,Domestic Shorthair Mix,Brown Tabby,8/21/2013,10/23/2013 17:30,2013-10-23T17:30:00,,Partner,Transfer,Intact Female,30.45956035,-97.71748752,9.104166667
970,5 months,A714128,Cat,Domestic Shorthair Mix,Black/White,3/4/2015,8/16/2015 18:15,2015-08-16T18:15:00,Leo,,Adoption,Neutered Male,30.45241566,-97.71826134,23.68005952
971,1 year,A675161,Cat,Domestic Shorthair Mix,Orange Tabby,10/18/2014,10/19/2015 9:00,2015-10-19T09:00:00,,SCRP,Transfer,Intact Male,30.5763316,-97.67468463,52.33928571
972,1 year,A686113,Other,Bat Mix,Black/Brown,3/24/2013,3/24/2014 15:35,2014-03-24T15:35:00,,Rabies Risk,Euthanasia,Unknown,30.70808985,-97.55385316,52.23561508
973,3 weeks,A691586,Dog,Australian Kelpie Mix,Sable,7/25/2014,8/20/2014 14:06,2014-08-20T14:06:00,,Partner,Transfer,Intact Male,30.51609184,-97.46348799,3.798214286
974,1 year,A756819,Dog,Pit Bull Mix,Tan/White,5/7/2013,12/24/2014 17:33,2014-12-24T17:33:00,*Cassidy,Partner,Transfer,Spayed Female,30.39254451,-97.46391449,85.24732143
975,4 months,A714811,Cat,Domestic Shorthair Mix,Orange Tabby,4/25/2017,8/31/2017 18:49,2017-08-31T18:49:00,*Nashville,,Adoption,Neutered Male,30.4179158,-97.63604605,18.39771825
976,2 years,A742656,Cat,Domestic Shorthair Mix,Black/White,10/28/2013,10/29/2015 9:00,2015-10-29T09:00:00,,SCRP,Transfer,Intact Male,30.44654586,-97.63061552,104.4821429
977,1 year,A683712,Other,Raccoon,Brown/Black,1/25/2016,1/26/2017 8:48,2017-01-26T08:48:00,,Rabies Risk,Euthanasia,Unknown,30.47602204,-97.2748374,52.48095238
978,10 months,A755997,Dog,Dachshund Wirehair Chihuahua Longhair,Gray/White,9/14/2013,7/21/2014 13:07,2014-07-21T13:07:00,,Partner,Transfer,Spayed Female,30.33650254,-97.27534442,44.36378968
979,4 months,A761372,Cat,Domestic Shorthair Mix,Black/White,7/23/2017,12/10/2017 18:24,2017-12-10T18:24:00,Luke,,Adoption,Neutered Male,30.59800863,-97.51057257,20.10952381
980,1 year,A762370,Cat,Domestic Shorthair Mix,Orange Tabby/White,11/3/2016,11/19/2017 14:33,2017-11-19T14:33:00,*Marmalade,,Adoption,Spayed Female,30.55963962,-97.49544468,54.51517857
981,3 years,A745166,Bird,Muscovy,Black/White,11/19/2014,11/22/2017 10:51,2017-11-22T10:51:00,,Partner,Transfer,Unknown,30.44221852,-97.58416364,157.0645833
982,1 week,A696218,Cat,Domestic Shorthair Mix,Black,3/6/2017,3/13/2017 18:11,2017-03-13T18:11:00,,Partner,Transfer,Intact Female,30.4270712,-97.72788545,1.108234127
983,5 months,A676786,Cat,Domestic Shorthair Mix,Black,8/31/2014,2/6/2015 16:50,2015-02-06T16:50:00,Mo,,Adoption,Neutered Male,30.39675399,-97.52263395,22.81448413
984,1 year,A690731,Dog,Chihuahua Shorthair Mix,White/Brown,4/15/2013,4/20/2014 18:34,2014-04-20T18:34:00,Tuzi,,Adoption,Spayed Female,30.40675779,-97.73082125,52.96765873
985,2 months,A699457,Cat,Balinese Mix,Chocolate Point/White,8/25/2014,10/31/2014 12:20,2014-10-31T12:20:00,Jinx,,Adoption,Intact Male,30.55535563,-97.45788543,9.64484127
986,1 year,A763984,Other,Bat Mix,Brown,3/27/2014,3/28/2015 8:40,2015-03-28T08:40:00,,Rabies Risk,Euthanasia,Unknown,30.76538117,-97.72298209,52.33730159
987,5 months,A686960,Dog,Chihuahua Shorthair Mix,Black/White,7/23/2017,12/23/2017 16:16,2017-12-23T16:16:00,,,Adoption,Spayed Female,30.66219725,-97.51587671,21.95396825
988,1 year,A758342,Dog,Mastiff Mix,Tan/Black,3/3/2013,9/1/2014 18:17,2014-09-01T18:17:00,Tonka,,Return to Owner,Neutered Male,30.57038913,-97.63642958,78.25168651
989,1 year,A707005,Other,Bat,Brown,9/14/2016,9/14/2017 17:21,2017-09-14T17:21:00,,Rabies Risk,Euthanasia,Unknown,30.54682319,-97.47949133,52.24613095
990,7 months,A711467,Dog,Golden Retriever Border Collie,Gold/Cream,12/9/2014,7/12/2015 17:37,2015-07-12T17:37:00,*Jake,,Adoption,Neutered Male,30.32871992,-97.53846138,30.81914683
991,2 months,A691889,Cat,Domestic Shorthair Mix,Black,7/23/2015,10/10/2015 14:52,2015-10-10T14:52:00,*Peanut,Foster,Adoption,Neutered Male,30.27055648,-97.66901885,11.37420635
992,7 years,A736818,Dog,Labrador Retriever Mix,Black,11/11/2007,11/18/2014 17:56,2014-11-18T17:56:00,*Molly,,Adoption,Spayed Female,30.54806196,-97.30310624,366.3924603
993,1 year,A741267,Dog,Australian Cattle Dog,Red Tick/Tan,10/17/2015,11/10/2016 16:08,2016-11-10T16:08:00,*Cisco,,Adoption,Neutered Male,30.34547909,-97.53867584,55.81031746
994,2 months,A692511,Dog,Labrador Retriever Mix,Black/White,10/30/2016,1/5/2017 17:31,2017-01-05T17:31:00,,,Adoption,Spayed Female,30.35704201,-97.71843279,9.675694444
995,1 year,A755281,Dog,Pit Bull Mix,Tan/White,11/21/2013,1/8/2015 18:06,2015-01-08T18:06:00,Ella,,Return to Owner,Spayed Female,30.57092281,-97.7369848,59.1077381
996,11 months,A718203,Cat,Domestic Shorthair Mix,Blue Tabby/White,1/1/2017,12/27/2017 15:42,2017-12-27T15:42:00,Haku,,Adoption,Neutered Male,30.76153028,-97.46421737,51.52202381
997,2 years,A733531,Dog,Labrador Retriever Mix,Black,12/23/2013,4/12/2016 14:40,2016-04-12T14:40:00,Crissy,,Adoption,Spayed Female,30.70617383,-97.36597396,120.2301587
998,1 year,A707937,Cat,Domestic Shorthair Mix,Orange Tabby/White,8/23/2015,9/22/2016 16:01,2016-09-22T16:01:00,*Ellis,Partner,Transfer,Spayed Female,30.34890815,-97.41972798,56.66676587
999,13 years,A751510,Dog,Chihuahua Shorthair Mix,Black/Brown,7/20/2002,7/25/2015 11:31,2015-07-25T11:31:00,Blackie,,Adoption,Neutered Male,30.6260542,-97.69737902,679.0685516
1000,1 year,A733863,Cat,Domestic Shorthair Mix,Blue/White,6/9/2016,6/27/2017 18:13,2017-06-27T18:13:00,Sammy,,Return to Owner,Neutered Male,30.41181727,-97.68328107,54.82271825
1001,5 months,A688409,Dog,Rat Terrier Mix,Tricolor,4/13/2016,10/4/2016 9:43,2016-10-04T09:43:00,Dobby,In Kennel,Died,Neutered Male,30.65807838,-97.72861493,24.91498016
1002,1 year,A715268,Other,Opossum Mix,Gray/Pink,9/19/2013,9/19/2014 11:58,2014-09-19T11:58:00,,Rabies Risk,Euthanasia,Unknown,30.40205143,-97.30953421,52.2140873
1003,4 years,A741961,Dog,Pit Bull Mix,Tan/White,11/3/2011,12/14/2015 20:10,2015-12-14T20:10:00,*Cece,Partner,Transfer,Intact Female,30.72643461,-97.40444351,214.6914683
1004,4 months,A681938,Cat,Domestic Shorthair Mix,Brown Tabby/White,10/3/2016,2/4/2017 14:28,2017-02-04T14:28:00,*Chanel,Foster,Adoption,Spayed Female,30.53802253,-97.66727181,17.80039683
1005,2 months,A715339,Cat,Domestic Shorthair Mix,Torbie,5/6/2014,7/7/2014 13:22,2014-07-07T13:22:00,*Martha,Suffering,Euthanasia,Intact Female,30.67268505,-97.31733803,8.936706349
1006,3 months,A753426,Cat,Domestic Shorthair Mix,Brown Tabby,10/13/2015,1/16/2016 14:17,2016-01-16T14:17:00,,Foster,Adoption,Spayed Female,30.27823823,-97.49523401,13.65644841
1007,2 years,A745857,Cat,Domestic Shorthair Mix,White,7/6/2015,7/10/2017 18:10,2017-07-10T18:10:00,,Snr,Transfer,Spayed Female,30.30904141,-97.62075279,105.1081349
1008,16 years,A734461,Dog,Pekingese Mix,Brown/White,3/26/2001,3/26/2017 13:20,2017-03-26T13:20:00,Lucy,,Return to Owner,Intact Female,30.29130217,-97.26149179,834.9365079
1009,3 months,A705516,Cat,Domestic Medium Hair Mix,Black,6/6/2016,9/10/2016 15:55,2016-09-10T15:55:00,Baghera,,Adoption,Neutered Male,30.47631429,-97.44248215,13.80902778
1010,2 months,A676126,Cat,Domestic Shorthair Mix,Blue/White,4/3/2015,6/24/2015 12:23,2015-06-24T12:23:00,*Leila,Partner,Transfer,Spayed Female,30.39655422,-97.2602516,11.78799603
1011,1 year,A702189,Cat,Domestic Shorthair Mix,Brown Tabby/White,7/17/2012,12/29/2013 12:24,2013-12-29T12:24:00,Zooey,,Adoption,Spayed Female,30.38109887,-97.35410145,75.78809524
1012,3 years,A733405,Dog,Labrador Retriever Mix,Black,4/5/2011,5/10/2014 11:17,2014-05-10T11:17:00,*Jelly Bean,,Adoption,Spayed Female,30.61642973,-97.56277588,161.6385913
1013,1 year,A758511,Cat,Domestic Shorthair Mix,Brown Tabby,5/10/2014,5/23/2015 16:00,2015-05-23T16:00:00,Kylie,,Adoption,Spayed Female,30.46185112,-97.47080306,54.0952381
1014,1 year,A722108,Dog,Catahoula Staffordshire,Brown Brindle/White,8/21/2015,8/31/2016 15:36,2016-08-31T15:36:00,Iris,,Adoption,Intact Female,30.68427545,-97.72740152,53.80714286
1015,2 months,A718977,Cat,Domestic Medium Hair Mix,Blue/White,8/27/2017,11/15/2017 16:30,2017-11-15T16:30:00,*Kiblet,Foster,Adoption,Neutered Male,30.48778607,-97.57893408,11.52678571
1016,2 years,A742491,Dog,Pit Bull Mix,Brown Brindle/White,9/11/2014,11/18/2016 13:21,2016-11-18T13:21:00,*Mack,,Return to Owner,Neutered Male,30.57975164,-97.33019787,114.2223214
1017,10 years,A667809,Dog,Catahoula Mix,Brown,1/10/2006,9/1/2016 11:46,2016-09-01T11:46:00,Bella,Foster,Adoption,Spayed Female,30.41923109,-97.4818778,555.355754
1018,2 months,A672357,Dog,Pointer Mix,White/Black,12/22/2016,2/24/2017 11:08,2017-02-24T11:08:00,*Ponce,Foster,Adoption,Neutered Male,30.27526481,-97.58378579,9.209126984
1019,2 months,A679467,Dog,German Shepherd Mix,Brown/Black,9/23/2013,11/30/2013 17:37,2013-11-30T17:37:00,Lily,,Adoption,Spayed Female,30.53933273,-97.68925159,9.819146825
1020,8 years,A721726,Dog,Carolina Dog Mix,Red,2/8/2006,3/29/2014 14:39,2014-03-29T14:39:00,Princess,,Adoption,Spayed Female,30.59850038,-97.64784104,424.5157738
1021,2 years,A710350,Dog,Siberian Husky Mix,Black/Brown,12/21/2011,5/29/2014 15:32,2014-05-29T15:32:00,Asia,,Adoption,Spayed Female,30.70712061,-97.39077382,127.2353175
1022,3 days,A704877,Cat,Domestic Shorthair Mix,Black/White,2/29/2016,3/3/2016 13:18,2016-03-03T13:18:00,,Partner,Transfer,Intact Male,30.60122104,-97.33546398,0.507738095
1023,2 months,A764175,Dog,Border Collie Mix,Black,6/22/2015,8/26/2015 18:41,2015-08-26T18:41:00,Oso,,Adoption,Neutered Male,30.40455622,-97.50984937,9.396924603
1024,1 year,A713368,Cat,Domestic Shorthair Mix,Brown Tabby/White,6/10/2014,6/11/2015 7:59,2015-06-11T07:59:00,,Suffering,Euthanasia,Intact Male,30.6352467,-97.4645698,52.33323413
1025,2 years,A687107,Dog,Siberian Husky Mix,Red/White,12/23/2015,12/29/2017 15:20,2017-12-29T15:20:00,Moonie,,Return to Owner,Neutered Male,30.54014737,-97.71108361,105.3769841
1026,1 month,A669680,Cat,Domestic Shorthair Mix,Blue,10/1/2015,11/13/2015 11:54,2015-11-13T11:54:00,,Partner,Transfer,Intact Male,30.49492144,-97.31567884,6.213690476
1027,3 years,A691064,Dog,Rhod Ridgeback Pit Bull,Red/Brown,12/1/2013,10/4/2017 17:57,2017-10-04T17:57:00,Montopolis,,Return to Owner,Neutered Male,30.71731941,-97.69668304,200.5354167
1028,2 years,A721480,Dog,Plott Hound Mix,Brown Brindle/White,12/24/2011,3/28/2014 12:27,2014-03-28T12:27:00,Nino,,Return to Owner,Neutered Male,30.43250419,-97.53417966,117.93125
1029,7 months,A678765,Cat,Domestic Shorthair Mix,Torbie,3/1/2014,10/30/2014 9:00,2014-10-30T09:00:00,,SCRP,Transfer,Intact Female,30.33862669,-97.39132498,34.76785714
1030,3 months,A729159,Dog,Pit Bull Mix,Red,11/9/2015,3/3/2016 0:00,2016-03-03T00:00:00,,Partner,Transfer,Intact Female,30.44449023,-97.54728394,16.42857143
1031,4 weeks,A734251,Dog,Black Mouth Cur Mix,Tan,4/13/2014,5/13/2014 15:19,2014-05-13T15:19:00,,Partner,Transfer,Intact Male,30.55616224,-97.7235155,4.376884921
1032,6 months,A719465,Other,Opossum,Gray,12/14/2015,6/14/2016 12:03,2016-06-14T12:03:00,,Medical,Euthanasia,Unknown,30.6993113,-97.71941631,26.21458333
1033,11 months,A747956,Other,Hotot Mix,White/Black,1/3/2016,12/12/2016 12:19,2016-12-12T12:19:00,*Marilyn Bun,,Adoption,Spayed Female,30.7456053,-97.38429986,49.21617063
1034,5 months,A741271,Dog,Pug Mix,Cream/Black,8/24/2015,1/25/2016 17:11,2016-01-25T17:11:00,Hazel,,Adoption,Spayed Female,30.69843813,-97.41068972,22.10228175
1035,6 months,A678892,Dog,Plott Hound Mix,Chocolate/White,11/30/2015,6/4/2016 15:45,2016-06-04T15:45:00,Nikola,,Adoption,Neutered Male,30.64370584,-97.52075547,26.80803571
1036,2 months,A725275,Dog,Chihuahua Shorthair Mix,Tan,2/20/2017,4/28/2017 18:58,2017-04-28T18:58:00,Princess Ana,,Adoption,Spayed Female,30.687813,-97.66539163,9.684325397
1037,3 months,A740490,Dog,Border Collie Mix,Black/White,11/30/2016,3/7/2017 9:17,2017-03-07T09:17:00,*Sassy,Foster,Adoption,Spayed Female,30.48887294,-97.25294386,13.91240079
1038,2 months,A673487,Cat,Domestic Shorthair Mix,Silver Tabby,4/13/2014,7/4/2014 15:45,2014-07-04T15:45:00,*Winnie,,Adoption,Spayed Female,30.73396788,-97.50422595,11.80803571
1039,8 months,A668598,Dog,Rhod Ridgeback Mix,Red,8/27/2015,4/27/2016 19:13,2016-04-27T19:13:00,Rudolph,,Return to Owner,Neutered Male,30.44180012,-97.54882884,34.97152778
1040,1 year,A750436,Other,Rabbit Lh Mix,Black,12/18/2015,12/18/2016 14:32,2016-12-18T14:32:00,Hero Boy,Partner,Transfer,Intact Male,30.48867656,-97.50058136,52.37222222
1041,6 months,A665240,Other,Bat Mix,Brown,8/24/2013,2/25/2014 9:00,2014-02-25T09:00:00,,Rabies Risk,Euthanasia,Unknown,30.6710414,-97.73282836,26.48214286
1042,2 years,A696127,Dog,Rottweiler Mix,Black/White,10/14/2013,12/28/2015 11:20,2015-12-28T11:20:00,Sprinkles,,Return to Owner,Neutered Male,30.60823329,-97.62864137,115.0674603
1043,2 months,A747591,Cat,Domestic Shorthair Mix,Blue/White,4/5/2017,6/16/2017 18:15,2017-06-16T18:15:00,*Royal,Foster,Adoption,Spayed Female,30.33046719,-97.54649618,10.39434524
1044,1 month,A699974,Dog,Australian Kelpie Mix,Sable/White,9/8/2013,10/15/2013 16:11,2013-10-15T16:11:00,,Partner,Transfer,Intact Female,30.70202884,-97.67562048,5.382043651
1045,2 years,A738833,Dog,Pit Bull Mix,Tan,1/30/2013,2/7/2015 14:36,2015-02-07T14:36:00,Charlie,,Return to Owner,Neutered Male,30.48045834,-97.28936631,105.5154762
1046,1 year,A706115,Cat,Domestic Longhair Mix,Brown Tabby,4/21/2016,4/25/2017 9:27,2017-04-25T09:27:00,,Snr,Transfer,Neutered Male,30.36920961,-97.62347334,52.77053571
1047,1 year,A681259,Dog,Boxer Mix,Brown Brindle,3/5/2014,4/20/2015 17:42,2015-04-20T17:42:00,Caine,Aggressive,Euthanasia,Neutered Male,30.4495535,-97.4260715,58.81964286
1048,1 weeks,A693910,Cat,Domestic Shorthair Mix,Gray/White,11/13/2016,11/22/2016 12:11,2016-11-22T12:11:00,,Partner,Transfer,Unknown,30.3622308,-97.27621638,1.358234127
1049,8 years,A636714,Dog,Rat Terrier Mix,White/Tricolor,6/25/2007,7/5/2015 16:44,2015-07-05T16:44:00,*Louise,,Adoption,Spayed Female,30.66124669,-97.61718362,418.956746
1050,3 weeks,A696222,Cat,Domestic Shorthair Mix,Black/White,5/23/2014,6/14/2014 12:45,2014-06-14T12:45:00,,Partner,Transfer,Intact Male,30.33750876,-97.63471249,3.21875
1051,2 years,A708890,Dog,Boxer,Tan,12/16/2012,1/7/2015 13:26,2015-01-07T13:26:00,*Kyra,,Adoption,Spayed Female,30.37091265,-97.67525781,107.5085317
1052,4 years,A565938,Dog,Siberian Husky Mix,Sable/White,1/2/2010,1/5/2014 18:03,2014-01-05T18:03:00,Blue,,Adoption,Neutered Male,30.38267405,-97.25476565,209.2502976
1053,2 years,A744093,Cat,Domestic Shorthair Mix,Brown Tabby,1/31/2013,2/1/2015 9:00,2015-02-01T09:00:00,,SCRP,Transfer,Intact Male,30.58006274,-97.68801043,104.4821429
1054,5 months,A663845,Cat,Domestic Shorthair Mix,Black/White,6/17/2015,12/10/2015 11:47,2015-12-10T11:47:00,*Obsidian,Foster,Adoption,Neutered Male,30.34391069,-97.67595832,25.21299603
1055,8 years,A743515,Dog,Chihuahua Shorthair Mix,Tan,2/2/2009,12/21/2017 15:54,2017-12-21T15:54:00,Scooby,Partner,Transfer,Neutered Male,30.62770512,-97.55112982,463.5232143
1056,5 years,A741351,Dog,German Shepherd Mix,Black/Brown,2/23/2012,3/6/2017 11:25,2017-03-06T11:25:00,Dumbo,,Return to Owner,Neutered Male,30.33368407,-97.73134996,262.6393849
1057,7 months,A750942,Dog,Pit Bull Mix,White/Tan,2/24/2013,10/7/2013 13:11,2013-10-07T13:11:00,Bullet,Partner,Transfer,Neutered Male,30.32781322,-97.61251903,32.22132937
1058,1 year,A741380,Dog,Jack Russell Terrier Chihuahua Shorthair,Tan/White,12/11/2015,2/12/2017 12:16,2017-02-12T12:16:00,Riley,,Adoption,Neutered Male,30.40563577,-97.38877323,61.35873016
1059,1 year,A735445,Dog,Pit Bull Mix,White,12/31/2015,6/4/2017 15:28,2017-06-04T15:28:00,Toby,,Return to Owner,Intact Male,30.74676615,-97.67181085,74.52063492
1060,3 years,A706880,Dog,Pit Bull Mix,Brown Brindle/White,6/2/2014,6/8/2017 13:12,2017-06-08T13:12:00,Tank,,Rto-Adopt,Neutered Male,30.52882515,-97.70628669,157.5071429
1061,10 months,A700932,Dog,Labrador Retriever Mix,Brown,3/1/2016,1/7/2017 11:39,2017-01-07T11:39:00,Bingo,,Return to Owner,Neutered Male,30.40588044,-97.28888528,44.64077381
1062,2 months,A705754,Dog,Rottweiler Mix,Black/Tan,7/8/2016,9/23/2016 16:37,2016-09-23T16:37:00,,Suffering,Euthanasia,Intact Female,30.58981601,-97.41943584,11.09890873
1063,5 months,A661698,Dog,Labrador Retriever Mix,Brown,2/4/2015,7/15/2015 15:25,2015-07-15T15:25:00,*Aldo,Partner,Transfer,Neutered Male,30.65319207,-97.63919324,23.09176587
1064,2 weeks,A736506,Cat,Domestic Medium Hair Mix,Black,4/6/2015,4/21/2015 14:37,2015-04-21T14:37:00,,Partner,Transfer,Unknown,30.55601995,-97.45913863,2.229861111
1065,2 months,A698894,Cat,Domestic Shorthair Mix,Orange Tabby/White,4/20/2015,7/4/2015 10:30,2015-07-04T10:30:00,*Javier,Partner,Transfer,Neutered Male,30.58872943,-97.28159358,10.77678571
1066,3 months,A752774,Cat,Domestic Shorthair Mix,Brown Tabby,7/16/2013,10/20/2013 12:27,2013-10-20T12:27:00,,Partner,Transfer,Neutered Male,30.32040385,-97.46266691,13.78839286
1067,2 years,A699469,Dog,Pit Bull Mix,Blue,10/11/2014,11/25/2016 16:32,2016-11-25T16:32:00,*Coraline,,Adoption,Spayed Female,30.626042,-97.43614203,110.9555556
1068,1 year,A730305,Dog,Manchester Terrier Chihuahua Shorthair,Chocolate/Tan,3/19/2014,3/26/2015 19:03,2015-03-26T19:03:00,Chris,,Adoption,Neutered Male,30.58108158,-97.41613353,53.25625
1069,1 week,A733673,Cat,Domestic Shorthair Mix,Black,6/20/2017,6/27/2017 17:39,2017-06-27T17:39:00,,Partner,Transfer,Intact Male,30.59514276,-97.4032631,1.105059524
1070,2 months,A708832,Dog,Labrador Retriever Mix,Black/White,1/12/2015,4/3/2015 16:52,2015-04-03T16:52:00,*Fallon,Partner,Transfer,Spayed Female,30.3427964,-97.48042168,11.6718254
1071,2 years,A667027,Dog,Great Pyrenees Mix,White,7/1/2014,7/5/2016 14:32,2016-07-05T14:32:00,*Bach,Partner,Transfer,Intact Male,30.47339207,-97.32055414,105.0865079
1072,6 months,A754139,Dog,Pointer,White/Brown,2/25/2016,8/29/2016 16:54,2016-08-29T16:54:00,,,Adoption,Spayed Female,30.54342713,-97.62769612,26.67202381
1073,3 months,A671133,Cat,Domestic Shorthair Mix,Blue/White,7/30/2015,11/11/2015 13:47,2015-11-11T13:47:00,,Foster,Adoption,Neutered Male,30.69657982,-97.71648317,14.93918651
1074,1 year,A756949,Cat,Siamese Mix,Flame Point,11/11/2012,11/21/2013 15:17,2013-11-21T15:17:00,*Casper,Partner,Transfer,Neutered Male,30.57977925,-97.46396621,53.66240079
1075,2 years,A710771,Dog,Pit Bull Mix,Brown/White,7/16/2015,8/19/2017 12:00,2017-08-19T12:00:00,*Heidi,,Adoption,Spayed Female,30.53899722,-97.32548431,109.3571429
1076,3 years,A716369,Dog,American Bulldog Mix,White/Brown Brindle,7/19/2012,6/14/2016 9:08,2016-06-14T09:08:00,Chuck,Foster,Adoption,Neutered Male,30.64048407,-97.58936664,203.7686508
1077,1 week,A706181,Cat,Domestic Shorthair Mix,Brown Tabby/White,8/21/2017,8/28/2017 17:21,2017-08-28T17:21:00,,Partner,Transfer,Intact Male,30.37872906,-97.38368166,1.10327381
1078,6 years,A726476,Dog,Chihuahua Shorthair Mix,Brown,8/28/2009,8/28/2015 17:23,2015-08-28T17:23:00,Kelli,,Return to Owner,Spayed Female,30.70871776,-97.73880824,313.1034722
1079,2 months,A756504,Dog,Boxer Mix,Brown Brindle/White,10/18/2015,1/7/2016 17:09,2016-01-07T17:09:00,*Copper,Foster,Adoption,Neutered Male,30.56467787,-97.62629823,11.6735119
1080,1 year,A734194,Dog,Pit Bull Mix,Brown/White,6/26/2014,7/6/2015 18:22,2015-07-06T18:22:00,Lola,,Return to Owner,Spayed Female,30.60468447,-97.28171822,53.68075397
1081,1 month,A753985,Dog,Catahoula Plott Hound,Black/White,5/11/2016,7/6/2016 18:02,2016-07-06T18:02:00,*Newton,Foster,Adoption,Spayed Female,30.75969781,-97.38324854,8.10734127
1082,2 weeks,A673924,Dog,Bernese Mountain Dog Mix,Sable/White,8/6/2017,8/21/2017 12:20,2017-08-21T12:20:00,,Partner,Transfer,Intact Female,30.33359893,-97.73403141,2.216269841
1083,2 years,A754921,Dog,Rat Terrier Mix,White/Brown,9/3/2014,9/10/2016 17:08,2016-09-10T17:08:00,*Pringles,,Adoption,Neutered Male,30.74678896,-97.52293624,105.5305556
1084,2 years,A707089,Other,Bat Mix,Black,7/13/2015,7/14/2017 7:47,2017-07-14T07:47:00,,Rabies Risk,Euthanasia,Unknown,30.56373368,-97.24740321,104.6177579
1085,1 year,A683330,Other,Bat Mix,Black/Brown,3/4/2013,3/4/2014 16:49,2014-03-04T16:49:00,,,Disposal,Unknown,30.53916965,-97.45608825,52.24295635
1086,2 years,A679230,Dog,Pit Bull Mix,Black Tiger,7/26/2015,7/27/2017 16:31,2017-07-27T16:31:00,Princess,,Return to Owner,Intact Female,30.31604436,-97.67990218,104.6697421
1087,10 years,A736959,Dog,Chihuahua Shorthair Mix,Black/Brown,7/7/2005,7/11/2015 12:32,2015-07-11T12:32:00,Pancho,Partner,Transfer,Intact Male,30.30487369,-97.53444451,522.3603175
1088,2 months,A742905,Cat,Domestic Shorthair Mix,Black Tabby,4/24/2014,7/15/2014 16:59,2014-07-15T16:59:00,,,Adoption,Neutered Male,30.57300996,-97.63830554,11.81537698
1089,2 years,A734796,Dog,Pit Bull Mix,White/Yellow,3/6/2014,2/20/2017 0:00,2017-02-20T00:00:00,Cooper,Partner,Transfer,Neutered Male,30.75143944,-97.50875075,154.5714286
1090,3 years,A665006,Other,Skunk Mix,Black/White,10/20/2013,10/20/2016 11:34,2016-10-20T11:34:00,,Rabies Risk,Euthanasia,Unknown,30.57884495,-97.47950785,156.6402778
1091,1 year,A693659,Cat,Siamese Mix,Flame Point,1/30/2016,2/11/2017 15:41,2017-02-11T15:41:00,*Topaz,,Adoption,Spayed Female,30.52790451,-97.61879501,54.09335317
1092,10 months,A680919,Dog,Pit Bull Mix,Blue/White,11/13/2015,9/20/2016 18:06,2016-09-20T18:06:00,*Hans,,Adoption,Neutered Male,30.49628393,-97.65778656,44.67916667
1093,6 months,A692962,Dog,Border Collie Mix,White/Brown,3/28/2013,10/19/2013 15:59,2013-10-19T15:59:00,Sasha,,Adoption,Spayed Female,30.45386876,-97.60265566,29.38085317
1094,1 year,A705340,Dog,Labrador Retriever Mix,Black/White,6/12/2013,3/1/2015 18:57,2015-03-01T18:57:00,*Lika,,Adoption,Spayed Female,30.67273973,-97.44901002,89.68422619
1095,2 months,A764715,Cat,Domestic Shorthair Mix,Cream Tabby,4/9/2014,6/10/2014 16:44,2014-06-10T16:44:00,,Partner,Transfer,Intact Male,30.6295805,-97.67051346,8.956746032
1096,2 months,A680047,Dog,Chihuahua Shorthair Mix,Gold/White,9/14/2014,11/29/2014 14:55,2014-11-29T14:55:00,,Partner,Transfer,Intact Male,30.41371764,-97.53909277,10.94593254
1097,3 weeks,A727292,Cat,Domestic Shorthair Mix,Brown Tabby,5/25/2015,6/17/2015 12:27,2015-06-17T12:27:00,,Partner,Transfer,Intact Female,30.6299917,-97.32393519,3.359821429
1098,2 years,A736954,Dog,Chihuahua Shorthair Mix,Tan,1/4/2016,1/4/2018 17:39,2018-01-04T17:39:00,Elsa,,Return to Owner,Spayed Female,30.67273715,-97.5222095,104.533631
1099,2 years,A738749,Other,Opossum,Gray/White,5/29/2012,5/29/2014 11:49,2014-05-29T11:49:00,,Suffering,Euthanasia,Intact Male,30.62499469,-97.32064661,104.3560516
1100,2 years,A722061,Cat,Domestic Medium Hair Mix,Brown Tabby/White,10/27/2013,9/3/2016 15:54,2016-09-03T15:54:00,Aria,,Adoption,Spayed Female,30.57291653,-97.55595673,148.9517857
1101,1 year,A745902,Dog,Pit Bull Mix,Brown,5/20/2015,5/22/2016 12:36,2016-05-22T12:36:00,,Partner,Transfer,Intact Female,30.28634621,-97.60739747,52.64642857
1102,3 years,A672751,Dog,Labrador Retriever Mix,Tan,10/20/2013,11/18/2016 17:29,2016-11-18T17:29:00,Holly,,Adoption,Spayed Female,30.48577618,-97.26172496,160.8183532
1103,7 years,A699022,Dog,German Shepherd,Brown/Black,11/20/2009,11/25/2016 14:09,2016-11-25T14:09:00,Camelia,,Adoption,Spayed Female,30.60895401,-97.3166651,366.0842262
1104,3 years,A726433,Dog,Miniature Schnauzer Miniature Poodle,Black,3/10/2013,3/14/2016 12:21,2016-03-14T12:21:00,Berta,Partner,Transfer,Intact Female,30.40193913,-97.48859828,157.216369
1105,1 year,A761761,Dog,Pit Bull Mix,Blue/White,4/26/2016,10/4/2017 12:33,2017-10-04T12:33:00,Chief,,Return to Owner,Neutered Male,30.61775847,-97.73246145,75.21755952
1106,11 years,A682926,Dog,Australian Shepherd Mix,Black/Brown Merle,2/16/2003,3/1/2014 11:33,2014-03-01T11:33:00,*Simon,Partner,Transfer,Neutered Male,30.61004859,-97.31748587,575.9258929
1107,2 weeks,A715813,Dog,Chihuahua Shorthair Mix,Brown,3/5/2015,3/22/2015 13:03,2015-03-22T13:03:00,Estelle,Partner,Transfer,Intact Female,30.72410235,-97.61761706,2.50625
1108,3 months,A718925,Cat,Domestic Shorthair Mix,White/Brown Tabby,4/3/2016,7/9/2016 20:34,2016-07-09T20:34:00,*Doug,Foster,Adoption,Neutered Male,30.68741269,-97.33263987,13.97956349
1109,2 months,A664230,Dog,Cairn Terrier Mix,Black/White,11/2/2017,1/11/2018 9:01,2018-01-11T09:01:00,,Foster,Adoption,Neutered Male,30.33150528,-97.62928728,10.05367063
1110,3 years,A736023,Dog,Chihuahua Shorthair Mix,Tan/White,7/5/2011,7/7/2014 17:19,2014-07-07T17:19:00,Chicho,,Return to Owner,Neutered Male,30.36849376,-97.42222039,156.9602183
1111,1 year,A704218,Dog,Black Tan Hound,Black/Tan,11/10/2014,3/15/2016 18:28,2016-03-15T18:28:00,Lola,,Return to Owner,Spayed Female,30.5216482,-97.30625783,70.25277778
1112,1 year,A702225,Other,Hotot Mix,White/Black,1/9/2015,3/8/2016 19:01,2016-03-08T19:01:00,Foo Foo,,Adoption,Spayed Female,30.45548379,-97.48761587,60.68462302
1113,1 year,A682203,Dog,Whippet Mix,Black,4/30/2012,10/7/2013 13:13,2013-10-07T13:13:00,Arya,Partner,Transfer,Spayed Female,30.53041385,-97.40204505,75.07867063
1114,5 months,A756720,Dog,Siberian Husky,Red/White,5/6/2016,10/11/2016 13:04,2016-10-11T13:04:00,Benson,,Return to Owner,Spayed Female,30.29151143,-97.70848197,22.64920635
1115,1 month,A697444,Dog,Chihuahua Shorthair Mix,Brown/White,6/1/2015,7/26/2015 18:28,2015-07-26T18:28:00,*Sansa,Foster,Adoption,Spayed Female,30.46471987,-97.58470221,7.967063492
1116,2 months,A718621,Cat,Domestic Shorthair Mix,Orange Tabby,4/19/2015,7/1/2015 12:07,2015-07-01T12:07:00,*Edmund,Foster,Adoption,Neutered Male,30.66650426,-97.73962335,10.50069444
1117,10 months,A757158,Dog,Chihuahua Shorthair Mix,Black/Brown,8/25/2013,6/29/2014 17:58,2014-06-29T17:58:00,,,Adoption,Neutered Male,30.44737696,-97.44134447,44.10694444
1118,2 weeks,A760379,Cat,Domestic Shorthair Mix,Brown Tabby,8/9/2017,8/24/2017 17:45,2017-08-24T17:45:00,,Partner,Transfer,Intact Female,30.51773132,-97.46420881,2.248511905
1119,6 months,A673501,Other,Bat Mix,Brown,8/23/2014,2/24/2015 8:44,2015-02-24T08:44:00,,Rabies Risk,Euthanasia,Unknown,30.6011564,-97.43871038,26.48055556
1120,1 year,A704897,Cat,Domestic Shorthair Mix,Tortie,1/3/2015,1/11/2016 18:05,2016-01-11T18:05:00,*Cleopatra,,Adoption,Spayed Female,30.42515082,-97.55054796,53.39335317
1121,1 year,A668199,Dog,Labrador Retriever Mix,White/Black,8/30/2016,8/31/2017 14:12,2017-08-31T14:12:00,Pirata,,Return to Owner,Intact Female,30.55721617,-97.53632243,52.3702381
1122,3 months,A723338,Cat,Domestic Shorthair Mix,Black/White,9/8/2017,12/16/2017 14:43,2017-12-16T14:43:00,*Skully,,Adoption,Neutered Male,30.48171959,-97.40151294,14.23045635
1123,1 year,A765050,Dog,Chihuahua Shorthair Mix,Brown,2/25/2013,2/25/2014 16:39,2014-02-25T16:39:00,Cassandra,Suffering,Euthanasia,Spayed Female,30.67320592,-97.70027272,52.24196429
1124,6 months,A731765,Dog,Australian Shepherd German Shepherd,Tricolor,12/10/2014,6/15/2015 15:18,2015-06-15T15:18:00,,,Adoption,Spayed Female,30.54427423,-97.4194554,26.80535714
1125,2 years,A729381,Dog,Pit Bull Mix,Black/White,11/29/2011,1/23/2014 15:36,2014-01-23T15:36:00,*Sam,,Adoption,Neutered Male,30.7024355,-97.70225367,112.3785714
1126,1 year,A728069,Dog,Pit Bull Mix,Blue/White,3/30/2015,4/15/2016 17:41,2016-04-15T17:41:00,*Carter,,Adoption,Neutered Male,30.73975883,-97.42212557,54.67668651
1127,3 months,A674292,Cat,Domestic Longhair Mix,Calico,10/12/2017,1/13/2018 18:16,2018-01-13T18:16:00,*Rosie,,Adoption,Spayed Female,30.64803084,-97.63689911,13.39444444
1128,10 months,A717892,Dog,Labrador Retriever,Black/White,9/27/2015,8/1/2016 19:14,2016-08-01T19:14:00,,,Adoption,Neutered Male,30.69050125,-97.34020735,44.25734127
1129,6 months,A711096,Dog,Maltese Mix,White,1/17/2016,8/8/2016 12:58,2016-08-08T12:58:00,Tijeras,,Return to Owner,Neutered Male,30.42975411,-97.52953413,29.22003968
1130,3 months,A711247,Dog,German Shepherd Mix,Black/White,2/3/2016,6/3/2016 17:04,2016-06-03T17:04:00,*Chase,,Adoption,Neutered Male,30.30251627,-97.73557947,17.38730159
1131,1 year,A667968,Dog,Pit Bull Mix,Red,3/10/2013,3/12/2014 17:31,2014-03-12T17:31:00,Dallas,,Return to Owner,Neutered Male,30.61316638,-97.62319725,52.5328373
1132,6 years,A666544,Dog,Chihuahua Shorthair Mix,Black/Brown,12/22/2009,12/22/2015 17:38,2015-12-22T17:38:00,Paco,,Adoption,Neutered Male,30.35126105,-97.28573945,313.1049603
1133,4 years,A688032,Dog,American Staffordshire Terrier Mix,Blue/White,9/1/2013,9/3/2017 17:49,2017-09-03T17:49:00,Schatzi,,Adoption,Spayed Female,30.73412143,-97.24522671,209.1060516
1134,2 years,A733316,Cat,Domestic Shorthair Mix,Tortie,9/4/2013,9/5/2015 9:00,2015-09-05T09:00:00,,SCRP,Transfer,Intact Female,30.66097964,-97.63911577,104.4821429
1135,3 years,A701154,Cat,Domestic Shorthair Mix,Orange Tabby/White,11/25/2010,12/18/2013 13:17,2013-12-18T13:17:00,*Tabo,,Adoption,Neutered Male,30.32438747,-97.62559674,159.9362103
1136,6 months,A661599,Dog,Chihuahua Shorthair Dachshund,Red Merle/White,5/6/2013,11/9/2013 13:21,2013-11-09T13:21:00,,,Adoption,Spayed Female,30.68893859,-97.30018521,26.79375
1137,1 year,A633943,Dog,Border Collie Mix,White/Brown,9/13/2013,9/28/2014 16:25,2014-09-28T16:25:00,Denali,,Adoption,Neutered Male,30.71681402,-97.73920623,54.38343254
1138,1 year,A696989,Dog,Pit Bull Mix,Red/White,8/20/2015,12/22/2016 16:58,2016-12-22T16:58:00,*Mitchell,Partner,Transfer,Neutered Male,30.69442048,-97.26038067,70.10099206
1139,2 months,A705768,Dog,Dachshund Manchester Terrier,Brown/White,4/20/2015,6/28/2015 17:41,2015-06-28T17:41:00,Chester,,Adoption,Neutered Male,30.71672372,-97.54367491,9.962400794
1140,14 years,A762023,Dog,Miniature Pinscher Mix,Black,8/22/2000,9/28/2014 17:39,2014-09-28T17:39:00,Toby,,Return to Owner,Neutered Male,30.4464501,-97.52534904,735.8193452
1141,4 years,A713544,Dog,Miniature Pinscher Mix,Brown,8/3/2009,2/7/2014 18:28,2014-02-07T18:28:00,Chalky,,Adoption,Neutered Male,30.3721862,-97.69474174,235.6813492
1142,5 years,A691739,Dog,Labrador Retriever Pit Bull,Red/Black,2/16/2010,2/27/2015 13:01,2015-02-27T13:01:00,Toby,,Return to Owner,Neutered Male,30.39572101,-97.25543368,262.5060516
1143,3 years,A733848,Cat,Domestic Shorthair Mix,Tortie,6/21/2012,6/22/2015 9:00,2015-06-22T09:00:00,,SCRP,Transfer,Intact Female,30.29859568,-97.57650308,156.625
1144,3 months,A666518,Cat,Domestic Shorthair Mix,Black/White,9/13/2017,12/21/2017 13:27,2017-12-21T13:27:00,*Uno Momento,Partner,Transfer,Neutered Male,30.61671212,-97.38911121,14.22291667
1145,1 year,A724479,Dog,Pit Bull Mix,Black/White,4/8/2014,10/18/2015 15:03,2015-10-18T15:03:00,*Libby,,Adoption,Spayed Female,30.75042662,-97.3592176,79.80386905
1146,6 months,A664707,Cat,Domestic Shorthair Mix,Orange Tabby/White,5/9/2014,11/10/2014 18:49,2014-11-10T18:49:00,Oliver,,Adoption,Neutered Male,30.35916573,-97.2856359,26.5405754
1147,7 months,A719031,Dog,Labrador Retriever Mix,Chocolate,1/28/2016,8/28/2016 17:57,2016-08-28T17:57:00,Zeus,,Return to Owner,Intact Male,30.32497425,-97.28844045,30.53541667
1148,3 months,A692521,Dog,American Pit Bull Terrier Mix,Brown/White,8/2/2013,11/7/2013 12:53,2013-11-07T12:53:00,,Partner,Transfer,Spayed Female,30.62997889,-97.37493558,13.93382937
1149,3 years,A631963,Dog,Chihuahua Shorthair Mix,Tan/White,4/18/2013,4/19/2016 18:53,2016-04-19T18:53:00,Rocky,,Return to Owner,Intact Male,30.31945772,-97.46457222,156.8266865
1150,8 months,A753227,Dog,Border Collie Mix,Black/White,2/7/2013,10/17/2013 17:45,2013-10-17T17:45:00,Stevie,,Adoption,Spayed Female,30.4613568,-97.54763987,36.10565476
1151,6 months,A710007,Dog,Miniature Schnauzer Miniature Poodle,Gray/Tan,7/11/2015,1/18/2016 17:30,2016-01-18T17:30:00,Rufus,,Adoption,Neutered Male,30.49393891,-97.47977022,27.38988095
1152,2 years,A709299,Dog,Pit Bull Mix,Fawn/White,11/21/2013,12/14/2015 9:04,2015-12-14T09:04:00,Coby,,Adoption,Neutered Male,30.3792584,-97.38579926,107.6253968
1153,10 years,A734248,Dog,Patterdale Terr Mix,Brown/Tan,7/10/2004,11/23/2014 16:19,2014-11-23T16:19:00,Ragzee,,Return to Owner,Spayed Female,30.59194326,-97.29327237,541.2399802
1154,5 years,A692960,Dog,Pekingese,Buff/White,7/3/2012,7/3/2017 15:05,2017-07-03T15:05:00,,Partner,Transfer,Intact Female,30.62668863,-97.70051123,260.9469246
1155,1 year,A720820,Cat,Domestic Shorthair Mix,Black,8/15/2014,8/16/2015 9:00,2015-08-16T09:00:00,,SCRP,Transfer,Intact Male,30.37311241,-97.47358367,52.33928571
1156,1 month,A671704,Cat,Domestic Shorthair Mix,Black,6/30/2015,8/11/2015 0:00,2015-08-11T00:00:00,*Jon,Partner,Transfer,Intact Male,30.37553471,-97.56079569,6
1157,5 months,A669082,Other,Rabbit Sh Mix,White/Black,7/3/2016,12/11/2016 17:37,2016-12-11T17:37:00,*Cappucino,,Adoption,Spayed Female,30.64513268,-97.66920929,23.10486111
1158,2 months,A743183,Dog,Chihuahua Shorthair Mix,Cream/White,9/14/2014,11/29/2014 14:54,2014-11-29T14:54:00,,Partner,Transfer,Intact Female,30.27952539,-97.29438588,10.94583333
1159,1 year,A716199,Cat,Domestic Shorthair Mix,Brown Tabby,2/15/2015,2/22/2016 15:56,2016-02-22T15:56:00,,SCRP,Transfer,Intact Female,30.62410948,-97.44820519,53.23769841
1160,3 years,A759642,Dog,Pit Bull Boxer,Black/White,1/29/2012,5/27/2015 17:55,2015-05-27T17:55:00,Chloe,,Return to Owner,Spayed Female,30.57576428,-97.3811356,173.5352183
1161,4 years,A688064,Dog,Boxer,Brown/Black,12/14/2009,1/15/2014 15:39,2014-01-15T15:39:00,*Hayes,,Adoption,Neutered Male,30.47257385,-97.40653536,213.378869
1162,5 months,A762194,Dog,Soft Coated Wheaten Terrier Mix,Sable/Cream,9/5/2016,2/6/2017 11:51,2017-02-06T11:51:00,Rocko,,Return to Owner,Intact Male,30.42810591,-97.26961563,22.07053571
1163,1 year,A720529,Cat,Domestic Shorthair Mix,Black,9/24/2015,12/31/2016 9:46,2016-12-31T09:46:00,Kingston,Foster,Adoption,Neutered Male,30.3112941,-97.68324478,66.34384921
1164,1 week,A721414,Cat,American Shorthair Mix,Brown Tabby/White,9/28/2017,10/5/2017 0:00,2017-10-05T00:00:00,,Partner,Transfer,Unknown,30.34744979,-97.27480538,1
1165,7 months,A708455,Dog,Catahoula Mix,Chocolate/White,1/30/2014,9/14/2014 15:55,2014-09-14T15:55:00,Blue,,Return to Owner,Intact Male,30.48990248,-97.26697764,32.52331349
1166,7 years,A751404,Dog,Chihuahua Shorthair Mix,Brown,11/16/2010,11/16/2017 12:47,2017-11-16T12:47:00,Rajito,,Return to Owner,Neutered Male,30.60255066,-97.36337412,365.3618056
1167,1 year,A693173,Dog,Great Pyrenees Mix,Cream/White,4/1/2015,6/10/2016 17:27,2016-06-10T17:27:00,Estrella,Partner,Transfer,Spayed Female,30.72573474,-97.57530483,62.38958333
1168,9 years,A763987,Dog,Shih Tzu Mix,Gray,2/26/2007,3/1/2016 14:41,2016-03-01T14:41:00,,Partner,Transfer,Spayed Female,30.32780603,-97.65486506,470.2302579
1169,3 years,A675864,Other,Opossum Mix,Gray/Pink,7/28/2012,7/29/2015 12:11,2015-07-29T12:11:00,,Suffering,Euthanasia,Unknown,30.32967832,-97.24598014,156.6439484
1170,3 months,A674915,Cat,Domestic Shorthair Mix,Blue Tabby/White,3/7/2017,6/23/2017 17:09,2017-06-23T17:09:00,*Gabriella,,Adoption,Spayed Female,30.54899647,-97.26914986,15.53065476
1171,3 months,A703624,Cat,Domestic Shorthair Mix,Brown Tabby/White,9/18/2014,12/28/2014 16:38,2014-12-28T16:38:00,Yuki,,Adoption,Spayed Female,30.4848351,-97.56153228,14.52757937
1172,11 months,A756049,Dog,Siberian Husky,White/Brown,1/19/2017,1/4/2018 18:55,2018-01-04T18:55:00,Jack,,Return to Owner,Neutered Male,30.34274843,-97.2925359,50.11259921
1173,2 months,A748850,Cat,Domestic Shorthair Mix,Black,2/24/2014,5/5/2014 15:13,2014-05-05T15:13:00,Tormund,Partner,Transfer,Neutered Male,30.44997261,-97.2821928,10.0905754
1174,2 years,A683772,Cat,Domestic Shorthair Mix,Brown Tabby/White,3/20/2012,3/20/2014 16:32,2014-03-20T16:32:00,,SCRP,Transfer,Intact Female,30.36965957,-97.33061791,104.384127
1175,2 years,A683732,Dog,Pit Bull Mix,White/Brown,5/27/2013,4/12/2016 18:55,2016-04-12T18:55:00,Rex,,Return to Owner,Neutered Male,30.35823718,-97.62673772,150.2554563
1176,2 months,A746727,Cat,American Shorthair Mix,Black/White,7/13/2017,9/16/2017 14:51,2017-09-16T14:51:00,*Mochi,Offsite,Adoption,Spayed Female,30.63317236,-97.45561049,9.374107143
1177,2 years,A704775,Dog,Chihuahua Shorthair Mix,Brown/White,5/7/2015,5/8/2017 11:56,2017-05-08T11:56:00,Friend,,Return to Owner,Intact Male,30.31748263,-97.41919967,104.6424603
1178,1 month,A685162,Cat,Domestic Shorthair Mix,Blue,5/24/2014,7/24/2014 20:03,2014-07-24T20:03:00,Vesper,,Adoption,Spayed Female,30.67684199,-97.42602781,8.833630952
1179,4 weeks,A739084,Cat,Domestic Shorthair Mix,Blue,6/23/2014,7/25/2014 16:48,2014-07-25T16:48:00,,Partner,Transfer,Intact Male,30.4500563,-97.31296492,4.671428571
1180,1 year,A745133,Bird,Parakeet,Blue/Black,4/8/2016,4/12/2017 14:20,2017-04-12T14:20:00,,,Adoption,Unknown,30.41089405,-97.42994428,52.79960317
1181,3 years,A707771,Cat,Domestic Shorthair Mix,Black/White,6/9/2012,6/9/2015 9:48,2015-06-09T09:48:00,,Suffering,Euthanasia,Intact Male,30.64516349,-97.36804844,156.4869048
1182,2 weeks,A683713,Cat,Domestic Shorthair Mix,White/Black,7/27/2014,8/10/2014 16:35,2014-08-10T16:35:00,*Maple,Partner,Transfer,Unknown,30.2862903,-97.73228434,2.098710317
1183,3 years,A678616,Dog,German Shepherd Mix,Sable,11/27/2013,1/24/2017 19:16,2017-01-24T19:16:00,*Franklin,Partner,Transfer,Neutered Male,30.71850842,-97.69688212,164.9718254
1184,1 year,A725523,Dog,Chihuahua Shorthair Mix,Tan,3/13/2016,3/24/2017 12:02,2017-03-24T12:02:00,*Magic,Partner,Transfer,Neutered Male,30.73886105,-97.59445353,53.7859127
1185,2 years,A713092,Dog,English Bulldog Mix,White,7/17/2013,7/21/2015 17:57,2015-07-21T17:57:00,,,Adoption,Spayed Female,30.65660395,-97.42442342,104.9639881
1186,2 years,A700479,Cat,Domestic Shorthair Mix,Blue/White,7/14/2012,7/25/2014 15:48,2014-07-25T15:48:00,Harvey,,Return to Owner,Neutered Male,30.364224,-97.28705218,105.9511905
1187,2 years,A669293,Dog,Miniature Schnauzer Mix,Black,5/10/2012,5/17/2014 11:20,2014-05-17T11:20:00,Chavez,,Return to Owner,Neutered Male,30.32552955,-97.59921356,105.3531746
1188,1 year,A674318,Cat,Domestic Shorthair Mix,Black,4/30/2015,7/4/2016 11:39,2016-07-04T11:39:00,*Liza,,Adoption,Spayed Female,30.30434873,-97.42430272,61.64077381
1189,1 year,A710979,Dog,Great Pyrenees Mix,White,10/2/2014,10/2/2015 14:42,2015-10-02T14:42:00,Justice,,Return to Owner,Intact Male,30.40686297,-97.34419348,52.23035714
1190,1 month,A756473,Dog,Labrador Retriever,Brown/White,3/3/2015,5/3/2015 19:41,2015-05-03T19:41:00,Quinn,Offsite,Adoption,Spayed Female,30.29411633,-97.67601758,8.831448413
1191,4 years,A739400,Dog,Newfoundland Labrador Retriever,Black/Brown,12/18/2009,12/23/2013 16:49,2013-12-23T16:49:00,*Mini Mouse,,Adoption,Spayed Female,30.6825073,-97.70543171,209.5286706
1192,7 years,A725712,Dog,Dachshund Mix,Brown,3/11/2007,3/15/2014 19:06,2014-03-15T19:06:00,,Partner,Transfer,Neutered Male,30.69448149,-97.2873613,365.9708333
1193,4 months,A742470,Cat,Domestic Shorthair Mix,Brown Tabby,5/1/2015,9/1/2015 9:00,2015-09-01T09:00:00,,SCRP,Transfer,Intact Male,30.7647895,-97.71132696,17.625
1194,1 month,A705883,Dog,Labrador Retriever Doberman Pinsch,Tan,6/28/2017,8/24/2017 18:54,2017-08-24T18:54:00,,,Adoption,Spayed Female,30.71246927,-97.53664467,8.255357143
1195,1 year,A699354,Dog,Chihuahua Shorthair Mix,Tan/Black,12/2/2015,12/6/2016 17:15,2016-12-06T17:15:00,,,Adoption,Spayed Female,30.42888285,-97.69831911,52.95982143
1196,3 years,A730620,Dog,Pit Bull Mix,Tan/White,5/2/2013,8/8/2016 18:29,2016-08-08T18:29:00,Jax (Obi),,Adoption,Neutered Male,30.47596398,-97.37729196,170.6814484
1197,1 year,A721048,Dog,Labrador Retriever Mix,Black,1/22/2016,1/22/2017 15:59,2017-01-22T15:59:00,Saydi,,Return to Owner,Spayed Female,30.30180857,-97.47588017,52.38085317
1198,2 months,A563400,Cat,Domestic Shorthair Mix,Blue,4/22/2015,6/24/2015 12:52,2015-06-24T12:52:00,,In Surgery,Died,Neutered Male,30.39448927,-97.3897709,9.076587302
1199,2 months,A695917,Dog,Australian Shepherd Mix,Tricolor,1/26/2015,3/30/2015 17:16,2015-03-30T17:16:00,Nica,,Adoption,Spayed Female,30.35419139,-97.37599288,9.102777778
1200,4 months,A707629,Cat,Domestic Shorthair Mix,Calico,5/18/2016,9/24/2016 16:01,2016-09-24T16:01:00,*Lorna,Partner,Transfer,Spayed Female,30.66644724,-97.46008887,18.52390873
1201,3 years,A733070,Dog,Catahoula Mix,Blue Merle/White,2/20/2013,4/13/2016 16:57,2016-04-13T16:57:00,*Henry,,Adoption,Neutered Male,30.68414839,-97.24626161,164.1008929
1202,5 years,A716060,Cat,Domestic Shorthair Mix,Orange Tabby,9/22/2008,2/26/2014 18:52,2014-02-26T18:52:00,Heater,,Return to Owner,Neutered Male,30.40364493,-97.68919459,283.3980159
1203,2 months,A688599,Dog,Chihuahua Shorthair Dachshund,Black/White,11/30/2014,1/31/2015 11:36,2015-01-31T11:36:00,Indiana,,Adoption,Spayed Female,30.75335084,-97.62298629,8.926190476
1204,2 months,A673750,Dog,Labrador Retriever Mix,Black/White,4/30/2015,7/24/2015 18:01,2015-07-24T18:01:00,Zeus,,Adoption,Neutered Male,30.36220043,-97.58015871,12.25009921
1205,1 year,A658628,Other,Bat Mix,Brown,8/16/2015,8/17/2016 8:09,2016-08-17T08:09:00,,Rabies Risk,Euthanasia,Unknown,30.73074219,-97.42561202,52.47708333
1206,2 years,A729012,Dog,American Eskimo Mix,Cream,11/13/2013,11/19/2015 16:07,2015-11-19T16:07:00,*Sprite,,Adoption,Neutered Male,30.37252134,-97.26332869,105.2387897
1207,3 weeks,A708567,Cat,Domestic Shorthair Mix,Tortie,8/30/2014,9/21/2014 13:21,2014-09-21T13:21:00,,Partner,Transfer,Intact Female,30.28095545,-97.30651955,3.222321429
1208,4 weeks,A607074,Other,Bat,Brown/Black,2/1/2014,3/1/2014 17:25,2014-03-01T17:25:00,,Rabies Risk,Euthanasia,Unknown,30.70327831,-97.49862843,4.103670635
1209,6 years,A690493,Dog,Labrador Retriever Smooth Fox Terrier,Brown/White,7/12/2010,4/28/2017 16:26,2017-04-28T16:26:00,Oso,,Adoption,Neutered Male,30.45035939,-97.2672867,354.669246
1210,2 months,A664336,Cat,Domestic Shorthair Mix,Blue,4/12/2016,6/29/2016 16:03,2016-06-29T16:03:00,,,Adoption,Neutered Male,30.44365304,-97.30581666,11.23839286
1211,4 weeks,A719782,Cat,Domestic Shorthair Mix,Black/White,6/30/2015,8/2/2015 13:22,2015-08-02T13:22:00,*Jack,Partner,Transfer,Intact Male,30.4906349,-97.42015505,4.793849206
1212,2 years,A618657,Dog,Pointer Pit Bull,White/Brown,5/23/2011,10/27/2013 9:27,2013-10-27T09:27:00,Nala,Aggressive,Euthanasia,Spayed Female,30.36870654,-97.56269358,126.9133929
1213,2 years,A696205,Dog,Chihuahua Shorthair Mix,Yellow/White,10/21/2012,10/26/2014 13:00,2014-10-26T13:00:00,,Partner,Transfer,Spayed Female,30.73003692,-97.70158444,105.077381
1214,2 months,A734710,Cat,Domestic Shorthair Mix,Calico,7/17/2013,10/8/2013 18:44,2013-10-08T18:44:00,,,Adoption,Spayed Female,30.47752708,-97.6797882,11.96865079
1215,2 months,A720243,Dog,Border Collie,Chocolate/White,11/14/2015,1/29/2016 16:50,2016-01-29T16:50:00,Max,,Adoption,Neutered Male,30.6362251,-97.73879522,10.95734127
1216,6 years,A742314,Dog,Pit Bull Mix,Tan/White,1/17/2008,12/20/2014 19:00,2014-12-20T19:00:00,Rodney,,Adoption,Neutered Male,30.60775877,-97.3206238,361.3988095
1217,2 years,A750047,Cat,Domestic Shorthair Mix,Black,1/31/2013,2/11/2015 17:05,2015-02-11T17:05:00,Roo,,Adoption,Spayed Female,30.69177856,-97.70824061,105.9588294
1218,3 years,A761611,Bird,Chicken Mix,Gray/Tan,9/11/2013,9/11/2016 14:29,2016-09-11T14:29:00,Tammy Wynett,Suffering,Euthanasia,Intact Female,30.34955017,-97.41460548,156.6576389
1219,2 years,A685989,Dog,Pit Bull Mix,Brown Brindle/White,2/5/2014,5/17/2016 19:28,2016-05-17T19:28:00,Bobe,,Adoption,Neutered Male,30.48593961,-97.72560037,118.9730159
1220,1 year,A759537,Dog,Labrador Retriever Beagle,Black,11/19/2015,1/22/2017 15:39,2017-01-22T15:39:00,Bearry,,Adoption,Neutered Male,30.3556032,-97.61210139,61.52172619
1221,2 months,A753015,Cat,Domestic Shorthair Mix,Orange Tabby,5/2/2017,7/18/2017 13:58,2017-07-18T13:58:00,*Tostada,Foster,Adoption,Neutered Male,30.59439871,-97.29968683,11.08313492
1222,5 years,A674348,Cat,Domestic Shorthair Mix,Brown Tabby,11/7/2012,11/11/2017 13:23,2017-11-11T13:23:00,,Snr,Transfer,Intact Female,30.73858091,-97.31919194,261.5082341
1223,2 months,A744141,Cat,Domestic Shorthair Mix,Black,6/19/2014,9/8/2014 19:42,2014-09-08T19:42:00,,,Adoption,Spayed Female,30.55650349,-97.6956237,11.68869048
1224,6 years,A613961,Cat,Domestic Shorthair Mix,Brown Tabby/White,10/3/2011,10/4/2017 14:48,2017-10-04T14:48:00,,,Return to Owner,Neutered Male,30.60496937,-97.26260555,313.3738095
1225,8 months,A690521,Cat,Domestic Shorthair Mix,White/Black,10/30/2016,7/4/2017 10:57,2017-07-04T10:57:00,,Snr,Transfer,Intact Male,30.72045266,-97.30804709,35.35089286
1226,6 months,A700379,Cat,Domestic Shorthair Mix,Calico,9/11/2013,3/13/2014 14:21,2014-03-13T14:21:00,,SCRP,Transfer,Intact Female,30.52372499,-97.24854739,26.22827381
1227,2 years,A753517,Dog,Great Dane Labrador Retriever,Black/White,2/23/2015,2/26/2017 14:55,2017-02-26T14:55:00,*Timber,,Adoption,Neutered Male,30.48308638,-97.2896876,104.9459325
1228,5 years,A680989,Dog,Miniature Poodle,White,7/15/2011,8/11/2016 15:50,2016-08-11T15:50:00,Rufus,,Adoption,Neutered Male,30.37169643,-97.73474712,264.9513889
1229,6 months,A722362,Other,Bat Mix,Brown,4/21/2014,10/21/2014 19:01,2014-10-21T19:01:00,,,Euthanasia,Unknown,30.73954459,-97.34519057,26.25605159
1230,5 months,A704072,Other,Bat,Brown,10/12/2014,4/12/2015 18:36,2015-04-12T18:36:00,,Rabies Risk,Euthanasia,Unknown,30.35785465,-97.31571059,26.11071429
1231,2 years,A684898,Dog,Chihuahua Shorthair Mix,Tan,7/7/2015,7/8/2017 12:42,2017-07-08T12:42:00,Kiwi,,Return to Owner,Intact Female,30.5965618,-97.37147902,104.6470238
1232,1 year,A710467,Dog,Chihuahua Shorthair Mix,Brown/Tan,6/11/2013,7/16/2014 8:19,2014-07-16T08:19:00,Ginger,Foster,Adoption,Intact Female,30.51229267,-97.39185635,57.19236111
1233,7 months,A684622,Dog,German Shepherd Labrador Retriever,Tan/White,8/25/2015,3/25/2016 12:11,2016-03-25T12:11:00,Brisket,,Return to Owner,Intact Male,30.52883188,-97.64076473,30.50109127
1234,3 weeks,A734079,Cat,Domestic Shorthair Mix,Blue/White,5/8/2015,6/1/2015 13:46,2015-06-01T13:46:00,,Partner,Transfer,Intact Male,30.30398624,-97.56466867,3.510515873
1235,1 year,A692246,Cat,Domestic Shorthair Mix,Blue Tabby,7/30/2013,8/6/2014 13:18,2014-08-06T13:18:00,*Izy,,Adoption,Spayed Female,30.76645832,-97.48261062,53.22202381
1236,2 weeks,A675303,Cat,Domestic Shorthair Mix,Tortie,8/8/2015,8/23/2015 15:20,2015-08-23T15:20:00,,Partner,Transfer,Unknown,30.7136279,-97.67141606,2.234126984
1237,3 weeks,A704754,Cat,Domestic Shorthair Mix,Black,7/4/2014,7/26/2014 14:10,2014-07-26T14:10:00,,Partner,Transfer,Intact Male,30.47330024,-97.50470243,3.22718254
1238,6 months,A705391,Cat,Maine Coon Mix,Brown Tabby,3/1/2016,9/11/2016 17:02,2016-09-11T17:02:00,Sassy,,Adoption,Spayed Female,30.57571459,-97.29067188,27.8156746
1239,4 months,A711823,Cat,Domestic Shorthair Mix,Black,8/2/2014,12/4/2014 12:25,2014-12-04T12:25:00,Alexis,Partner,Transfer,Spayed Female,30.70422524,-97.37564469,17.78819444
1240,7 months,A681547,Dog,Pit Bull Mix,Blue,8/26/2013,4/1/2014 12:27,2014-04-01T12:27:00,,,Adoption,Neutered Male,30.47584909,-97.27688225,31.21696429
1241,2 months,A741464,Cat,Domestic Shorthair Mix,Black,5/1/2015,7/18/2015 15:37,2015-07-18T15:37:00,Arthur,Foster,Adoption,Neutered Male,30.60840604,-97.68021833,11.23581349
1242,8 years,A708396,Dog,Cocker Spaniel Mix,Black/White,6/19/2007,6/28/2015 13:41,2015-06-28T13:41:00,,,Adoption,Neutered Male,30.47409318,-97.70825648,418.7957341
1243,3 months,A757230,Cat,Domestic Shorthair Mix,Orange Tabby,8/8/2015,11/10/2015 14:18,2015-11-10T14:18:00,*Beau,Foster,Adoption,Neutered Male,30.54285879,-97.26094287,13.51369048
1244,8 years,A681181,Dog,Brittany Mix,White/Red,6/18/2006,6/18/2014 14:49,2014-06-18T14:49:00,Roscoe,,Return to Owner,Intact Male,30.35931481,-97.26269286,417.5167659
1245,2 months,A739187,Cat,Domestic Shorthair Mix,Brown Tabby,11/2/2016,1/7/2017 18:10,2017-01-07T18:10:00,,,Adoption,Spayed Female,30.49576078,-97.32928734,9.536706349
1246,1 year,A698462,Dog,Pit Bull Mix,Black/White,7/27/2014,8/9/2015 12:42,2015-08-09T12:42:00,Camshaft,,Adoption,Intact Female,30.35868839,-97.43660315,54.07559524
1247,2 months,A674381,Dog,Beagle Mix,Brown/White,6/19/2017,9/4/2017 17:03,2017-09-04T17:03:00,,,Adoption,Neutered Male,30.3708664,-97.44928109,11.1014881
1248,5 years,A711392,Dog,Pit Bull Mix,Brown,6/13/2009,6/24/2014 17:39,2014-06-24T17:39:00,Lucky,,Return to Owner,Neutered Male,30.58696334,-97.43507408,262.533631
1249,1 year,A734223,Dog,Miniature Poodle Mix,White,11/29/2015,12/4/2016 18:31,2016-12-04T18:31:00,,,Adoption,Neutered Male,30.63348966,-97.46929795,53.11021825
1250,7 years,A686256,Dog,Labrador Retriever Mix,Yellow/White,3/12/2008,3/15/2015 17:52,2015-03-15T17:52:00,Rex,,Return to Owner,Intact Male,30.61974687,-97.60275144,365.6777778
1251,2 years,A758896,Dog,German Shepherd Pit Bull,Brown,3/12/2012,3/14/2014 18:40,2014-03-14T18:40:00,Ruilo,,Return to Owner,Neutered Male,30.66879636,-97.70985017,104.6825397
1252,2 months,A681280,Dog,English Foxhound,Buff,7/6/2015,9/8/2015 15:31,2015-09-08T15:31:00,*Molly,Partner,Transfer,Intact Female,30.41987002,-97.38595017,9.235218254
1253,5 months,A671210,Other,Rabbit Sh Mix,Black,7/3/2016,12/11/2016 17:37,2016-12-11T17:37:00,*Espresso,,Adoption,Spayed Female,30.65206245,-97.33853225,23.10486111
1254,3 years,A675064,Dog,German Shepherd Mix,Sable,8/19/2011,9/5/2014 17:20,2014-09-05T17:20:00,*Oscar,,Adoption,Neutered Male,30.76272147,-97.32155314,159.1031746
1255,2 months,A703505,Dog,Labrador Retriever Mix,Brown/White,7/23/2017,9/29/2017 4:25,2017-09-29T04:25:00,Pumpkin,,Adoption,Neutered Male,30.51247952,-97.32441192,9.740575397
1256,1 year,A704004,Other,Bat,Orange,6/14/2013,6/14/2014 15:00,2014-06-14T15:00:00,,Rabies Risk,Euthanasia,Unknown,30.40988278,-97.54479708,52.23214286
1257,4 months,A689919,Other,Skunk Mix,Black/White,9/21/2013,1/21/2014 10:18,2014-01-21T10:18:00,,Rabies Risk,Euthanasia,Unknown,30.74067424,-97.27462514,17.48988095
1258,2 years,A751603,Dog,Pit Bull Mix,Tan/White,3/22/2012,8/2/2014 14:39,2014-08-02T14:39:00,*Zoe,Partner,Transfer,Spayed Female,30.6453934,-97.6661263,123.3729167
1259,2 years,A699447,Cat,Domestic Shorthair Mix,Brown Tabby,5/25/2013,5/25/2015 15:26,2015-05-25T15:26:00,,Suffering,Euthanasia,Intact Male,30.37129184,-97.39365133,104.3775794
1260,9 years,A752602,Dog,Anatol Shepherd Mix,White/Tan,6/6/2006,6/6/2015 13:17,2015-06-06T13:17:00,Jack,,Return to Owner,Neutered Male,30.43468495,-97.64311463,469.650496
1261,1 year,A635818,Cat,Domestic Shorthair Mix,Black,10/11/2013,10/12/2014 9:00,2014-10-12T09:00:00,,SCRP,Transfer,Unknown,30.38476772,-97.374915,52.33928571
1262,1 month,A750378,Cat,Snowshoe Mix,Lilac Point/White,4/25/2017,6/25/2017 15:50,2017-06-25T15:50:00,,Partner,Transfer,Intact Female,30.73386158,-97.51728568,8.808531746
1263,5 months,A737824,Other,Bat Mix,Gray,9/27/2014,3/27/2015 0:00,2015-03-27T00:00:00,,,Died,Unknown,30.51262498,-97.45881539,25.85714286
1264,1 year,A730477,Dog,Yorkshire Terrier Mix,White,6/24/2016,6/26/2017 17:42,2017-06-26T17:42:00,Chavito,,Return to Owner,Intact Male,30.34884088,-97.33443727,52.53392857
1265,4 years,A738936,Dog,Dachshund Mix,Black/Tan,8/28/2009,3/4/2014 13:36,2014-03-04T13:36:00,Oscar,,Return to Owner,Neutered Male,30.67963256,-97.57388694,235.652381
1266,2 years,A697131,Other,Lionhead Mix,Gray/Black,5/26/2015,6/29/2017 11:58,2017-06-29T11:58:00,*Anise,,Adoption,Spayed Female,30.55675814,-97.36478182,109.3569444
1267,1 year,A736910,Other,Snake Mix,Brown/Black,11/5/2015,11/11/2016 18:35,2016-11-11T18:35:00,Kaa,,Return to Owner,Unknown,30.47182178,-97.41840703,53.25347222
1268,5 years,A747433,Dog,Labrador Retriever Labrador Retriever,Brown,7/5/2011,7/20/2016 17:59,2016-07-20T17:59:00,Justice,,Return to Owner,Neutered Male,30.53128297,-97.42417027,263.2499008
1269,1 year,A737258,Dog,Pit Bull Mix,White/Tan,11/23/2015,3/22/2017 15:26,2017-03-22T15:26:00,Isabella Eve,,Adoption,Spayed Female,30.44202538,-97.31551942,69.37757937
1270,8 years,A745760,Dog,Boxer,Tan,2/19/2007,4/28/2015 14:23,2015-04-28T14:23:00,Charlotte,,Adoption,Spayed Female,30.47262612,-97.28407235,427.2284722
1271,1 year,A707269,Cat,Domestic Shorthair Mix,Orange Tabby/White,10/19/2015,10/31/2016 0:00,2016-10-31T00:00:00,,Partner,Transfer,Spayed Female,30.31029187,-97.64969267,54
1272,5 months,A702737,Dog,Labrador Retriever Mix,Cream,11/4/2016,4/23/2017 18:34,2017-04-23T18:34:00,,,Adoption,Spayed Female,30.75442117,-97.59797084,24.39623016
1273,2 months,A693027,Dog,Labrador Retriever Mix,Black/White,8/24/2016,10/29/2016 14:13,2016-10-29T14:13:00,Maggie,,Adoption,Spayed Female,30.3015327,-97.54714192,9.513194444
1274,6 years,A687186,Dog,Dachshund Mix,Brown/White,3/23/2011,8/23/2017 18:42,2017-08-23T18:42:00,Spike,,Adoption,Neutered Male,30.60983181,-97.50830628,335.1113095
1275,5 years,A621534,Cat,Domestic Shorthair Mix,Brown Tabby,7/10/2010,7/10/2015 18:39,2015-07-10T18:39:00,,Suffering,Euthanasia,Unknown,30.48215169,-97.54204288,260.9681548
1276,4 weeks,A719873,Cat,Snowshoe Mix,Blue Point/White,4/17/2015,5/18/2015 16:39,2015-05-18T16:39:00,Baylee,Partner,Transfer,Intact Male,30.67620831,-97.68020189,4.527678571
1277,6 months,A690234,Cat,Domestic Shorthair Mix,Brown Tabby/White,5/30/2014,12/1/2014 9:00,2014-12-01T09:00:00,,SCRP,Transfer,Intact Female,30.41912478,-97.42469333,26.48214286
1278,6 months,A736652,Other,Bat Mix,Brown,3/1/2014,9/2/2014 10:11,2014-09-02T10:11:00,,,Disposal,Unknown,30.34977854,-97.28816643,26.48918651
1279,4 years,A693798,Dog,Staffordshire Mix,Blue/White,9/8/2010,12/4/2014 14:14,2014-12-04T14:14:00,Diamond,,Return to Owner,Spayed Female,30.66828903,-97.68370759,221.2275794
1280,2 months,A713460,Cat,Domestic Shorthair Mix,Blue/White,1/8/2016,4/2/2016 17:14,2016-04-02T17:14:00,,Foster,Adoption,Neutered Male,30.73328218,-97.40171931,12.24543651
1281,2 years,A751540,Dog,Chihuahua Shorthair Dachshund,Chocolate/Tan,11/17/2013,5/23/2016 17:30,2016-05-23T17:30:00,Hershey,,Return to Owner,Neutered Male,30.42497495,-97.36102292,131.2470238
1282,10 years,A755680,Cat,Domestic Shorthair Mix,Calico,10/14/2006,10/22/2016 17:00,2016-10-22T17:00:00,Little Bit,,Adoption,Spayed Female,30.4971849,-97.55931944,523.1011905
1283,1 month,A706894,Dog,Labrador Retriever Mix,Brown/White,12/13/2014,2/7/2015 19:08,2015-02-07T19:08:00,Jupiter,,Adoption,Neutered Male,30.37267572,-97.388246,8.113888889
1284,1 month,A714548,Dog,German Shepherd Mix,Black/Brown,8/23/2015,10/11/2015 14:56,2015-10-11T14:56:00,,Partner,Transfer,Intact Male,30.54111312,-97.56752894,7.088888889
1285,2 months,A574020,Cat,Domestic Medium Hair Mix,Black,4/9/2017,6/18/2017 14:55,2017-06-18T14:55:00,Dracula,,Adoption,Neutered Male,30.54303566,-97.34095504,10.08878968
1286,3 years,A686906,Other,Bat Mix,Brown,8/7/2014,8/7/2017 13:55,2017-08-07T13:55:00,,Rabies Risk,Euthanasia,Unknown,30.41868537,-97.28344545,156.6542659
1287,5 years,A749254,Dog,Chihuahua Shorthair Mix,Black/Tan,7/5/2010,7/10/2015 16:53,2015-07-10T16:53:00,Fargo,,Adoption,Spayed Female,30.66343563,-97.64761097,261.6719246
1288,1 year,A690021,Dog,Yorkshire Terrier Mix,Black/Red,8/25/2014,10/27/2015 18:12,2015-10-27T18:12:00,Willie,,Return to Owner,Intact Male,30.4731371,-97.72879289,61.25119048
1289,8 years,A719925,Dog,Smooth Fox Terrier Mix,Tricolor,5/19/2005,10/26/2013 17:27,2013-10-26T17:27:00,Petey,,Adoption,Neutered Male,30.29593017,-97.38495947,440.3895833
1290,6 months,A679445,Other,Rabbit Sh Mix,Black,2/28/2014,8/31/2014 11:40,2014-08-31T11:40:00,,Partner,Transfer,Unknown,30.75476502,-97.46447092,26.35515873
1291,5 months,A763898,Dog,Labrador Retriever Mix,Yellow,12/12/2016,5/16/2017 17:23,2017-05-16T17:23:00,Penny,,Adoption,Spayed Female,30.58735958,-97.39830063,22.24632937
1292,1 year,A688085,Cat,Domestic Shorthair,Blue/White,11/13/2013,2/24/2015 8:55,2015-02-24T08:55:00,Cody,Foster,Adoption,Neutered Male,30.40194244,-97.42902131,66.91021825
1293,1 year,A731155,Dog,Labrador Retriever Mix,Brown,1/30/2015,2/14/2016 14:11,2016-02-14T14:11:00,*Teacup,,Adoption,Spayed Female,30.33026826,-97.40875851,54.37013889
1294,2 weeks,A691973,Cat,Domestic Shorthair Mix,Calico,5/6/2014,5/21/2014 13:48,2014-05-21T13:48:00,,Partner,Transfer,Intact Female,30.3907503,-97.38622263,2.225
1295,3 years,A700443,Dog,Pit Bull Mix,White/Brown,4/29/2014,12/25/2017 12:12,2017-12-25T12:12:00,Cane,,Return to Owner,Neutered Male,30.32997083,-97.50569826,190.9297619
1296,10 years,A667113,Dog,Miniature Poodle Mix,White,9/14/2004,9/14/2014 16:06,2014-09-14T16:06:00,Gina,,Return to Owner,Spayed Female,30.33024861,-97.57294595,521.810119
1297,3 months,A703902,Cat,Domestic Shorthair Mix,Black/White,5/15/2016,9/7/2016 18:13,2016-09-07T18:13:00,*James,,Adoption,Neutered Male,30.55566589,-97.30761721,16.53700397
1298,2 months,A693985,Cat,Domestic Shorthair Mix,Gray Tabby/White,8/29/2014,11/17/2014 17:17,2014-11-17T17:17:00,*Gracie Lou,,Adoption,Spayed Female,30.51185288,-97.61292064,11.53144841
1299,2 days,A664265,Cat,Domestic Shorthair Mix,Black/White,4/11/2015,4/13/2015 19:07,2015-04-13T19:07:00,,Partner,Transfer,Intact Female,30.49746116,-97.5801601,0.399503968
1300,3 years,A500002,Cat,Domestic Shorthair Mix,Black/White,11/12/2010,11/14/2013 18:33,2013-11-14T18:33:00,Simon,,Return to Owner,Neutered Male,30.41229354,-97.60749338,156.9675595
1301,3 years,A660074,Dog,Miniature Schnauzer,Silver,5/30/2012,6/5/2015 12:29,2015-06-05T12:29:00,*Rufus,Partner,Transfer,Neutered Male,30.75929566,-97.64016853,157.3600198
1302,1 year,A690968,Dog,Basenji Jack Russell Terrier,White/Brown,12/18/2013,12/22/2014 16:54,2014-12-22T16:54:00,Max,,Adoption,Neutered Male,30.63408091,-97.34028676,52.81488095
1303,2 months,A731922,Cat,Domestic Shorthair Mix,Brown Tabby,7/17/2013,10/12/2013 18:20,2013-10-12T18:20:00,*Dixon,,Adoption,Neutered Male,30.57501292,-97.61790446,12.53769841
1304,7 years,A714186,Dog,Labrador Retriever Boxer,Black/White,6/16/2007,7/12/2014 15:10,2014-07-12T15:10:00,Bruce Lee,Aggressive,Euthanasia,Intact Male,30.31811968,-97.69677203,369.0902778
1305,1 year,A733209,Dog,American Bulldog Mix,White/Tan,2/5/2012,12/16/2013 14:28,2013-12-16T14:28:00,Hank,Partner,Transfer,Neutered Male,30.71709355,-97.26274994,97.22896825
1306,2 months,A724377,Cat,Himalayan Mix,Tortie Point,9/28/2014,12/12/2014 8:36,2014-12-12T08:36:00,*Eleanor,Foster,Adoption,Spayed Female,30.34396446,-97.58294916,10.76547619
1307,14 years,A743987,Dog,Toy Poodle Mix,Silver/Gray,7/29/2002,8/3/2016 15:35,2016-08-03T15:35:00,,Suffering,Euthanasia,Intact Female,30.54341044,-97.33096737,731.3784722
1308,4 months,A691935,Cat,Domestic Shorthair Mix,Orange Tabby,7/4/2015,11/16/2015 18:48,2015-11-16T18:48:00,Fergus,,Adoption,Neutered Male,30.32143377,-97.30635614,19.39761905
1309,1 month,A698832,Cat,Domestic Shorthair Mix,Orange Tabby,7/11/2016,8/19/2016 9:04,2016-08-19T09:04:00,,Partner,Transfer,Unknown,30.7586448,-97.31713413,5.625396825
1310,1 year,A568123,Cat,Domestic Shorthair Mix,Black,4/16/2015,5/9/2016 13:30,2016-05-09T13:30:00,*Flo,,Return to Owner,Spayed Female,30.31667019,-97.27950956,55.65178571
1311,12 years,A715897,Cat,Domestic Medium Hair Mix,Black/White,2/21/2005,2/23/2017 13:11,2017-02-23T13:11:00,Elvis,Partner,Transfer,Spayed Female,30.43425188,-97.38281031,626.5070437
1312,3 years,A708470,Dog,Pit Bull Mix,Brown/White,11/12/2011,12/9/2014 13:09,2014-12-09T13:09:00,Bruno,Partner,Transfer,Neutered Male,30.71987385,-97.68031024,160.5068452
1313,2 years,A711088,Dog,Labrador Retriever Mix,Brown,10/18/2012,3/25/2015 13:07,2015-03-25T13:07:00,Stella,,Return to Owner,Spayed Female,30.75322145,-97.53365798,126.9352183
1314,5 years,A746463,Dog,Chihuahua Shorthair Mix,Black/Tan,12/29/2009,8/26/2015 11:39,2015-08-26T11:39:00,Miley,,Return to Owner,Neutered Male,30.59420463,-97.57084378,295.2122024
1315,1 year,A713868,Cat,Domestic Shorthair Mix,Brown Tabby/White,5/12/2014,11/15/2015 18:50,2015-11-15T18:50:00,,SCRP,Transfer,Intact Male,30.52386107,-97.31624517,78.96924603
1316,2 months,A729378,Cat,Domestic Shorthair Mix,Orange Tabby,5/13/2015,8/1/2015 17:15,2015-08-01T17:15:00,Butter,,Adoption,Neutered Male,30.57494447,-97.40936016,11.53125
1317,3 weeks,A756985,Cat,Domestic Shorthair Mix,White/Black,8/10/2015,9/1/2015 18:43,2015-09-01T18:43:00,,Partner,Transfer,Intact Female,30.49609862,-97.57321968,3.254265873
1318,8 months,A662278,Dog,Basset Hound Mix,White/Tan,1/27/2017,10/7/2017 19:16,2017-10-07T19:16:00,Spots,,Adoption,Neutered Male,30.4265018,-97.63291226,36.25753968
1319,2 years,A736394,Cat,Domestic Shorthair Mix,Brown Tabby/White,10/14/2013,11/4/2015 10:36,2015-11-04T10:36:00,Miss,Partner,Transfer,Spayed Female,30.41376549,-97.71940581,107.3488095
1320,2 months,A710013,Cat,Domestic Shorthair Mix,Calico,5/17/2016,8/11/2016 11:25,2016-08-11T11:25:00,*Daisy,Foster,Adoption,Spayed Female,30.42476054,-97.37888678,12.35367063
1321,2 months,A741329,Cat,Domestic Shorthair Mix,Black,6/28/2017,9/1/2017 14:37,2017-09-01T14:37:00,*Delroy,Partner,Transfer,Intact Male,30.682264,-97.41810562,9.372718254
1322,3 months,A710957,Cat,Domestic Shorthair Mix,Black,8/1/2013,11/4/2013 18:35,2013-11-04T18:35:00,*Honeybear,Foster,Adoption,Spayed Female,30.35887242,-97.34076428,13.68204365
1323,2 years,A714375,Dog,Pit Bull Mix,Tan/White,10/10/2014,1/20/2017 15:31,2017-01-20T15:31:00,*Dozer,Foster,Adoption,Neutered Male,30.3632796,-97.38261536,119.0923611
1324,3 years,A663921,Cat,Domestic Shorthair Mix,White/Gray,8/16/2012,8/17/2015 9:00,2015-08-17T09:00:00,*Loverboy,SCRP,Transfer,Neutered Male,30.59655669,-97.51811117,156.625
1325,1 year,A660611,Dog,Bull Terrier,White/Black,12/31/2015,3/22/2017 13:42,2017-03-22T13:42:00,Spot,Partner,Transfer,Neutered Male,30.64781866,-97.64964909,63.93869048
1326,3 months,A672154,Cat,Domestic Shorthair Mix,Black,7/15/2015,10/26/2015 17:08,2015-10-26T17:08:00,Bruce,,Adoption,Neutered Male,30.3587338,-97.49679599,14.81626984
1327,2 months,A721823,Cat,Domestic Medium Hair Mix,Orange Tabby,9/22/2015,12/12/2015 18:03,2015-12-12T18:03:00,*Luke,Foster,Adoption,Neutered Male,30.47505113,-97.46994324,11.67886905
1328,1 year,A750076,Dog,Labrador Retriever German Shepherd,Black,9/26/2012,10/11/2013 12:01,2013-10-11T12:01:00,*Collins,Partner,Transfer,Spayed Female,30.54395384,-97.50144893,54.35724206
1329,3 years,A731468,Dog,Pit Bull Mix,Black/White,8/9/2010,10/9/2013 16:04,2013-10-09T16:04:00,*Cookie,,Adoption,Spayed Female,30.54654087,-97.40741873,165.3813492
1330,1 year,A753445,Other,Raccoon Mix,Black/Brown,2/5/2013,2/5/2014 11:45,2014-02-05T11:45:00,,Suffering,Euthanasia,Unknown,30.68857836,-97.46667518,52.21279762
1331,2 years,A682886,Dog,Labrador Retriever Mix,Black,3/5/2014,3/5/2016 11:43,2016-03-05T11:43:00,Charlie,,Return to Owner,Neutered Male,30.44152015,-97.28444987,104.4983135
1332,2 months,A710862,Cat,Domestic Shorthair Mix,White/Black,3/23/2017,5/27/2017 13:35,2017-05-27T13:35:00,,,Adoption,Intact Male,30.60656042,-97.44053626,9.36656746
1333,3 months,A690850,Cat,Domestic Shorthair Mix,Black,4/22/2016,8/13/2016 12:27,2016-08-13T12:27:00,*Geronimo,Partner,Transfer,Neutered Male,30.29769926,-97.30217312,16.21696429
1334,1 weeks,A704740,Cat,Domestic Shorthair Mix,Brown Tabby,6/26/2017,7/6/2017 15:40,2017-07-06T15:40:00,,Partner,Transfer,Intact Female,30.63263734,-97.47511364,1.521825397
1335,2 months,A700690,Dog,Labrador Retriever Pit Bull,Black/White,4/20/2014,7/8/2014 17:49,2014-07-08T17:49:00,Tyson,,Adoption,Neutered Male,30.65660476,-97.63237145,11.39176587
1336,1 year,A759424,Cat,Domestic Shorthair Mix,Brown Tabby,8/29/2014,9/1/2015 15:52,2015-09-01T15:52:00,Clyde,Partner,Transfer,Neutered Male,30.33784733,-97.70700026,52.66587302
1337,1 month,A754825,Dog,Irish Setter Pit Bull,Black,9/12/2014,10/27/2014 14:04,2014-10-27T14:04:00,Blackie,Partner,Transfer,Intact Male,30.45053694,-97.28365773,6.512301587
1338,2 years,A722914,Dog,Norfolk Terrier Mix,Tan,6/8/2013,7/24/2015 14:11,2015-07-24T14:11:00,Benji,,Return to Owner,Neutered Male,30.37180708,-97.5479845,110.9415675
1339,6 months,A713942,Dog,Labrador Retriever Great Dane,Black/White,10/18/2014,4/26/2015 12:17,2015-04-26T12:17:00,Lucy,,Adoption,Spayed Female,30.61162064,-97.51199533,27.21597222
1340,1 year,A732192,Dog,Labrador Retriever Mix,Black,10/1/2016,10/2/2017 16:25,2017-10-02T16:25:00,Charlie,Partner,Transfer,Intact Male,30.57346856,-97.34049929,52.38343254
1341,1 month,A667325,Cat,Domestic Shorthair Mix,Black,5/31/2017,7/31/2017 18:52,2017-07-31T18:52:00,Jon Snow,,Adoption,Intact Male,30.55500892,-97.35683279,8.826587302
1342,3 years,A731692,Cat,Domestic Shorthair Mix,Black,3/24/2013,3/25/2016 14:55,2016-03-25T14:55:00,Ninja,,Return to Owner,Neutered Male,30.58265341,-97.40142352,156.8030754
1343,2 weeks,A682147,Cat,Domestic Shorthair Mix,Black/White,9/30/2015,10/16/2015 16:11,2015-10-16T16:11:00,,Partner,Transfer,Intact Female,30.40270963,-97.46577643,2.382043651
1344,3 months,A704508,Cat,Domestic Shorthair Mix,Brown Tabby,7/9/2016,10/11/2016 9:11,2016-10-11T09:11:00,*Becky,Foster,Adoption,Spayed Female,30.3944159,-97.71117547,13.48323413
1345,2 months,A681769,Cat,Domestic Shorthair Mix,Black,9/5/2013,11/22/2013 17:16,2013-11-22T17:16:00,*Nikki,SCRP,Transfer,Intact Female,30.64004649,-97.60736088,11.24563492
1346,1 year,A683412,Dog,Staffordshire Mix,Black/White,7/26/2015,1/28/2017 16:36,2017-01-28T16:36:00,Maddie,,Adoption,Spayed Female,30.5633017,-97.46137527,78.95595238
1347,3 months,A724199,Dog,Pit Bull Mix,Black/White,3/24/2014,6/28/2014 17:07,2014-06-28T17:07:00,Lady,,Adoption,Spayed Female,30.29590026,-97.29023336,13.81617063
1348,2 years,A728401,Cat,Domestic Shorthair Mix,Blue,6/5/2013,6/6/2015 10:33,2015-06-06T10:33:00,,Suffering,Euthanasia,Intact Male,30.58211348,-97.32578234,104.491369
1349,7 years,A696672,Dog,American Pit Bull Terrier Mix,White,6/20/2008,12/6/2015 16:26,2015-12-06T16:26:00,Pixie,,Adoption,Spayed Female,30.3437009,-97.55329476,389.3835317
1350,2 months,A731425,Cat,Siamese Mix,Flame Point,5/10/2014,7/14/2014 12:35,2014-07-14T12:35:00,Olaf,,Adoption,Intact Male,30.44250871,-97.47286842,9.360615079
1351,1 year,A662736,Dog,German Shepherd Mix,Sable,10/13/2014,4/19/2016 16:22,2016-04-19T16:22:00,*Rolf,,Adoption,Neutered Male,30.54955511,-97.70797526,79.24027778
1352,3 months,A700897,Cat,Domestic Shorthair Mix,Brown Tabby,2/3/2016,6/3/2016 18:56,2016-06-03T18:56:00,,Suffering,Euthanasia,Intact Female,30.35579938,-97.61879441,17.3984127
1353,6 months,A756910,Other,Raccoon Mix,Brown,8/9/2014,2/10/2015 8:18,2015-02-10T08:18:00,,Rabies Risk,Euthanasia,Unknown,30.34096635,-97.66564812,26.47797619
1354,2 months,A682593,Dog,German Shepherd Mix,Brown/Black,5/22/2016,7/26/2016 17:00,2016-07-26T17:00:00,Ashley,,Adoption,Spayed Female,30.50156144,-97.36772342,9.386904762
1355,1 year,A739669,Cat,Domestic Medium Hair Mix,Black/White,9/8/2012,4/17/2014 14:19,2014-04-17T14:19:00,,SCRP,Transfer,Spayed Female,30.43228025,-97.67367256,83.79950397
1356,4 months,A691606,Dog,Anatol Shepherd Border Collie,Black/Cream,12/6/2014,4/25/2015 17:35,2015-04-25T17:35:00,Donnatelo,,Adoption,Neutered Male,30.41860581,-97.60449392,20.1046627
1357,2 weeks,A687306,Cat,Domestic Shorthair Mix,Black,8/13/2017,8/27/2017 17:24,2017-08-27T17:24:00,,Partner,Transfer,Intact Male,30.69696319,-97.39371768,2.103571429
1358,5 years,A742154,Dog,Beagle,Brown/White,6/30/2009,7/16/2014 17:33,2014-07-16T17:33:00,Pinto,,Return to Owner,Neutered Male,30.58428727,-97.68840749,263.2473214
1359,1 year,A691732,Cat,Domestic Shorthair Mix,Tortie,12/5/2015,12/23/2016 19:12,2016-12-23T19:12:00,*Peach,,Adoption,Spayed Female,30.52329728,-97.68220819,54.97142857
1360,3 years,A760132,Dog,Pit Bull Mix,Brown Brindle/White,11/7/2011,11/12/2014 16:44,2014-11-12T16:44:00,Wolverine,,Return to Owner,Intact Male,30.74013315,-97.32210343,157.3853175
1361,5 years,A757115,Dog,Pit Bull Mix,Black/White,9/3/2009,2/12/2015 9:07,2015-02-12T09:07:00,*Sienna,Foster,Adoption,Spayed Female,30.68628189,-97.37217994,284.0542659
1362,4 years,A750586,Dog,Chihuahua Shorthair Mix,Brown/White,1/16/2013,1/20/2017 17:22,2017-01-20T17:22:00,Merlin,,Adoption,Neutered Male,30.30959402,-97.41261571,209.3890873
1363,2 years,A765046,Dog,Catahoula Mix,Tan/White,11/8/2012,12/4/2014 17:22,2014-12-04T17:22:00,Copper,Partner,Transfer,Neutered Male,30.68342306,-97.69128009,108.103373
1364,5 months,A731653,Dog,German Shepherd,Black/Brown,3/13/2017,9/4/2017 12:11,2017-09-04T12:11:00,Zeus,,Return to Owner,Neutered Male,30.63604347,-97.42035364,25.07251984
1365,1 year,A660814,Other,Opossum,Gray,8/30/2016,8/30/2017 11:51,2017-08-30T11:51:00,,Medical,Euthanasia,Unknown,30.73525042,-97.34605205,52.21339286
1366,1 month,A696652,Cat,Domestic Shorthair Mix,Brown Tabby/White,4/20/2017,6/1/2017 0:00,2017-06-01T00:00:00,*Joel,Partner,Transfer,Intact Male,30.31908114,-97.31752498,6
1367,1 year,A691842,Dog,Pit Bull Mix,Brown Brindle/White,7/12/2016,1/18/2018 17:11,2018-01-18T17:11:00,*Leon,Partner,Transfer,Intact Male,30.68662316,-97.47802499,79.38799603
1368,3 years,A752542,Dog,Chihuahua Longhair Cardigan Welsh Corgi,Tan/White,7/25/2013,2/28/2017 16:23,2017-02-28T16:23:00,Nellie,Partner,Transfer,Spayed Female,30.68873977,-97.60057347,187.8118056
1369,2 years,A721200,Dog,Pit Bull Mix,Black/White,8/12/2011,1/10/2014 11:34,2014-01-10T11:34:00,*Baby Girl,Partner,Transfer,Spayed Female,30.64981613,-97.67488265,126.0688492
1370,1 year,A722435,Dog,Great Pyrenees Labrador Retriever,Cream,11/24/2014,5/1/2016 17:59,2016-05-01T17:59:00,Archie,,Return to Owner,Neutered Male,30.28965989,-97.66641712,74.96418651
1371,5 months,A721784,Dog,Pit Bull Mix,Brown/White,6/10/2014,11/10/2014 16:36,2014-11-10T16:36:00,,Suffering,Euthanasia,Intact Male,30.32122118,-97.59956741,21.95595238
1372,6 months,A702266,Cat,Domestic Shorthair Mix,Black,12/23/2016,6/27/2017 0:00,2017-06-27T00:00:00,,Snr,Transfer,Spayed Female,30.45179692,-97.72525977,26.57142857
1373,2 years,A760733,Dog,Chihuahua Shorthair Mix,Tan/White,2/23/2015,12/9/2017 19:09,2017-12-09T19:09:00,*Finn,,Adoption,Neutered Male,30.53466297,-97.62702047,145.8282738
1374,1 year,A712755,Dog,Chihuahua Shorthair Mix,White/Tan,9/16/2014,4/17/2016 15:50,2016-04-17T15:50:00,Creed,,Adoption,Neutered Male,30.42270198,-97.48796437,82.80853175
1375,1 year,A666570,Other,Rabbit Sh Mix,Black/Tan,3/4/2015,3/8/2016 0:00,2016-03-08T00:00:00,,Partner,Transfer,Intact Male,30.34840619,-97.38843502,52.85714286
1376,2 weeks,A764375,Other,Raccoon Mix,Black/Gray,4/26/2015,5/11/2015 15:37,2015-05-11T15:37:00,,Rabies Risk,Euthanasia,Unknown,30.64238554,-97.24355193,2.235813492
1377,5 years,A721261,Dog,Chihuahua Longhair Mix,Tan/White,10/25/2012,11/3/2017 16:18,2017-11-03T16:18:00,Sweetie,Partner,Transfer,Spayed Female,30.60027443,-97.56595642,262.239881
1378,2 months,A708873,Cat,Domestic Medium Hair Mix,Calico,8/27/2015,11/21/2015 13:00,2015-11-21T13:00:00,*Sadie,,Adoption,Spayed Female,30.66378154,-97.27100253,12.36309524
1379,1 year,A749373,Dog,Pit Bull Mix,Brown/White,5/6/2012,11/7/2013 16:53,2013-11-07T16:53:00,Willie,,Return to Owner,Neutered Male,30.39591952,-97.6023255,78.6719246
1380,5 years,A724319,Dog,Labrador Retriever Mix,Black/White,12/28/2012,1/9/2018 16:41,2018-01-09T16:41:00,Westley,,Return to Owner,Neutered Male,30.65010703,-97.67155894,262.6707341
1381,8 years,A723131,Dog,Lhasa Apso Mix,Tricolor,2/24/2008,2/24/2016 13:50,2016-02-24T13:50:00,Muffy,Partner,Transfer,Spayed Female,30.64904578,-97.26046208,417.5109127
1382,2 months,A667424,Cat,Domestic Shorthair Mix,Blue Tabby,6/1/2015,8/16/2015 18:53,2015-08-16T18:53:00,*Admiral,,Adoption,Neutered Male,30.60008639,-97.5876957,10.96954365
1383,2 months,A740569,Dog,Australian Terrier Mix,Brown/White,2/27/2017,5/14/2017 12:49,2017-05-14T12:49:00,Zeus,,Return to Owner,Neutered Male,30.35339217,-97.56515352,10.93343254
1384,10 months,A726411,Dog,Beagle Mix,Buff/White,6/15/2015,4/19/2016 19:45,2016-04-19T19:45:00,,,Adoption,Neutered Male,30.5243417,-97.45841046,44.26041667
1385,5 years,A749961,Dog,Boxer Catahoula,Brown Brindle/White,3/27/2011,4/9/2016 13:37,2016-04-09T13:37:00,*Grady,,Adoption,Neutered Male,30.70754541,-97.72580865,262.9381944
1386,1 month,A737969,Dog,German Shepherd Mix,Black/Tan,10/1/2013,11/19/2013 18:59,2013-11-19T18:59:00,,Partner,Transfer,Intact Male,30.67077169,-97.55034591,7.112996032
1387,5 years,A695218,Dog,Pit Bull Mix,White,12/19/2011,12/30/2016 13:43,2016-12-30T13:43:00,Miley,,Return to Owner,Spayed Female,30.3016299,-97.28005204,262.6530754
1388,11 years,A750652,Dog,Labrador Retriever Chow Chow,Brown,5/10/2005,5/17/2016 16:05,2016-05-17T16:05:00,Pepper,Partner,Transfer,Neutered Male,30.40833616,-97.35800552,575.0957341
1389,1 year,A700724,Dog,Pit Bull Mix,Brown,5/21/2016,5/22/2017 12:36,2017-05-22T12:36:00,Disel,,Return to Owner,Intact Male,30.68661807,-97.40026465,52.36071429
1390,9 years,A684179,Dog,Chihuahua Shorthair Mix,Black/White,11/7/2007,1/18/2017 8:38,2017-01-18T08:38:00,Sheena,Foster,Adoption,Spayed Female,30.35964997,-97.67908975,480.0513889
1391,2 years,A717550,Dog,Chihuahua Shorthair Mix,Brown/White,1/11/2013,1/15/2015 17:46,2015-01-15T17:46:00,Nalu,,Adoption,Neutered Male,30.34498349,-97.62164645,104.9628968
1392,2 years,A498720,Dog,Pit Bull Mix,Red/White,5/30/2015,6/6/2017 11:24,2017-06-06T11:24:00,Pancake,Partner,Transfer,Spayed Female,30.71616293,-97.63222367,105.4964286
1393,1 year,A724249,Dog,Chihuahua Shorthair Rat Terrier,Chocolate/Tan,4/18/2014,4/19/2015 17:32,2015-04-19T17:32:00,Jellybean,,Return to Owner,Spayed Female,30.47771364,-97.4861718,52.39007937
1394,7 years,A750519,Dog,Pomeranian Mix,Tan,7/20/2007,7/21/2014 17:15,2014-07-21T17:15:00,Tod,,Return to Owner,Neutered Male,30.30121098,-97.52765734,365.53125
1395,1 year,A732894,Dog,Miniature Poodle Mix,White,12/10/2014,12/17/2015 16:57,2015-12-17T16:57:00,Isabel,,Adoption,Spayed Female,30.48368416,-97.45902883,53.24375
1396,10 years,A734821,Dog,Rat Terrier,Tricolor,7/30/2006,7/29/2016 13:25,2016-07-29T13:25:00,*Mitzi,Foster,Adoption,Spayed Female,30.49445119,-97.41114544,521.7941468
1397,2 years,A689914,Dog,Chihuahua Shorthair Mix,Black/Tan,4/14/2014,5/5/2016 18:22,2016-05-05T18:22:00,*Marty,,Adoption,Neutered Male,30.52314688,-97.73932622,107.5378968
1398,5 months,A712133,Dog,Labrador Retriever Mix,Black,1/28/2017,7/8/2017 18:28,2017-07-08T18:28:00,*Raven,,Adoption,Spayed Female,30.6233463,-97.73443394,23.10992063
1399,4 weeks,A765086,Cat,Domestic Shorthair Mix,Orange Tabby,7/14/2016,8/15/2016 16:27,2016-08-15T16:27:00,,Partner,Transfer,Intact Male,30.54388677,-97.26850875,4.669345238
1400,1 year,A762649,Dog,Black Mouth Cur Mix,Tan/White,9/13/2015,9/25/2016 14:24,2016-09-25T14:24:00,*Sadie,Partner,Transfer,Intact Female,30.35436019,-97.62375053,54.08571429
1401,1 year,A674182,Cat,Domestic Shorthair Mix,White,10/11/2013,10/12/2014 9:00,2014-10-12T09:00:00,,SCRP,Transfer,Intact Male,30.32220769,-97.29356125,52.33928571
1402,3 years,A738439,Dog,Chinese Sharpei Mix,White/Brown,9/21/2012,9/24/2015 18:27,2015-09-24T18:27:00,*Molly,,Adoption,Spayed Female,30.44652568,-97.51287607,156.9669643
1403,7 years,A702782,Dog,English Bulldog,Fawn/White,1/12/2011,1/24/2018 16:14,2018-01-24T16:14:00,Audrey,,Adoption,Spayed Female,30.62783023,-97.27352709,367.096627
1404,10 months,A724899,Dog,Labrador Retriever Mix,Black/White,1/22/2017,11/25/2017 15:34,2017-11-25T15:34:00,Blue,,Adoption,Spayed Female,30.40999952,-97.46560629,43.94980159
1405,4 years,A683044,Dog,Labrador Retriever Mix,Brown,3/8/2010,3/16/2014 11:57,2014-03-16T11:57:00,Gordo,,Return to Owner,Neutered Male,30.69521392,-97.55787298,209.9282738
1406,2 years,A715843,Cat,Domestic Shorthair Mix,Black/White,11/15/2014,11/15/2016 16:08,2016-11-15T16:08:00,Tips,,Return to Owner,Neutered Male,30.45135146,-97.50919629,104.5246032
1407,1 year,A703165,Dog,Lhasa Apso Pbgv,Black/Tan,5/17/2014,5/20/2015 11:57,2015-05-20T11:57:00,,Partner,Transfer,Intact Male,30.41905284,-97.37426972,52.64255952
1408,6 months,A616271,Dog,Rat Terrier Mix,Tan/White,10/22/2015,4/26/2016 18:36,2016-04-26T18:36:00,,,Adoption,Neutered Male,30.54873001,-97.31927453,26.825
1409,9 years,A689954,Dog,Chihuahua Longhair Mix,Brown Brindle/White,7/7/2005,7/7/2014 13:03,2014-07-07T13:03:00,Saki,,Return to Owner,Neutered Male,30.55347425,-97.2479719,469.6491071
1410,5 years,A725562,Dog,Labrador Retriever Mix,Brown,11/11/2010,11/23/2015 17:44,2015-11-23T17:44:00,Gabe,,Adoption,Neutered Male,30.71035109,-97.24358438,262.6769841
1411,3 months,A691542,Cat,Domestic Shorthair Mix,Brown Tabby,4/14/2015,7/19/2015 19:30,2015-07-19T19:30:00,,Foster,Adoption,Spayed Female,30.62584794,-97.3267573,13.83035714
1412,2 years,A703262,Dog,German Shepherd Mix,Red,10/6/2011,4/16/2014 12:50,2014-04-16T12:50:00,*Franziska,Partner,Transfer,Spayed Female,30.29593358,-97.69839584,131.9335317
1413,3 years,A721922,Dog,Beagle Mix,Sable,10/11/2011,10/21/2014 16:23,2014-10-21T16:23:00,*Sophie,Partner,Transfer,Spayed Female,30.33168327,-97.58417635,158.0975198
1414,2 months,A756044,Cat,Domestic Shorthair Mix,Black Tabby,4/25/2016,7/2/2016 17:12,2016-07-02T17:12:00,,,Adoption,Spayed Female,30.66647694,-97.68513184,9.816666667
1415,3 years,A621244,Dog,Pit Bull Mix,Blue,11/6/2011,1/29/2015 17:48,2015-01-29T17:48:00,Axel,,Adoption,Neutered Male,30.55242217,-97.69822673,168.677381
1416,2 years,A717094,Other,Skunk Mix,Black/White,5/22/2013,5/24/2015 10:59,2015-05-24T10:59:00,,Rabies Risk,Euthanasia,Unknown,30.49386547,-97.61802571,104.6368056
1417,5 months,A710417,Other,Raccoon Mix,Brown,9/7/2015,3/7/2016 13:43,2016-03-07T13:43:00,,Rabies Risk,Euthanasia,Unknown,30.72088094,-97.24938103,26.08164683
1418,10 months,A689316,Dog,Labrador Retriever Mix,Brown/Brown,10/13/2016,8/17/2017 0:00,2017-08-17T00:00:00,*Milan,Partner,Transfer,Intact Male,30.29466133,-97.37351517,44
1419,8 years,A749101,Cat,Maine Coon Mix,Orange Tabby,3/3/2009,1/2/2018 11:31,2018-01-02T11:31:00,,,Return to Owner,Spayed Female,30.70722038,-97.47320335,461.0685516
1420,9 years,A665416,Dog,German Shepherd Labrador Retriever,Black/Brown,12/2/2006,12/2/2015 12:02,2015-12-02T12:02:00,Cookie,Suffering,Euthanasia,Spayed Female,30.29488615,-97.62229168,469.6430556
1421,7 years,A674021,Dog,Chihuahua Shorthair Mix,White,8/30/2008,9/12/2015 11:56,2015-09-12T11:56:00,Skipper,,Adoption,Neutered Male,30.5541828,-97.45830339,367.0710317
1422,3 years,A752196,Cat,Domestic Shorthair Mix,Black,10/2/2011,10/11/2014 12:04,2014-10-11T12:04:00,*Willie,,Adoption,Neutered Male,30.56702456,-97.33809014,157.9289683
1423,2 months,A738137,Cat,Domestic Shorthair Mix,Black,4/18/2017,7/1/2017 19:15,2017-07-01T19:15:00,*Mary Kate,Foster,Adoption,Spayed Female,30.50061973,-97.53094203,10.6860119
1424,2 months,A757581,Dog,Cairn Terrier Mix,Tan,8/6/2013,10/21/2013 19:10,2013-10-21T19:10:00,,,Adoption,Spayed Female,30.55341765,-97.38085324,10.97123016
1425,1 year,A702724,Other,Bat Mix,Brown/Black,3/6/2013,3/6/2014 11:06,2014-03-06T11:06:00,,Rabies Risk,Euthanasia,Unknown,30.30466086,-97.74096368,52.20892857
1426,2 years,A706652,Cat,American Shorthair Mix,Brown Tabby,6/19/2015,6/21/2017 13:40,2017-06-21T13:40:00,,Partner,Transfer,Intact Female,30.70541124,-97.28973564,104.7956349
1427,2 months,A715003,Dog,Chihuahua Shorthair Mix,White/Tan,8/26/2016,11/14/2016 17:24,2016-11-14T17:24:00,,,Adoption,Spayed Female,30.63863843,-97.39595269,11.53214286
1428,2 months,A721021,Cat,Domestic Medium Hair Mix,Blue/White,7/20/2017,10/15/2017 12:56,2017-10-15T12:56:00,,In Kennel,Died,Intact Male,30.43976527,-97.46585516,12.50555556
1429,16 years,A689235,Dog,Basenji Mix,Tan/White,5/18/1999,5/18/2015 11:20,2015-05-18T11:20:00,Quennie,,Return to Owner,Spayed Female,30.75609833,-97.60906182,834.9246032
1430,4 years,A729522,Cat,Domestic Shorthair Mix,Black,7/1/2011,7/17/2015 14:18,2015-07-17T14:18:00,Midnight,Partner,Transfer,Spayed Female,30.53267873,-97.43980369,211.085119
1431,2 years,A688839,Cat,Domestic Shorthair Mix,Blue/White,10/29/2013,9/24/2016 16:27,2016-09-24T16:27:00,Marley,,Adoption,Spayed Female,30.43269677,-97.57881305,151.6693452
1432,6 months,A666306,Cat,Domestic Shorthair Mix,Torbie,8/19/2015,3/8/2016 18:42,2016-03-08T18:42:00,Cat,,Adoption,Spayed Female,30.71013579,-97.47981076,28.96845238
1433,1 day,A674379,Dog,Labrador Retriever Mix,Black/White,10/1/2014,10/2/2014 14:36,2014-10-02T14:36:00,,Partner,Transfer,Unknown,30.27380384,-97.5288286,0.229761905
1434,2 months,A706081,Dog,Labrador Retriever Mix,Black,4/5/2016,6/23/2016 17:37,2016-06-23T17:37:00,,,Adoption,Neutered Male,30.33413975,-97.29799984,11.3905754
1435,1 year,A717878,Cat,Domestic Medium Hair Mix,Black/White,9/24/2013,10/13/2014 19:22,2014-10-13T19:22:00,*Wilson,,Adoption,Neutered Male,30.53380162,-97.29422281,54.97242063
1436,8 years,A744778,Dog,Chihuahua Longhair Mix,White/Brown,10/30/2005,11/29/2013 16:08,2013-11-29T16:08:00,*Pearl,Partner,Transfer,Spayed Female,30.51355943,-97.58657989,421.8103175
1437,3 years,A762393,Dog,German Shepherd Mix,Tan/Black,3/12/2011,3/15/2014 16:54,2014-03-15T16:54:00,July,,Return to Owner,Intact Female,30.59730835,-97.41882702,157.1005952
1438,2 years,A699705,Dog,Australian Shepherd Mix,Brown Brindle,6/24/2013,6/24/2015 19:17,2015-06-24T19:17:00,Diamond,,Return to Owner,Neutered Male,30.28793986,-97.51015874,104.400496
1439,7 years,A714315,Dog,Labrador Retriever Mix,Brown,12/17/2008,2/28/2016 16:20,2016-02-28T16:20:00,Jax,,Adoption,Neutered Male,30.35158061,-97.56187886,375.6686508
1440,2 months,A679232,Dog,Chihuahua Shorthair Mix,Red,12/23/2016,3/12/2017 17:03,2017-03-12T17:03:00,,,Adoption,Neutered Male,30.55753175,-97.2925261,11.38720238
1441,13 years,A702255,Dog,Australian Cattle Dog Mix,Black/White,11/19/2004,11/25/2017 15:27,2017-11-25T15:27:00,Buster,,Adoption,Neutered Male,30.72539207,-97.73329533,679.2348214
1442,1 year,A741302,Other,Bat,Black/Brown,4/1/2014,4/1/2015 13:17,2015-04-01T13:17:00,,Rabies Risk,Euthanasia,Unknown,30.62214769,-97.39339767,52.2219246
1443,13 years,A706409,Cat,Russian Blue Mix,Blue,1/1/2002,11/4/2015 12:26,2015-11-04T12:26:00,*Kojak,,Adoption,Neutered Male,30.36219918,-97.66498578,722.2168651
1444,4 years,A685366,Cat,Domestic Shorthair Mix,Orange Tabby,5/17/2010,5/19/2014 14:12,2014-05-19T14:12:00,Simba,,Return to Owner,Neutered Male,30.6973735,-97.29968398,209.0845238
1445,2 weeks,A715701,Cat,Domestic Shorthair Mix,Black,4/26/2015,5/12/2015 13:36,2015-05-12T13:36:00,,Partner,Transfer,Intact Female,30.71869621,-97.2731272,2.366666667
1446,1 year,A667383,Dog,Labrador Retriever Mix,Black,11/2/2015,1/3/2017 18:47,2017-01-03T18:47:00,Titan,,Adoption,Neutered Male,30.64339058,-97.26170787,61.2546627
1447,1 year,A745180,Dog,Pit Bull Mix,Black/White,12/28/2013,7/8/2015 18:49,2015-07-08T18:49:00,Shadow,,Adoption,Spayed Female,30.26971886,-97.34399982,79.68343254
1448,2 years,A726988,Dog,Chihuahua Shorthair Mix,Buff/White,8/6/2012,9/14/2014 14:58,2014-09-14T14:58:00,*Davie,Partner,Transfer,Neutered Male,30.57426664,-97.38639522,109.9462302
1449,8 years,A731198,Cat,Domestic Shorthair Mix,Brown Tabby/White,11/8/2007,11/8/2015 15:50,2015-11-08T15:50:00,,Suffering,Euthanasia,Spayed Female,30.62742171,-97.71942679,417.5228175
1450,2 months,A759389,Dog,Pit Bull Mix,White/Tan,9/2/2013,11/23/2013 15:09,2013-11-23T15:09:00,Olympus,,Adoption,Neutered Male,30.28056572,-97.37125573,11.80446429
1451,2 years,A729985,Dog,Pit Bull Mix,White/Brown Brindle,3/14/2015,3/19/2017 11:46,2017-03-19T11:46:00,Seven,,Return to Owner,Intact Male,30.52951184,-97.56630987,105.2128968
1452,2 months,A717409,Cat,Domestic Shorthair Mix,Blue,4/20/2016,6/27/2016 17:54,2016-06-27T17:54:00,*Puff,Foster,Adoption,Neutered Male,30.42575075,-97.69169879,9.820833333
1453,2 years,A725675,Dog,Chihuahua Shorthair Mix,Brown,7/18/2014,7/28/2016 16:53,2016-07-28T16:53:00,Nana,,Return to Owner,Spayed Female,30.38139731,-97.70852854,105.9576389
1454,2 months,A713812,Cat,Domestic Shorthair Mix,Black/White,7/27/2017,10/6/2017 14:22,2017-10-06T14:22:00,,Partner,Transfer,Intact Female,30.47957965,-97.35465241,10.22837302
1455,3 years,A687645,Dog,Plott Hound Mix,White/Brown,2/26/2013,6/27/2016 12:29,2016-06-27T12:29:00,Estrella,,Return to Owner,Spayed Female,30.62106314,-97.60362847,173.9314484
1456,9 years,A738531,Cat,Domestic Medium Hair Mix,Black/White,12/7/2006,1/28/2016 21:00,2016-01-28T21:00:00,*Emmy,In Foster,Died,Spayed Female,30.71735321,-97.2948192,477.125
1457,8 years,A687185,Dog,Miniature Pinscher Mix,Black/Brown,5/1/2008,5/8/2016 15:56,2016-05-08T15:56:00,Maya,,Adoption,Spayed Female,30.6897296,-97.73270068,418.5234127
1458,4 months,A669366,Cat,Domestic Shorthair Mix,Orange Tabby,9/25/2015,1/27/2016 18:48,2016-01-27T18:48:00,*Leo,Foster,Adoption,Neutered Male,30.70496525,-97.25688781,17.82619048
1459,2 weeks,A671505,Cat,Domestic Shorthair Mix,Brown Tabby,8/24/2014,9/8/2014 16:41,2014-09-08T16:41:00,,Partner,Transfer,Intact Male,30.32290552,-97.72453426,2.242162698
1460,1 weeks,A696151,Cat,Domestic Shorthair Mix,Black Tabby,11/7/2016,11/17/2016 12:30,2016-11-17T12:30:00,,Partner,Transfer,Unknown,30.64518884,-97.26543258,1.50297619
1461,4 years,A697359,Dog,Chihuahua Shorthair Mix,Brown/White,9/2/2010,9/9/2014 18:40,2014-09-09T18:40:00,*Pepsi,,Adoption,Spayed Female,30.55191441,-97.51767821,209.8253968
1462,6 months,A705155,Dog,Parson Russell Terrier Mix,White/Tan,6/19/2013,12/29/2013 13:44,2013-12-29T13:44:00,,,Adoption,Neutered Male,30.58767383,-97.46140379,27.6531746
1463,3 months,A706412,Cat,Russian Blue Mix,Blue,12/3/2013,3/20/2014 16:01,2014-03-20T16:01:00,*Rasputin,,Adoption,Neutered Male,30.48740926,-97.25803845,15.38105159
1464,1 month,A723832,Dog,Dachshund Mix,Black/Brown,12/31/2014,2/24/2015 17:17,2015-02-24T17:17:00,Sully,Foster,Adoption,Neutered Male,30.70834194,-97.34782082,7.960019841
1465,5 years,A729826,Dog,Miniature Poodle Mix,White,2/22/2010,2/25/2015 17:01,2015-02-25T17:01:00,Poppy,,Return to Owner,Spayed Female,30.72996839,-97.4406544,261.387004
1466,1 weeks,A720585,Dog,American Staffordshire Terrier,Tricolor,6/11/2015,6/19/2015 13:44,2015-06-19T13:44:00,,Partner,Transfer,Intact Male,30.46409339,-97.44366681,1.224603175
1467,3 years,A706507,Other,Raccoon,Black/Gray,6/28/2012,6/28/2015 16:15,2015-06-28T16:15:00,,Medical,Euthanasia,Intact Female,30.73117597,-97.52763926,156.5252976
1468,4 years,A665943,Dog,Australian Cattle Dog Mix,Blue Merle,4/7/2012,4/11/2016 18:33,2016-04-11T18:33:00,Buck,,Return to Owner,Intact Male,30.68133924,-97.55556557,209.396131
1469,2 years,A763215,Dog,Miniature Poodle Mix,White,6/24/2014,7/4/2016 13:05,2016-07-04T13:05:00,Snow,,Return to Owner,Intact Male,30.34972522,-97.30750226,105.9350198
1470,5 years,A749996,Dog,Chow Chow Mix,Red,2/12/2011,2/14/2016 16:56,2016-02-14T16:56:00,Dog,,Adoption,Neutered Male,30.35454137,-97.7324346,261.2436508
1471,5 days,A752261,Cat,Domestic Shorthair Mix,Black,6/25/2015,6/30/2015 0:00,2015-06-30T00:00:00,,In Kennel,Died,Unknown,30.49586279,-97.4937223,0.714285714
1472,3 years,A719756,Cat,Siamese Mix,Lynx Point,10/24/2010,11/6/2013 15:19,2013-11-06T15:19:00,Twin,,Return to Owner,Neutered Male,30.42518292,-97.27454413,158.5197421
1473,4 months,A755390,Cat,Domestic Shorthair Mix,Blue Cream,8/11/2017,12/15/2017 18:08,2017-12-15T18:08:00,Honey,,Adoption,Spayed Female,30.69584458,-97.31370375,18.10793651
1474,1 year,A687696,Cat,Domestic Medium Hair Mix,Brown Tabby,5/22/2016,5/26/2017 18:58,2017-05-26T18:58:00,,Snr,Transfer,Spayed Female,30.73625468,-97.71336006,52.82718254
1475,2 years,A700088,Cat,Domestic Shorthair Mix,Cream Tabby,6/20/2015,6/28/2017 14:32,2017-06-28T14:32:00,*Tina,Partner,Transfer,Intact Female,30.38917641,-97.34304846,105.6579365
1476,1 year,A721371,Dog,Shih Tzu Mix,White/Black,3/27/2015,11/15/2016 16:58,2016-11-15T16:58:00,Fluffy,,Return to Owner,Neutered Male,30.66551021,-97.54072512,85.67242063
1477,13 years,A719321,Dog,Chow Chow Mix,Gold,8/2/2004,8/13/2017 14:55,2017-08-13T14:55:00,Marley,,Return to Owner,Neutered Male,30.63489825,-97.57169204,679.9459325
1478,6 months,A683507,Other,Bat Mix,Brown,3/8/2014,9/9/2014 9:03,2014-09-09T09:03:00,,,Disposal,Unknown,30.55926817,-97.562324,26.48244048
1479,4 years,A664503,Dog,Labrador Retriever Mix,Black/White,5/8/2010,4/18/2015 12:16,2015-04-18T12:16:00,Chubbs,,Return to Owner,Neutered Male,30.39595863,-97.47458773,258.0730159
1480,4 years,A700756,Dog,Labrador Retriever Mix,Chocolate/Tan,2/25/2012,2/25/2016 18:12,2016-02-25T18:12:00,Georgo,,Return to Owner,Neutered Male,30.48839823,-97.53764206,208.822619
1481,6 years,A665225,Cat,Domestic Shorthair Mix,Torbie,1/17/2010,1/24/2016 17:47,2016-01-24T17:47:00,Kaya,,Adoption,Spayed Female,30.45765437,-97.55366143,314.1058532
1482,3 years,A679133,Dog,Cairn Terrier Mix,Buff,7/11/2011,7/15/2014 17:26,2014-07-15T17:26:00,,,Adoption,Spayed Female,30.71523721,-97.45160454,157.246627
1483,2 months,A682746,Cat,Domestic Shorthair Mix,Black/White,7/20/2013,10/10/2013 18:17,2013-10-10T18:17:00,,,Adoption,Neutered Male,30.47234334,-97.26591803,11.82311508
1484,7 years,A680264,Dog,Bichon Frise Mix,White,5/1/2008,10/10/2015 12:20,2015-10-10T12:20:00,Maya,,Adoption,Spayed Female,30.39184765,-97.33845218,388.359127
1485,2 months,A680967,Dog,Pug Mix,Brown/Black,7/31/2013,10/19/2013 17:53,2013-10-19T17:53:00,,,Adoption,Spayed Female,30.63539415,-97.3466364,11.53501984
1486,3 months,A664241,Dog,Pit Bull Mix,Brown Brindle/White,1/16/2014,5/16/2014 19:32,2014-05-16T19:32:00,,Partner,Transfer,Intact Female,30.71041773,-97.31200549,17.25912698
1487,2 months,A738741,Cat,Domestic Shorthair Mix,Blue Tabby,5/2/2014,7/7/2014 12:26,2014-07-07T12:26:00,,Partner,Transfer,Intact Female,30.73667752,-97.47940274,9.502579365
1488,2 months,A698600,Dog,German Shepherd,Black/Tan,3/16/2014,5/31/2014 16:31,2014-05-31T16:31:00,,Partner,Transfer,Intact Female,30.47619126,-97.36950163,10.95545635
1489,2 months,A739386,Cat,Domestic Shorthair Mix,Orange Tabby/White,6/3/2014,8/5/2014 17:00,2014-08-05T17:00:00,*Bandit,,Adoption,Neutered Male,30.42273522,-97.64110216,9.101190476
1490,3 months,A684660,Dog,Pit Bull Mix,Brown Brindle/White,8/1/2013,11/1/2013 18:38,2013-11-01T18:38:00,Fina,,Adoption,Spayed Female,30.4605209,-97.6910182,13.25376984
1491,2 years,A752378,Cat,Domestic Shorthair Mix,Blue,11/20/2014,11/21/2016 9:00,2016-11-21T09:00:00,,SCRP,Transfer,Neutered Male,30.45749985,-97.34248977,104.625
1492,17 years,A745663,Cat,Siamese Mix,Lynx Point,3/14/1998,7/18/2015 13:02,2015-07-18T13:02:00,Nuts,Partner,Transfer,Spayed Female,30.32152042,-97.41144616,905.0775794
1493,1 year,A743813,Cat,Domestic Longhair Mix,Brown Tabby/White,12/1/2015,12/2/2016 9:00,2016-12-02T09:00:00,,SCRP,Transfer,Spayed Female,30.70709345,-97.55097097,52.48214286
1494,3 months,A750054,Cat,Domestic Shorthair Mix,Torbie,4/26/2014,7/27/2014 9:00,2014-07-27T09:00:00,,SCRP,Transfer,Intact Female,30.37860409,-97.61232475,13.19642857
1495,2 months,A665619,Cat,Domestic Shorthair Mix,Calico,5/15/2017,7/22/2017 10:05,2017-07-22T10:05:00,*Luna,Foster,Adoption,Spayed Female,30.35795223,-97.56087238,9.774305556
1496,2 years,A676611,Dog,Australian Shepherd Mix,Tricolor,3/21/2015,3/21/2017 19:29,2017-03-21T19:29:00,Law,,Return to Owner,Intact Male,30.56196476,-97.6192041,104.5445437
1497,3 years,A754757,Dog,Labrador Retriever Mix,Black,8/17/2013,2/22/2017 17:15,2017-02-22T17:15:00,*Sullivan,,Adoption,Neutered Male,30.33956251,-97.29584767,183.6741071
1498,1 month,A755953,Cat,Domestic Shorthair Mix,Brown Tabby,4/23/2017,6/6/2017 0:00,2017-06-06T00:00:00,*George,Partner,Transfer,Intact Male,30.71170969,-97.29245636,6.285714286
1499,3 years,A680151,Dog,Chihuahua Shorthair Mix,Black/Tan,10/22/2012,12/24/2015 15:15,2015-12-24T15:15:00,Chico,,Return to Owner,Neutered Male,30.39363125,-97.68582337,165.5193452
1500,3 weeks,A572587,Cat,Domestic Shorthair Mix,Orange Tabby,3/21/2014,4/12/2014 16:48,2014-04-12T16:48:00,,Partner,Transfer,Intact Male,30.4160073,-97.65046771,3.242857143
1501,2 years,A758487,Dog,Tibetan Spaniel Mix,Black/White,7/9/2015,7/26/2017 17:20,2017-07-26T17:20:00,Gremlin,,Adoption,Neutered Male,30.50281112,-97.35878424,106.9603175
1502,2 years,A733191,Dog,Pit Bull Mix,Brown Brindle,8/11/2015,10/9/2017 17:58,2017-10-09T17:58:00,*Micki,,Adoption,Spayed Female,30.55924507,-97.47378715,112.9640873
1503,3 weeks,A758109,Cat,Domestic Longhair Mix,Brown Tabby/White,5/8/2014,5/30/2014 14:37,2014-05-30T14:37:00,,Partner,Transfer,Intact Female,30.30932013,-97.44482137,3.229861111
1504,10 years,A721943,Dog,German Shepherd Mix,Black/Tan,5/6/2005,3/9/2016 18:27,2016-03-09T18:27:00,Ranger,,Return to Owner,Neutered Male,30.3934313,-97.33077435,565.8241071
1505,1 year,A722861,Other,Bat,Brown,9/17/2016,9/18/2017 9:28,2017-09-18T09:28:00,,Rabies Risk,Euthanasia,Unknown,30.693026,-97.24941742,52.34206349
1506,3 months,A763120,Cat,Domestic Shorthair Mix,Black,8/11/2016,11/15/2016 9:40,2016-11-15T09:40:00,*Lunar,Foster,Adoption,Neutered Male,30.60240506,-97.69131732,13.7718254
1507,2 months,A680549,Cat,American Shorthair Mix,Brown Tabby,9/14/2017,11/28/2017 17:16,2017-11-28T17:16:00,,,Adoption,Neutered Male,30.64489796,-97.44947615,10.81706349
1508,1 year,A678285,Dog,German Shepherd Mix,Black/Tan,3/7/2015,3/16/2016 14:18,2016-03-16T14:18:00,*Brunhilde,,Adoption,Spayed Female,30.30290815,-97.64219341,53.65654762
1509,3 months,A704237,Dog,Labrador Retriever Mix,White/Brown,12/23/2015,3/28/2016 13:35,2016-03-28T13:35:00,*Azul,,Adoption,Neutered Male,30.33181349,-97.5253291,13.79513889
1510,2 years,A727997,Other,Belgian Hare,Gray/Gray,12/3/2015,1/14/2018 15:41,2018-01-14T15:41:00,*Arya,,Adoption,Spayed Female,30.33927207,-97.47612553,110.5219246
1511,2 months,A702061,Dog,Great Pyrenees Mix,Cream,4/4/2014,6/10/2014 14:32,2014-06-10T14:32:00,Hershey,Partner,Transfer,Intact Male,30.49083537,-97.70988907,9.657936508
1512,2 years,A683671,Dog,Chihuahua Shorthair Cairn Terrier,Tan,5/6/2012,7/2/2014 12:12,2014-07-02T12:12:00,Mia,,Adoption,Spayed Female,30.69553916,-97.41937403,112.5011905
1513,1 year,A671638,Dog,Miniature Poodle Mix,White,6/2/2014,6/4/2015 15:06,2015-06-04T15:06:00,,In Kennel,Died,Intact Male,30.47719927,-97.38245974,52.51845238
1514,6 years,A695189,Dog,Pit Bull Mix,Red/White,5/17/2010,6/3/2016 17:14,2016-06-03T17:14:00,Cappuccino,,Return to Owner,Neutered Male,30.44262689,-97.57601713,315.6740079
1515,1 year,A684595,Other,Bat,Brown,5/8/2014,5/8/2015 15:59,2015-05-08T15:59:00,,Rabies Risk,Euthanasia,Unknown,30.41704603,-97.45577131,52.23799603
1516,2 months,A693065,Cat,Domestic Longhair Mix,Orange Tabby/White,6/6/2014,8/24/2014 17:20,2014-08-24T17:20:00,*Pumpkin,,Adoption,Spayed Female,30.35957953,-97.30557517,11.38888889
1517,1 year,A762257,Dog,Dutch Shepherd Boxer,Brown Brindle/White,1/28/2013,4/27/2014 18:06,2014-04-27T18:06:00,*Hopscotch,Partner,Transfer,Spayed Female,30.28949132,-97.48597066,64.96488095
1518,11 months,A684044,Dog,Border Collie German Shepherd,Black/White,9/10/2014,8/11/2015 17:49,2015-08-11T17:49:00,Gunner,,Return to Owner,Neutered Male,30.53372038,-97.45455274,47.96319444
1519,2 months,A701957,Cat,Domestic Shorthair Mix,White/Black Smoke,5/10/2014,8/2/2014 12:43,2014-08-02T12:43:00,,,Adoption,Spayed Female,30.74902293,-97.68143423,12.07569444
1520,4 years,A690820,Cat,Domestic Medium Hair Mix,Torbie,12/1/2010,12/1/2014 16:36,2014-12-01T16:36:00,Zulma,,Return to Owner,Spayed Female,30.58285961,-97.5286631,208.8130952
1521,1 month,A741451,Dog,Labrador Retriever Australian Cattle Dog,Black/White,10/2/2017,11/17/2017 19:21,2017-11-17T19:21:00,,Partner,Transfer,Intact Male,30.61107254,-97.65385378,6.686607143
1522,2 months,A734395,Cat,Domestic Shorthair Mix,Brown Tabby,5/11/2014,7/22/2014 16:57,2014-07-22T16:57:00,,,Adoption,Neutered Male,30.60987386,-97.44199343,10.38660714
1523,2 years,A328422,Dog,Pit Bull Mix,White,5/6/2013,5/6/2015 19:21,2015-05-06T19:21:00,Sugar,Suffering,Euthanasia,Spayed Female,30.45716675,-97.5888885,104.4008929
1524,5 years,A737900,Dog,Pit Bull Mix,Red,10/26/2009,11/4/2014 14:55,2014-11-04T14:55:00,Honey,Aggressive,Euthanasia,Spayed Female,30.41644295,-97.24400336,262.2316468
1525,1 year,A675331,Dog,Manchester Terrier Mix,Black/Brown Brindle,1/2/2016,1/7/2017 19:14,2017-01-07T19:14:00,,,Adoption,Neutered Male,30.53484051,-97.63302732,53.11448413
1526,2 months,A670328,Dog,Pit Bull Mix,Buff/White,7/6/2016,9/6/2016 18:22,2016-09-06T18:22:00,King,,Return to Owner,Intact Male,30.70756854,-97.42008314,8.966468254
1527,10 years,A667795,Dog,Parson Russell Terrier Mix,White/Black,4/13/2003,3/17/2014 11:55,2014-03-17T11:55:00,Cru,,Return to Owner,Neutered Male,30.31990297,-97.31108424,570.2137897
1528,1 year,A698319,Dog,Labrador Retriever Mix,Black,11/6/2015,11/26/2016 11:46,2016-11-26T11:46:00,*Dr. Pepper,Partner,Transfer,Neutered Male,30.32699771,-97.6655209,55.21289683
1529,8 months,A718121,Cat,Domestic Shorthair Mix,Calico,6/26/2013,3/26/2014 15:51,2014-03-26T15:51:00,,SCRP,Transfer,Intact Female,30.73385932,-97.56223241,39.09434524
1530,1 year,A737815,Cat,Domestic Medium Hair Mix,White/Brown,7/6/2012,1/6/2014 9:52,2014-01-06T09:52:00,,Suffering,Euthanasia,Neutered Male,30.48051393,-97.73338035,78.48730159
1531,9 months,A710364,Dog,Pit Bull Mix,White/Black,2/22/2013,12/16/2013 19:17,2013-12-16T19:17:00,*Blue,,Adoption,Neutered Male,30.42275161,-97.41711005,42.54335317
1532,4 years,A709855,Dog,Silky Terrier Mix,Silver/Tan,3/9/2011,3/13/2015 17:14,2015-03-13T17:14:00,Nik-O,,Adoption,Spayed Female,30.44153228,-97.34145362,209.3882937
1533,7 months,A686577,Dog,Boston Terrier Dachshund,Brown Brindle/White,5/21/2015,12/24/2015 13:36,2015-12-24T13:36:00,Kava,,Adoption,Neutered Male,30.562366,-97.44184816,31.08095238
1534,1 year,A699969,Dog,Labrador Retriever Basset Hound,Tan/White,11/4/2015,12/11/2016 16:20,2016-12-11T16:20:00,Jayco,,Adoption,Neutered Male,30.67894914,-97.24507546,57.66865079
1535,2 months,A751519,Cat,Domestic Shorthair Mix,Blue Tabby,6/7/2015,8/29/2015 16:22,2015-08-29T16:22:00,*Reuben,,Adoption,Neutered Male,30.67273384,-97.55354709,11.95456349
1536,4 months,A745466,Cat,Domestic Longhair Mix,Cream Tabby,4/13/2015,8/16/2015 18:46,2015-08-16T18:46:00,Gryffindor,,Adoption,Intact Male,30.30416231,-97.53248155,17.96884921
1537,5 months,A743624,Other,Bat Mix,Gray,2/23/2014,8/24/2014 9:25,2014-08-24T09:25:00,,,Disposal,Unknown,30.659905,-97.30671978,26.05605159
1538,8 months,A705677,Dog,German Shepherd German Shepherd,Tan/White,9/5/2014,5/15/2015 16:45,2015-05-15T16:45:00,*Mari,Partner,Transfer,Spayed Female,30.7025047,-97.55139127,36.09970238
1539,1 year,A755502,Dog,Pit Bull Mix,White/Blue,6/9/2016,6/27/2017 15:44,2017-06-27T15:44:00,*Monticello,Partner,Transfer,Intact Male,30.60761628,-97.74080028,54.80793651
1540,3 months,A746092,Dog,Labrador Retriever Mix,Black,12/18/2016,3/20/2017 19:32,2017-03-20T19:32:00,Pablo,,Return to Owner,Intact Male,30.62233166,-97.3343356,13.25912698
1541,2 years,A723132,Dog,German Shepherd,Red/White,2/13/2015,2/14/2017 0:00,2017-02-14T00:00:00,Gavin,Partner,Transfer,Neutered Male,30.28966945,-97.46506728,104.5714286
1542,2 years,A711960,Dog,Dogo Argentino Mix,White,6/20/2013,11/3/2015 13:12,2015-11-03T13:12:00,*Luigi,Partner,Transfer,Neutered Male,30.53174742,-97.30157818,123.7928571
1543,10 years,A737991,Dog,Labrador Retriever Mix,Black,8/5/2007,8/5/2017 13:01,2017-08-05T13:01:00,Molly,,Return to Owner,Intact Female,30.51203486,-97.74179864,521.934623
1544,2 years,A732715,Dog,Rottweiler,Black/Tan,3/28/2015,4/1/2017 13:45,2017-04-01T13:45:00,Nibbles,Partner,Transfer,Neutered Male,30.46120968,-97.72889589,105.0818452
1545,1 year,A731554,Other,Opossum,Gray,3/27/2015,3/27/2016 12:22,2016-03-27T12:22:00,,Suffering,Euthanasia,Unknown,30.61833641,-97.32800522,52.3593254
1546,13 years,A668846,Dog,Catahoula Mix,Black/White,9/14/2002,9/16/2015 12:23,2015-09-16T12:23:00,,Partner,Transfer,Neutered Male,30.62733353,-97.44031589,678.6451389
1547,1 year,A721641,Dog,German Shepherd Mix,Brown,11/10/2015,11/26/2016 18:10,2016-11-26T18:10:00,*Nora,,Adoption,Spayed Female,30.29621645,-97.2445349,54.67956349
1548,2 years,A673432,Other,Bat Mix,Brown,8/12/2014,8/12/2016 18:32,2016-08-12T18:32:00,,Rabies Risk,Euthanasia,Unknown,30.66855963,-97.38108532,104.5388889
1549,3 months,A710949,Cat,Domestic Shorthair Mix,Black,5/8/2016,8/13/2016 12:27,2016-08-13T12:27:00,Buddy,Partner,Transfer,Neutered Male,30.45175157,-97.72729419,13.93125
1550,3 years,A763350,Dog,Labrador Retriever Mix,Black,12/10/2010,4/16/2014 18:37,2014-04-16T18:37:00,Max,,Return to Owner,Neutered Male,30.44557564,-97.26442254,174.8250992
1551,1 year,A687740,Cat,Domestic Shorthair Mix,Torbie/White,3/1/2015,6/1/2016 13:54,2016-06-01T13:54:00,*Aurelia,Foster,Adoption,Spayed Female,30.55681633,-97.27689924,65.51130952
1552,8 months,A741355,Cat,Domestic Shorthair Mix,Brown Tabby/White,6/24/2013,3/2/2014 15:53,2014-03-02T15:53:00,*Lucinda,Partner,Transfer,Spayed Female,30.54759342,-97.38425455,35.95168651
1553,5 months,A675583,Cat,Domestic Shorthair Mix,Black,3/15/2015,9/10/2015 13:52,2015-09-10T13:52:00,*Bart,,Adoption,Neutered Male,30.50783914,-97.47882404,25.65396825
1554,1 month,A708697,Dog,Australian Shepherd Mix,Tricolor,10/24/2017,12/9/2017 11:22,2017-12-09T11:22:00,,Partner,Transfer,Intact Male,30.74534553,-97.64263927,6.639087302
1555,5 years,A720412,Cat,Domestic Shorthair Mix,Calico,9/9/2009,9/14/2014 13:15,2014-09-14T13:15:00,Marlyin,,Adoption,Spayed Female,30.42247183,-97.3296011,261.6502976
1556,10 years,A671390,Dog,Labrador Retriever Mix,Black,1/2/2007,1/2/2017 11:57,2017-01-02T11:57:00,Zeppo,,Return to Owner,Neutered Male,30.59133645,-97.68940481,521.9282738
1557,1 month,A742324,Dog,Pit Bull Mix,Brown/White,2/23/2014,4/3/2014 13:22,2014-04-03T13:22:00,,Partner,Transfer,Intact Male,30.41703474,-97.41547429,5.650992063
1558,2 years,A746881,Dog,Boxer Mix,Brown Brindle/White,7/30/2013,9/24/2015 14:06,2015-09-24T14:06:00,*Ashleigh,,Adoption,Spayed Female,30.43235295,-97.6330896,112.3696429
1559,5 months,A747436,Dog,German Shepherd Mix,Brown/Black,9/9/2015,3/9/2016 12:21,2016-03-09T12:21:00,*Ferlata,,Adoption,Spayed Female,30.32810075,-97.32426185,26.0735119
1560,2 years,A764123,Cat,Bengal Mix,Brown Tabby/Black,1/23/2012,2/3/2014 18:40,2014-02-03T18:40:00,Bodi,,Return to Owner,Spayed Female,30.38822375,-97.63163189,106.1111111
1561,7 years,A701628,Dog,Beagle Mix,Yellow,1/24/2010,1/29/2017 16:19,2017-01-29T16:19:00,*Larry,Offsite,Adoption,Neutered Male,30.72126767,-97.35792044,366.097123
1562,1 year,A672679,Other,Skunk,Black/White,4/10/2016,4/10/2017 16:46,2017-04-10T16:46:00,,Rabies Risk,Euthanasia,Unknown,30.61969094,-97.74099065,52.24265873
1563,2 years,A584327,Dog,Black Mouth Cur,Tan/Black,10/19/2014,4/19/2017 16:48,2017-04-19T16:48:00,Jed,,Return to Owner,Neutered Male,30.64329988,-97.24993543,130.5285714
1564,11 months,A714600,Cat,Domestic Shorthair Mix,Brown Tabby,1/22/2017,12/27/2017 18:25,2017-12-27T18:25:00,Esteban,,Adoption,Neutered Male,30.74638075,-97.71031367,48.53819444
1565,4 weeks,A701926,Cat,Domestic Shorthair Mix,Brown Tabby,4/2/2015,5/2/2015 15:12,2015-05-02T15:12:00,,Partner,Transfer,Intact Male,30.55349227,-97.41063658,4.376190476
1566,4 years,A747950,Dog,Labrador Retriever Boxer,Black/White,2/14/2011,7/9/2015 15:01,2015-07-09T15:01:00,Mellie,,Adoption,Spayed Female,30.76511176,-97.71631382,229.5179563
1567,11 years,A710928,Dog,Chihuahua Shorthair Mix,Buff/White,9/18/2005,10/24/2016 17:34,2016-10-24T17:34:00,Dosh,,Return to Owner,Neutered Male,30.44582803,-97.38222077,579.2474206
1568,2 months,A708073,Cat,Domestic Shorthair Mix,Blue Tabby/White,8/27/2015,11/15/2015 16:59,2015-11-15T16:59:00,James Bond,,Adoption,Neutered Male,30.32750978,-97.62546133,11.5296627
1569,3 weeks,A687478,Cat,Domestic Shorthair Mix,Brown Tabby,4/14/2015,5/7/2015 14:47,2015-05-07T14:47:00,,Partner,Transfer,Intact Male,30.51082916,-97.67168243,3.373710317
1570,3 years,A728444,Dog,Siberian Husky Mix,White/Gray,4/27/2014,4/27/2017 16:19,2017-04-27T16:19:00,Asher,,Return to Owner,Neutered Male,30.74227633,-97.60776439,156.6685516
1571,11 months,A713381,Dog,Labrador Retriever Mix,Tan/White,9/30/2014,9/21/2015 18:39,2015-09-21T18:39:00,*Henry,,Adoption,Neutered Male,30.60496698,-97.65012599,50.96815476
1572,2 weeks,A666957,Cat,Domestic Shorthair Mix,Blue/White,7/7/2015,7/22/2015 14:17,2015-07-22T14:17:00,,Partner,Transfer,Intact Male,30.27121653,-97.58537568,2.227876984
1573,2 months,A676659,Dog,Chihuahua Shorthair Mix,Blue/Tan,7/5/2014,9/6/2014 17:03,2014-09-06T17:03:00,,,Return to Owner,Spayed Female,30.31429421,-97.66964968,9.101488095
1574,4 months,A735625,Cat,Domestic Shorthair Mix,Black,2/4/2016,7/4/2016 12:28,2016-07-04T12:28:00,,,Adoption,Neutered Male,30.56128944,-97.53836384,21.64563492
1575,2 years,A719574,Cat,Domestic Shorthair Mix,Brown Tabby/White,7/22/2015,9/20/2017 12:47,2017-09-20T12:47:00,,,Adoption,Neutered Male,30.74891245,-97.24672437,113.0760913
1576,2 years,A681396,Dog,Doberman Pinsch,Black/Tan,11/10/2011,11/16/2013 18:12,2013-11-16T18:12:00,Leroy,,Adoption,Neutered Male,30.69184385,-97.26315529,105.3940476
1577,2 months,A741176,Cat,Domestic Longhair Mix,Blue Tabby/White,3/2/2014,5/27/2014 11:42,2014-05-27T11:42:00,*Ginger,,Adoption,Spayed Female,30.41012579,-97.72837942,12.35535714
1578,1 year,A695985,Dog,Chihuahua Shorthair Mix,Tan/White,9/26/2015,10/8/2016 17:40,2016-10-08T17:40:00,*Lucy,,Adoption,Spayed Female,30.27122672,-97.28150119,54.10515873
1579,2 years,A763333,Dog,Pit Bull Mix,Fawn/White,1/22/2014,3/23/2016 9:09,2016-03-23T09:09:00,*Abby,Foster,Adoption,Spayed Female,30.27728229,-97.35985534,113.0544643
1580,1 month,A739559,Cat,Domestic Shorthair Mix,Brown Tabby/White,5/9/2014,6/30/2014 10:51,2014-06-30T10:51:00,*Joy,Partner,Transfer,Intact Female,30.74486197,-97.39697007,7.493154762
1581,7 months,A721361,Cat,Domestic Shorthair Mix,Orange Tabby/White,5/29/2016,1/3/2017 17:53,2017-01-03T17:53:00,,,Adoption,Neutered Male,30.57461043,-97.3606388,31.3921627
1582,1 year,A699719,Dog,Pit Bull Mix,Brown/White,1/26/2014,2/7/2015 16:14,2015-02-07T16:14:00,Macy,,Adoption,Spayed Female,30.43463871,-97.34697882,53.95376984
1583,1 year,A721783,Cat,American Shorthair Mix,Gray Tabby/Black,12/7/2016,12/13/2017 17:11,2017-12-13T17:11:00,Micho,Snr,Transfer,Intact Male,30.7034568,-97.72292252,53.10228175
1584,1 year,A679229,Cat,Domestic Shorthair Mix,Lynx Point,12/4/2015,12/4/2016 16:07,2016-12-04T16:07:00,,Suffering,Euthanasia,Intact Female,30.32750851,-97.57767815,52.38164683
1585,10 months,A721264,Cat,Domestic Medium Hair Mix,Calico,5/25/2015,3/27/2016 15:33,2016-03-27T15:33:00,Leia,,Adoption,Spayed Female,30.66031182,-97.45806078,43.94970238
1586,3 months,A516705,Dog,Schnauzer Giant Mix,Black,1/17/2015,4/19/2015 17:52,2015-04-19T17:52:00,Gus,Partner,Transfer,Neutered Male,30.46269381,-97.48059486,13.24920635
1587,6 years,A669065,Dog,Miniature Schnauzer Mix,Black/Gray,3/4/2010,3/8/2016 11:54,2016-03-08T11:54:00,Bella,,Return to Owner,Spayed Female,30.32890462,-97.31966105,313.785119
1588,3 months,A678092,Dog,Chihuahua Shorthair Mix,White/Black,2/2/2014,5/17/2014 18:39,2014-05-17T18:39:00,,Partner,Transfer,Intact Female,30.31737014,-97.26827643,14.96815476
1589,12 years,A729111,Dog,Chihuahua Shorthair Mix,White/Brown,2/24/2004,3/6/2016 0:00,2016-03-06T00:00:00,Pickle,Partner,Transfer,Neutered Male,30.48444777,-97.49910681,627.7142857
1590,8 years,A759009,Dog,Basenji,Black/White,12/20/2007,10/25/2016 11:14,2016-10-25T11:14:00,Jake,,Return to Owner,Neutered Male,30.33495353,-97.65995496,461.7811508
1591,4 years,A752278,Dog,Chihuahua Shorthair Mix,Black/Tan,12/14/2009,12/18/2013 18:17,2013-12-18T18:17:00,Zahrah,,Adoption,Spayed Female,30.37969011,-97.36066019,209.3945437
1592,1 month,A762416,Cat,Domestic Shorthair Mix,White/Orange Tabby,4/7/2014,6/5/2014 17:12,2014-06-05T17:12:00,,,Adoption,Spayed Female,30.47781072,-97.26573868,8.530952381
1593,2 months,A730259,Cat,Domestic Shorthair Mix,Brown Tabby/White,5/19/2016,8/3/2016 11:45,2016-08-03T11:45:00,Leo,,Adoption,Neutered Male,30.4803321,-97.55619916,10.92708333
1594,2 months,A655397,Dog,Yorkshire Terrier Mix,Black,8/17/2017,10/18/2017 9:03,2017-10-18T09:03:00,*Lancelot,Foster,Adoption,Neutered Male,30.51172604,-97.63451957,8.911011905
1595,1 month,A700434,Cat,Domestic Shorthair Mix,Orange Tabby,5/5/2017,7/1/2017 18:07,2017-07-01T18:07:00,,Foster,Adoption,Neutered Male,30.67938743,-97.56800659,8.250694444
1596,8 months,A449703,Cat,Domestic Shorthair Mix,Black/White,3/20/2017,11/20/2017 16:02,2017-11-20T16:02:00,Luigi,,Return to Owner,Intact Male,30.67987963,-97.39160158,35.09543651
1597,5 months,A673208,Dog,German Shepherd Mix,Black/Brown,1/1/2016,7/1/2016 13:37,2016-07-01T13:37:00,Princess,,Return to Owner,Intact Female,30.67008127,-97.71817678,26.08105159
1598,3 years,A732820,Cat,Domestic Shorthair Mix,Black,4/24/2013,6/28/2016 11:48,2016-06-28T11:48:00,Notte,,Adoption,Neutered Male,30.61298051,-97.59834341,165.927381
1599,2 years,A674605,Cat,Domestic Shorthair Mix,Black,4/13/2013,4/14/2015 9:00,2015-04-14T09:00:00,,SCRP,Transfer,Unknown,30.27892183,-97.66418625,104.4821429
1600,8 years,A670630,Cat,Siamese Mix,Seal Point,7/11/2006,2/4/2015 18:43,2015-02-04T18:43:00,Monkey,,Adoption,Spayed Female,30.3395004,-97.28500523,447.2542659
1601,3 years,A763332,Dog,Boxer,White,2/20/2013,5/22/2016 15:29,2016-05-22T15:29:00,Cataleya,,Adoption,Spayed Female,30.37536215,-97.3211959,169.6635913
1602,1 year,A689268,Cat,Domestic Shorthair Mix,Black/White,8/13/2015,9/20/2016 13:30,2016-09-20T13:30:00,*Syrah,Partner,Transfer,Spayed Female,30.47119872,-97.54271043,57.79464286
1603,2 years,A752919,Dog,Pug Chihuahua Shorthair,Black,3/15/2012,3/24/2014 13:31,2014-03-24T13:31:00,*Albus,Partner,Transfer,Neutered Male,30.3824768,-97.33161858,105.6518849
1604,1 year,A748988,Dog,Miniature Pinscher Mix,Black/Tan,1/11/2013,2/6/2014 16:15,2014-02-06T16:15:00,Sampson,,Adoption,Neutered Male,30.43198577,-97.45360136,55.95386905
1605,3 months,A751813,Cat,Domestic Shorthair Mix,Orange Tabby,9/11/2017,12/12/2017 18:35,2017-12-12T18:35:00,,,Adoption,Neutered Male,30.50935481,-97.36738295,13.25347222
1606,3 weeks,A709064,Cat,Domestic Shorthair Mix,Black/White,9/9/2014,10/1/2014 15:19,2014-10-01T15:19:00,,Partner,Transfer,Intact Male,30.27772722,-97.29458108,3.234027778
1607,1 year,A712028,Cat,Domestic Shorthair Mix,Black,6/29/2016,7/3/2017 15:41,2017-07-03T15:41:00,,Partner,Transfer,Spayed Female,30.33901186,-97.38877172,52.80763889
1608,1 month,A715875,Dog,Labrador Retriever Mix,Black/Tan,4/2/2017,5/9/2017 16:03,2017-05-09T16:03:00,,Partner,Transfer,Intact Female,30.58358667,-97.68552778,5.38125
1609,3 months,A710244,Cat,Domestic Shorthair Mix,Brown Tabby/White,5/6/2017,8/17/2017 11:39,2017-08-17T11:39:00,,Foster,Adoption,Neutered Male,30.52179617,-97.65616023,14.78363095
1610,6 months,A680937,Cat,Domestic Shorthair Mix,Brown Tabby/White,5/20/2015,11/25/2015 16:51,2015-11-25T16:51:00,Marley,,Adoption,Neutered Male,30.57717331,-97.38581354,27.10029762
1611,3 weeks,A733801,Cat,Domestic Shorthair Mix,Brown Tabby/White,8/24/2015,9/16/2015 10:45,2015-09-16T10:45:00,,Partner,Transfer,Intact Male,30.69548828,-97.52640023,3.349702381
1612,2 years,A714032,Dog,Labrador Retriever Mix,White/Brown,9/11/2015,1/19/2018 11:32,2018-01-19T11:32:00,Max,,Adoption,Neutered Male,30.37927799,-97.41341958,123.0686508
1613,4 months,A760001,Dog,Manchester Terrier Dachshund,Tricolor,4/20/2015,8/28/2015 17:58,2015-08-28T17:58:00,Cohen,,Adoption,Neutered Male,30.57443409,-97.34513176,18.67837302
1614,6 years,A737739,Dog,Australian Cattle Dog Mix,Blue Merle,6/10/2008,6/23/2014 12:51,2014-06-23T12:51:00,*Hank,,Adoption,Neutered Male,30.51124721,-97.36773232,314.933631
1615,2 years,A720500,Dog,Pit Bull Mix,Brown Brindle/White,8/27/2014,11/21/2016 16:11,2016-11-21T16:11:00,Guapo,Partner,Transfer,Neutered Male,30.72889912,-97.56524862,116.8106151
1616,5 years,A677264,Cat,Domestic Shorthair Mix,Blue,10/17/2010,10/24/2015 13:33,2015-10-24T13:33:00,*Olivia,Partner,Transfer,Spayed Female,30.58911918,-97.35561169,261.9377976
1617,3 years,A732373,Dog,Siberian Husky Mix,Black/White,10/11/2014,10/13/2017 17:12,2017-10-13T17:12:00,Toby,,Return to Owner,Intact Male,30.44715372,-97.26160043,156.9595238
1618,8 months,A758431,Cat,Domestic Shorthair Mix,Black,8/27/2016,5/15/2017 0:00,2017-05-15T00:00:00,Troy,Partner,Transfer,Neutered Male,30.4065525,-97.43669519,37.28571429
1619,5 years,A696517,Dog,Cairn Terrier Mix,Black/Gray,2/10/2011,2/19/2016 18:49,2016-02-19T18:49:00,*Tina,,Adoption,Spayed Female,30.74895714,-97.41518633,262.2548611
1620,3 years,A738558,Dog,Jack Russell Terrier Mix,White/Brown,4/24/2011,4/24/2014 11:44,2014-04-24T11:44:00,Biscuit,,Return to Owner,Spayed Female,30.66301592,-97.34884634,156.6412698
1621,2 months,A685994,Cat,Domestic Medium Hair Mix,Black/White,7/6/2016,9/9/2016 8:44,2016-09-09T08:44:00,*Gideon,In Foster,Died,Intact Male,30.52494265,-97.50580011,9.337698413
1622,4 weeks,A707892,Cat,Domestic Shorthair Mix,Gray Tabby,8/16/2017,9/16/2017 0:00,2017-09-16T00:00:00,,Partner,Transfer,Intact Female,30.75143506,-97.73336314,4.428571429
1623,2 years,A739105,Cat,Siamese Mix,Lynx Point,2/6/2013,2/6/2015 14:57,2015-02-06T14:57:00,,Suffering,Euthanasia,Intact Male,30.30357478,-97.58491397,104.3747024
1624,1 year,A740471,Dog,Pit Bull Mix,White/Tan,11/17/2015,5/24/2017 17:24,2017-05-24T17:24:00,Marley,,Return to Owner,Intact Female,30.49505789,-97.64299152,79.24642857
1625,1 year,A703985,Dog,Dachshund Mix,Brown,8/15/2013,8/16/2014 13:08,2014-08-16T13:08:00,Rosco,,Return to Owner,Intact Male,30.39332028,-97.30209203,52.36388889
1626,2 years,A704537,Cat,Domestic Shorthair Mix,White/Tan,7/19/2013,8/18/2015 16:49,2015-08-18T16:49:00,Booboo,,Return to Owner,Neutered Male,30.69178018,-97.25165645,108.6715278
1627,5 years,A716864,Dog,Miniature Poodle Mix,Gray,11/28/2011,12/2/2016 14:11,2016-12-02T14:11:00,,,Adoption,Spayed Female,30.67763303,-97.27551557,261.6558532
1628,9 months,A761552,Dog,Labrador Retriever Mix,Tan/White,3/17/2016,12/23/2016 17:13,2016-12-23T17:13:00,Mika,,Adoption,Intact Female,30.7569243,-97.73925492,40.2453373
1629,3 years,A718926,Dog,American Bulldog Mix,Tan/White,5/31/2012,7/25/2015 13:01,2015-07-25T13:01:00,Simba,Partner,Transfer,Neutered Male,30.56485201,-97.46413977,164.3631944
1630,2 months,A667170,Dog,Labrador Retriever Mix,Black/White,4/6/2015,6/17/2015 17:29,2015-06-17T17:29:00,*Morty,,Adoption,Neutered Male,30.52135927,-97.24308967,10.38978175
1631,2 years,A735611,Cat,Domestic Shorthair Mix,Cream Tabby/White,11/27/2013,12/2/2015 15:21,2015-12-02T15:21:00,Halo,,Adoption,Spayed Female,30.45517953,-97.30880813,105.091369
1632,2 years,A721862,Other,Bat Mix,Black,11/6/2015,11/6/2017 18:02,2017-11-06T18:02:00,,Rabies Risk,Euthanasia,Unknown,30.65273667,-97.24324231,104.5359127
1633,4 years,A729384,Dog,German Shepherd Mix,Tricolor,1/9/2012,1/10/2016 17:03,2016-01-10T17:03:00,Gunner,,Return to Owner,Neutered Male,30.50366434,-97.26319521,208.958631
1634,2 years,A672652,Dog,Cardigan Welsh Corgi Chihuahua Shorthair,Red/White,11/13/2011,11/17/2013 18:01,2013-11-17T18:01:00,Chewy,,Return to Owner,Neutered Male,30.46362954,-97.48650854,105.1072421
1635,3 months,A743167,Cat,Domestic Shorthair Mix,Blue/White,6/30/2016,10/2/2016 12:17,2016-10-02T12:17:00,*Juliette,,Adoption,Spayed Female,30.38954592,-97.69771855,13.50168651
1636,2 years,A719764,Dog,Labrador Retriever Mix,Black,3/6/2014,8/17/2016 12:27,2016-08-17T12:27:00,*Moose,Foster,Adoption,Neutered Male,30.52809004,-97.4216171,127.93125
1637,2 years,A720866,Dog,Staffordshire Mix,Blue/Brown,6/17/2014,7/16/2016 16:27,2016-07-16T16:27:00,Minnie,,Adoption,Spayed Female,30.66948921,-97.32630573,108.6693452
1638,2 years,A675600,Dog,Chihuahua Shorthair Mix,Brown,2/14/2012,2/19/2014 13:11,2014-02-19T13:11:00,,,Adoption,Neutered Male,30.746648,-97.4062449,105.2213294
1639,3 months,A675232,Dog,Pit Bull Mix,Black/White,12/5/2016,3/20/2017 18:17,2017-03-20T18:17:00,Rocky,,Adoption,Neutered Male,30.52574584,-97.34563078,15.10882937
1640,1 year,A706471,Dog,Staffordshire Mix,Brown Brindle,1/27/2015,2/4/2016 13:34,2016-02-04T13:34:00,*Hector,,Adoption,Neutered Male,30.39384544,-97.31032366,53.36646825
1641,5 years,A743375,Dog,Pit Bull Mix,Blue/White,6/9/2011,7/25/2016 15:13,2016-07-25T15:13:00,*Titus,,Adoption,Neutered Male,30.73311325,-97.39356338,267.662004
1642,5 years,A697002,Dog,Beagle Mix,Tricolor,3/29/2009,3/31/2014 19:01,2014-03-31T19:01:00,Lucy,,Return to Owner,Spayed Female,30.41085418,-97.53784457,261.2560516
1643,4 years,A586033,Cat,Domestic Shorthair Mix,Tortie/Blue Cream,3/25/2010,4/6/2014 18:48,2014-04-06T18:48:00,Melinda,,Adoption,Spayed Female,30.73922131,-97.58009541,210.5404762
1644,1 year,A745860,Dog,Labrador Retriever Mix,Black,6/29/2014,7/13/2015 17:57,2015-07-13T17:57:00,Starla,,Adoption,Spayed Female,30.70476618,-97.46097221,54.24970238
1645,5 months,A750548,Cat,Domestic Shorthair Mix,Blue/White,9/9/2016,2/10/2017 12:18,2017-02-10T12:18:00,,Partner,Transfer,Intact Male,30.48702699,-97.33225926,22.07321429
1646,1 year,A694130,Cat,Domestic Shorthair Mix,Orange Tabby/White,2/16/2014,3/3/2015 16:43,2015-03-03T16:43:00,Lucinda,Partner,Transfer,Spayed Female,30.58508085,-97.72981103,54.38521825
1647,6 years,A743076,Dog,Beagle Labrador Retriever,White,1/2/2010,3/6/2016 17:56,2016-03-06T17:56:00,Moose,,Adoption,Neutered Male,30.44812644,-97.44942272,322.2496032
1648,7 years,A686416,Dog,Australian Shepherd Mix,Tricolor,11/23/2009,3/25/2017 15:37,2017-03-25T15:37:00,Bodo,,Return to Owner,Intact Male,30.66029719,-97.56897397,382.8072421
1649,5 years,A706223,Dog,Labrador Retriever Mix,Black/White,5/28/2012,6/10/2017 15:30,2017-06-10T15:30:00,Bella,,Adoption,Spayed Female,30.51462315,-97.24534089,262.8065476
1650,8 months,A669663,Dog,Chihuahua Longhair Mix,Black/Brown,9/20/2014,6/20/2015 0:00,2015-06-20T00:00:00,Snoopy,Partner,Transfer,Intact Male,30.48359515,-97.24567746,39
1651,1 year,A707870,Other,English Spot Mix,White/Black,2/3/2016,3/1/2017 18:38,2017-03-01T18:38:00,*Gus,,Adoption,Neutered Male,30.54034046,-97.48849519,56.1109127
1652,2 months,A757566,Dog,Labrador Retriever Great Dane,Black/White,6/15/2014,8/30/2014 17:16,2014-08-30T17:16:00,Lady,,Adoption,Spayed Female,30.69028081,-97.60328072,10.95992063
1653,1 month,A674925,Cat,Domestic Longhair Mix,White,5/19/2015,6/27/2015 12:05,2015-06-27T12:05:00,,Partner,Transfer,Intact Female,30.66151195,-97.35217861,5.643353175
1654,1 year,A713138,Dog,Chihuahua Shorthair Mix,Chocolate/White,12/24/2012,12/29/2013 17:51,2013-12-29T17:51:00,Roxy,,Adoption,Spayed Female,30.66483554,-97.25066974,52.96339286
1655,2 weeks,A692355,Cat,Domestic Shorthair Mix,Brown Tabby/White,7/4/2015,7/19/2015 14:25,2015-07-19T14:25:00,,Partner,Transfer,Unknown,30.31544735,-97.69690156,2.228670635
1656,1 year,A755049,Dog,Rottweiler Mix,Black/Tan,9/3/2016,10/3/2017 14:09,2017-10-03T14:09:00,86,Partner,Transfer,Intact Female,30.40946599,-97.50540102,56.51279762
1657,10 months,A688590,Dog,Jack Russell Terrier Mix,Tan/White,7/20/2013,6/16/2014 15:44,2014-06-16T15:44:00,*Nelly,,Adoption,Spayed Female,30.31786225,-97.63259214,47.37936508
1658,1 year,A759480,Cat,Domestic Shorthair Mix,Tortie/Brown,10/3/2014,10/7/2015 14:23,2015-10-07T14:23:00,*Tullia,Partner,Transfer,Spayed Female,30.39005333,-97.36968011,52.79990079
1659,8 months,A723891,Cat,Domestic Shorthair Mix,Torbie,3/18/2014,11/25/2014 18:40,2014-11-25T18:40:00,,SCRP,Transfer,Intact Female,30.42800661,-97.40737483,36.11111111
1660,1 year,A666854,Dog,Pit Bull Mix,Black,7/28/2016,8/14/2017 16:10,2017-08-14T16:10:00,*Kingsley,Partner,Transfer,Intact Male,30.6248827,-97.49887212,54.66765873
1661,7 years,A750881,Cat,Domestic Shorthair Mix,Brown Tabby,9/22/2007,11/9/2014 12:59,2014-11-09T12:59:00,*Gus,,Adoption,Spayed Female,30.59383613,-97.73210264,372.2201389
1662,9 months,A736369,Dog,Chihuahua Shorthair Mix,Black/Black,1/2/2017,10/3/2017 15:04,2017-10-03T15:04:00,,Partner,Transfer,Intact Female,30.60258833,-97.39197964,39.23253968
1663,2 months,A721405,Dog,Australian Shepherd Mix,White,3/30/2016,6/15/2016 11:27,2016-06-15T11:27:00,,Foster,Adoption,Spayed Female,30.44159481,-97.30877667,11.06815476
1664,2 months,A726367,Cat,Domestic Shorthair Mix,Brown Tabby/White,9/17/2013,11/26/2013 16:05,2013-11-26T16:05:00,*Julian,Medical,Euthanasia,Intact Male,30.5512676,-97.5147927,10.09573413
1665,5 years,A733575,Dog,Chihuahua Shorthair Mix,Brown,6/1/2012,6/2/2017 12:59,2017-06-02T12:59:00,Happy,,Return to Owner,Neutered Male,30.58504186,-97.70615812,261.0772817
1666,8 years,A685929,Cat,Domestic Shorthair Mix,Brown Tabby,10/9/2008,10/9/2016 15:19,2016-10-09T15:19:00,,In Kennel,Died,Intact Male,30.53121352,-97.69336398,417.5197421
1667,1 month,A737348,Dog,Anatol Shepherd Mix,Tricolor,1/11/2016,3/8/2016 19:07,2016-03-08T19:07:00,,Foster,Adoption,Neutered Male,30.66219245,-97.71771892,8.256646825
1668,1 year,A692402,Cat,Domestic Medium Hair Mix,White/Black,5/10/2015,7/4/2016 14:03,2016-07-04T14:03:00,*Sophie,,Adoption,Spayed Female,30.63325749,-97.36999123,60.2264881
1669,2 years,A755201,Dog,Vizsla Mix,Red/White,8/23/2015,12/15/2017 11:36,2017-12-15T11:36:00,Nova,,Adoption,Spayed Female,30.41532569,-97.27002377,120.7833333
1670,5 years,A751569,Other,Bat Mix,Brown,8/14/2009,8/14/2014 15:10,2014-08-14T15:10:00,,,Euthanasia,Unknown,30.31328666,-97.65800964,260.9474206
1671,3 years,A677098,Dog,Chihuahua Shorthair Mix,Tan/White,10/26/2013,10/30/2016 18:36,2016-10-30T18:36:00,,,Adoption,Spayed Female,30.71061545,-97.49982227,157.2535714
1672,2 years,A745933,Dog,Pit Bull Mix,Tan,11/19/2012,11/27/2014 13:55,2014-11-27T13:55:00,Brownie,Partner,Transfer,Spayed Female,30.57377219,-97.29707809,105.5114087
1673,3 years,A759181,Cat,Domestic Shorthair Mix,White,7/31/2014,8/6/2017 17:35,2017-08-06T17:35:00,*Mogwai,,Adoption,Neutered Male,30.65801961,-97.2940549,157.5332341
1674,3 months,A706983,Cat,Domestic Shorthair Mix,Black,2/22/2017,6/19/2017 17:34,2017-06-19T17:34:00,Ebzy,,Adoption,Intact Female,30.5013763,-97.49315174,16.81884921
1675,5 months,A672243,Cat,Domestic Shorthair Mix,Black,3/25/2014,9/11/2014 14:22,2014-09-11T14:22:00,*Mickey,Foster,Adoption,Intact Female,30.64652153,-97.72740697,24.37123016
1676,5 months,A756123,Other,Bat,Brown,9/26/2016,3/26/2017 16:14,2017-03-26T16:14:00,,Rabies Risk,Euthanasia,Unknown,30.70876314,-97.32948706,25.95376984
1677,4 weeks,A578341,Cat,Domestic Shorthair Mix,Black/White,8/28/2017,9/28/2017 0:00,2017-09-28T00:00:00,,Partner,Transfer,Intact Male,30.33080661,-97.54910987,4.428571429
1678,4 months,A694129,Cat,Domestic Shorthair Mix,Brown Tabby/White,3/6/2015,7/20/2015 14:56,2015-07-20T14:56:00,*Mini,Partner,Transfer,Spayed Female,30.36113878,-97.73321884,19.51746032
1679,1 year,A747412,Cat,Domestic Shorthair Mix,Gray,2/6/2013,2/6/2014 13:30,2014-02-06T13:30:00,,Suffering,Euthanasia,Intact Male,30.60228704,-97.28388749,52.22321429
1680,5 months,A737867,Dog,Whippet Mix,White/Tan,3/14/2017,8/19/2017 10:42,2017-08-19T10:42:00,Bird,,Adoption,Neutered Male,30.48351214,-97.65361846,22.63511905
1681,6 years,A689391,Dog,Pekingese Mix,White,3/2/2010,11/28/2016 17:13,2016-11-28T17:13:00,Lucas,,Adoption,Neutered Male,30.35993643,-97.63283448,351.959623
1682,7 months,A679385,Dog,Chihuahua Shorthair Mix,Brown,5/14/2014,12/20/2014 17:53,2014-12-20T17:53:00,Bear,,Return to Owner,Neutered Male,30.43827715,-97.5330417,31.53501984
1683,2 months,A667361,Cat,Domestic Shorthair Mix,Tortie,2/4/2017,4/21/2017 15:17,2017-04-21T15:17:00,,,Adoption,Spayed Female,30.65601802,-97.66597922,10.94811508
1684,1 year,A755587,Dog,Cavalier Span Chihuahua Longhair,Chocolate/White,11/5/2015,11/9/2016 18:59,2016-11-09T18:59:00,,,Adoption,Spayed Female,30.4441059,-97.39268822,52.97013889
1685,1 month,A694917,Cat,Domestic Shorthair Mix,Black/White,8/9/2014,10/7/2014 11:07,2014-10-07T11:07:00,,Suffering,Euthanasia,Intact Male,30.76674126,-97.58254826,8.494742063
1686,2 months,A740161,Dog,German Shepherd Mix,Brown/Black,2/28/2014,5/28/2014 19:42,2014-05-28T19:42:00,Layla,,Return to Owner,Spayed Female,30.28769458,-97.58337422,12.83154762
1687,1 year,A711884,Dog,Pit Bull Mix,Brown/White,11/16/2012,8/19/2014 14:38,2014-08-19T14:38:00,*Grizz,,Adoption,Neutered Male,30.40081484,-97.28658175,91.65853175
1688,1 year,A728099,Cat,Domestic Shorthair Mix,Brown Tabby,8/5/2016,8/11/2017 13:40,2017-08-11T13:40:00,,Snr,Transfer,Intact Male,30.74344962,-97.4710728,53.08134921
1689,1 year,A677171,Dog,Labrador Retriever Mix,Black/White,1/6/2014,2/2/2015 14:41,2015-02-02T14:41:00,*Alphonse,Partner,Transfer,Neutered Male,30.67811141,-97.26313462,56.08740079
1690,2 years,A757636,Dog,Yorkshire Terrier Mix,Tan/Silver,12/12/2014,12/14/2016 14:39,2016-12-14T14:39:00,Rocko,,Return to Owner,Neutered Male,30.6945122,-97.44169852,104.8014881
1691,3 weeks,A749213,Cat,Domestic Shorthair Mix,Black,8/22/2015,9/13/2015 12:20,2015-09-13T12:20:00,,Partner,Transfer,Intact Male,30.7061623,-97.40339689,3.216269841
1692,6 years,A752406,Cat,Domestic Shorthair Mix,Torbie,5/30/2010,6/15/2016 15:24,2016-06-15T15:24:00,*Tulipe,Partner,Transfer,Intact Female,30.65850902,-97.62069471,315.5202381
1693,8 months,A703333,Cat,Domestic Shorthair Mix,Orange Tabby,8/21/2013,5/11/2014 17:49,2014-05-11T17:49:00,Cuddles,,Adoption,Neutered Male,30.60482288,-97.71593206,37.67748016
1694,1 year,A742283,Dog,Pit Bull Mix,Brown Brindle,9/4/2016,9/15/2017 14:25,2017-09-15T14:25:00,130,Partner,Transfer,Intact Male,30.74898958,-97.70445625,53.80009921
1695,2 months,A720288,Cat,Domestic Shorthair Mix,Black/White,4/17/2017,7/1/2017 16:44,2017-07-01T16:44:00,,Foster,Adoption,Neutered Male,30.62877814,-97.25974784,10.81388889
1696,2 weeks,A700989,Cat,Domestic Medium Hair Mix,Brown Tabby,6/4/2017,6/22/2017 12:09,2017-06-22T12:09:00,,Partner,Transfer,Intact Female,30.4658953,-97.74197959,2.64375
1697,3 weeks,A682847,Cat,Domestic Shorthair Mix,Black,5/1/2015,5/23/2015 15:41,2015-05-23T15:41:00,,Partner,Transfer,Unknown,30.29607777,-97.58035126,3.236210317
1698,2 years,A742160,Dog,Collie Rough Mix,Tan/White,1/18/2015,3/12/2017 12:48,2017-03-12T12:48:00,Luna,,Adoption,Spayed Female,30.43927724,-97.50114197,112.0761905
1699,3 years,A678524,Dog,Pit Bull Mix,White/Brown,2/6/2013,2/8/2016 18:02,2016-02-08T18:02:00,Yabba,,Return to Owner,Spayed Female,30.48444096,-97.24637689,156.821627
1700,4 days,A726199,Cat,Domestic Shorthair Mix,Orange Tabby,4/18/2015,4/22/2015 14:55,2015-04-22T14:55:00,,Partner,Transfer,Unknown,30.56926924,-97.26465474,0.660218254
1701,4 weeks,A750587,Other,Bat,Brown,6/3/2014,7/3/2014 19:07,2014-07-03T19:07:00,,Rabies Risk,Euthanasia,Unknown,30.27380308,-97.37016019,4.399503968
1702,4 months,A672606,Other,Netherlnd Dwarf Mix,Black/White,12/1/2016,4/16/2017 18:41,2017-04-16T18:41:00,*Rhubarb,Offsite,Adoption,Neutered Male,30.58340256,-97.3773505,19.53978175
1703,1 year,A685370,Other,Raccoon Mix,Black/Gray,5/9/2013,5/9/2014 17:36,2014-05-09T17:36:00,,Suffering,Euthanasia,Unknown,30.29008432,-97.37450038,52.24761905
1704,3 months,A719238,Cat,Domestic Shorthair Mix,Orange Tabby/White,3/20/2016,6/22/2016 14:33,2016-06-22T14:33:00,*Ronan,Foster,Adoption,Neutered Male,30.64965032,-97.28022942,13.51517857
1705,1 month,A601250,Cat,Domestic Shorthair Mix,Brown Tabby/White,4/20/2017,6/1/2017 0:00,2017-06-01T00:00:00,*Julie,Partner,Transfer,Intact Female,30.57517268,-97.65631948,6
1706,10 years,A674035,Cat,Siamese Mix,Lynx Point,2/16/2004,2/16/2014 18:53,2014-02-16T18:53:00,Ian,,Return to Owner,Neutered Male,30.41225232,-97.65554558,521.9695437
1707,2 months,A751972,Dog,Labrador Retriever Mix,Black/White,6/6/2014,8/11/2014 18:30,2014-08-11T18:30:00,*Dixon,,Adoption,Neutered Male,30.56977811,-97.39701162,9.538690476
1708,7 months,A689028,Dog,Pointer Mix,White/Black,11/30/2015,7/28/2016 11:14,2016-07-28T11:14:00,*Ziggy,Foster,Adoption,Spayed Female,30.65419222,-97.33405936,34.49543651
1709,4 years,A745794,Dog,Labrador Retriever Mix,Black,1/3/2011,7/20/2015 16:15,2015-07-20T16:15:00,Charly,,Adoption,Spayed Female,30.3624563,-97.59864103,237.0967262
1710,2 years,A727311,Dog,Boston Terrier Mix,Black/White,3/6/2012,3/11/2014 15:38,2014-03-11T15:38:00,*Alice,Partner,Transfer,Spayed Female,30.31929627,-97.41217146,105.0930556
1711,1 month,A697908,Cat,Domestic Shorthair Mix,Brown/Black,4/24/2017,6/16/2017 12:41,2017-06-16T12:41:00,,Suffering,Euthanasia,Intact Female,30.42243151,-97.56643451,7.646924603
1712,5 years,A761441,Dog,Chihuahua Shorthair,Sable,9/28/2009,10/2/2014 18:07,2014-10-02T18:07:00,Sparky,Partner,Transfer,Neutered Male,30.70122421,-97.40065778,261.5364087
1713,1 year,A688541,Dog,Chihuahua Shorthair Mix,Cream,3/24/2016,3/29/2017 0:00,2017-03-29T00:00:00,Blanca,Partner,Transfer,Spayed Female,30.56548794,-97.59824526,52.85714286
1714,10 years,A707537,Dog,Rat Terrier Mix,White,5/21/2006,5/31/2016 11:37,2016-05-31T11:37:00,*Quincy,Partner,Transfer,Neutered Male,30.41675817,-97.56764033,523.3548611
1715,1 year,A720958,Dog,Miniature Poodle English Cocker Spaniel,Cream,3/3/2014,3/7/2015 17:36,2015-03-07T17:36:00,,,Adoption,Spayed Female,30.37835489,-97.72679641,52.81904762
1716,5 months,A717012,Dog,Chihuahua Shorthair Mix,Black/Tricolor,5/20/2017,11/10/2017 16:41,2017-11-10T16:41:00,,,Adoption,Neutered Male,30.31542301,-97.53842902,24.95644841
1717,1 month,A744421,Cat,Domestic Shorthair Mix,Blue Tabby/White,8/5/2014,9/24/2014 14:58,2014-09-24T14:58:00,*Elaine,Partner,Transfer,Intact Female,30.73503294,-97.71734648,7.231944444
1718,3 months,A744804,Cat,Domestic Shorthair Mix,Calico,4/14/2015,7/18/2015 14:47,2015-07-18T14:47:00,*Olive,,Adoption,Spayed Female,30.59325781,-97.56652438,13.6594246
1719,1 year,A669457,Dog,Labrador Retriever Mix,Black,2/18/2015,2/27/2016 19:22,2016-02-27T19:22:00,*Sam,,Adoption,Neutered Male,30.38913985,-97.52580631,53.54384921
1720,8 months,A674495,Cat,Domestic Shorthair Mix,Black/White,3/30/2015,12/4/2015 19:43,2015-12-04T19:43:00,,SCRP,Transfer,Spayed Female,30.27983933,-97.62544051,35.68878968
1721,1 year,A727312,Dog,Staffordshire Mix,Brown/White,2/28/2016,4/1/2017 15:58,2017-04-01T15:58:00,*Bogie,,Adoption,Neutered Male,30.47392712,-97.30946892,56.95218254
1722,1 year,A673113,Cat,Siamese Mix,Seal Point,9/8/2015,3/9/2017 9:00,2017-03-09T09:00:00,*Otter,SCRP,Transfer,Neutered Male,30.30743443,-97.67705245,78.33928571
1723,5 years,A679304,Dog,Miniature Schnauzer Miniature Poodle,Gray,12/21/2008,1/2/2014 12:05,2014-01-02T12:05:00,Nala,Partner,Transfer,Intact Female,30.39629927,-97.29988092,262.6433532
1724,8 years,A696439,Dog,Miniature Schnauzer,Gray/White,3/14/2006,3/15/2014 18:24,2014-03-15T18:24:00,Tinka,,Return to Owner,Spayed Female,30.74579992,-97.60126282,417.6809524
1725,2 months,A748865,Cat,Domestic Medium Hair Mix,Black/White,4/21/2016,7/9/2016 17:57,2016-07-09T17:57:00,*Clyde,Foster,Adoption,Neutered Male,30.3208095,-97.26230206,11.39255952
1726,5 years,A742313,Dog,Maltese,White,2/19/2009,3/16/2014 13:47,2014-03-16T13:47:00,Lizzie,,Adoption,Spayed Female,30.71958459,-97.38436718,264.5106151
1727,2 months,A720617,Dog,German Shepherd Mix,Brown/Black,3/19/2014,5/23/2014 18:58,2014-05-23T18:58:00,Sheila,,Return to Owner,Spayed Female,30.68965873,-97.74196997,9.398611111
1728,10 months,A762685,Dog,Labrador Retriever Australian Cattle Dog,Cream/White,4/4/2014,2/11/2015 16:24,2015-02-11T16:24:00,*Hector,Partner,Transfer,Neutered Male,30.52098161,-97.58401639,44.81190476
1729,1 year,A764931,Cat,Domestic Shorthair Mix,Orange Tabby,5/8/2016,5/13/2017 13:31,2017-05-13T13:31:00,Toby,,Return to Owner,Intact Male,30.39166385,-97.34202249,52.93759921
1730,2 years,A731346,Dog,Pit Bull Mix,Blue/White,1/19/2015,1/29/2017 14:57,2017-01-29T14:57:00,*Oona,,Adoption,Spayed Female,30.48873829,-97.54964814,105.946131
1731,10 months,A677887,Dog,Pit Bull Mix,White/Brown,4/12/2015,2/21/2016 18:37,2016-02-21T18:37:00,Adeleine,,Adoption,Spayed Female,30.36728521,-97.36624058,45.11081349
1732,2 years,A709314,Cat,Domestic Shorthair Mix,Black/White,11/24/2015,12/21/2017 13:26,2017-12-21T13:26:00,Nine,Partner,Transfer,Neutered Male,30.60969302,-97.38837644,108.3656746
1733,4 months,A691545,Cat,Domestic Shorthair Mix,Brown Tabby,9/9/2017,1/10/2018 10:53,2018-01-10T10:53:00,,Partner,Transfer,Intact Male,30.65108543,-97.54693203,17.63621032
1734,2 years,A702208,Other,Bat Mix,Brown,7/20/2014,7/20/2016 18:51,2016-07-20T18:51:00,,,Disposal,Intact Male,30.27182565,-97.67455194,104.5407738
1735,2 years,A703500,Dog,Rat Terrier Chihuahua Shorthair,Tricolor,4/30/2012,5/12/2014 19:06,2014-05-12T19:06:00,*Glenda,,Adoption,Spayed Female,30.2714327,-97.4837731,106.1136905
1736,3 weeks,A736516,Cat,Domestic Shorthair Mix,Brown Tabby,7/21/2015,8/11/2015 0:00,2015-08-11T00:00:00,,Partner,Transfer,Intact Male,30.62054866,-97.58456665,3
1737,4 weeks,A681857,Cat,Domestic Shorthair Mix,Cream,10/9/2014,11/9/2014 17:31,2014-11-09T17:31:00,*Maple,Partner,Transfer,Intact Male,30.2742935,-97.72098736,4.532837302
1738,2 weeks,A666408,Cat,Domestic Shorthair Mix,Black,4/25/2015,5/10/2015 19:31,2015-05-10T19:31:00,,Partner,Transfer,Unknown,30.49297476,-97.7415155,2.259027778
1739,1 year,A710669,Other,Bat,Brown,5/25/2014,5/25/2015 14:20,2015-05-25T14:20:00,,Rabies Risk,Euthanasia,Unknown,30.621295,-97.36491862,52.2281746
1740,5 months,A762323,Cat,Domestic Shorthair Mix,Brown Tabby/White,8/28/2016,2/24/2017 17:01,2017-02-24T17:01:00,Blue,Partner,Transfer,Neutered Male,30.45617471,-97.69069005,25.8155754
1741,1 year,A453083,Dog,Chihuahua Shorthair Mix,White/Tan,6/21/2013,6/26/2014 8:58,2014-06-26T08:58:00,Tarva,Partner,Transfer,Spayed Female,30.54609908,-97.68106733,52.91051587
1742,6 months,A726075,Dog,Chihuahua Shorthair Mix,White/Brown,5/1/2013,11/2/2013 11:27,2013-11-02T11:27:00,,Partner,Transfer,Intact Male,30.40589577,-97.35907884,26.49672619
1743,6 months,A700423,Dog,Labrador Retriever Mix,Black/White,2/15/2015,8/31/2015 17:10,2015-08-31T17:10:00,Koda,,Adoption,Spayed Female,30.53819184,-97.57970504,28.24503968
1744,2 months,A679909,Cat,Domestic Shorthair Mix,Brown Tabby,10/12/2017,12/24/2017 10:14,2017-12-24T10:14:00,*Luka,,Adoption,Neutered Male,30.48992012,-97.48192054,10.48948413
1745,10 years,A711367,Dog,Border Collie Mix,Chocolate/White,11/13/2005,1/12/2016 16:40,2016-01-12T16:40:00,Liz,,Return to Owner,Spayed Female,30.6444431,-97.45171797,530.3849206
1746,9 years,A753661,Dog,Labrador Retriever,Chocolate,5/6/2008,8/4/2017 9:53,2017-08-04T09:53:00,Henry,,Return to Owner,Neutered Male,30.35360139,-97.27810187,482.4874008
1747,2 years,A723319,Dog,Boxer,Brown Brindle/White,4/13/2013,4/28/2015 15:39,2015-04-28T15:39:00,Tyson,,Adoption,Neutered Male,30.30886265,-97.27328351,106.5217262
1748,2 months,A718985,Cat,Domestic Medium Hair Mix,Torbie/White,4/23/2014,7/13/2014 18:57,2014-07-13T18:57:00,*Milicent,Foster,Adoption,Spayed Female,30.48329392,-97.68279807,11.68422619
1749,2 weeks,A700832,Cat,Domestic Shorthair Mix,Black/White,8/21/2015,9/5/2015 18:43,2015-09-05T18:43:00,,Partner,Transfer,Unknown,30.33496738,-97.46872833,2.254265873
1750,1 month,A734458,Cat,Domestic Shorthair Mix,White,5/25/2017,7/10/2017 17:45,2017-07-10T17:45:00,,Suffering,Euthanasia,Intact Male,30.50603082,-97.32605712,6.677083333
1751,4 months,A729222,Dog,Labrador Retriever Mix,Black/White,11/14/2015,4/3/2016 16:13,2016-04-03T16:13:00,Jam-It,,Adoption,Neutered Male,30.45022638,-97.69786753,20.23938492
1752,3 years,A687167,Dog,Toy Poodle Mix,Apricot,7/10/2012,1/15/2016 19:22,2016-01-15T19:22:00,,,Adoption,Neutered Male,30.51520044,-97.38106591,183.5438492
1753,6 years,A742767,Dog,Miniature Poodle Mix,White,4/20/2009,4/21/2015 12:59,2015-04-21T12:59:00,Sweetie,,Return to Owner,Spayed Female,30.5668129,-97.50594946,313.2201389
1754,1 year,A689251,Dog,Chihuahua Shorthair Mix,Brown/Tan,9/6/2015,9/15/2016 15:48,2016-09-15T15:48:00,*Hobie,Partner,Transfer,Intact Male,30.65003858,-97.24764812,53.66547619
1755,2 weeks,A686884,Dog,Pit Bull Mix,Blue/White,6/2/2016,6/22/2016 0:00,2016-06-22T00:00:00,,,Return to Owner,Intact Female,30.4913856,-97.46475611,2.857142857
1756,1 month,A703887,Dog,Patterdale Terr Mix,Black/White,8/29/2014,10/23/2014 18:38,2014-10-23T18:38:00,,,Adoption,Spayed Female,30.58945496,-97.68586367,7.968055556
1757,7 months,A673353,Dog,Labrador Retriever Mix,Black,6/27/2016,2/14/2017 15:20,2017-02-14T15:20:00,Marley,,Return to Owner,Intact Female,30.48697549,-97.42800172,33.23412698
1758,2 years,A751178,Dog,Pit Bull Mix,Blue/White,10/1/2012,10/2/2014 18:45,2014-10-02T18:45:00,Blue,,Return to Owner,Neutered Male,30.65595586,-97.27060599,104.5401786
1759,8 years,A732169,Dog,Miniature Schnauzer Mix,White,8/28/2006,9/7/2014 13:27,2014-09-07T13:27:00,Abby,,Return to Owner,Spayed Female,30.49867082,-97.73030853,418.9372024
1760,1 month,A762050,Cat,Domestic Shorthair Mix,Tortie,5/8/2015,6/13/2015 14:59,2015-06-13T14:59:00,*Dixie,Partner,Transfer,Intact Female,30.64899359,-97.52985065,5.232043651
1761,1 year,A757370,Dog,Chihuahua Shorthair Mix,Red,2/22/2013,2/27/2014 17:14,2014-02-27T17:14:00,Simon,,Return to Owner,Neutered Male,30.66670548,-97.71891931,52.95972222
1762,2 months,A751482,Cat,Domestic Shorthair Mix,Tortie,4/24/2017,7/1/2017 14:07,2017-07-01T14:07:00,*Plum,Foster,Adoption,Spayed Female,30.30593874,-97.5295046,9.798313492
1763,1 year,A699224,Dog,Cairn Terrier Mix,White,8/3/2015,8/9/2016 9:43,2016-08-09T09:43:00,*Tulip,Partner,Transfer,Spayed Female,30.55054184,-97.57921746,53.20069444
1764,13 years,A762341,Dog,Labrador Retriever Mix,Black/White,11/14/2004,11/14/2017 13:56,2017-11-14T13:56:00,Trooper,,Return to Owner,Neutered Male,30.41680729,-97.30214633,678.3686508
1765,3 years,A611892,Dog,German Shepherd Mix,Tricolor,9/1/2014,10/3/2017 13:28,2017-10-03T13:28:00,42,Partner,Transfer,Intact Male,30.29001196,-97.44210534,161.2230159
1766,2 years,A690804,Dog,Shih Tzu,White/Black,6/8/2015,6/12/2017 11:24,2017-06-12T11:24:00,Piper,Partner,Transfer,Spayed Female,30.55888638,-97.65183622,105.0678571
1767,3 years,A760077,Dog,American Bulldog Mix,Chocolate/White,3/25/2012,3/25/2015 18:00,2015-03-25T18:00:00,Gunner,,Return to Owner,Neutered Male,30.55695735,-97.42155648,156.5357143
1768,1 year,A688478,Cat,Snowshoe Mix,White/Tan,11/18/2016,11/23/2017 0:00,2017-11-23T00:00:00,,Snr,Transfer,Neutered Male,30.71809489,-97.64820103,52.85714286
1769,3 years,A757897,Dog,Jack Russell Terrier Yorkshire Terrier,Tricolor,5/13/2011,5/29/2014 19:15,2014-05-29T19:15:00,Rufo,,Adoption,Neutered Male,30.68106422,-97.3842452,158.9717262
1770,1 year,A720728,Cat,Domestic Shorthair Mix,Orange Tabby,10/26/2013,10/27/2014 9:00,2014-10-27T09:00:00,,SCRP,Transfer,Intact Male,30.70788695,-97.31696772,52.33928571
1771,1 year,A718236,Dog,Black Tan Hound Mix,Black/Tan,10/12/2016,10/21/2017 19:12,2017-10-21T19:12:00,Sky,,Adoption,Spayed Female,30.27177617,-97.67994196,53.54285714
1772,4 years,A690878,Dog,Shih Tzu Mix,Black/Gray,9/19/2010,9/30/2014 17:59,2014-09-30T17:59:00,Charlie,,Return to Owner,Neutered Male,30.58377023,-97.67262479,210.3927579
1773,8 months,A698929,Dog,Labrador Retriever Mix,Black,1/8/2017,10/2/2017 16:38,2017-10-02T16:38:00,Pandora,Partner,Transfer,Spayed Female,30.43659174,-97.54171427,38.24186508
1774,1 year,A669781,Bird,Chicken Mix,Black/Cream,2/14/2015,3/8/2016 14:24,2016-03-08T14:24:00,Rooster 12,,Adoption,Intact Male,30.52168512,-97.65724091,55.51428571
1775,5 years,A691377,Cat,Domestic Shorthair Mix,Calico,12/26/2010,1/5/2016 13:20,2016-01-05T13:20:00,*Stevie,Partner,Transfer,Spayed Female,30.45384739,-97.27476016,262.3650794
1776,4 years,A657774,Dog,German Shepherd Mix,Black/Brown,4/27/2010,10/29/2014 14:12,2014-10-29T14:12:00,Iggy,,Adoption,Neutered Male,30.52160736,-97.46323167,235.227381
1777,1 year,A738289,Dog,English Coonhound Mix,Tricolor,9/19/2013,3/20/2015 13:07,2015-03-20T13:07:00,Hans,,Return to Owner,Neutered Male,30.53123873,-97.54929242,78.22093254
1778,1 year,A759418,Dog,Labrador Retriever Chow Chow,Yellow,6/27/2012,12/31/2013 16:42,2013-12-31T16:42:00,Cuatemo,,Return to Owner,Neutered Male,30.53858471,-97.39318988,78.95654762
1779,2 years,A729267,Dog,Chihuahua Shorthair Mix,Tan/Brown,11/3/2012,11/11/2014 12:02,2014-11-11T12:02:00,*Sunshine,Partner,Transfer,Spayed Female,30.38873196,-97.59379633,105.5001984
1780,1 year,A715199,Dog,Labrador Retriever Mix,Black/White,6/2/2012,10/9/2013 17:45,2013-10-09T17:45:00,Ottis,,Return to Owner,Neutered Male,30.60247716,-97.50159246,70.67708333
1781,1 month,A675466,Cat,Domestic Shorthair Mix,Brown Tabby/White,10/12/2016,12/3/2016 16:34,2016-12-03T16:34:00,*Aden,,Adoption,Intact Male,30.72418098,-97.43055555,7.52718254
1782,4 weeks,A676584,Cat,American Shorthair Mix,Brown Tabby,9/1/2017,10/2/2017 13:50,2017-10-02T13:50:00,,Partner,Transfer,Intact Female,30.32450986,-97.63995446,4.510912698
1783,2 months,A749452,Cat,Domestic Shorthair Mix,Calico,4/15/2016,6/27/2016 0:00,2016-06-27T00:00:00,*Merry,Partner,Transfer,Spayed Female,30.27554544,-97.50970037,10.42857143
1784,3 years,A704637,Cat,Domestic Shorthair Mix,Brown Tabby,11/2/2012,11/3/2015 9:00,2015-11-03T09:00:00,,SCRP,Transfer,Neutered Male,30.72420279,-97.48274774,156.625
1785,1 day,A626405,Cat,Domestic Shorthair Mix,White,3/28/2014,3/29/2014 15:33,2014-03-29T15:33:00,,Partner,Transfer,Intact Male,30.76157091,-97.26265525,0.235416667
1786,1 year,A727714,Dog,German Shepherd Mix,Sable/Tan,4/12/2013,4/16/2014 12:50,2014-04-16T12:50:00,,Partner,Transfer,Neutered Male,30.30766767,-97.64321685,52.7906746
1787,1 year,A724207,Cat,Domestic Medium Hair Mix,Calico,5/25/2015,9/26/2016 14:12,2016-09-26T14:12:00,Leia,Partner,Transfer,Spayed Female,30.52711521,-97.24875863,70.08452381
1788,10 years,A732264,Cat,Domestic Shorthair Mix,Black/White,5/15/2007,5/15/2017 11:36,2017-05-15T11:36:00,,Suffering,Euthanasia,Neutered Male,30.31880765,-97.39603541,521.9261905
1789,3 weeks,A678840,Cat,Domestic Shorthair Mix,Blue Tabby,5/16/2015,6/7/2015 13:23,2015-06-07T13:23:00,,Partner,Transfer,Intact Male,30.47871817,-97.52328959,3.222519841
1790,5 years,A722897,Dog,Great Dane Mix,White/Black,5/6/2008,10/30/2013 11:45,2013-10-30T11:45:00,Ziven,,Return to Owner,Neutered Male,30.76174606,-97.33801402,286.2127976
1791,1 year,A738212,Dog,Labrador Retriever Mix,Black,5/25/2015,6/7/2016 13:53,2016-06-07T13:53:00,*Sammy,,Adoption,Neutered Male,30.56805127,-97.52472611,54.22549603
1792,2 months,A666980,Cat,Domestic Shorthair Mix,Calico,4/12/2016,7/9/2016 16:04,2016-07-09T16:04:00,*Cici,Foster,Adoption,Spayed Female,30.43438281,-97.47238399,12.66706349
1793,8 months,A707167,Dog,Labrador Retriever Mix,Black,12/4/2015,8/17/2016 0:00,2016-08-17T00:00:00,King,,Adoption,Neutered Male,30.35981923,-97.32113557,36.71428571
1794,1 day,A685100,Cat,Domestic Shorthair Mix,Torbie,5/12/2014,5/13/2014 14:53,2014-05-13T14:53:00,,Partner,Transfer,Intact Female,30.47491888,-97.49182894,0.231448413
1795,1 year,A742867,Cat,Domestic Medium Hair,Black Smoke,3/23/2015,3/31/2016 13:01,2016-03-31T13:01:00,*Anastasia,,Adoption,Spayed Female,30.51133777,-97.37461201,53.50605159
1796,6 months,A712641,Dog,German Shepherd,Black/Brown,5/11/2016,11/13/2016 19:00,2016-11-13T19:00:00,Karma,Partner,Transfer,Spayed Female,30.44147973,-97.70293369,26.68452381
1797,3 months,A663256,Cat,Domestic Shorthair Mix,Black/White,8/26/2013,12/23/2013 17:06,2013-12-23T17:06:00,*Donald,,Adoption,Neutered Male,30.45872623,-97.26319225,17.10178571
1798,3 months,A726391,Cat,Domestic Shorthair Mix,Blue Tabby,5/8/2015,8/23/2015 19:26,2015-08-23T19:26:00,*Yarrow,,Adoption,Neutered Male,30.5520842,-97.26989852,15.40138889
1799,1 year,A742448,Dog,Miniature Poodle Mix,Buff,8/2/2013,8/6/2014 18:33,2014-08-06T18:33:00,Abigail,,Adoption,Spayed Female,30.73303944,-97.35816082,52.82470238
1800,1 year,A743983,Dog,Chihuahua Shorthair Mix,Tan,1/29/2016,2/5/2017 11:40,2017-02-05T11:40:00,Star,,Adoption,Spayed Female,30.27508708,-97.58918323,53.35515873
1801,2 years,A679511,Dog,Chihuahua Shorthair Mix,Brown/White,9/26/2013,10/6/2015 16:44,2015-10-06T16:44:00,Lolita,,Return to Owner,Spayed Female,30.33109836,-97.25145711,105.8138889
1802,2 years,A709382,Other,Rabbit Sh Mix,White,9/15/2011,12/8/2013 13:27,2013-12-08T13:27:00,* Henry,Partner,Transfer,Intact Male,30.59304535,-97.4471308,116.508631
1803,12 years,A723221,Dog,Labrador Retriever Mix,Brown,11/10/2003,5/10/2016 14:29,2016-05-10T14:29:00,Diamond,In Kennel,Died,Unknown,30.69021413,-97.71859212,652.2290675
1804,2 months,A743221,Cat,Domestic Longhair Mix,Brown Tabby,11/18/2016,1/25/2017 14:25,2017-01-25T14:25:00,*Sassy,,Adoption,Spayed Female,30.73745421,-97.32583344,9.800099206
1805,3 years,A705111,Dog,Labrador Retriever Mix,White/Fawn,2/20/2014,5/7/2017 14:21,2017-05-07T14:21:00,*Leilani,,Adoption,Spayed Female,30.51471027,-97.41848825,167.5139881
1806,5 years,A746386,Dog,Pit Bull Mix,Blue/White,5/24/2009,5/31/2014 11:28,2014-05-31T11:28:00,Mary Jane,,Return to Owner,Spayed Female,30.64536065,-97.385288,261.9253968
1807,4 months,A715005,Cat,Domestic Shorthair Mix,Black,4/8/2015,8/9/2015 9:00,2015-08-09T09:00:00,,SCRP,Transfer,Intact Male,30.4110124,-97.51868053,17.625
1808,3 years,A682343,Dog,Labrador Retriever Border Collie,Black/White,3/28/2013,3/29/2016 16:03,2016-03-29T16:03:00,Kate,,Return to Owner,Spayed Female,30.51248527,-97.27684475,156.8098214
1809,4 months,A738940,Dog,Australian Cattle Dog Mix,Cream/White,10/6/2016,2/11/2017 17:05,2017-02-11T17:05:00,,,Adoption,Spayed Female,30.45099675,-97.61655063,18.38740079
1810,2 years,A737497,Dog,Chihuahua Shorthair Mix,Brown/Black,6/13/2013,6/24/2015 15:25,2015-06-24T15:25:00,*Kiki,,Adoption,Spayed Female,30.49554316,-97.68977231,105.9489087
1811,1 year,A754517,Dog,Siberian Husky Mix,Black/White,4/1/2016,4/5/2017 12:40,2017-04-05T12:40:00,*Rye,,Adoption,Spayed Female,30.70122704,-97.69921251,52.78968254
1812,2 months,A755901,Cat,Domestic Shorthair Mix,Black,8/29/2015,11/17/2015 0:00,2015-11-17T00:00:00,*Onyx,Partner,Transfer,Spayed Female,30.56403792,-97.6910468,11.42857143
1813,5 months,A716156,Dog,Chihuahua Shorthair Dachshund,Black/Tan,2/28/2014,8/15/2014 18:58,2014-08-15T18:58:00,Lulu,Foster,Adoption,Spayed Female,30.49875801,-97.60651902,24.11289683
1814,6 years,A679980,Cat,Domestic Longhair,Orange Tabby/White,3/30/2010,12/2/2016 14:01,2016-12-02T14:01:00,Sherbert,,Return to Owner,Neutered Male,30.4793097,-97.68096711,348.512004
1815,1 year,A752167,Cat,Domestic Shorthair Mix,Brown Tabby,10/30/2015,10/31/2016 13:56,2016-10-31T13:56:00,Coco,,Return to Owner,Spayed Female,30.4251695,-97.50525282,52.51150794
1816,3 months,A701696,Cat,Domestic Shorthair Mix,Brown Tabby/White,5/6/2017,8/11/2017 14:14,2017-08-11T14:14:00,,Partner,Transfer,Intact Male,30.62423818,-97.48466578,13.94186508
1817,1 year,A761286,Dog,Havanese,Cream,8/10/2016,8/14/2017 12:21,2017-08-14T12:21:00,,Partner,Transfer,Intact Male,30.27050619,-97.54637137,52.78779762
1818,2 years,A682493,Dog,Pointer Border Collie,Black/White,6/5/2013,11/28/2015 17:06,2015-11-28T17:06:00,*Snapper,,Adoption,Neutered Male,30.36870593,-97.65374232,129.5303571
1819,1 year,A732176,Cat,Domestic Shorthair Mix,Black/White,5/28/2013,5/28/2014 8:00,2014-05-28T08:00:00,,SCRP,Transfer,Neutered Male,30.64004474,-97.45335593,52.19047619
1820,1 year,A751687,Dog,Labrador Retriever Mix,Black,6/19/2016,7/1/2017 13:45,2017-07-01T13:45:00,Pippen,,Adoption,Neutered Male,30.31278056,-97.51772974,53.9389881
1821,5 years,A721842,Dog,Jack Russell Terrier Mix,Brown/White,5/3/2010,10/6/2015 13:06,2015-10-06T13:06:00,Hurricane,Partner,Transfer,Spayed Female,30.59574241,-97.37361503,283.2208333
1822,10 years,A529956,Cat,Domestic Shorthair Mix,Orange Tabby/White,11/2/2007,1/21/2018 17:20,2018-01-21T17:20:00,Bob,,Adoption,Neutered Male,30.48712255,-97.67102695,533.3888889
1823,2 years,A700396,Cat,Domestic Shorthair Mix,Orange Tabby/White,6/28/2012,7/18/2014 11:23,2014-07-18T11:23:00,,,Adoption,Neutered Male,30.52400049,-97.60397566,107.2106151
1824,2 months,A673660,Dog,Chow Chow Mix,Tan,6/3/2016,8/7/2016 18:11,2016-08-07T18:11:00,,,Adoption,Spayed Female,30.37345324,-97.63762141,9.393948413
1825,3 months,A670013,Cat,Domestic Shorthair Mix,Black/White,5/6/2017,8/16/2017 0:00,2017-08-16T00:00:00,*Wilson,Partner,Transfer,Neutered Male,30.51620021,-97.56012445,14.57142857
1826,1 year,A744500,Dog,Pit Bull Mix,White/Brown,3/5/2015,5/30/2016 15:19,2016-05-30T15:19:00,*Helena,,Adoption,Spayed Female,30.59881753,-97.61984153,64.66259921
1827,4 years,A718359,Dog,Pit Bull Mix,White/Brown,9/8/2010,9/8/2014 13:41,2014-09-08T13:41:00,Coco,,Return to Owner,Spayed Female,30.6347243,-97.40294217,208.7957341
1828,3 years,A752730,Dog,Pit Bull Mix,Black/White,4/13/2012,12/8/2015 11:45,2015-12-08T11:45:00,Calseta,,Return to Owner,Spayed Female,30.63097268,-97.73089846,190.641369
1829,4 months,A760982,Dog,Australian Shepherd Mix,White/Black,10/28/2013,3/4/2014 18:46,2014-03-04T18:46:00,Loulou,,Adoption,Spayed Female,30.29290766,-97.43863464,18.25456349
1830,2 years,A722352,Dog,Catahoula Alaskan Husky,Tan/White,12/31/2011,1/3/2014 11:05,2014-01-03T11:05:00,Bandit,,Return to Owner,Spayed Female,30.54964299,-97.62617921,104.9231151
1831,4 months,A722303,Dog,Labrador Retriever Mix,Black,10/2/2016,3/2/2017 15:26,2017-03-02T15:26:00,,,Return to Owner,Intact Male,30.29389818,-97.40071526,21.66329365
1832,4 months,A697689,Cat,Domestic Shorthair Mix,Blue,8/28/2015,1/8/2016 19:15,2016-01-08T19:15:00,,SCRP,Transfer,Neutered Male,30.67644804,-97.35652342,19.11458333
1833,3 months,A690332,Cat,Domestic Shorthair Mix,Blue,5/15/2017,9/5/2017 11:42,2017-09-05T11:42:00,Yola,Foster,Adoption,Intact Female,30.73223624,-97.46151827,16.2125
1834,2 years,A729624,Cat,Persian Mix,Orange Tabby,10/27/2015,10/31/2017 16:39,2017-10-31T16:39:00,,,Adoption,Neutered Male,30.6365125,-97.47149975,105.0991071
1835,7 months,A720966,Dog,Labrador Retriever Mix,Black/White,8/15/2015,4/2/2016 18:13,2016-04-02T18:13:00,Zombie,,Adoption,Spayed Female,30.38704966,-97.415768,33.10843254
1836,1 year,A716035,Cat,Domestic Shorthair Mix,Orange Tabby/White,3/14/2015,3/18/2016 16:53,2016-03-18T16:53:00,*Tarleton,,Adoption,Neutered Male,30.30333141,-97.49054688,52.95763889
1837,1 year,A716633,Dog,Flat Coat Retriever Mix,Black/Brown Brindle,8/26/2013,3/24/2015 11:44,2015-03-24T11:44:00,Reptar,,Adoption,Neutered Male,30.49221475,-97.67424969,82.21269841
1838,10 months,A739663,Dog,Pit Bull Mix,Tan/White,12/18/2013,10/26/2014 17:12,2014-10-26T17:12:00,Zeus,,Adoption,Neutered Male,30.37118812,-97.30974011,44.67380952
1839,1 month,A682584,Cat,Domestic Shorthair Mix,Brown Tabby/White,5/25/2016,7/21/2016 18:00,2016-07-21T18:00:00,*Baxter,,Adoption,Neutered Male,30.68239899,-97.41907665,8.25
1840,1 year,A673433,Dog,Border Collie,Blue Merle,2/18/2015,3/14/2016 13:46,2016-03-14T13:46:00,*Aspen,Partner,Transfer,Intact Female,30.62872188,-97.37152863,55.79623016
1841,4 months,A752199,Cat,Domestic Shorthair Mix,Brown Tabby/White,7/29/2015,11/29/2015 17:15,2015-11-29T17:15:00,Starbucks,,Adoption,Intact Male,30.46998038,-97.74048448,17.67410714
1842,1 year,A706917,Cat,Domestic Shorthair Mix,Tortie,11/22/2014,11/26/2015 20:20,2015-11-26T20:20:00,,SCRP,Transfer,Intact Female,30.65052974,-97.59154036,52.83531746
1843,1 year,A674787,Dog,Siberian Husky Mix,Black/White,12/5/2015,12/9/2016 17:47,2016-12-09T17:47:00,Rocky,,Return to Owner,Neutered Male,30.58635321,-97.64609167,52.96299603
1844,1 year,A760566,Dog,Chihuahua Shorthair Mix,Tan/White,6/30/2013,7/13/2014 16:48,2014-07-13T16:48:00,,,Adoption,Neutered Male,30.57392794,-97.55202573,54.1
1845,2 years,A742776,Dog,German Shepherd Mix,Sable,2/24/2012,3/18/2014 14:17,2014-03-18T14:17:00,Rocko,,Adoption,Neutered Male,30.7491227,-97.25343404,107.6564484
1846,2 months,A764373,Cat,Domestic Shorthair Mix,Calico/Brown,4/19/2017,6/28/2017 18:20,2017-06-28T18:20:00,,,Adoption,Spayed Female,30.38821123,-97.43929927,10.10912698
1847,12 years,A692875,Dog,German Shepherd Mix,Brown/Black,7/5/2003,7/7/2015 15:07,2015-07-07T15:07:00,Duke,,Return to Owner,Neutered Male,30.44254818,-97.7079191,626.5185516
1848,8 months,A714574,Dog,Jack Russell Terrier Shih Tzu,Chocolate/Brown,7/18/2013,3/28/2014 18:18,2014-03-28T18:18:00,Hercules,,Return to Owner,Neutered Male,30.65745063,-97.48020467,36.25178571
1849,2 months,A751051,Cat,Domestic Medium Hair Mix,Tortie,9/8/2017,11/30/2017 13:56,2017-11-30T13:56:00,*Lydia,,Adoption,Intact Female,30.69919672,-97.24333038,11.94007937
1850,9 years,A755447,Dog,Dachshund,Black/Tan,1/27/2008,2/1/2017 13:09,2017-02-01T13:09:00,*Franzi,Partner,Transfer,Spayed Female,30.69240854,-97.33076413,470.5068452
1851,1 year,A703475,Dog,Alaskan Husky Mix,Black/White,12/28/2016,1/2/2018 16:37,2018-01-02T16:37:00,Max,,Adoption,Neutered Male,30.4790155,-97.2867024,52.95605159
1852,1 month,A752655,Cat,Domestic Shorthair Mix,Black/White,10/24/2014,12/23/2014 11:17,2014-12-23T11:17:00,*Rembrandt,,Adoption,Neutered Male,30.62634838,-97.28394083,8.63859127
1853,9 months,A708485,Cat,Domestic Shorthair Mix,Blue,1/25/2015,10/29/2015 19:46,2015-10-29T19:46:00,*Robin,SCRP,Transfer,Intact Female,30.68261928,-97.47440001,39.6890873
1854,1 year,A731757,Cat,Domestic Shorthair Mix,Brown Tabby/White,6/3/2016,6/4/2017 16:41,2017-06-04T16:41:00,,Rabies Risk,Euthanasia,Unknown,30.64020428,-97.27678183,52.38501984
1855,2 months,A668981,Cat,Domestic Shorthair Mix,Black/White,6/3/2017,8/18/2017 13:09,2017-08-18T13:09:00,*Mike,Partner,Transfer,Intact Male,30.33256351,-97.62922707,10.93541667
1856,6 months,A697765,Dog,Pit Bull Mix,White/Tan,11/10/2014,5/29/2015 15:33,2015-05-29T15:33:00,*Dotty,Partner,Transfer,Intact Female,30.60576756,-97.6780155,28.6639881
1857,6 years,A694738,Cat,Domestic Medium Hair Mix,Black,6/28/2011,7/12/2017 15:13,2017-07-12T15:13:00,*Patti,Suffering,Euthanasia,Spayed Female,30.45465388,-97.4329884,315.2334325
1858,2 months,A744598,Cat,Domestic Shorthair Mix,Tortie,5/4/2015,7/29/2015 9:00,2015-07-29T09:00:00,*Snickers,SCRP,Transfer,Spayed Female,30.44774309,-97.41750582,12.33928571
1859,4 months,A657360,Cat,Domestic Shorthair Mix,Black/Blue,3/27/2016,7/28/2016 9:00,2016-07-28T09:00:00,,SCRP,Transfer,Neutered Male,30.38989236,-97.47048117,17.625
1860,12 years,A746471,Cat,Domestic Shorthair Mix,Orange Tabby,12/12/2001,12/16/2013 13:05,2013-12-16T13:05:00,Rudolph,Suffering,Euthanasia,Intact Male,30.50606505,-97.6372879,626.7921627
1861,4 years,A681961,Dog,Chinese Sharpei Mix,Brown,2/27/2013,4/2/2017 14:20,2017-04-02T14:20:00,Louise,,Return to Owner,Spayed Female,30.70271719,-97.60735182,213.656746
1862,4 years,A670767,Dog,Boxer Staffordshire,Brown Brindle/White,1/3/2012,2/28/2016 14:45,2016-02-28T14:45:00,Moxie,,Return to Owner,Spayed Female,30.70609725,-97.37656678,216.8020833
1863,1 year,A673364,Dog,Cairn Terrier Mix,Tan/White,3/3/2016,3/8/2017 19:21,2017-03-08T19:21:00,,,Adoption,Neutered Male,30.67045056,-97.6802287,52.97232143
1864,3 years,A741366,Dog,Chihuahua Shorthair Mix,Brown/White,8/26/2012,12/19/2015 17:58,2015-12-19T17:58:00,Panzon,Partner,Transfer,Neutered Male,30.38033608,-97.60829546,172.9640873
1865,2 years,A737266,Dog,Chihuahua Shorthair Mix,White/Tan,10/3/2014,4/3/2017 17:53,2017-04-03T17:53:00,Lucky,,Return to Owner,Intact Male,30.7474779,-97.39466698,130.5350198
1866,4 months,A693816,Cat,Domestic Shorthair Mix,Black,4/30/2014,9/11/2014 11:58,2014-09-11T11:58:00,,Foster,Adoption,Spayed Female,30.48513691,-97.39607968,19.2140873
1867,3 years,A715156,Dog,Chinese Sharpei Mix,Tan,1/14/2011,1/15/2014 17:15,2014-01-15T17:15:00,Chato,,Return to Owner,Neutered Male,30.72113164,-97.51893946,156.8169643
1868,6 months,A672549,Cat,Domestic Shorthair Mix,Brown Tabby/White,8/22/2013,2/22/2014 18:21,2014-02-22T18:21:00,Haley,,Return to Owner,Spayed Female,30.71173343,-97.53579623,26.39494048
1869,1 year,A666523,Dog,Norwich Terrier Mix,Tan,12/31/2015,1/5/2017 17:25,2017-01-05T17:25:00,,,Adoption,Neutered Male,30.33043666,-97.53132249,53.10367063
1870,10 years,A698837,Cat,Domestic Shorthair Mix,Orange Tabby,10/25/2006,10/25/2016 12:59,2016-10-25T12:59:00,,Partner,Transfer,Neutered Male,30.55225531,-97.5529424,521.9344246
1871,1 year,A715320,Dog,Rat Terrier Mix,Brown/White,12/15/2013,1/18/2015 20:03,2015-01-18T20:03:00,,Offsite,Adoption,Neutered Male,30.65571161,-97.7037928,57.11934524
1872,2 years,A682948,Other,Rat,Tan,11/1/2013,11/12/2015 13:39,2015-11-12T13:39:00,,Partner,Transfer,Unknown,30.44740194,-97.3604392,105.9383929
1873,1 year,A670572,Dog,Pit Bull Mix,Black/White,2/12/2013,2/24/2014 16:59,2014-02-24T16:59:00,Aries,,Adoption,Neutered Male,30.56002267,-97.44399229,53.95823413
1874,10 years,A723593,Dog,Chesa Bay Retr Mix,Brown,11/2/2003,11/13/2013 11:30,2013-11-13T11:30:00,Archie,Partner,Transfer,Neutered Male,30.32863392,-97.51628036,523.4970238
1875,2 years,A682785,Cat,Siamese Mix,Tortie Point,3/12/2015,1/15/2018 15:33,2018-01-15T15:33:00,Nora,Partner,Transfer,Spayed Female,30.69420837,-97.5629656,148.6639881
1876,3 months,A709687,Cat,Domestic Shorthair Mix,Tortie,8/3/2015,11/14/2015 12:17,2015-11-14T12:17:00,,,Adoption,Spayed Female,30.4501269,-97.71147728,14.78740079
1877,4 months,A690507,Cat,Domestic Medium Hair Mix,Black/White,6/5/2014,10/30/2014 18:45,2014-10-30T18:45:00,*Rain,,Adoption,Spayed Female,30.40118527,-97.27579518,21.11160714
1878,2 months,A674080,Cat,Domestic Shorthair Mix,White/Brown Tabby,10/28/2013,1/12/2014 17:54,2014-01-12T17:54:00,Echo,,Adoption,Spayed Female,30.59987236,-97.44011914,10.96369048
1879,2 days,A692797,Cat,Domestic Shorthair Mix,Tortie/Blue,4/3/2016,4/5/2016 15:23,2016-04-05T15:23:00,,Partner,Transfer,Intact Female,30.41271068,-97.69750003,0.377281746
1880,2 years,A693388,Dog,Australian Kelpie Mix,Black/Brown,7/2/2012,7/13/2014 13:42,2014-07-13T13:42:00,Lilly,,Adoption,Spayed Female,30.55964976,-97.42257033,105.9386905
1881,7 months,A620883,Dog,Labrador Retriever Mix,Black/White,2/12/2015,10/12/2015 12:17,2015-10-12T12:17:00,*Rooney,Partner,Transfer,Neutered Male,30.39884367,-97.71147647,34.64454365
1882,1 year,A680184,Cat,Domestic Shorthair Mix,Brown Tabby,11/9/2013,11/25/2014 18:33,2014-11-25T18:33:00,,SCRP,Transfer,Intact Female,30.56712421,-97.73396092,54.5389881
1883,4 weeks,A701864,Other,Bat,Brown/Black,2/7/2014,3/7/2014 10:46,2014-03-07T10:46:00,,Rabies Risk,Euthanasia,Unknown,30.70221812,-97.72012467,4.064087302
1884,4 years,A676712,Dog,Miniature Poodle Mix,White,11/25/2010,11/22/2015 13:51,2015-11-22T13:51:00,Suzze,,Adoption,Spayed Female,30.48059566,-97.43904178,260.5110119
1885,8 years,A688823,Dog,Parson Russell Terrier Beagle,White/Brown,12/10/2006,3/15/2015 18:05,2015-03-15T18:05:00,Cowboy,,Adoption,Neutered Male,30.746583,-97.69451324,431.1076389
1886,4 years,A701136,Dog,Labrador Retriever Mix,Black,2/26/2010,11/4/2014 14:01,2014-11-04T14:01:00,Sadie,,Adoption,Spayed Female,30.6480124,-97.40384716,244.6548611
1887,1 year,A692642,Cat,Domestic Shorthair Mix,Brown Tabby,5/30/2013,6/13/2014 11:54,2014-06-13T11:54:00,Akasha,,Adoption,Spayed Female,30.51789122,-97.32848355,54.21369048
1888,1 year,A739887,Other,Opossum,Gray,5/5/2014,5/5/2015 15:33,2015-05-05T15:33:00,,Rabies Risk,Euthanasia,Intact Female,30.7317359,-97.37511907,52.23541667
1889,4 years,A664363,Dog,Maltese Mix,White,4/14/2010,4/15/2014 17:57,2014-04-15T17:57:00,Gala,,Return to Owner,Spayed Female,30.65515207,-97.43958653,208.9639881
1890,2 years,A707873,Cat,Domestic Shorthair Mix,Black Smoke/White,8/25/2014,8/27/2016 15:04,2016-08-27T15:04:00,Kevin,Foster,Adoption,Neutered Male,30.27567416,-97.71120311,104.8039683
1891,2 years,A686093,Dog,American Bulldog Mix,White/Blue,4/24/2013,4/24/2015 17:59,2015-04-24T17:59:00,Mexico,,Return to Owner,Intact Male,30.58453994,-97.56195286,104.3927579
1892,1 year,A668408,Dog,Chihuahua Shorthair,Tan/White,11/23/2013,8/27/2015 18:33,2015-08-27T18:33:00,Millie,,Return to Owner,Spayed Female,30.64596597,-97.57993788,91.82470238
1893,2 years,A759082,Dog,German Shepherd Mix,Tan/White,12/8/2014,12/13/2016 18:06,2016-12-13T18:06:00,,,Adoption,Spayed Female,30.71696878,-97.66957561,105.2505952
1894,3 years,A720044,Dog,Labrador Retriever German Shepherd,White,4/2/2010,10/12/2013 18:50,2013-10-12T18:50:00,,,Adoption,Spayed Female,30.3551174,-97.46355233,184.2549603
1895,1 year,A760258,Dog,Queensland Heeler,Red Tick/White,4/27/2015,6/11/2016 13:34,2016-06-11T13:34:00,Missy,,Adoption,Spayed Female,30.35251383,-97.27331901,58.79503968
1896,4 months,A705996,Cat,Domestic Shorthair Mix,Brown Tabby/White,4/7/2014,8/23/2014 16:51,2014-08-23T16:51:00,Mouse,Partner,Transfer,Spayed Female,30.34239291,-97.72800639,19.81458333
1897,1 year,A701472,Cat,Domestic Shorthair Mix,Lynx Point/Gray Tabby,12/3/2012,12/16/2013 14:38,2013-12-16T14:38:00,Eberhart,SCRP,Transfer,Neutered Male,30.44336706,-97.67870772,54.08710317
1898,8 months,A735434,Dog,Great Pyrenees Mix,White,1/26/2017,9/27/2017 18:43,2017-09-27T18:43:00,,,Return to Owner,Intact Female,30.30872895,-97.56748,34.96855159
1899,10 years,A751124,Cat,Domestic Shorthair Mix,Brown Tabby,2/1/2006,2/1/2016 15:57,2016-02-01T15:57:00,Cat,,Return to Owner,Neutered Male,30.5376052,-97.42033529,521.8092262
1900,2 years,A579608,Dog,Miniature Poodle Mix,White/White,10/15/2015,10/19/2017 17:58,2017-10-19T17:58:00,,Partner,Transfer,Spayed Female,30.36819153,-97.55965668,105.1069444
1901,10 years,A729530,Dog,Toy Poodle Mix,Gray,6/23/2005,6/29/2015 12:19,2015-06-29T12:19:00,Betsy,,Adoption,Spayed Female,30.66508498,-97.50748091,522.6447421
1902,2 weeks,A736154,Cat,Domestic Shorthair Mix,Blue Tabby/White,4/11/2015,4/30/2015 12:52,2015-04-30T12:52:00,,Partner,Transfer,Intact Female,30.56172678,-97.73689075,2.790873016
1903,6 months,A674306,Cat,Domestic Shorthair,Brown Tabby,3/23/2016,10/16/2016 18:48,2016-10-16T18:48:00,*Dozer,,Adoption,Neutered Male,30.52491907,-97.34581787,29.68333333
1904,2 years,A683812,Cat,Domestic Shorthair Mix,Orange Tabby,6/4/2015,6/9/2017 18:28,2017-06-09T18:28:00,,Snr,Transfer,Neutered Male,30.68853438,-97.41461586,105.2527778
1905,4 years,A731581,Dog,Labrador Retriever Mix,Black/White,6/9/2010,7/21/2014 12:43,2014-07-21T12:43:00,Max,,Return to Owner,Neutered Male,30.45516021,-97.72110951,214.7899802
1906,1 year,A723017,Cat,Domestic Shorthair Mix,Brown Tabby,6/19/2015,6/26/2016 0:00,2016-06-26T00:00:00,*Tina,Partner,Transfer,Intact Female,30.48829259,-97.30685021,53.28571429
1907,4 weeks,A753996,Cat,Domestic Medium Hair Mix,Black,9/5/2016,10/5/2016 19:33,2016-10-05T19:33:00,,Partner,Transfer,Intact Male,30.68802924,-97.70290792,4.402083333
1908,3 years,A706629,Dog,Chihuahua Shorthair Mix,Black/White,3/11/2011,3/20/2014 14:27,2014-03-20T14:27:00,*Blackbird,Partner,Transfer,Spayed Female,30.38733753,-97.73387772,157.9431548
1909,3 years,A674706,Cat,Domestic Shorthair Mix,Black/White,7/15/2011,8/19/2014 11:39,2014-08-19T11:39:00,Squishy,Partner,Transfer,Spayed Female,30.73623606,-97.41518903,161.6407738
1910,4 weeks,A688877,Dog,Plott Hound Mix,Black,7/24/2016,8/25/2016 0:00,2016-08-25T00:00:00,,Partner,Transfer,Intact Female,30.44629616,-97.70783628,4.571428571
1911,1 year,A683331,Dog,Jack Russell Terrier Mix,White/Black,3/25/2015,4/6/2016 15:25,2016-04-06T15:25:00,*Spotz,,Adoption,Neutered Male,30.54020332,-97.48216811,54.09176587
1912,2 months,A756090,Dog,Jack Russell Terrier Pembroke Welsh Corgi,Brown,5/14/2017,7/18/2017 17:09,2017-07-18T17:09:00,Ginger,,Adoption,Spayed Female,30.4890566,-97.34411753,9.387797619
1913,1 year,A698931,Cat,Domestic Shorthair Mix,Brown Tabby/White,7/1/2014,7/2/2015 9:00,2015-07-02T09:00:00,,SCRP,Transfer,Intact Male,30.46021176,-97.43741118,52.33928571
1914,5 months,A664222,Cat,Domestic Shorthair Mix,Brown Tabby,9/17/2013,3/18/2014 15:01,2014-03-18T15:01:00,,SCRP,Transfer,Unknown,30.64363851,-97.5882983,26.08938492
1915,6 months,A714688,Cat,Domestic Shorthair Mix,Tortie,3/25/2014,9/27/2014 9:00,2014-09-27T09:00:00,,SCRP,Transfer,Intact Female,30.4422947,-97.67827408,26.625
1916,1 year,A761030,Cat,Domestic Shorthair Mix,Blue Tabby,7/9/2013,7/21/2014 10:43,2014-07-21T10:43:00,,Partner,Transfer,Spayed Female,30.32860984,-97.58087463,53.92093254
1917,2 months,A733720,Cat,American Shorthair Mix,Black/White,7/26/2017,10/6/2017 16:46,2017-10-06T16:46:00,,,Adoption,Spayed Female,30.46452715,-97.67561682,10.38551587
1918,3 years,A727670,Dog,Bloodhound Mix,Red/Black,3/19/2012,3/20/2015 11:24,2015-03-20T11:24:00,,,Return to Owner,Intact Male,30.36383138,-97.39301776,156.6392857
1919,7 months,A703955,Dog,Chihuahua Shorthair Dachshund,Black/Tan,3/30/2013,11/18/2013 14:59,2013-11-18T14:59:00,*Rosie,,Adoption,Spayed Female,30.36180986,-97.4165929,33.37490079
1920,1 year,A664172,Cat,Domestic Medium Hair Mix,Black/White,10/27/2014,10/27/2015 9:00,2015-10-27T09:00:00,,SCRP,Transfer,Intact Female,30.44698917,-97.63182179,52.19642857
1921,6 months,A710167,Bird,Chicken Mix,Brown,4/27/2017,10/31/2017 0:00,2017-10-31T00:00:00,Taffy,Partner,Transfer,Intact Male,30.42275123,-97.6549002,26.71428571
1922,1 year,A712044,Cat,Domestic Shorthair Mix,Brown Tabby,8/26/2015,8/26/2016 14:58,2016-08-26T14:58:00,,Partner,Transfer,Intact Male,30.33254018,-97.28767228,52.37480159
1923,3 years,A763110,Cat,Domestic Shorthair Mix,Blue/White,5/24/2013,8/20/2016 16:29,2016-08-20T16:29:00,Marley,,Adoption,Spayed Female,30.6234361,-97.28622987,169.2409722
1924,9 years,A650104,Dog,Golden Retriever Mix,Red,5/31/2006,6/2/2015 14:42,2015-06-02T14:42:00,Lady,,Return to Owner,Spayed Female,30.64069884,-97.71622505,469.9446429
1925,15 years,A760069,Cat,Maine Coon Mix,Brown Tabby,9/30/1998,10/3/2013 19:00,2013-10-03T19:00:00,Spider,,Return to Owner,Neutered Male,30.74623413,-97.66042105,783.2559524
1926,2 months,A741165,Cat,Domestic Shorthair Mix,Brown Tabby/White,7/30/2015,10/27/2015 12:12,2015-10-27T12:12:00,*Skeeter,,Adoption,Neutered Male,30.61506647,-97.3607654,12.78690476
1927,2 months,A753075,Dog,German Shepherd Labrador Retriever,Red/Black,7/16/2015,9/22/2015 18:09,2015-09-22T18:09:00,*Owen,,Adoption,Neutered Male,30.28745377,-97.33587601,9.822321429
1928,2 months,A710347,Dog,Border Collie Mix,Black/White,11/3/2017,1/12/2018 17:06,2018-01-12T17:06:00,,Foster,Adoption,Spayed Female,30.42103378,-97.44274387,10.10178571
1929,3 years,A647363,Dog,Australian Kelpie Mix,Black/Tan,3/24/2010,10/15/2013 17:28,2013-10-15T17:28:00,Katie,Suffering,Euthanasia,Intact Female,30.34742491,-97.56879347,185.9611111
1930,2 years,A673128,Dog,Labrador Retriever Mix,Black/White,10/12/2015,10/21/2017 15:08,2017-10-21T15:08:00,Solar,,Adoption,Spayed Female,30.72719868,-97.50751932,105.8043651
1931,2 years,A686725,Dog,German Shepherd Mix,Brown/Black,12/28/2014,8/23/2017 8:53,2017-08-23T08:53:00,Lucy,Foster,Adoption,Spayed Female,30.42557681,-97.49116285,138.4814484
1932,2 months,A684525,Cat,Domestic Shorthair Mix,Black,4/16/2017,7/9/2017 18:17,2017-07-09T18:17:00,Nina Rae,,Adoption,Spayed Female,30.59646164,-97.53553704,12.10882937
1933,10 months,A720396,Dog,Labrador Retriever Mix,Black,12/28/2014,10/31/2015 15:21,2015-10-31T15:21:00,Lulu,,Adoption,Spayed Female,30.47720675,-97.60190133,43.9485119
1934,2 years,A721317,Dog,Labrador Retriever Mix,White/Red,11/9/2012,11/14/2014 14:09,2014-11-14T14:09:00,Daisy,,Return to Owner,Spayed Female,30.34951741,-97.40937495,105.0842262
1935,1 year,A697451,Dog,German Shepherd Mix,Black/Tan,4/19/2013,5/25/2014 16:53,2014-05-25T16:53:00,Star,,Return to Owner,Spayed Female,30.53052322,-97.31027831,57.38621032
1936,1 year,A545772,Dog,Pit Bull Mix,Blue/White,8/25/2013,8/29/2014 13:55,2014-08-29T13:55:00,Nala,,Return to Owner,Spayed Female,30.28973783,-97.28672177,52.79712302
1937,4 weeks,A749527,Other,Bat,Brown/Black,6/24/2014,7/25/2014 8:47,2014-07-25T08:47:00,,,Disposal,Unknown,30.6271913,-97.72116319,4.480853175
1938,3 months,A706246,Cat,Domestic Shorthair Mix,Brown Tabby/White,2/8/2016,5/13/2016 14:51,2016-05-13T14:51:00,*Hunter,Foster,Adoption,Spayed Female,30.50274401,-97.50344485,13.65982143
1939,3 years,A760059,Dog,Pit Bull Mix,Black,2/24/2013,5/21/2016 14:55,2016-05-21T14:55:00,Sophie,Partner,Transfer,Spayed Female,30.62049373,-97.71306918,168.9459325
1940,3 years,A754078,Dog,Miniature Schnauzer Cairn Terrier,Gray/Black,2/24/2012,6/7/2015 17:59,2015-06-07T17:59:00,Clover,,Adoption,Spayed Female,30.73979503,-97.36768369,171.3927579
1941,7 years,A729380,Dog,Plott Hound Mastiff,Brown Brindle,6/6/2007,12/15/2014 17:53,2014-12-15T17:53:00,Kibbeh,Foster,Adoption,Neutered Male,30.64956024,-97.41032552,392.8207341
1942,2 years,A760490,Dog,Border Collie Mix,White,12/16/2014,6/2/2017 15:34,2017-06-02T15:34:00,Arista,,Return to Owner,Spayed Female,30.38115601,-97.46250412,128.5212302
1943,2 weeks,A699383,Cat,Domestic Shorthair Mix,Black/White,6/11/2015,6/26/2015 17:13,2015-06-26T17:13:00,,Partner,Transfer,Intact Male,30.59397915,-97.56538643,2.245337302
1944,2 years,A757623,Cat,Domestic Shorthair Mix,Gray Tabby/White,10/11/2015,10/19/2017 16:10,2017-10-19T16:10:00,Kitty,,Adoption,Spayed Female,30.33265979,-97.39949586,105.6676587
1945,4 months,A656444,Cat,Domestic Shorthair Mix,Calico,3/31/2017,8/9/2017 18:59,2017-08-09T18:59:00,*Auri,,Adoption,Spayed Female,30.32098235,-97.49012338,18.82728175
1946,2 months,A701482,Cat,Domestic Shorthair Mix,Black Smoke,5/17/2016,8/11/2016 11:20,2016-08-11T11:20:00,*Poppy,Foster,Adoption,Neutered Male,30.52259436,-97.47403667,12.3531746
1947,2 years,A689337,Cat,Domestic Shorthair Mix,Brown Tabby/White,10/19/2015,10/31/2017 16:43,2017-10-31T16:43:00,*Scooter,,Adoption,Neutered Male,30.47163664,-97.74090515,106.2423611
1948,1 year,A701772,Dog,Australian Shepherd Mix,Red/White,12/26/2013,3/29/2015 16:06,2015-03-29T16:06:00,Taylor Daisy,,Adoption,Spayed Female,30.4601985,-97.39104777,65.52440476
1949,2 years,A702049,Dog,Boxer Mix,Black/White,9/4/2015,10/4/2017 17:32,2017-10-04T17:32:00,119,Partner,Transfer,Intact Female,30.28470446,-97.6814871,108.8186508
1950,1 year,A678897,Dog,Catahoula Mix,White/Tan,10/14/2012,2/13/2014 15:50,2014-02-13T15:50:00,*Paige,Foster,Adoption,Spayed Female,30.65093836,-97.39257351,69.6656746
1951,1 year,A761419,Cat,Domestic Longhair Mix,Brown Tabby,4/30/2014,6/23/2015 13:40,2015-06-23T13:40:00,*Lavender,Partner,Transfer,Spayed Female,30.4560226,-97.71702355,59.93849206
1952,2 months,A677747,Dog,Border Collie Mix,Chocolate/White,7/26/2014,10/6/2014 19:05,2014-10-06T19:05:00,*Eva,,Adoption,Spayed Female,30.44722599,-97.47912254,10.39930556
1953,3 years,A719251,Dog,German Shepherd Mix,Black/White,5/4/2012,5/27/2015 0:00,2015-05-27T00:00:00,Dimond,Partner,Transfer,Spayed Female,30.65097813,-97.31927966,159.7142857
1954,1 weeks,A735301,Cat,Domestic Shorthair Mix,Blue Tabby,4/28/2015,5/8/2015 14:59,2015-05-08T14:59:00,,Partner,Transfer,Unknown,30.29014273,-97.63831015,1.517757937
1955,8 months,A601748,Dog,Boxer Pit Bull,Tan/White,9/14/2013,5/20/2014 17:36,2014-05-20T17:36:00,Polo,,Adoption,Neutered Male,30.63629476,-97.69318512,35.53333333
1956,2 months,A688497,Cat,Domestic Medium Hair Mix,Black,9/4/2017,11/17/2017 14:59,2017-11-17T14:59:00,,,Adoption,Neutered Male,30.45744386,-97.71367208,10.66061508
1957,1 year,A703933,Dog,Cairn Terrier,White,12/28/2012,5/3/2014 7:48,2014-05-03T07:48:00,,Offsite,Adoption,Spayed Female,30.7319225,-97.2732842,70.18928571
1958,1 year,A673558,Dog,Pit Bull Mix,White/Blue,1/16/2015,2/14/2016 13:26,2016-02-14T13:26:00,*Abigail,,Adoption,Spayed Female,30.54590081,-97.62629359,56.3656746
1959,2 years,A669887,Other,Opossum Mix,Gray/Black,9/22/2014,9/22/2016 9:30,2016-09-22T09:30:00,,Suffering,Euthanasia,Unknown,30.27542175,-97.57578306,104.485119
1960,3 years,A732395,Cat,Siamese Mix,Seal Point,5/8/2011,1/28/2015 11:36,2015-01-28T11:36:00,Sam,,Return to Owner,Neutered Male,30.64896899,-97.40713168,194.497619
1961,2 years,A733167,Cat,Domestic Shorthair Mix,Orange Tabby,9/20/2012,9/25/2014 19:19,2014-09-25T19:19:00,,SCRP,Transfer,Intact Male,30.61679765,-97.53436047,105.1149802
1962,2 years,A679049,Dog,German Shepherd Mix,Brown/Black,5/30/2013,5/31/2015 11:10,2015-05-31T11:10:00,Lucy,,Return to Owner,Spayed Female,30.3266962,-97.60895314,104.4950397
1963,1 year,A740053,Dog,St  Bernard Smooth Coat Anatol Shepherd,White/Brown Brindle,3/13/2013,3/13/2014 18:24,2014-03-13T18:24:00,*Gus,,Adoption,Neutered Male,30.65818685,-97.60863319,52.25238095
1964,7 years,A683525,Dog,Plott Hound Labrador Retriever,Black Brindle/Brown,12/29/2006,8/15/2014 14:08,2014-08-15T14:08:00,*Lorna,,Adoption,Spayed Female,30.57170411,-97.54923618,398.084127
1965,5 months,A738366,Dog,Manchester Terrier Chihuahua Shorthair,Tricolor,3/3/2016,8/18/2016 17:40,2016-08-18T17:40:00,Sam,,Adoption,Neutered Male,30.47513942,-97.2931542,24.10515873
1966,3 weeks,A664310,Cat,Domestic Shorthair Mix,Orange Tabby/White,7/27/2016,8/18/2016 12:59,2016-08-18T12:59:00,,Partner,Transfer,Unknown,30.3817738,-97.30221554,3.220138889
1967,6 years,A706012,Dog,Labrador Retriever Mix,Yellow,1/10/2008,5/21/2014 14:41,2014-05-21T14:41:00,Pilot,,Return to Owner,Neutered Male,30.73524826,-97.5601049,331.9445437
1968,1 year,A749739,Cat,Domestic Shorthair Mix,Cream Tabby,12/10/2015,1/18/2017 14:03,2017-01-18T14:03:00,*Oscar,Partner,Transfer,Neutered Male,30.39314866,-97.25363585,57.94077381
1969,1 month,A752288,Cat,Domestic Medium Hair,Blue/White,6/6/2014,7/14/2014 15:23,2014-07-14T15:23:00,,Partner,Transfer,Intact Male,30.71824656,-97.43880552,5.520138889
1970,6 months,A747524,Other,Raccoon Mix,Gray/Black,5/13/2016,11/13/2016 17:51,2016-11-13T17:51:00,,Rabies Risk,Euthanasia,Unknown,30.71425147,-97.65156849,26.39196429
1971,1 year,A668632,Cat,Domestic Medium Hair Mix,Orange Tabby/White,10/1/2012,1/1/2014 14:57,2014-01-01T14:57:00,Chan,,Return to Owner,Neutered Male,30.68995244,-97.52233012,65.37470238
1972,3 weeks,A706373,Cat,Domestic Medium Hair Mix,Blue,6/1/2015,6/23/2015 17:17,2015-06-23T17:17:00,,Partner,Transfer,Unknown,30.7549594,-97.62373023,3.245734127
1973,1 day,A746332,Dog,Chihuahua Shorthair Mix,Black/White,5/18/2017,5/19/2017 10:20,2017-05-19T10:20:00,,Partner,Transfer,Intact Male,30.52463278,-97.38624053,0.204365079
1974,2 years,A687711,Dog,Australian Shepherd Mix,Black/White,6/20/2015,6/24/2017 17:26,2017-06-24T17:26:00,,,Adoption,Spayed Female,30.73459171,-97.62970144,105.1037698
1975,1 year,A705846,Dog,Border Terrier Mix,Black/Tan,10/20/2015,6/18/2017 15:10,2017-06-18T15:10:00,*Nanette,,Adoption,Spayed Female,30.28340987,-97.58329945,86.80456349
1976,3 years,A694601,Dog,German Shepherd Labrador Retriever,Black,12/6/2010,12/6/2013 13:52,2013-12-06T13:52:00,,Suffering,Euthanasia,Intact Female,30.48191538,-97.51108122,156.6539683
1977,5 months,A761120,Dog,Golden Retriever Whippet,Red/Gold,1/13/2015,7/2/2015 11:38,2015-07-02T11:38:00,Howie,Partner,Transfer,Intact Male,30.67629982,-97.58079596,24.35496032
1978,6 years,A698800,Dog,Chihuahua Shorthair Mix,Black/Tan,3/31/2011,3/31/2017 16:36,2017-03-31T16:36:00,Flaco,,Return to Owner,Neutered Male,30.53346943,-97.42142468,313.2416667
1979,7 months,A674712,Dog,Pointer Mix,Brown Brindle/White,4/9/2014,11/27/2014 13:55,2014-11-27T13:55:00,Zucchini,,Return to Owner,Neutered Male,30.50959479,-97.44337159,33.22569444
1980,2 years,A718617,Dog,Chihuahua Shorthair Mix,Red,6/22/2013,6/29/2015 14:04,2015-06-29T14:04:00,Bee Bee,Partner,Transfer,Neutered Male,30.54465693,-97.33911252,105.3694444
1981,6 months,A721454,Cat,Domestic Shorthair Mix,Black,7/1/2014,1/6/2015 18:37,2015-01-06T18:37:00,*Barnaby,,Adoption,Neutered Male,30.71695227,-97.53068662,27.11081349
1982,5 months,A717694,Dog,Pit Bull Mix,Black/White,5/14/2017,11/8/2017 9:47,2017-11-08T09:47:00,*Brenna,Partner,Transfer,Spayed Female,30.3407426,-97.70927293,25.48680556
1983,4 years,A762781,Dog,Siberian Husky Mix,Sable,3/18/2011,3/19/2015 12:45,2015-03-19T12:45:00,Emma,,Return to Owner,Spayed Female,30.64249563,-97.52309804,208.9330357
1984,2 months,A756284,Dog,Pug Beagle,Brown/White,12/17/2013,3/18/2014 19:12,2014-03-18T19:12:00,,,Adoption,Neutered Male,30.63339718,-97.38011833,13.11428571
1985,1 year,A700580,Cat,Domestic Shorthair Mix,Torbie,1/3/2015,1/8/2016 18:59,2016-01-08T18:59:00,,SCRP,Transfer,Spayed Female,30.46010428,-97.43446479,52.97013889
1986,1 year,A702644,Dog,Miniature Schnauzer Miniature Poodle,Black/Tan,2/27/2015,3/3/2016 15:45,2016-03-03T15:45:00,,Partner,Transfer,Neutered Male,30.58784787,-97.29782409,52.95089286
1987,2 years,A756951,Dog,Pointer Mix,White/Brown,1/12/2015,5/11/2017 13:24,2017-05-11T13:24:00,Scooby,,Return to Owner,Neutered Male,30.35088069,-97.34534497,121.5083333
1988,1 year,A752724,Dog,Labrador Retriever Mix,Black/White,11/27/2016,12/3/2017 13:09,2017-12-03T13:09:00,,Partner,Transfer,Intact Female,30.28401112,-97.46005422,53.07827381
1989,1 year,A735138,Dog,Yorkshire Terrier Mix,White/Tricolor,8/17/2016,8/21/2017 18:26,2017-08-21T18:26:00,,,Adoption,Spayed Female,30.4580248,-97.45770669,52.82400794
1990,1 weeks,A741672,Cat,Domestic Shorthair Mix,Black,4/4/2015,4/16/2015 15:08,2015-04-16T15:08:00,,Partner,Transfer,Unknown,30.63496805,-97.24650447,1.804365079
1991,1 year,A662156,Other,Squirrel,Gray,5/16/2014,5/16/2015 15:04,2015-05-16T15:04:00,,Suffering,Euthanasia,Intact Male,30.64717251,-97.45605642,52.23253968
1992,7 months,A714163,Cat,Domestic Shorthair Mix,Brown Tabby/White,1/28/2017,9/4/2017 17:42,2017-09-04T17:42:00,,,Adoption,Spayed Female,30.69013936,-97.48180805,31.39107143
1993,2 days,A669145,Cat,Domestic Shorthair Mix,Black,6/24/2017,6/26/2017 18:41,2017-06-26T18:41:00,,Partner,Transfer,Intact Male,30.71954887,-97.25898296,0.396924603
1994,3 months,A680138,Cat,Domestic Shorthair Mix,Torbie,8/4/2016,11/12/2016 10:21,2016-11-12T10:21:00,*Sandy,Foster,Adoption,Spayed Female,30.33950399,-97.50085265,14.34732143
1995,2 years,A677774,Dog,Dachshund Mix,Black/Brown,1/6/2015,2/17/2017 12:08,2017-02-17T12:08:00,Brownie,,Return to Owner,Spayed Female,30.72034133,-97.42641361,110.5007937
1996,7 years,A599155,Cat,Domestic Longhair Mix,White/Black,8/30/2006,4/1/2014 17:01,2014-04-01T17:01:00,Luno,,Adoption,Neutered Male,30.69619632,-97.53099237,395.9584325
1997,2 months,A752674,Dog,Chihuahua Shorthair Mix,Cream,9/1/2015,11/25/2015 14:57,2015-11-25T14:57:00,*Ranger,Foster,Adoption,Neutered Male,30.48934905,-97.6038424,12.23184524
1998,4 months,A751117,Dog,Chihuahua Longhair Mix,Tan/White,7/31/2013,12/19/2013 17:16,2013-12-19T17:16:00,Nevins,,Adoption,Neutered Male,30.53435289,-97.39883837,20.24563492
1999,4 years,A741644,Cat,Domestic Shorthair Mix,White/Black,5/30/2010,5/30/2014 8:00,2014-05-30T08:00:00,,SCRP,Transfer,Intact Female,30.48044074,-97.52906718,208.7619048
2000,6 days,A755022,Cat,Domestic Shorthair Mix,Orange Tabby,4/23/2014,4/29/2014 13:38,2014-04-29T13:38:00,,Partner,Transfer,Intact Female,30.30667228,-97.25741561,0.938293651
2001,4 years,A681805,Dog,Chihuahua Shorthair Mix,White/Brown,4/28/2010,3/28/2015 19:25,2015-03-28T19:25:00,Machete,Suffering,Euthanasia,Neutered Male,30.7283881,-97.45954755,256.5441468
2002,4 months,A747619,Dog,St  Bernard Rough Coat Mix,Tan/White,2/14/2017,7/15/2017 18:13,2017-07-15T18:13:00,Muneca,,Adoption,Spayed Female,30.49738442,-97.35471957,21.67986111
2003,2 months,A694821,Cat,Domestic Shorthair Mix,Black/White,3/21/2017,6/18/2017 15:48,2017-06-18T15:48:00,*Popsicle,,Adoption,Spayed Female,30.56961757,-97.39557379,12.80833333
2004,6 months,A686594,Dog,Australian Shepherd Mix,Tan,7/5/2016,1/8/2017 11:20,2017-01-08T11:20:00,Toby,,Adoption,Neutered Male,30.5505231,-97.5192629,26.78174603
2005,3 years,A700214,Dog,Great Pyrenees Golden Retriever,Tan,7/28/2014,8/3/2017 19:22,2017-08-03T19:22:00,*Sam,,Adoption,Neutered Male,30.4085781,-97.24611418,157.5438492
2006,10 months,A622978,Dog,Jack Russell Terrier Chihuahua Shorthair,Red/White,9/20/2013,7/29/2014 14:04,2014-07-29T14:04:00,,Foster,Adoption,Neutered Male,30.35710074,-97.48481763,44.65515873
2007,2 years,A734495,Dog,Shih Tzu Mix,White/Black,4/22/2015,4/26/2017 16:22,2017-04-26T16:22:00,Caster,,Adoption,Neutered Male,30.52107551,-97.70292457,105.0974206
2008,4 years,A678587,Dog,Rottweiler Mix,Black/Tan,7/5/2012,7/20/2016 11:13,2016-07-20T11:13:00,Rocko,,Return to Owner,Neutered Male,30.67023707,-97.66177383,210.9239087
2009,4 months,A686564,Dog,Catahoula Labrador Retriever,Black/White,4/24/2014,8/31/2014 11:39,2014-08-31T11:39:00,,Partner,Transfer,Intact Male,30.37095075,-97.42682054,18.49791667
2010,5 years,A567903,Dog,Chihuahua Shorthair Mix,Tan/Black,4/9/2010,4/9/2015 19:21,2015-04-09T19:21:00,,,Return to Owner,Spayed Female,30.64879039,-97.24723556,260.9723214
2011,4 years,A745140,Dog,Pit Bull Mix,White/Black,3/27/2009,2/5/2014 14:52,2014-02-05T14:52:00,Sugar,,Return to Owner,Spayed Female,30.50942354,-97.60350591,253.8027778
2012,8 years,A672982,Dog,Chihuahua Shorthair Mix,Tan,9/7/2008,9/11/2016 14:23,2016-09-11T14:23:00,Morffi,,Adoption,Neutered Male,30.72720565,-97.43511133,418.0856151
2013,3 weeks,A710302,Cat,Domestic Shorthair Mix,Blue,4/18/2014,5/10/2014 17:44,2014-05-10T17:44:00,,Partner,Transfer,Intact Female,30.62305989,-97.71331005,3.248412698
2014,3 weeks,A708000,Cat,Domestic Shorthair Mix,Brown Tabby/White,8/1/2014,8/23/2014 16:37,2014-08-23T16:37:00,,Partner,Transfer,Intact Female,30.60763611,-97.46255184,3.241765873
2015,8 years,A763913,Dog,Pit Bull Mix,Brown/White,3/5/2009,3/17/2017 14:24,2017-03-17T14:24:00,Spot,Foster,Adoption,Spayed Female,30.72862563,-97.24383469,419.2285714
2016,1 year,A666270,Cat,Domestic Shorthair Mix,Blue,3/13/2016,3/14/2017 9:00,2017-03-14T09:00:00,,SCRP,Transfer,Intact Female,30.38770187,-97.48961845,52.33928571
2017,3 years,A354753,Dog,Pit Bull Mix,White/Red,2/18/2011,3/27/2014 13:52,2014-03-27T13:52:00,King,Aggressive,Euthanasia,Neutered Male,30.26856313,-97.32131089,161.9396825
2018,5 months,A755038,Dog,German Shepherd Black Tan Hound,Brown/Black,2/21/2015,8/22/2015 17:52,2015-08-22T17:52:00,Wesley,,Return to Owner,Neutered Male,30.31162394,-97.31237445,26.10634921
2019,1 year,A752603,Cat,Domestic Shorthair Mix,Black/White,7/21/2014,7/22/2015 9:00,2015-07-22T09:00:00,,SCRP,Transfer,Unknown,30.56174729,-97.3598622,52.33928571
2020,3 years,A706283,Cat,Domestic Shorthair Mix,Brown Tabby,6/18/2014,12/28/2017 14:37,2017-12-28T14:37:00,Lightning,,Return to Owner,Spayed Female,30.40472968,-97.41675657,184.2298611
2021,11 months,A715623,Dog,Pit Bull Mix,Tan/Black,11/29/2012,11/6/2013 16:42,2013-11-06T16:42:00,Viper,,Return to Owner,Neutered Male,30.32590593,-97.25980803,48.95654762
2022,13 years,A546081,Dog,Pit Bull,Brown Brindle/White,7/13/2003,4/22/2017 11:27,2017-04-22T11:27:00,Sammy,,Return to Owner,Neutered Male,30.60641611,-97.42144094,718.9252976
2023,5 months,A721120,Dog,English Pointer Mix,Chocolate/White,2/28/2017,7/31/2017 18:16,2017-07-31T18:16:00,Lucy,,Adoption,Spayed Female,30.65597329,-97.4058126,21.96587302
2024,6 months,A728122,Dog,Pit Bull Mix,Buff/White,12/24/2016,7/1/2017 11:21,2017-07-01T11:21:00,*Liberty,,Adoption,Spayed Female,30.6592391,-97.5929678,27.06755952
2025,1 year,A747892,Dog,Pit Bull Mix,Brown Brindle/White,6/27/2014,8/9/2015 18:24,2015-08-09T18:24:00,Jax,,Adoption,Neutered Male,30.75254089,-97.72385751,58.3952381
2026,3 years,A708917,Dog,Pit Bull Mix,Blue/White,11/6/2012,11/13/2015 17:59,2015-11-13T17:59:00,Max,,Return to Owner,Intact Male,30.35488138,-97.58644485,157.5356151
2027,5 years,A723641,Dog,Miniature Poodle,White,6/9/2008,2/23/2014 15:05,2014-02-23T15:05:00,Brayson,,Adoption,Neutered Male,30.29910812,-97.31290703,297.9469246
2028,4 years,A667635,Cat,Domestic Shorthair Mix,Brown Tabby,2/21/2012,3/3/2016 11:59,2016-03-03T11:59:00,*Rose,,Adoption,Spayed Female,30.66983871,-97.46945871,210.3570437
2029,1 month,A707030,Cat,Domestic Shorthair Mix,Orange Tabby,5/1/2016,6/8/2016 12:18,2016-06-08T12:18:00,*Mario B,Partner,Transfer,Intact Male,30.52455445,-97.3411152,5.501785714
2030,3 months,A735145,Cat,Siamese Mix,Lynx Point,4/15/2017,8/3/2017 17:52,2017-08-03T17:52:00,,Foster,Adoption,Spayed Female,30.27153006,-97.5896151,15.82063492
2031,2 years,A664382,Dog,American Bulldog Basset Hound,Black/White,8/2/2013,9/17/2015 17:11,2015-09-17T17:11:00,*Dante,,Adoption,Neutered Male,30.33474659,-97.44373072,110.9594246
2032,2 years,A746028,Dog,Labrador Retriever Mix,Black,4/4/2014,4/17/2016 0:00,2016-04-17T00:00:00,Walker,Partner,Transfer,Neutered Male,30.56792283,-97.25494708,106.2857143
2033,6 months,A741619,Cat,Domestic Medium Hair Mix,Orange Tabby/White,5/20/2013,11/20/2013 17:52,2013-11-20T17:52:00,,Suffering,Euthanasia,Unknown,30.69231424,-97.40622323,26.39206349
2034,2 months,A739293,Dog,Collie Smooth Mix,White/Black,5/6/2015,7/13/2015 17:19,2015-07-13T17:19:00,,,Adoption,Neutered Male,30.72208502,-97.27761004,9.817361111
2035,3 years,A740492,Dog,Great Dane,Tan/White,4/1/2013,9/24/2016 14:34,2016-09-24T14:34:00,Brandy,,Adoption,Spayed Female,30.36302054,-97.24493376,181.8009921
2036,6 months,A702745,Dog,Labrador Retriever Mix,Chocolate,4/2/2013,10/7/2013 17:52,2013-10-07T17:52:00,Chewey,,Adoption,Spayed Female,30.51270314,-97.44229291,26.96349206
2037,1 year,A705228,Dog,Carolina Dog Mix,Tan/White,3/28/2016,4/6/2017 18:54,2017-04-06T18:54:00,*Spencer,,Adoption,Neutered Male,30.27822302,-97.49010133,53.54107143
2038,2 months,A754030,Dog,Labrador Retriever,White/Black,10/21/2016,1/9/2017 14:53,2017-01-09T14:53:00,Maximus,,Adoption,Intact Male,30.48615617,-97.65069229,11.5171627
2039,2 years,A737244,Dog,Pit Bull Mix,Brown Brindle,11/30/2014,5/3/2017 18:42,2017-05-03T18:42:00,Sheba,Partner,Transfer,Intact Female,30.66499062,-97.64573637,126.539881
2040,10 years,A748276,Dog,Yorkshire Terrier,Silver/Black,12/19/2006,12/19/2016 17:27,2016-12-19T17:27:00,Dixie,,Return to Owner,Intact Female,30.65294273,-97.34774174,521.9610119
2041,2 years,A714391,Dog,Labrador Retriever Mix,Black,5/22/2013,5/22/2015 11:45,2015-05-22T11:45:00,Abigail,,Return to Owner,Intact Female,30.7157942,-97.45236649,104.3556548
2042,6 years,A669064,Dog,Pit Bull Mix,Brown Brindle/White,6/15/2011,11/26/2017 15:41,2017-11-26T15:41:00,Mamas,,Adoption,Spayed Female,30.62215216,-97.26372614,336.6647817
2043,4 months,A594497,Cat,Domestic Shorthair Mix,Brown Tabby/White,6/22/2017,10/30/2017 18:36,2017-10-30T18:36:00,*Jay,,Adoption,Neutered Male,30.26918881,-97.24417013,18.68214286
2044,8 months,A729255,Dog,Chihuahua Shorthair Mix,Tan,2/24/2016,10/28/2016 18:45,2016-10-28T18:45:00,Austin,,Adoption,Neutered Male,30.65475821,-97.60585991,35.39732143
2045,11 months,A676895,Dog,Pit Bull Mix,Blue/White,6/22/2016,5/27/2017 19:13,2017-05-27T19:13:00,Zumia,,Adoption,Spayed Female,30.2965515,-97.33914379,48.54295635
2046,9 years,A725427,Cat,Snowshoe Mix,Seal Point,5/19/2007,3/31/2017 14:15,2017-03-31T14:15:00,Charlie,Foster,Adoption,Neutered Male,30.32492944,-97.32580973,514.9419643
2047,2 years,A720444,Dog,Labrador Retriever German Shepherd,Black/Brown,12/13/2011,12/27/2013 16:44,2013-12-27T16:44:00,,,Adoption,Neutered Male,30.51269256,-97.52502095,106.5281746
2048,6 years,A702828,Dog,Miniature Poodle Mix,White,3/1/2010,6/6/2016 16:25,2016-06-06T16:25:00,Chikis,,Return to Owner,Spayed Female,30.69174179,-97.42164222,327.0977183
2049,9 months,A664965,Dog,Chihuahua Shorthair Mix,White/Brown Brindle,9/15/2015,6/27/2016 18:03,2016-06-27T18:03:00,*Lucy,,Adoption,Spayed Female,30.32284378,-97.52161205,40.96458333
2050,3 years,A724076,Dog,Boerboel Mix,Tan/White,4/16/2011,5/26/2014 13:55,2014-05-26T13:55:00,*Dobie,,Adoption,Neutered Male,30.67358308,-97.33403156,162.3685516
2051,2 years,A721107,Dog,Shih Tzu Toy Poodle,White/Black,4/29/2014,5/3/2016 17:28,2016-05-03T17:28:00,,,Adoption,Neutered Male,30.36739609,-97.53383911,105.1039683
2052,2 months,A744830,Dog,Pointer Mix,Black/White,12/9/2015,2/10/2016 18:33,2016-02-10T18:33:00,Aries,,Adoption,Neutered Male,30.35862871,-97.51917825,9.110416667
2053,1 month,A735136,Dog,Yorkshire Terrier Mix,White,3/24/2015,5/19/2015 18:07,2015-05-19T18:07:00,Polar Bear,,Adoption,Neutered Male,30.6160605,-97.26259779,8.107837302
2054,11 months,A667251,Dog,Australian Cattle Dog Mix,White/Tan,4/11/2013,3/21/2014 11:59,2014-03-21T11:59:00,Linda,,Return to Owner,Spayed Female,30.37392704,-97.74120471,49.21418651
2055,2 years,A713499,Dog,Labrador Retriever Mix,White/Tan,4/11/2014,11/2/2016 17:13,2016-11-02T17:13:00,Ghost,,Return to Owner,Neutered Male,30.56498327,-97.45336637,133.8167659
2056,1 year,A677594,Dog,Golden Retriever Mix,Red,2/21/2015,2/21/2016 15:27,2016-02-21T15:27:00,Bonnie,,Return to Owner,Spayed Female,30.34347052,-97.52557286,52.23482143
2057,9 years,A752253,Dog,Basset Hound Mix,Brown Brindle/Black,3/8/2008,3/20/2017 13:57,2017-03-20T13:57:00,Edward Hyde,,Euthanasia,Neutered Male,30.39160161,-97.24737682,471.36875
2058,3 months,A689260,Cat,Domestic Shorthair Mix,Black/White,8/4/2016,11/12/2016 10:27,2016-11-12T10:27:00,*Danny,Foster,Adoption,Neutered Male,30.39491934,-97.46890426,14.34791667
2059,3 years,A703517,Dog,Pit Bull,Black,11/15/2011,11/22/2014 18:13,2014-11-22T18:13:00,Delilah,Aggressive,Euthanasia,Spayed Female,30.718875,-97.60887782,157.6798611
2060,6 years,A753499,Dog,Labrador Retriever Mix,Tan,10/7/2009,10/11/2015 16:27,2015-10-11T16:27:00,Sammie,,Adoption,Neutered Male,30.54756183,-97.38923021,313.6693452
2061,3 months,A737528,Dog,Labrador Retriever Mix,Black/White,12/26/2013,4/26/2014 18:00,2014-04-26T18:00:00,,Partner,Transfer,Intact Female,30.44260982,-97.48986248,17.39285714
2062,1 year,A754359,Cat,Domestic Shorthair Mix,White,6/20/2016,1/20/2018 15:19,2018-01-20T15:19:00,,Foster,Adoption,Spayed Female,30.7323312,-97.24983338,82.80545635
2063,5 years,A726335,Dog,Shetland Sheepdog Mix,Black/Brown,10/1/2009,10/3/2014 15:23,2014-10-03T15:23:00,Gambit,,Return to Owner,Neutered Male,30.60700018,-97.70526122,261.2344246
2064,3 months,A703629,Cat,Domestic Shorthair Mix,Blue Tabby/White,3/25/2015,7/19/2015 13:16,2015-07-19T13:16:00,*Bailey,Foster,Adoption,Neutered Male,30.36629423,-97.54830867,16.65039683
2065,2 years,A753665,Dog,Australian Cattle Dog Mix,White/Tan,7/7/2015,7/15/2017 15:23,2017-07-15T15:23:00,*Sasha,,Adoption,Spayed Female,30.7494397,-97.65588857,105.662996
2066,4 months,A763032,Dog,Chihuahua Shorthair Mix,White/Red Merle,7/1/2016,11/4/2016 17:09,2016-11-04T17:09:00,Georgi,,Adoption,Spayed Female,30.60273632,-97.69007609,18.10208333
2067,5 years,A743908,Dog,Miniature Poodle Mix,White,7/26/2012,8/2/2017 16:14,2017-08-02T16:14:00,Nana,,Return to Owner,Intact Female,30.34168343,-97.56262623,261.9537698
2068,2 months,A672456,Dog,Great Pyrenees Mix,White,3/29/2016,6/17/2016 18:29,2016-06-17T18:29:00,,Foster,Adoption,Spayed Female,30.36973497,-97.62657203,11.53859127
2069,5 months,A672691,Dog,Labrador Retriever Mix,Black/White,12/31/2014,6/28/2015 15:52,2015-06-28T15:52:00,Gavin,,Adoption,Neutered Male,30.55544635,-97.50489509,25.66587302
2070,3 weeks,A673336,Dog,Beagle Mix,Brown,6/18/2017,7/11/2017 11:50,2017-07-11T11:50:00,,Partner,Transfer,Intact Male,30.4254737,-97.33340003,3.356150794
2071,1 year,A672164,Other,Squirrel Mix,Brown,12/1/2016,12/1/2017 17:42,2017-12-01T17:42:00,,Suffering,Euthanasia,Unknown,30.65681375,-97.69844539,52.24821429
2072,6 months,A745826,Dog,Beagle Mix,Black/Brown,8/19/2016,2/23/2017 21:37,2017-02-23T21:37:00,,,Adoption,Spayed Female,30.58551637,-97.45383854,26.98581349
2073,2 years,A745501,Dog,German Shorthair Pointer Mix,Black/Blue Merle,8/10/2011,2/21/2014 18:47,2014-02-21T18:47:00,Dexter,Partner,Transfer,Neutered Male,30.33806257,-97.7360718,132.3975198
2074,2 years,A631695,Dog,Labrador Retriever Mix,Tan,2/15/2012,7/14/2014 14:11,2014-07-14T14:11:00,Jeeves,,Adoption,Neutered Male,30.6440864,-97.52560524,125.7987103
2075,3 years,A750682,Dog,Labrador Retriever Border Terrier,Black,2/22/2011,3/3/2014 15:52,2014-03-03T15:52:00,Raven,Partner,Transfer,Spayed Female,30.43295632,-97.66397017,157.9515873
2076,2 years,A430368,Dog,Yorkshire Terrier Mix,Gray/Tan,2/5/2012,2/14/2014 15:03,2014-02-14T15:03:00,*Molly,Partner,Transfer,Spayed Female,30.30343825,-97.61267069,105.803869
2077,1 year,A731200,Dog,Alaskan Husky Mix,White/White,3/24/2016,3/27/2017 16:28,2017-03-27T16:28:00,Zeke,,Return to Owner,Intact Male,30.54684588,-97.43751692,52.66944444
2078,2 years,A687258,Dog,Chihuahua Shorthair Mix,Tricolor,3/18/2015,3/24/2017 18:45,2017-03-24T18:45:00,Daphne,,Adoption,Spayed Female,30.43000985,-97.72378968,105.3973214
2079,4 years,A709234,Dog,Pit Bull Mix,Black/White,7/7/2009,6/13/2014 13:17,2014-06-13T13:17:00,Koda,,Return to Owner,Neutered Male,30.70717072,-97.53561472,257.5076389
2080,1 year,A689845,Cat,Domestic Shorthair Mix,Blue Tabby/White,5/30/2016,8/19/2017 11:22,2017-08-19T11:22:00,*Olivia,,Adoption,Spayed Female,30.55782052,-97.38115945,63.78194444
2081,7 years,A702339,Dog,Labrador Retriever Mix,Black/White,3/26/2006,2/21/2014 18:09,2014-02-21T18:09:00,Arenal,,Adoption,Neutered Male,30.63597701,-97.46553389,412.8223214
2082,1 year,A733561,Dog,Border Collie Mix,Tan/White,7/18/2015,7/19/2016 22:12,2016-07-19T22:12:00,Cona,,Return to Owner,Spayed Female,30.26917178,-97.645997,52.56071429
2083,4 months,A737795,Cat,Domestic Shorthair Mix,Brown Tabby,5/2/2014,9/19/2014 17:51,2014-09-19T17:51:00,Chiquita,,Adoption,Spayed Female,30.40461215,-97.34407771,20.10625
2084,5 months,A667331,Cat,Domestic Shorthair Mix,Blue Tabby/White,3/6/2015,8/25/2015 18:14,2015-08-25T18:14:00,*Leandra,,Adoption,Spayed Female,30.56555093,-97.42210259,24.67996032
2085,2 years,A672171,Dog,Miniature Schnauzer Mix,Gray/White,10/10/2012,10/12/2014 18:28,2014-10-12T18:28:00,Prieta,,Return to Owner,Spayed Female,30.65073802,-97.64993531,104.6813492
2086,1 year,A714450,Dog,American Bulldog Mix,White/Brown,11/12/2013,5/12/2015 17:57,2015-05-12T17:57:00,Ayo,,Return to Owner,Intact Male,30.52679091,-97.38760045,78.10684524
2087,2 months,A697660,Cat,Domestic Shorthair Mix,Brown Tabby,7/24/2016,10/3/2016 11:33,2016-10-03T11:33:00,*Salsa,,Adoption,Spayed Female,30.28998771,-97.70337344,10.21160714
2088,2 years,A670633,Dog,Labrador Retriever Mix,Tan,11/4/2014,11/10/2016 17:37,2016-11-10T17:37:00,Leia,,Adoption,Spayed Female,30.58310249,-97.40842539,105.3905754
2089,4 months,A729857,Cat,Domestic Shorthair Mix,Calico/Brown Tabby,7/1/2013,11/18/2013 14:14,2013-11-18T14:14:00,Cali,,Adoption,Spayed Female,30.70424653,-97.3194902,20.08472222
2090,1 year,A680704,Dog,Labrador Retriever Mix,Black/White,5/5/2012,2/22/2014 13:35,2014-02-22T13:35:00,Billie Jean,,Adoption,Spayed Female,30.39603117,-97.53679158,94.08085317
2091,2 months,A676738,Dog,Chihuahua Shorthair,Blue/White,8/23/2015,10/24/2015 16:41,2015-10-24T16:41:00,Rex,,Return to Owner,Neutered Male,30.27871819,-97.3998557,8.956448413
2092,7 years,A676140,Dog,Staffordshire Bull Terrier,White/Black,2/26/2008,5/16/2015 16:46,2015-05-16T16:46:00,Buddy,,Return to Owner,Neutered Male,30.37934183,-97.30949696,376.6712302
2093,5 months,A687409,Dog,Plott Hound Mix,Brown Brindle,8/12/2013,1/15/2014 12:58,2014-01-15T12:58:00,*Fiona,Partner,Transfer,Intact Female,30.73489325,-97.58511882,22.36289683
2094,1 month,A747663,Cat,Domestic Shorthair Mix,Tortie,5/17/2016,6/24/2016 15:24,2016-06-24T15:24:00,,Partner,Transfer,Intact Female,30.59626273,-97.7185635,5.520238095
2095,1 weeks,A741299,Cat,Domestic Shorthair Mix,Lynx Point,5/28/2014,6/6/2014 14:39,2014-06-06T14:39:00,,Partner,Transfer,Intact Male,30.39763549,-97.31790231,1.372916667
2096,10 years,A612598,Dog,Boxer Mix,Brown,4/14/2004,4/16/2014 14:09,2014-04-16T14:09:00,Libby,,Return to Owner,Spayed Female,30.40430522,-97.35015699,522.0842262
2097,5 months,A715951,Dog,Chihuahua Shorthair Mix,Tan,11/5/2013,4/9/2014 16:40,2014-04-09T16:40:00,,,Adoption,Spayed Female,30.54442315,-97.68555146,22.24206349
2098,2 months,A593659,Dog,Golden Retriever Mix,Gold,7/4/2014,9/5/2014 17:08,2014-09-05T17:08:00,Stacy,,Return to Owner,Spayed Female,30.34080406,-97.57171408,9.101984127
2099,2 months,A743064,Cat,Domestic Shorthair Mix,Orange Tabby,3/16/2017,5/23/2017 11:26,2017-05-23T11:26:00,,Foster,Adoption,Neutered Male,30.47062092,-97.62531953,9.78234127
2100,12 years,A710126,Dog,German Shepherd Mix,Tan/Black,12/31/2004,1/5/2017 16:31,2017-01-05T16:31:00,*Iris,Partner,Transfer,Intact Female,30.51994779,-97.41463661,626.9554563
2101,3 years,A709340,Dog,Labrador Retriever Mix,Tan/White,10/21/2009,10/12/2013 17:21,2013-10-12T17:21:00,Harvey,,Return to Owner,Neutered Male,30.73572216,-97.37631767,207.5318452
2102,3 years,A752991,Dog,Pit Bull Mix,Black,2/24/2013,3/2/2016 18:16,2016-03-02T18:16:00,Sophie,,Return to Owner,Spayed Female,30.40815296,-97.56304665,157.5373016
2103,2 years,A666490,Dog,Pit Bull Mix,Blue/White,11/12/2013,2/28/2016 7:41,2016-02-28T07:41:00,*Maisy,,Adoption,Spayed Female,30.67476714,-97.31460135,119.7600198
2104,7 years,A670123,Dog,Labrador Retriever Mix,Black/White,1/1/2011,1/6/2018 13:21,2018-01-06T13:21:00,Sophie,,Return to Owner,Spayed Female,30.45662269,-97.58396852,366.0794643
2105,3 years,A718040,Cat,Domestic Shorthair Mix,Orange Tabby,2/3/2014,2/27/2017 12:30,2017-02-27T12:30:00,Coco,Partner,Transfer,Spayed Female,30.47910097,-97.2489962,160.0744048
2106,1 year,A751070,Dog,Chihuahua Shorthair Mix,Tan,8/18/2014,8/20/2015 13:33,2015-08-20T13:33:00,Chico,,Return to Owner,Intact Male,30.59225868,-97.72762467,52.50922619
2107,3 weeks,A681818,Cat,Domestic Shorthair Mix,White/Black,7/16/2015,8/7/2015 16:00,2015-08-07T16:00:00,,Partner,Transfer,Intact Male,30.39475568,-97.59836082,3.238095238
2108,4 weeks,A703593,Cat,Domestic Shorthair Mix,Brown Tabby,6/5/2017,7/5/2017 14:37,2017-07-05T14:37:00,*Verde,Partner,Transfer,Intact Male,30.55489999,-97.36261418,4.372718254
2109,6 months,A749803,Dog,Cairn Terrier Mix,Black,5/2/2013,11/3/2013 16:01,2013-11-03T16:01:00,,Partner,Transfer,Intact Female,30.46485456,-97.43543671,26.52390873
2110,1 month,A693416,Dog,Chihuahua Shorthair Mix,Brown,11/17/2013,1/3/2014 13:54,2014-01-03T13:54:00,Chiquita,,Return to Owner,Intact Female,30.70353937,-97.70479066,6.79702381
2111,2 years,A683455,Dog,Great Pyrenees Mix,White,12/20/2013,1/4/2016 19:41,2016-01-04T19:41:00,*Norris,,Adoption,Neutered Male,30.60810115,-97.62346154,106.5457341
2112,1 year,A375393,Cat,Domestic Shorthair Mix,Orange Tabby,6/3/2016,6/7/2017 0:00,2017-06-07T00:00:00,,Snr,Transfer,Neutered Male,30.48084977,-97.38759648,52.71428571
2113,10 months,A755859,Cat,Domestic Shorthair Mix,White/Orange Tabby,8/20/2013,7/15/2014 18:55,2014-07-15T18:55:00,Caramel,,Adoption,Spayed Female,30.40637144,-97.25523327,47.11259921
2114,2 years,A691884,Dog,Dachshund Rat Terrier,Black/Tan,5/27/2013,6/11/2015 18:52,2015-06-11T18:52:00,*Mack,,Adoption,Neutered Male,30.62441263,-97.37767034,106.540873
2115,4 years,A749780,Cat,Domestic Shorthair Mix,Black,9/19/2012,8/10/2017 14:22,2017-08-10T14:22:00,Shifonet,,Adoption,Spayed Female,30.62273231,-97.43727744,255.228373
2116,5 years,A669830,Dog,Pit Bull Mix,Chocolate/White,7/8/2010,7/20/2015 14:10,2015-07-20T14:10:00,Natalia,Partner,Transfer,Spayed Female,30.52192146,-97.34863521,262.655754
2117,1 year,A719922,Other,Rabbit Sh Mix,White/Black,7/10/2013,7/16/2014 16:11,2014-07-16T16:11:00,,Partner,Transfer,Unknown,30.60875378,-97.65058592,53.09632937
2118,13 years,A759582,Dog,German Shorthair Pointer,White/Liver,1/1/2002,6/13/2015 14:22,2015-06-13T14:22:00,Dash,,Return to Owner,Neutered Male,30.47958517,-97.41420059,701.6569444
2119,2 years,A671108,Dog,Anatol Shepherd Mix,Fawn,8/10/2015,8/10/2017 16:27,2017-08-10T16:27:00,Sansa,,Return to Owner,Intact Female,30.36301142,-97.70779959,104.5264881
2120,10 months,A718969,Dog,Anatol Shepherd,White/Brown,1/11/2014,11/16/2014 13:15,2014-11-16T13:15:00,,,Adoption,Neutered Male,30.66093259,-97.64326296,44.22172619
2121,4 months,A686152,Dog,Dachshund Mix,Tan/White,1/19/2017,5/23/2017 17:57,2017-05-23T17:57:00,Toby,,Adoption,Neutered Male,30.7129009,-97.6779288,17.82113095
2122,2 months,A736011,Dog,German Shepherd Mix,Cream/Black,10/21/2013,12/28/2013 14:07,2013-12-28T14:07:00,,Partner,Transfer,Intact Female,30.4032236,-97.26964916,9.798313492
2123,1 year,A692880,Dog,Pit Bull Mix,Blue/White,1/30/2015,2/28/2016 13:22,2016-02-28T13:22:00,Beast,In Kennel,Missing,Intact Male,30.4919961,-97.64525176,56.36527778
2124,4 months,A740328,Dog,Anatol Shepherd Mix,Tan/White,5/20/2017,10/8/2017 18:20,2017-10-08T18:20:00,Bailee,,Adoption,Spayed Female,30.62639081,-97.33918958,20.25198413
2125,3 years,A745491,Cat,Domestic Shorthair Mix,Black/White,1/18/2011,1/19/2014 11:23,2014-01-19T11:23:00,Kirby,,Return to Owner,Spayed Female,30.36141895,-97.48933799,156.7820437
2126,2 years,A737209,Dog,Border Terrier Mix,Cream/White,1/10/2014,1/16/2016 19:02,2016-01-16T19:02:00,*Gorton,,Adoption,Neutered Male,30.38684778,-97.39571444,105.2561508
2127,8 years,A683835,Dog,Pit Bull Mix,Fawn/White,8/17/2006,10/22/2014 16:17,2014-10-22T16:17:00,Sandy,,Adoption,Spayed Female,30.63868791,-97.67943482,426.9540675
2128,2 years,A731870,Dog,German Shorthair Pointer Mix,Chocolate,10/2/2014,10/3/2016 14:17,2016-10-03T14:17:00,Rex,,Return to Owner,Neutered Male,30.37500943,-97.57531454,104.6564484
2129,8 months,A681793,Dog,Pit Bull Mix,Brown,3/29/2014,12/2/2014 17:40,2014-12-02T17:40:00,Daphne,,Return to Owner,Spayed Female,30.4534118,-97.52458531,35.53373016
2130,3 months,A672540,Cat,Domestic Shorthair,Black/White,9/15/2016,12/27/2016 18:03,2016-12-27T18:03:00,,,Adoption,Neutered Male,30.34053854,-97.52763363,14.82172619
2131,2 years,A699102,Dog,Dachshund Mix,Brown,3/18/2015,3/22/2017 12:20,2017-03-22T12:20:00,Angel,,Return to Owner,Intact Female,30.34060173,-97.25240741,105.0734127
2132,5 months,A673326,Dog,Chihuahua Shorthair Mix,Red,5/25/2016,10/27/2016 17:18,2016-10-27T17:18:00,,,Adoption,Spayed Female,30.75496406,-97.38480541,22.24583333
2133,2 years,A762024,Cat,Domestic Shorthair Mix,Orange Tabby,7/15/2012,7/16/2014 9:00,2014-07-16T09:00:00,,SCRP,Transfer,Intact Male,30.51763181,-97.50667072,104.4821429
2134,1 year,A698434,Dog,Pit Bull Mix,White/Tan,3/28/2015,9/8/2016 12:54,2016-09-08T12:54:00,*Snowman,,Adoption,Neutered Male,30.4654366,-97.27391014,75.79107143
2135,1 year,A750049,Cat,Domestic Medium Hair Mix,Black/White,6/20/2013,6/21/2014 16:19,2014-06-21T16:19:00,Dinah,,Return to Owner,Spayed Female,30.68550773,-97.26178575,52.3828373
2136,5 months,A687099,Dog,Newfoundland Mix,Black/White,10/27/2013,4/3/2014 8:34,2014-04-03T08:34:00,*Jane,Foster,Adoption,Spayed Female,30.59744774,-97.45163771,22.62242063
2137,1 year,A750786,Dog,Siberian Husky Anatol Shepherd,Tan/White,5/31/2013,3/26/2015 16:53,2015-03-26T16:53:00,Buzz,,Return to Owner,Neutered Male,30.3153812,-97.28373833,94.95763889
2138,5 months,A753509,Cat,Domestic Shorthair Mix,Blue,9/22/2013,3/10/2014 17:38,2014-03-10T17:38:00,*Axel,,Adoption,Neutered Male,30.61529613,-97.41167061,24.24781746
2139,1 month,A711091,Dog,Cocker Spaniel Mix,Black,10/1/2017,11/13/2017 16:52,2017-11-13T16:52:00,Puppy,Suffering,Euthanasia,Intact Female,30.73772064,-97.70276327,6.243253968
2140,3 years,A691765,Dog,Australian Cattle Dog Mix,Black/White,3/11/2012,8/10/2015 19:25,2015-08-10T19:25:00,*Dolly,,Adoption,Spayed Female,30.65690508,-97.53697708,178.2584325
2141,1 month,A680451,Cat,Domestic Shorthair Mix,Brown Tabby,5/2/2017,7/1/2017 19:28,2017-07-01T19:28:00,*Enchilada,Foster,Adoption,Spayed Female,30.32013077,-97.42549274,8.687301587
2142,9 months,A753945,Dog,Australian Cattle Dog Mix,Black/White,12/1/2013,9/1/2014 14:36,2014-09-01T14:36:00,Chop,Rabies Risk,Euthanasia,Intact Male,30.71269465,-97.31565384,39.2297619
2143,10 months,A725891,Dog,Cairn Terrier Mix,Chocolate/White,7/31/2016,6/4/2017 19:05,2017-06-04T19:05:00,,,Adoption,Neutered Male,30.69763761,-97.31141651,44.11359127
2144,3 months,A760291,Cat,Domestic Medium Hair Mix,Brown Tabby/White,4/7/2017,7/14/2017 18:00,2017-07-14T18:00:00,Pepper,,Adoption,Spayed Female,30.57472542,-97.26054472,14.10714286
2145,2 weeks,A669895,Other,Squirrel Mix,Brown,8/17/2015,9/1/2015 16:20,2015-09-01T16:20:00,,Medical,Euthanasia,Unknown,30.74475531,-97.40747511,2.240079365
2146,3 years,A718527,Dog,Chow Chow,Buff,11/8/2011,12/16/2014 11:36,2014-12-16T11:36:00,Lila,,Adoption,Spayed Female,30.38898189,-97.36808746,162.0690476
2147,3 months,A756517,Cat,Domestic Longhair Mix,Orange Tabby/White,4/1/2014,7/20/2014 18:08,2014-07-20T18:08:00,*Simon,,Adoption,Neutered Male,30.56984788,-97.50520919,15.82222222
2148,8 months,A714206,Dog,Shih Tzu Mix,Cream/White,11/13/2016,7/17/2017 18:42,2017-07-17T18:42:00,,Partner,Transfer,Spayed Female,30.37257418,-97.71276875,35.25416667
2149,11 years,A757315,Dog,Miniature Pinscher Mix,Black/Tan,5/3/2005,8/19/2016 15:22,2016-08-19T15:22:00,Margie,Foster,Adoption,Spayed Female,30.64945675,-97.44818915,589.5200397
2150,4 months,A702427,Dog,Rat Terrier Labrador Retriever,Black/White,6/16/2017,10/20/2017 16:14,2017-10-20T16:14:00,,,Adoption,Neutered Male,30.47030368,-97.55285592,18.09662698
2151,3 years,A506000,Dog,Labrador Retriever Mix,Red,10/22/2013,2/12/2017 16:24,2017-02-12T16:24:00,Stacy,,Adoption,Spayed Female,30.45295189,-97.72820368,172.8119048
2152,2 years,A693022,Dog,German Shepherd Mix,Black/Tan,1/1/2014,1/3/2016 9:37,2016-01-03T09:37:00,,In Kennel,Died,Intact Female,30.74002572,-97.32680805,104.6286706
2153,3 months,A685025,Cat,Domestic Shorthair Mix,Blue,5/21/2017,8/26/2017 17:02,2017-08-26T17:02:00,Aveta,,Adoption,Spayed Female,30.44104725,-97.34173375,13.95853175
2154,4 years,A613689,Dog,Chihuahua Shorthair Mix,Black/Tan,10/20/2011,11/8/2015 15:42,2015-11-08T15:42:00,*Jimmy,Foster,Adoption,Neutered Male,30.62428596,-97.34886399,211.5220238
2155,2 years,A663228,Dog,Border Collie Mix,Black/White,9/1/2015,11/19/2017 15:33,2017-11-19T15:33:00,Shelby,,Return to Owner,Intact Female,30.56002626,-97.54102901,115.8068452
2156,5 months,A617461,Dog,Great Pyrenees Mix,White,11/28/2014,5/17/2015 16:12,2015-05-17T16:12:00,,Partner,Transfer,Spayed Female,30.50071673,-97.4752566,24.38214286
2157,9 years,A758457,Dog,Labrador Retriever Mix,White/Tan,10/8/2006,9/21/2016 12:03,2016-09-21T12:03:00,Lt,Foster,Adoption,Neutered Male,30.63981097,-97.61613399,519.5002976
2158,7 years,A733528,Dog,Labrador Retriever Mix,Black,11/30/2007,12/4/2014 17:02,2014-12-04T17:02:00,Lady,Partner,Transfer,Spayed Female,30.59476668,-97.48473024,365.9585317
2159,8 years,A745263,Dog,Australian Cattle Dog Mix,Blue Merle,8/1/2009,10/12/2017 11:15,2017-10-12T11:15:00,Diggy,,Return to Owner,Spayed Female,30.37932597,-97.42190309,427.78125
2160,4 years,A681959,Dog,Dachshund Chihuahua Shorthair,White/Brown,11/8/2009,6/30/2014 14:51,2014-06-30T14:51:00,Diego,,Return to Owner,Neutered Male,30.51400164,-97.66682617,242.23125
2161,5 years,A740188,Livestock,Miniature,Liver/Cream,9/15/2008,10/3/2013 10:59,2013-10-03T10:59:00,,Partner,Transfer,Intact Male,30.66930908,-97.58651828,263.4939484
2162,3 years,A735440,Dog,German Wirehaired Pointer,Black/Gray,1/7/2011,2/1/2014 12:21,2014-02-01T12:21:00,Tank,,Return to Owner,Neutered Male,30.29646389,-97.54868483,160.216369
2163,2 months,A706536,Cat,Siamese Mix,Flame Point,9/3/2017,11/9/2017 16:08,2017-11-09T16:08:00,,,Adoption,Neutered Male,30.48068886,-97.64280386,9.667460317
2164,2 months,A688747,Cat,Domestic Shorthair Mix,Orange Tabby/White,7/10/2016,9/17/2016 13:39,2016-09-17T13:39:00,*Marco,,Adoption,Neutered Male,30.67430025,-97.60371303,9.938392857
2165,2 years,A737370,Dog,Pit Bull Mix,Brown/Black,3/15/2015,4/14/2017 15:40,2017-04-14T15:40:00,*Pumba,Partner,Transfer,Intact Male,30.57829602,-97.46151983,108.8075397
2166,2 years,A761111,Dog,Australian Cattle Dog Mix,Tan/Black,6/18/2014,1/7/2017 11:48,2017-01-07T11:48:00,Sadie,,Return to Owner,Spayed Female,30.61394348,-97.25049576,133.4988095
2167,7 months,A686803,Dog,Pit Bull Mix,Black/Black,5/12/2016,12/20/2016 18:11,2016-12-20T18:11:00,Remi,,Adoption,Spayed Female,30.38727696,-97.64831322,31.82251984
2168,10 months,A677777,Cat,Domestic Shorthair,Brown Tabby,1/23/2016,11/25/2016 12:52,2016-11-25T12:52:00,*Phoebe,,Adoption,Spayed Female,30.34424696,-97.3275288,43.93373016
2169,5 years,A674920,Dog,English Bulldog,Tan/White,6/30/2010,3/29/2016 14:23,2016-03-29T14:23:00,Butch,,Return to Owner,Neutered Male,30.47958526,-97.50797573,299.9427579
2170,3 weeks,A763292,Cat,Domestic Shorthair Mix,Brown Tabby,9/1/2014,9/23/2014 13:23,2014-09-23T13:23:00,,Partner,Transfer,Intact Female,30.51031402,-97.4622731,3.222519841
2171,3 months,A669270,Cat,Domestic Shorthair Mix,Orange Tabby,8/19/2016,11/26/2016 15:57,2016-11-26T15:57:00,Pumpkin,,Adoption,Neutered Male,30.7383716,-97.42139644,14.23779762
2172,3 months,A765054,Cat,Domestic Shorthair Mix,Black,8/15/2017,12/11/2017 12:34,2017-12-11T12:34:00,,,Adoption,Spayed Female,30.42326322,-97.68696945,16.93194444
2173,3 months,A757870,Dog,Dachshund Mix,Red/White,5/5/2014,8/28/2014 17:02,2014-08-28T17:02:00,*Rupert,,Adoption,Neutered Male,30.46185831,-97.33915224,16.52996032
2174,6 days,A738984,Cat,Domestic Shorthair Mix,Orange Tabby,4/23/2014,4/29/2014 13:38,2014-04-29T13:38:00,,Partner,Transfer,Intact Male,30.46925402,-97.58744508,0.938293651
2175,1 year,A716146,Other,Opossum Mix,White,3/20/2013,3/20/2014 12:42,2014-03-20T12:42:00,,Rabies Risk,Euthanasia,Unknown,30.51693232,-97.43508177,52.21845238
2176,1 year,A702292,Dog,American Staffordshire Terrier Mix,Black/White,12/6/2016,1/13/2018 18:21,2018-01-13T18:21:00,*Michael,,Adoption,Neutered Male,30.67798304,-97.47242475,57.68065476
2177,8 months,A706068,Dog,English Foxhound Mix,White/Brown,11/2/2013,7/21/2014 16:15,2014-07-21T16:15:00,Zorro,,Adoption,Neutered Male,30.71700893,-97.55358603,37.38244048
2178,1 month,A765467,Dog,Anatol Shepherd Great Pyrenees,Sable/White,11/27/2017,1/14/2018 15:50,2018-01-14T15:50:00,,Partner,Transfer,Intact Male,30.28859935,-97.63070922,6.951388889
2179,3 months,A729376,Cat,Domestic Shorthair Mix,Brown Tabby,7/25/2017,11/7/2017 15:05,2017-11-07T15:05:00,Kenny,,Adoption,Neutered Male,30.33732682,-97.64791193,15.08978175
2180,2 years,A678900,Dog,Pit Bull Mix,Fawn,11/25/2014,12/30/2016 18:00,2016-12-30T18:00:00,*Herbie,Partner,Transfer,Neutered Male,30.72610027,-97.28885172,109.5357143
2181,5 months,A709799,Cat,Domestic Shorthair Mix,Tortie,10/31/2015,4/13/2016 19:37,2016-04-13T19:37:00,*Sally,Foster,Adoption,Spayed Female,30.2967357,-97.68701917,23.68819444
2182,2 months,A712405,Dog,Labrador Retriever Mix,Black/White,3/3/2015,5/15/2015 18:00,2015-05-15T18:00:00,Oreo,,Adoption,Neutered Male,30.39392769,-97.7376446,10.53571429
2183,8 months,A725483,Cat,Snowshoe Mix,Seal Point,10/24/2014,6/29/2015 13:56,2015-06-29T13:56:00,,Partner,Transfer,Intact Female,30.73616427,-97.33466121,35.51150794
2184,11 months,A670786,Dog,Dachshund Mix,Blue Tick/Tricolor,2/21/2017,1/24/2018 16:50,2018-01-24T16:50:00,,Partner,Transfer,Neutered Male,30.51685123,-97.3268358,48.24305556
2185,3 months,A734882,Cat,Domestic Shorthair Mix,Orange Tabby/White,3/17/2016,6/24/2016 18:34,2016-06-24T18:34:00,,,Adoption,Neutered Male,30.43101493,-97.24633757,14.25337302
2186,6 months,A737559,Dog,Pit Bull Mix,White/Black,10/14/2013,5/14/2014 15:23,2014-05-14T15:23:00,Juicy,,Return to Owner,Intact Female,30.30940002,-97.50694383,30.37728175
2187,1 month,A694404,Dog,Australian Kelpie Mix,Black,6/24/2015,8/14/2015 13:21,2015-08-14T13:21:00,,Partner,Transfer,Intact Female,30.7343106,-97.31453151,7.365178571
2188,3 months,A695600,Cat,Domestic Shorthair Mix,Brown Tabby,6/22/2015,9/24/2015 14:38,2015-09-24T14:38:00,,Partner,Transfer,Intact Female,30.68718439,-97.50575255,13.5156746
2189,2 years,A746993,Dog,German Shepherd,Black/Brown,4/29/2014,5/3/2016 17:45,2016-05-03T17:45:00,Tilly,,Adoption,Spayed Female,30.29734093,-97.42093414,105.1056548
2190,2 years,A760784,Dog,Pit Bull Mix,Tan/White,1/14/2012,1/16/2014 17:26,2014-01-16T17:26:00,Zaih,,Return to Owner,Spayed Female,30.71074293,-97.71091575,104.8180556
2191,4 months,A739004,Dog,Labrador Retriever Mix,Brown/White,5/1/2016,9/18/2016 17:03,2016-09-18T17:03:00,,,Adoption,Neutered Male,30.28114935,-97.52096118,20.1014881
2192,2 years,A715613,Dog,Catahoula Mix,Blue Merle,10/19/2015,12/3/2017 12:47,2017-12-03T12:47:00,Luna,,Adoption,Spayed Female,30.40286081,-97.29326365,110.9332341
2193,2 months,A753664,Dog,Pit Bull Mix,Black/White,8/16/2016,11/4/2016 17:32,2016-11-04T17:32:00,Corona,,Adoption,Spayed Female,30.47463456,-97.48642154,11.53293651
2194,4 months,A756497,Cat,Domestic Shorthair Mix,Black,8/27/2014,1/2/2015 17:39,2015-01-02T17:39:00,*Joni,,Adoption,Spayed Female,30.74556242,-97.38555011,18.39077381
2195,10 months,A717560,Dog,Pit Bull Mix,Brown,3/18/2014,2/8/2015 16:39,2015-02-08T16:39:00,Sunshine,Partner,Transfer,Spayed Female,30.46250659,-97.51086212,46.81339286
2196,8 years,A588789,Dog,Labrador Retriever Mix,Yellow,4/19/2009,4/19/2017 16:18,2017-04-19T16:18:00,*Jolie,Partner,Transfer,Spayed Female,30.33299347,-97.31979685,417.5255952
2197,2 years,A700407,Dog,Labrador Retriever Mix,Black/White,10/23/2015,10/25/2017 16:16,2017-10-25T16:16:00,Bacon,,Return to Owner,Neutered Male,30.59829977,-97.65926956,104.8111111
2198,9 months,A682971,Dog,Labrador Retriever Mix,Black/White,4/15/2016,1/18/2017 19:08,2017-01-18T19:08:00,Kali,,Adoption,Spayed Female,30.50760244,-97.72055205,39.8281746
2199,1 month,A671066,Cat,Domestic Shorthair Mix,Blue Tabby,10/2/2015,12/2/2015 17:00,2015-12-02T17:00:00,*Gandalf,,Adoption,Neutered Male,30.63556634,-97.55983878,8.81547619
2200,3 weeks,A751885,Dog,Beagle Mix,Brown,6/18/2017,7/11/2017 11:49,2017-07-11T11:49:00,,Partner,Transfer,Intact Male,30.67817491,-97.3562533,3.356051587
2201,10 years,A706827,Dog,Miniature Schnauzer Mix,Black,8/23/2007,8/23/2017 14:15,2017-08-23T14:15:00,Ginger,,Return to Owner,Intact Female,30.73520479,-97.36640865,521.9419643
2202,2 months,A692783,Cat,Domestic Shorthair Mix,Orange Tabby,9/30/2015,12/16/2015 15:24,2015-12-16T15:24:00,Milo,,Adoption,Neutered Male,30.65053671,-97.69532511,11.09166667
2203,4 years,A743290,Dog,Border Collie Mix,Chocolate/White,7/18/2010,5/31/2015 0:00,2015-05-31T00:00:00,Austin,Partner,Transfer,Neutered Male,30.36382822,-97.24376922,254
2204,10 months,A683663,Dog,Labrador Retriever Mix,Black,7/13/2014,6/7/2015 18:16,2015-06-07T18:16:00,Malo,,Return to Owner,Neutered Male,30.41696463,-97.51561725,47.10873016
2205,2 weeks,A764625,Cat,Domestic Longhair Mix,Brown Tabby/Orange,6/20/2014,7/5/2014 14:04,2014-07-05T14:04:00,,Partner,Transfer,Intact Male,30.68965526,-97.67453066,2.226587302
2206,1 year,A715625,Cat,Domestic Shorthair Mix,Brown Tabby/White,7/17/2012,1/21/2014 13:15,2014-01-21T13:15:00,Cloud,Partner,Transfer,Neutered Male,30.51550732,-97.45130003,79.07886905
2207,2 months,A751040,Cat,Domestic Shorthair Mix,Orange Tabby,5/8/2017,8/6/2017 16:51,2017-08-06T16:51:00,*Tommy,,Adoption,Neutered Male,30.75403572,-97.46109413,12.95744048
2208,7 months,A672742,Dog,Labrador Retriever Mix,Black,12/8/2014,7/26/2015 18:32,2015-07-26T18:32:00,Milo,,Adoption,Neutered Male,30.65556062,-97.73267943,32.96746032
2209,7 months,A672547,Cat,Domestic Shorthair Mix,Torbie,4/25/2014,11/26/2014 9:00,2014-11-26T09:00:00,,SCRP,Transfer,Intact Female,30.32426511,-97.52544003,30.76785714
2210,3 years,A760331,Dog,Labrador Retriever Mix,Black,2/7/2014,3/15/2017 0:00,2017-03-15T00:00:00,Jerry,Partner,Transfer,Neutered Male,30.61935539,-97.70795541,161.7142857
2211,4 months,A685577,Cat,Domestic Shorthair Mix,White/Orange Tabby,2/13/2014,7/14/2014 9:00,2014-07-14T09:00:00,,SCRP,Transfer,Intact Female,30.27184791,-97.4038923,21.625
2212,1 year,A702407,Other,Bat,Black,1/2/2017,1/3/2018 8:55,2018-01-03T08:55:00,,Rabies Risk,Euthanasia,Unknown,30.71251264,-97.57972508,52.33878968
2213,6 years,A749047,Dog,Beagle Labrador Retriever,White,1/2/2010,2/21/2016 19:17,2016-02-21T19:17:00,Moose,,Adoption,Neutered Male,30.76076288,-97.54009441,320.2576389
2214,1 year,A711572,Other,Bat Mix,Brown,11/6/2014,11/8/2015 9:07,2015-11-08T09:07:00,,Rabies Risk,Euthanasia,Unknown,30.51357433,-97.6347287,52.4828373
2215,5 months,A761200,Dog,Jack Russell Terrier Mix,White/Brown,1/3/2017,6/10/2017 17:24,2017-06-10T17:24:00,*Nicholson,,Adoption,Neutered Male,30.75097333,-97.66042715,22.675
2216,1 year,A690756,Dog,Chihuahua Shorthair Mix,Black,2/1/2013,2/20/2014 13:40,2014-02-20T13:40:00,,Partner,Transfer,Intact Female,30.53666962,-97.42184021,54.93849206
2217,2 months,A757341,Dog,Manchester Terrier Mix,Tan,12/15/2013,2/16/2014 17:25,2014-02-16T17:25:00,Daisy,,Adoption,Spayed Female,30.37984028,-97.71131795,9.103670635
2218,2 years,A696688,Cat,American Shorthair Mix,Torbie,8/21/2015,10/29/2017 12:41,2017-10-29T12:41:00,Toffie,,Adoption,Spayed Female,30.61809182,-97.35531854,114.3612103
2219,1 year,A685318,Dog,Border Collie Mix,Black/White,8/9/2013,8/11/2014 11:19,2014-08-11T11:19:00,Buddy,,Return to Owner,Neutered Male,30.40436613,-97.63879926,52.49593254
2220,2 weeks,A679291,Cat,Domestic Shorthair Mix,Brown Tabby/White,4/28/2015,5/13/2015 13:59,2015-05-13T13:59:00,,Partner,Transfer,Unknown,30.56761391,-97.54722726,2.22609127
2221,3 weeks,A683802,Cat,Domestic Medium Hair Mix,White,4/18/2017,5/10/2017 18:56,2017-05-10T18:56:00,,Partner,Transfer,Intact Male,30.56523835,-97.74009303,3.255555556
2222,2 years,A728669,Dog,Chihuahua Shorthair Mix,Blue/Tan,9/9/2013,9/29/2015 15:09,2015-09-29T15:09:00,*Candy,Medical,Euthanasia,Intact Female,30.40901585,-97.5502175,107.2330357
2223,3 months,A731737,Cat,Domestic Shorthair Mix,Brown Tabby,7/31/2017,10/31/2017 13:36,2017-10-31T13:36:00,,Suffering,Euthanasia,Intact Male,30.53390927,-97.63974094,13.22380952
2224,1 year,A755012,Dog,Pembroke Welsh Corgi Mix,Tricolor,10/25/2013,10/29/2014 17:08,2014-10-29T17:08:00,,,Adoption,Neutered Male,30.56041615,-97.3510358,52.81626984
2225,2 years,A731205,Dog,Labrador Retriever Mix,Black/White,9/1/2015,10/3/2017 12:27,2017-10-03T12:27:00,19,Partner,Transfer,Intact Female,30.38141828,-97.73732174,109.0741071
2226,3 years,A681307,Cat,Domestic Shorthair Mix,Calico/White,2/10/2012,11/3/2015 12:24,2015-11-03T12:24:00,Mari,,Adoption,Spayed Female,30.72741088,-97.49328594,194.6452381
2227,2 weeks,A728029,Cat,Domestic Shorthair Mix,Black,7/21/2014,8/5/2014 16:21,2014-08-05T16:21:00,,Partner,Transfer,Intact Female,30.70976743,-97.65356702,2.240178571
2228,1 year,A720148,Dog,Siberian Husky Labrador Retriever,Black/Tan,5/19/2013,6/1/2014 12:50,2014-06-01T12:50:00,Zeus,,Adoption,Neutered Male,30.74255782,-97.69503919,54.07638889
2229,2 months,A706981,Dog,Border Collie Great Pyrenees,Black/White,5/15/2014,7/19/2014 18:40,2014-07-19T18:40:00,Riley,,Adoption,Neutered Male,30.67694769,-97.69724493,9.396825397
2230,1 year,A759695,Cat,Domestic Shorthair Mix,Black,6/6/2015,8/17/2016 12:07,2016-08-17T12:07:00,,Foster,Adoption,Spayed Female,30.28701035,-97.731445,62.64355159
2231,2 years,A714203,Dog,Pit Bull Mix,Tan/White,7/26/2014,9/11/2016 17:36,2016-09-11T17:36:00,Sophie,,Adoption,Spayed Female,30.54388684,-97.52700892,111.247619
2232,7 years,A712193,Dog,Chihuahua Shorthair Jack Russell Terrier,White/Tricolor,7/28/2010,9/15/2017 12:17,2017-09-15T12:17:00,Annie,,Return to Owner,Spayed Female,30.39946851,-97.34651565,372.3588294
2233,2 years,A755877,Cat,Domestic Shorthair Mix,Tortie,7/18/2014,8/24/2016 19:02,2016-08-24T19:02:00,*Hana,,Adoption,Spayed Female,30.35873904,-97.48658633,109.8275794
2234,6 years,A725103,Cat,Domestic Shorthair Mix,Brown Tabby/White,6/14/2008,8/3/2014 8:34,2014-08-03T08:34:00,*Scarlet,Suffering,Euthanasia,Spayed Female,30.72087766,-97.64096139,320.1938492
2235,12 years,A699487,Dog,Chihuahua Shorthair Mix,Tan/White,5/30/2004,11/26/2016 16:28,2016-11-26T16:28:00,Ceasar,Foster,Adoption,Neutered Male,30.40453511,-97.47739067,651.9551587
2236,1 year,A735676,Dog,German Shepherd Mix,Brown/Black,2/3/2015,2/7/2016 18:21,2016-02-07T18:21:00,*Sally Jessy,,Adoption,Spayed Female,30.68092298,-97.67645851,52.8235119
2237,3 months,A708787,Cat,Domestic Shorthair Mix,Brown Tabby/White,4/6/2015,7/20/2015 14:57,2015-07-20T14:57:00,*Teeny,Partner,Transfer,Spayed Female,30.50265306,-97.40434478,15.0889881
2238,2 years,A637670,Other,Raccoon,Black/Gray,10/6/2015,10/6/2017 9:20,2017-10-06T09:20:00,,Rabies Risk,Euthanasia,Unknown,30.57597725,-97.36451121,104.484127
2239,4 months,A666364,Cat,Domestic Shorthair Mix,Calico,6/19/2015,10/25/2015 12:33,2015-10-25T12:33:00,*Marmalade,,Adoption,Spayed Female,30.5629495,-97.61651113,18.36041667
2240,10 years,A695599,Dog,Boxer Mix,White/Black,9/19/2005,9/20/2015 16:01,2015-09-20T16:01:00,,Suffering,Euthanasia,Intact Male,30.65566849,-97.29568051,521.9524802
2241,2 years,A757849,Cat,Domestic Medium Hair Mix,Orange Tabby/White,8/10/2015,8/13/2017 19:20,2017-08-13T19:20:00,,Snr,Transfer,Neutered Male,30.35410791,-97.36091952,104.9722222
2242,6 days,A719528,Cat,Domestic Shorthair Mix,Black,4/20/2016,4/26/2016 12:01,2016-04-26T12:01:00,,Partner,Transfer,Unknown,30.69130973,-97.35579391,0.928670635
2243,1 year,A663956,Dog,Norwich Terrier Mix,Buff/White,3/28/2014,5/13/2015 15:19,2015-05-13T15:19:00,*Crunchella,Partner,Transfer,Spayed Female,30.41958875,-97.29235653,58.80545635
2244,3 weeks,A758351,Cat,Domestic Shorthair Mix,Brown Tabby/White,9/6/2016,9/28/2016 13:48,2016-09-28T13:48:00,,Partner,Transfer,Intact Male,30.63756128,-97.60093018,3.225
2245,5 years,A705803,Dog,English Bulldog,Tan/White,6/30/2010,1/11/2016 12:46,2016-01-11T12:46:00,Butch,,Return to Owner,Neutered Male,30.2684869,-97.35519399,288.7902778
2246,1 year,A710336,Cat,Domestic Shorthair Mix,Brown Tabby,1/31/2014,8/1/2015 9:00,2015-08-01T09:00:00,,SCRP,Transfer,Intact Male,30.68331616,-97.50503205,78.19642857
2247,2 years,A666401,Dog,Pit Bull Mix,Blue/White,9/20/2011,2/28/2014 11:20,2014-02-28T11:20:00,Shadow,,Return to Owner,Spayed Female,30.55324568,-97.48527781,127.4960317
2248,6 years,A747053,Dog,Dachshund Mix,Brown,10/31/2007,11/10/2013 16:04,2013-11-10T16:04:00,Little Bit,,Return to Owner,Spayed Female,30.40466574,-97.6157189,314.6670635
2249,3 years,A691471,Dog,Dachshund Mix,Tan,1/18/2012,1/23/2015 12:17,2015-01-23T12:17:00,Ellabelle,,Adoption,Spayed Female,30.74523634,-97.44112597,157.3588294
2250,2 months,A683434,Cat,American Shorthair Mix,Black/White,8/8/2017,10/29/2017 17:57,2017-10-29T17:57:00,*Cooper,Foster,Adoption,Neutered Male,30.5262545,-97.32852184,11.82113095
2251,2 years,A755475,Dog,Pit Bull Mix,Brown Brindle/White,1/22/2014,2/13/2016 14:50,2016-02-13T14:50:00,*Norbert,,Adoption,Neutered Male,30.70202323,-97.46903481,107.5168651
2252,4 years,A760627,Dog,Australian Shepherd Mix,Tricolor,9/27/2009,12/1/2013 17:55,2013-12-01T17:55:00,Haven,,Adoption,Spayed Female,30.35124852,-97.52379565,218.1066468
2253,1 year,A630889,Other,Bat Mix,Brown,9/14/2016,9/15/2017 8:48,2017-09-15T08:48:00,,In Kennel,Died,Unknown,30.41743243,-97.63378574,52.33809524
2254,3 years,A560146,Dog,Boston Terrier Mix,Brown Brindle/White,6/21/2012,6/23/2015 11:07,2015-06-23T11:07:00,Gucci,,Return to Owner,Neutered Male,30.51010843,-97.68403889,156.7804563
2255,2 months,A693312,Cat,Domestic Longhair Mix,Brown Tabby/White,7/6/2015,9/21/2015 15:54,2015-09-21T15:54:00,*Rydell,Partner,Transfer,Intact Male,30.4193863,-97.57154156,11.09464286
2256,9 years,A701655,Dog,Chihuahua Shorthair Mix,Tricolor,10/31/2005,1/17/2015 14:00,2015-01-17T14:00:00,*Clint,,Adoption,Neutered Male,30.5136485,-97.58914219,480.797619
2257,2 years,A691524,Dog,Australian Cattle Dog Mix,Blue Tick,4/13/2015,4/17/2017 17:16,2017-04-17T17:16:00,,,Adoption,Spayed Female,30.74542127,-97.28117752,105.1027778
2258,2 years,A691643,Dog,Pit Bull Mix,Brown/White,11/5/2012,2/15/2015 11:01,2015-02-15T11:01:00,Munchies,Partner,Transfer,Intact Male,30.35257962,-97.26878481,118.9227183
2259,9 months,A749145,Dog,Dachshund Australian Cattle Dog,Chocolate/Brown Merle,9/10/2013,7/10/2014 16:57,2014-07-10T16:57:00,,Partner,Transfer,Intact Male,30.48651857,-97.55189304,43.38660714
2260,3 months,A736157,Cat,Domestic Shorthair Mix,Orange Tabby,6/25/2017,9/30/2017 13:15,2017-09-30T13:15:00,*Laurel,,Adoption,Neutered Male,30.50503725,-97.54815876,13.9360119
2261,2 years,A700270,Dog,American Pit Bull Terrier Mix,Gray/White,10/21/2015,10/22/2017 11:55,2017-10-22T11:55:00,Zeus,,Return to Owner,Neutered Male,30.76450445,-97.68133042,104.6423611
2262,2 years,A738085,Dog,Siberian Husky Mix,White,6/28/2011,12/16/2013 19:07,2013-12-16T19:07:00,Baylah,,Return to Owner,Spayed Female,30.50788788,-97.59525641,128.9709325
2263,7 years,A678104,Cat,Domestic Shorthair Mix,Blue Tabby/White,10/28/2009,8/19/2017 17:06,2017-08-19T17:06:00,Eno,,Adoption,Neutered Male,30.68889416,-97.60687238,407.5303571
2264,2 years,A743024,Dog,Chihuahua Shorthair Mix,Yellow,12/5/2012,12/10/2014 15:23,2014-12-10T15:23:00,,Partner,Transfer,Intact Male,30.50199186,-97.3951043,105.0915675
2265,3 weeks,A737960,Cat,Domestic Shorthair Mix,Black,4/10/2015,5/2/2015 18:16,2015-05-02T18:16:00,,Partner,Transfer,Intact Male,30.40012461,-97.37942443,3.251587302
2266,6 months,A668767,Cat,Domestic Shorthair Mix,Tortie,5/5/2014,11/6/2014 9:00,2014-11-06T09:00:00,,SCRP,Transfer,Intact Female,30.40791441,-97.72518275,26.48214286
2267,4 weeks,A665901,Cat,Domestic Longhair Mix,Black Tabby,10/16/2014,11/14/2014 14:25,2014-11-14T14:25:00,,Partner,Transfer,Intact Male,30.71501511,-97.44491399,4.228670635
2268,2 months,A682138,Cat,Domestic Shorthair Mix,Orange Tabby/White,3/11/2017,5/28/2017 18:12,2017-05-28T18:12:00,*Lavender,,Adoption,Intact Female,30.48163985,-97.46060446,11.25119048
2269,3 years,A691087,Dog,Cardigan Welsh Corgi Mix,White/Black,10/5/2013,10/8/2016 13:33,2016-10-08T13:33:00,Oreo,,Return to Owner,Intact Male,30.7186154,-97.46185457,157.0806548
2270,3 years,A761521,Dog,Pit Bull Mix,Brown,4/10/2012,6/1/2015 18:11,2015-06-01T18:11:00,*Turner,,Adoption,Neutered Male,30.71042329,-97.60280604,163.965377
2271,1 month,A730669,Cat,Domestic Medium Hair Mix,Black/White,10/9/2016,11/26/2016 11:04,2016-11-26T11:04:00,,In Kennel,Died,Unknown,30.57371831,-97.63262313,6.923015873
2272,1 weeks,A694584,Cat,Domestic Shorthair Mix,Orange,4/25/2014,5/4/2014 17:28,2014-05-04T17:28:00,,Partner,Transfer,Intact Male,30.47203365,-97.65714424,1.38968254
2273,7 months,A753130,Dog,Chihuahua Shorthair Jack Russell Terrier,Tricolor,6/27/2016,2/6/2017 15:27,2017-02-06T15:27:00,Eddy,,Adoption,Neutered Male,30.64278304,-97.25843794,32.09196429
2274,1 year,A716039,Dog,Chihuahua Shorthair Mix,Brown/Tan,11/7/2015,11/11/2016 11:58,2016-11-11T11:58:00,Coffee,,Adoption,Neutered Male,30.58993746,-97.53463443,52.92837302
2275,1 year,A720818,Dog,German Shepherd Mix,Black/Tan,11/9/2012,12/9/2013 18:29,2013-12-09T18:29:00,Vincent,,Return to Owner,Intact Male,30.46938424,-97.27653169,56.53859127
2276,2 months,A744889,Dog,Pit Bull Mix,Chocolate/White,8/13/2013,10/28/2013 12:47,2013-10-28T12:47:00,,Partner,Transfer,Neutered Male,30.51287572,-97.27991797,10.93323413
2277,3 years,A700888,Dog,Chihuahua Shorthair Mix,Black/White,6/24/2011,6/26/2014 11:07,2014-06-26T11:07:00,Frannie,,Return to Owner,Spayed Female,30.76318541,-97.44802294,156.9233135
2278,3 weeks,A685621,Cat,Domestic Shorthair Mix,Blue Tabby,10/7/2014,10/30/2014 10:37,2014-10-30T10:37:00,,Partner,Transfer,Unknown,30.60874926,-97.41025791,3.34890873
2279,1 year,A688213,Cat,American Shorthair Mix,Gray Tabby/White,5/6/2016,11/10/2017 19:14,2017-11-10T19:14:00,Meridian,Snr,Transfer,Unknown,30.58769935,-97.30213807,79.11448413
2280,1 year,A668298,Dog,Jack Russell Terrier Mix,White,7/8/2015,7/9/2016 16:05,2016-07-09T16:05:00,Snow,,Return to Owner,Intact Female,30.69445482,-97.38701997,52.52430556
2281,2 years,A717055,Dog,Pit Bull Mix,Brown/White,12/31/2012,12/31/2014 12:52,2014-12-31T12:52:00,Miss Crush,,Return to Owner,Spayed Female,30.43250023,-97.31976999,104.3623016
2282,8 months,A694963,Dog,Border Collie Mix,Black/White,11/2/2016,7/13/2017 15:40,2017-07-13T15:40:00,Lego,,Return to Owner,Intact Male,30.33950353,-97.27038716,36.23611111
2283,1 year,A650399,Cat,Siamese Mix,Seal Point,5/13/2014,11/13/2015 15:12,2015-11-13T15:12:00,Dirty,Suffering,Euthanasia,Neutered Male,30.5676233,-97.24801086,78.51904762
2284,6 months,A602465,Dog,Pointer Mix,Fawn/White,8/15/2015,2/23/2016 15:15,2016-02-23T15:15:00,*Atticus,,Adoption,Neutered Male,30.41853621,-97.39608227,27.51934524
2285,3 years,A708985,Dog,Dachshund Chihuahua Shorthair,Tan/Black,3/9/2014,3/26/2017 18:45,2017-03-26T18:45:00,Louis,,Adoption,Neutered Male,30.44607207,-97.56117847,159.1116071
2286,1 year,A750194,Dog,Rhod Ridgeback Pit Bull,White/Brown,4/21/2014,7/26/2015 12:16,2015-07-26T12:16:00,*Wilbur,,Adoption,Neutered Male,30.37667282,-97.54948977,65.93015873
2287,4 weeks,A668440,Other,Bat,Brown/Black,7/10/2014,8/10/2014 13:37,2014-08-10T13:37:00,,,Disposal,Unknown,30.75326612,-97.54650437,4.509623016
2288,1 month,A647538,Cat,Domestic Shorthair Mix,White/Gray,8/9/2014,9/16/2014 17:56,2014-09-16T17:56:00,,Partner,Transfer,Intact Female,30.43952026,-97.6354439,5.53531746
2289,12 years,A709407,Cat,Domestic Shorthair Mix,Blue/White,12/1/2001,12/6/2013 17:25,2013-12-06T17:25:00,Cleo,Partner,Transfer,Spayed Female,30.7064113,-97.3722202,626.9608135
2290,3 years,A685809,Dog,Labrador Retriever Mix,Yellow,12/1/2012,12/2/2015 18:37,2015-12-02T18:37:00,Sammy,,Return to Owner,Neutered Male,30.41750121,-97.6654623,156.6822421
2291,4 years,A753662,Dog,Pit Bull Mix,Blue/White,1/7/2012,7/5/2016 14:37,2016-07-05T14:37:00,Sheba,,Return to Owner,Spayed Female,30.34236684,-97.57406995,234.5155754
2292,2 years,A662261,Dog,Yorkshire Terrier Chihuahua Longhair,Silver/Tan,3/28/2011,11/15/2013 16:23,2013-11-15T16:23:00,Tyson,Partner,Transfer,Neutered Male,30.59020307,-97.4060823,137.6689484
2293,6 years,A740985,Dog,Chihuahua Shorthair Mix,Brown,3/2/2011,4/28/2017 13:17,2017-04-28T13:17:00,Blessings,,Return to Owner,Neutered Male,30.6527449,-97.3396216,321.3647817
2294,4 weeks,A744416,Cat,Domestic Shorthair Mix,Brown Tabby,7/12/2015,8/9/2015 11:46,2015-08-09T11:46:00,*Abbie,Partner,Transfer,Intact Female,30.73383139,-97.25403653,4.070039683
2295,1 month,A709838,Cat,Domestic Shorthair Mix,Orange Tabby/White,4/9/2017,5/27/2017 17:58,2017-05-27T17:58:00,Honey,,Adoption,Intact Female,30.64344577,-97.73742327,6.964087302
2296,7 months,A388691,Dog,Labrador Retriever Mix,Tan,5/4/2013,12/5/2013 15:46,2013-12-05T15:46:00,,Aggressive,Euthanasia,Intact Male,30.72071325,-97.71399236,30.80813492
2297,4 years,A707241,Dog,Pit Bull Mix,Brown Brindle/White,2/12/2011,5/28/2015 10:09,2015-05-28T10:09:00,Rocky,Aggressive,Euthanasia,Neutered Male,30.60466252,-97.38202401,223.7747024
2298,2 years,A740874,Dog,Boxer Mix,Tan/White,8/8/2013,8/25/2015 14:41,2015-08-25T14:41:00,Nagini,,Adoption,Spayed Female,30.56601911,-97.44258133,106.8016865
2299,2 years,A761794,Dog,Dachshund Australian Cattle Dog,Brown Brindle/White,8/13/2012,8/22/2014 17:52,2014-08-22T17:52:00,Darcy,,Adoption,Spayed Female,30.48975016,-97.45415786,105.6777778
2300,2 months,A759984,Cat,Domestic Shorthair Mix,Brown Tabby,5/25/2017,8/4/2017 21:48,2017-08-04T21:48:00,*Caden,,Adoption,Neutered Male,30.38881482,-97.56187699,10.27261905
2301,5 months,A721747,Cat,Domestic Medium Hair Mix,Black/White,7/24/2013,12/24/2013 12:55,2013-12-24T12:55:00,*Kim,Partner,Transfer,Neutered Male,30.31637114,-97.7398513,21.93402778
2302,1 month,A683638,Dog,Cairn Terrier Mix,Tan,11/10/2016,1/6/2017 17:41,2017-01-06T17:41:00,Bowie,Foster,Adoption,Spayed Female,30.65893111,-97.58139334,8.248115079
2303,10 months,A680036,Dog,Boxer Mix,Brown,4/30/2016,3/15/2017 12:27,2017-03-15T12:27:00,Dosha,,Adoption,Spayed Female,30.48987029,-97.73298664,45.64553571
2304,6 years,A715702,Dog,Yorkshire Terrier Mix,Sable,8/13/2009,8/23/2015 11:36,2015-08-23T11:36:00,Bandito,,Return to Owner,Intact Male,30.59778418,-97.29873263,314.497619
2305,12 years,A749563,Dog,Miniature Schnauzer Mix,Black/Gray,5/16/2003,11/29/2015 18:40,2015-11-29T18:40:00,Blaze,,Return to Owner,Neutered Male,30.50309124,-97.50328249,654.3968254
2306,1 year,A677884,Cat,Domestic Medium Hair Mix,Blue,7/10/2014,7/11/2015 9:00,2015-07-11T09:00:00,,SCRP,Transfer,Unknown,30.48701276,-97.57028932,52.33928571
2307,11 years,A721425,Dog,Chihuahua Shorthair Mix,Tan,12/24/2005,12/31/2016 17:11,2016-12-31T17:11:00,*Fig,,Adoption,Neutered Male,30.26966793,-97.65957709,575.1022817
2308,7 months,A725027,Dog,Labrador Retriever Mix,Black,3/29/2017,11/11/2017 13:34,2017-11-11T13:34:00,Coco,,Adoption,Spayed Female,30.44669997,-97.46465667,32.5093254
2309,4 months,A671513,Cat,Domestic Shorthair Mix,Black,6/23/2017,10/31/2017 11:20,2017-10-31T11:20:00,,Partner,Transfer,Spayed Female,30.35783273,-97.71941948,18.63888889
2310,10 years,A681417,Dog,Rat Terrier,White/Black,3/3/2006,3/14/2016 15:27,2016-03-14T15:27:00,Molly,,Adoption,Spayed Female,30.67428512,-97.71679665,523.5205357
2311,1 month,A656967,Cat,Domestic Shorthair Mix,Black,6/6/2014,7/25/2014 16:46,2014-07-25T16:46:00,,Partner,Transfer,Intact Male,30.50842504,-97.50697927,7.099801587
2312,3 months,A684378,Cat,Domestic Shorthair Mix,Black Smoke,4/29/2014,8/21/2014 17:38,2014-08-21T17:38:00,Smoke Dawg,Foster,Adoption,Neutered Male,30.2882106,-97.65102576,16.3906746
2313,1 year,A666592,Cat,Domestic Shorthair Mix,Black,4/16/2015,4/27/2016 10:58,2016-04-27T10:58:00,*Flo,SCRP,Transfer,Spayed Female,30.50622167,-97.71744325,53.92242063
2314,10 months,A680380,Dog,Chihuahua Shorthair Dachshund,Brown,1/8/2015,11/15/2015 14:16,2015-11-15T14:16:00,*Kojak,Partner,Transfer,Intact Male,30.4360888,-97.7014466,44.51349206
2315,4 weeks,A711901,Cat,Domestic Shorthair Mix,Brown Tabby,4/16/2017,5/18/2017 15:36,2017-05-18T15:36:00,*Sam,Partner,Transfer,Intact Male,30.39107198,-97.45550556,4.664285714
2316,2 years,A685730,Dog,Pit Bull Mix,Brown,4/30/2012,8/16/2014 19:00,2014-08-16T19:00:00,Juliette,,Adoption,Spayed Female,30.33565979,-97.44215717,119.827381
2317,4 weeks,A691126,Dog,German Shepherd Mix,White/Brown,1/26/2016,2/28/2016 15:34,2016-02-28T15:34:00,*Jolly,Partner,Transfer,Intact Male,30.48091502,-97.54816909,4.806944444
2318,2 months,A701569,Cat,Siamese Mix,Flame Point,4/10/2016,6/30/2016 18:50,2016-06-30T18:50:00,*Jackson,Foster,Adoption,Neutered Male,30.66346828,-97.29532557,11.68353175
2319,2 years,A736208,Dog,Australian Cattle Dog Labrador Retriever,Brown,1/25/2012,2/15/2014 12:47,2014-02-15T12:47:00,*Bogo,,Adoption,Neutered Male,30.74596117,-97.26880101,107.5046627
2320,13 years,A711222,Dog,Miniature Schnauzer Mix,Gray/White,6/16/2001,7/3/2014 16:00,2014-07-03T16:00:00,Whiskers,Partner,Transfer,Neutered Male,30.70783355,-97.53256001,680.8095238
2321,3 years,A662498,Dog,Australian Cattle Dog Mix,Blue Tick,12/21/2009,11/11/2013 15:31,2013-11-11T15:31:00,Homer,Aggressive,Euthanasia,Intact Male,30.67415731,-97.24364761,203.0923611
2322,2 weeks,A674897,Cat,Domestic Shorthair Mix,Black,7/7/2014,7/22/2014 17:34,2014-07-22T17:34:00,,Partner,Transfer,Unknown,30.42712959,-97.46892729,2.247420635
2323,2 years,A734310,Dog,Chihuahua Shorthair Mix,Buff/White,5/4/2011,11/10/2013 16:35,2013-11-10T16:35:00,Chewie,,Adoption,Neutered Male,30.57516366,-97.30246401,131.6701389
2324,1 month,A760453,Cat,Domestic Shorthair Mix,Brown Tabby,5/11/2014,7/11/2014 16:52,2014-07-11T16:52:00,,In Foster,Died,Intact Male,30.63952591,-97.50328149,8.81468254
2325,5 years,A710478,Dog,Australian Shepherd Mix,White/Brown,9/13/2010,9/17/2015 15:21,2015-09-17T15:21:00,Hope,,Return to Owner,Spayed Female,30.48459023,-97.67457535,261.5199405
2326,2 months,A697180,Dog,Labrador Retriever Mix,Black/White,6/12/2014,8/17/2014 17:29,2014-08-17T17:29:00,Willie,,Adoption,Neutered Male,30.63459876,-97.45367537,9.532638889
2327,9 years,A698121,Dog,Maltese Miniature Poodle,White,10/30/2005,11/5/2014 11:27,2014-11-05T11:27:00,Max,,Return to Owner,Neutered Male,30.60201843,-97.52774246,470.4967262
2328,1 year,A765100,Other,Bat Mix,Brown,5/1/2014,5/4/2015 11:06,2015-05-04T11:06:00,,Rabies Risk,Euthanasia,Unknown,30.38726672,-97.50409972,52.6375
2329,2 years,A728042,Dog,Pomeranian Mix,Red/Tan,10/6/2014,11/17/2016 16:20,2016-11-17T16:20:00,*Edward,,Return to Owner,Intact Male,30.40459337,-97.46865928,110.5257937
2330,4 years,A716637,Dog,Pit Bull Mix,Brown/White,11/3/2011,11/3/2015 18:57,2015-11-03T18:57:00,Capone,,Return to Owner,Neutered Male,30.39353863,-97.36747715,208.8270833
2331,2 months,A715244,Cat,Domestic Shorthair Mix,Tortie,7/20/2013,10/19/2013 15:34,2013-10-19T15:34:00,*Grace,Partner,Transfer,Intact Female,30.369705,-97.36044082,13.09265873
2332,4 years,A736820,Dog,Lhasa Apso,Black/White,3/20/2010,3/20/2014 16:28,2014-03-20T16:28:00,Layla,,Return to Owner,Spayed Female,30.3798307,-97.4210583,208.8123016
2333,7 months,A677216,Dog,Boston Terrier,Black/White,2/4/2016,9/4/2016 14:35,2016-09-04T14:35:00,Audi,,Return to Owner,Neutered Male,30.51014992,-97.32323275,30.51537698
2334,2 years,A728332,Cat,Domestic Shorthair Mix,Blue Tabby/White,10/18/2015,12/6/2017 15:27,2017-12-06T15:27:00,Cinderella,Partner,Transfer,Spayed Female,30.74215976,-97.50839647,111.5205357
2335,1 year,A685014,Cat,Domestic Medium Hair Mix,Torbie,8/23/2014,8/24/2015 9:00,2015-08-24T09:00:00,,SCRP,Transfer,Intact Female,30.70681051,-97.6323361,52.33928571
2336,7 years,A678482,Dog,Shih Tzu Mix,Cream,2/19/2008,2/20/2015 14:00,2015-02-20T14:00:00,Mr. Pickles,,Return to Owner,Neutered Male,30.46756748,-97.27923956,365.5119048
2337,6 days,A717748,Dog,Labrador Retriever Mix,Brown,2/28/2015,3/6/2015 9:50,2015-03-06T09:50:00,,Partner,Transfer,Unknown,30.72045478,-97.62055054,0.915674603
2338,1 year,A734785,Dog,Pit Bull Chow Chow,White/Black,1/14/2017,1/14/2018 18:08,2018-01-14T18:08:00,Logan,,Return to Owner,Neutered Male,30.40249414,-97.44660823,52.25079365
2339,6 months,A762708,Dog,Plott Hound Mix,Brown/White,11/30/2015,6/11/2016 13:14,2016-06-11T13:14:00,Karma,,Adoption,Spayed Female,30.30201564,-97.42528588,27.79305556
2340,6 months,A678284,Dog,German Shepherd Mix,Brown/Black,5/7/2015,11/27/2015 13:31,2015-11-27T13:31:00,,Partner,Transfer,Spayed Female,30.68111846,-97.31827087,29.22331349
2341,13 years,A687077,Cat,Domestic Shorthair Mix,Silver Tabby,11/18/2002,11/29/2015 19:17,2015-11-29T19:17:00,Smokey,,Adoption,Neutered Male,30.66841279,-97.47657049,679.9719246
2342,2 months,A756242,Dog,Chihuahua Shorthair Dachshund,Black/Tan,8/2/2016,10/18/2016 11:19,2016-10-18T11:19:00,Daisy,Partner,Transfer,Intact Female,30.50910851,-97.70591802,11.06736111
2343,4 weeks,A705270,Cat,Domestic Shorthair Mix,Black,3/21/2014,4/21/2014 18:03,2014-04-21T18:03:00,,Partner,Transfer,Intact Male,30.53061206,-97.57809748,4.536011905
2344,1 year,A619278,Dog,Maltese Mix,White,6/2/2015,6/5/2016 12:11,2016-06-05T12:11:00,Spicey,,Adoption,Spayed Female,30.56377317,-97.62342787,52.78680556
2345,2 years,A737894,Dog,Catahoula Australian Cattle Dog,Black,8/1/2012,8/10/2014 12:20,2014-08-10T12:20:00,Eli,Partner,Transfer,Intact Male,30.38913698,-97.72042536,105.6448413
2346,2 years,A714103,Dog,Miniature Poodle Miniature Schnauzer,Black/White,5/9/2012,5/14/2014 19:15,2014-05-14T19:15:00,,,Adoption,Neutered Male,30.32878199,-97.38650177,105.1145833
2347,5 years,A745897,Cat,Domestic Shorthair Mix,Blue Cream/White,12/14/2010,12/29/2015 19:56,2015-12-29T19:56:00,*Sugar,Partner,Transfer,Intact Female,30.69541109,-97.51869567,263.1186508
2348,3 years,A724638,Dog,Pit Bull Mix,Fawn,9/13/2013,9/13/2016 16:36,2016-09-13T16:36:00,Mac,,Return to Owner,Intact Male,30.3336008,-97.28780288,156.6702381
2349,13 years,A755687,Cat,Domestic Shorthair Mix,Brown Tabby,11/25/2004,11/25/2017 15:24,2017-11-25T15:24:00,Noah,,Return to Owner,Neutered Male,30.74630303,-97.71192607,678.377381
2350,10 months,A716751,Cat,Domestic Shorthair Mix,Black,7/6/2013,5/7/2014 13:02,2014-05-07T13:02:00,,SCRP,Transfer,Unknown,30.68050921,-97.27215704,43.64900794
2351,2 years,A756330,Dog,Pit Bull Mix,Brown/White,8/30/2012,8/31/2014 11:21,2014-08-31T11:21:00,Hildago,,Return to Owner,Intact Male,30.49119226,-97.33453654,104.496131
2352,2 months,A690538,Cat,Domestic Shorthair Mix,Gray Tabby,6/16/2017,8/21/2017 18:01,2017-08-21T18:01:00,,,Adoption,Neutered Male,30.44740207,-97.56838796,9.535813492
2353,4 weeks,A688206,Cat,Domestic Shorthair,Black/White,5/15/2015,6/17/2015 12:45,2015-06-17T12:45:00,,Partner,Transfer,Intact Female,30.45655494,-97.5964596,4.790178571
2354,2 years,A756751,Dog,Great Pyrenees,White,10/28/2011,4/23/2014 16:55,2014-04-23T16:55:00,Bella,,Return to Owner,Intact Female,30.31863405,-97.48189328,129.8149802
2355,2 years,A724108,Cat,Domestic Shorthair Mix,Tortie,11/6/2014,11/7/2016 9:00,2016-11-07T09:00:00,,Snr,Transfer,Spayed Female,30.62423593,-97.58130859,104.625
2356,4 years,A764953,Cat,Munchkin Longhair Mix,Brown Tabby/White,10/18/2011,10/29/2015 11:24,2015-10-29T11:24:00,,Partner,Transfer,Neutered Male,30.32502555,-97.38790989,210.3535714
2357,4 years,A688633,Cat,Domestic Shorthair Mix,Black/White,3/26/2013,5/30/2017 9:59,2017-05-30T09:59:00,Pepper,,Adoption,Spayed Female,30.5754849,-97.71259552,218.0594246
2358,4 years,A663582,Dog,Pit Bull Mix,Brown/White,4/19/2012,4/23/2016 11:44,2016-04-23T11:44:00,,,Return to Owner,Intact Male,30.76647255,-97.50449787,209.3555556
2359,3 years,A764345,Other,Bat Mix,Brown,8/7/2014,8/7/2017 13:50,2017-08-07T13:50:00,,,Disposal,Unknown,30.57577532,-97.66704113,156.6537698
2360,10 months,A726171,Dog,Blue Lacy Mix,Fawn,1/24/2015,11/30/2015 17:52,2015-11-30T17:52:00,Donnor,,Adoption,Neutered Male,30.6328885,-97.68722873,44.39206349
2361,2 years,A748110,Cat,Domestic Shorthair Mix,Gray,8/17/2015,8/23/2017 12:03,2017-08-23T12:03:00,Mister Kitty,,Return to Owner,Neutered Male,30.66742728,-97.24686601,105.3574405
2362,3 months,A724648,Dog,Maltese Mix,White/Tan,7/22/2014,10/30/2014 11:19,2014-10-30T11:19:00,*Chelsea,,Adoption,Spayed Female,30.33761352,-97.24935091,14.3530754
2363,3 years,A705156,Cat,Domestic Longhair Mix,Orange Tabby,9/16/2011,9/17/2014 14:06,2014-09-17T14:06:00,Garfield,Partner,Transfer,Neutered Male,30.68293067,-97.57496179,156.7982143
2364,18 years,A711435,Cat,Domestic Shorthair Mix,White/Calico,8/24/1999,8/24/2017 17:58,2017-08-24T17:58:00,Lulu Bell,Suffering,Euthanasia,Spayed Female,30.73723867,-97.30801653,939.3926587
2365,9 years,A712561,Dog,Dachshund Mix,Brown,5/18/2007,10/14/2016 16:36,2016-10-14T16:36:00,Peewee,,Return to Owner,Neutered Male,30.51404825,-97.39019127,491.0988095
2366,2 years,A702291,Dog,Miniature Pinscher,Black/Tan,4/12/2014,4/21/2016 13:44,2016-04-21T13:44:00,Brownie,,Return to Owner,Intact Female,30.35920564,-97.41443277,105.7960317
2367,5 years,A716931,Dog,Miniature Poodle,White,1/9/2013,1/15/2018 14:03,2018-01-15T14:03:00,,Partner,Transfer,Spayed Female,30.45415305,-97.4761121,261.7979167
2368,1 year,A730888,Other,Bat,Brown,9/21/2013,9/21/2014 16:33,2014-09-21T16:33:00,,Rabies Risk,Euthanasia,Unknown,30.31137577,-97.5628759,52.24136905
2369,4 months,A683432,Cat,Domestic Shorthair Mix,Black,8/6/2013,12/27/2013 19:38,2013-12-27T19:38:00,*Korovyov,Partner,Transfer,Neutered Male,30.41279977,-97.37578794,20.54543651
2370,4 months,A720493,Cat,Domestic Shorthair Mix,Calico,8/28/2017,12/29/2017 13:41,2017-12-29T13:41:00,Madison,,Adoption,Spayed Female,30.65667946,-97.64538398,17.65287698
2371,1 year,A664236,Cat,Domestic Shorthair Mix,Torbie,5/7/2015,7/14/2016 16:00,2016-07-14T16:00:00,*Darla,,Adoption,Spayed Female,30.62463039,-97.3707659,62.0952381
2372,6 months,A705094,Dog,Australian Cattle Dog Mix,White/Tan,10/29/2016,5/27/2017 19:11,2017-05-27T19:11:00,*Crumpet,,Adoption,Spayed Female,30.52817831,-97.56331277,30.11418651
2373,2 years,A736663,Dog,Cairn Terrier Mix,Tricolor,4/20/2014,4/21/2016 18:57,2016-04-21T18:57:00,Lyric,,Return to Owner,Intact Male,30.56297791,-97.2810602,104.6842262
2374,1 weeks,A684583,Dog,American Staffordshire Terrier,Fawn,6/11/2015,6/19/2015 13:44,2015-06-19T13:44:00,,Partner,Transfer,Intact Male,30.35965284,-97.60112569,1.224603175
2375,5 months,A682781,Dog,Dachshund Labrador Retriever,Brown Brindle,4/6/2015,9/10/2015 12:41,2015-09-10T12:41:00,*Minnie,Partner,Transfer,Intact Female,30.56149433,-97.71392744,22.50406746
2376,5 years,A733097,Cat,Domestic Shorthair Mix,Orange Tabby,9/25/2010,9/26/2015 9:00,2015-09-26T09:00:00,,SCRP,Transfer,Intact Male,30.27739156,-97.52520218,261.0535714
2377,8 years,A679964,Cat,Domestic Shorthair Mix,Orange Tabby,5/11/2007,5/13/2015 11:08,2015-05-13T11:08:00,Golden Boy,Suffering,Euthanasia,Neutered Male,30.27788335,-97.33015158,417.7805556
2378,2 months,A722293,Cat,Domestic Shorthair Mix,White,11/25/2015,2/16/2016 8:29,2016-02-16T08:29:00,,Foster,Adoption,Spayed Female,30.28844106,-97.67522461,11.90763889
2379,1 year,A669198,Dog,Black Mouth Cur Mix,Brown/White,7/12/2015,7/24/2016 18:35,2016-07-24T18:35:00,Kaly,,Adoption,Spayed Female,30.743566,-97.34882249,54.11061508
2380,3 weeks,A691062,Cat,Domestic Shorthair Mix,Tortie,6/18/2014,7/11/2014 19:10,2014-07-11T19:10:00,,Partner,Transfer,Intact Female,30.42331745,-97.644489,3.399801587
2381,1 month,A705930,Dog,Labrador Retriever Mix,Black/White,12/17/2015,2/13/2016 17:25,2016-02-13T17:25:00,Penelope,,Adoption,Spayed Female,30.68619823,-97.72236004,8.389384921
2382,1 week,A735534,Cat,Domestic Shorthair Mix,Orange/White,9/24/2013,10/1/2013 10:44,2013-10-01T10:44:00,,Partner,Transfer,Unknown,30.69531295,-97.63073637,1.063888889
2383,1 year,A749019,Dog,Staffordshire Mix,Blue/White,6/18/2014,7/5/2015 14:00,2015-07-05T14:00:00,Magna,,Adoption,Spayed Female,30.50413335,-97.59795502,54.6547619
2384,5 years,A707062,Cat,Domestic Medium Hair Mix,Orange Tabby,10/14/2011,10/15/2016 9:00,2016-10-15T09:00:00,Nicks,Suffering,Euthanasia,Neutered Male,30.47727462,-97.30538366,261.1964286
2385,2 months,A704183,Dog,Labrador Retriever Newfoundland,Black,5/18/2014,7/29/2014 17:04,2014-07-29T17:04:00,,,Adoption,Spayed Female,30.60072236,-97.31032139,10.38730159
2386,1 year,A713124,Cat,Domestic Shorthair Mix,White/Black,1/2/2013,7/3/2014 9:00,2014-07-03T09:00:00,,SCRP,Transfer,Neutered Male,30.30712363,-97.39405299,78.19642857
2387,2 years,A659414,Dog,Pit Bull Mix,Chocolate/White,8/17/2014,3/26/2017 16:17,2017-03-26T16:17:00,Rylie,,Adoption,Spayed Female,30.54237196,-97.35638026,136.0969246
2388,10 years,A678781,Dog,Cocker Spaniel,Black/White,5/28/2004,6/4/2014 15:06,2014-06-04T15:06:00,Maddie,Partner,Transfer,Intact Female,30.38780341,-97.55269825,522.8041667
2389,5 months,A737135,Other,Bat,Brown,9/14/2015,3/14/2016 13:36,2016-03-14T13:36:00,,Rabies Risk,Euthanasia,Unknown,30.65932739,-97.4330515,26.08095238
2390,2 years,A723866,Dog,Pit Bull Mix,Tan/Brown,12/16/2011,6/24/2014 18:56,2014-06-24T18:56:00,Cooper,,Adoption,Neutered Male,30.28450445,-97.7334642,131.684127
2391,2 years,A758773,Cat,Domestic Shorthair Mix,White/Black,7/29/2014,1/3/2017 18:57,2017-01-03T18:57:00,Tiny,,Adoption,Spayed Female,30.60940882,-97.40512291,127.1127976
2392,2 years,A740429,Dog,Labrador Retriever Border Collie,Chocolate/White,6/22/2014,4/23/2017 14:05,2017-04-23T14:05:00,Bleu,,Adoption,Spayed Female,30.68726483,-97.41151282,148.0838294
2393,1 year,A703320,Dog,Labrador Retriever Mix,Chocolate/Brown,9/25/2015,12/1/2016 18:06,2016-12-01T18:06:00,*Knight,,Return to Owner,Intact Male,30.2778418,-97.63165032,61.96488095
2394,1 month,A680578,Cat,Domestic Shorthair Mix,Brown Tabby,3/19/2017,5/11/2017 14:12,2017-05-11T14:12:00,,Partner,Transfer,Intact Male,30.4461062,-97.47025778,7.655952381
2395,1 year,A757097,Dog,Australian Cattle Dog Mix,Red Merle,7/7/2014,7/17/2015 14:55,2015-07-17T14:55:00,Hercules,,Adoption,Neutered Male,30.30450798,-97.35017392,53.66021825
2396,1 month,A663879,Cat,Domestic Shorthair Mix,Tortie,4/25/2015,6/7/2015 15:31,2015-06-07T15:31:00,,Partner,Transfer,Intact Female,30.6446984,-97.56892825,6.235218254
2397,1 year,A688188,Dog,Australian Cattle Dog,White/Tan,10/2/2014,10/6/2015 16:23,2015-10-06T16:23:00,*Bonnie,Partner,Transfer,Spayed Female,30.41397414,-97.55626233,52.81180556
2398,11 months,A722566,Dog,Chihuahua Shorthair Mix,Brown,3/24/2013,3/5/2014 17:58,2014-03-05T17:58:00,Ginger,,Adoption,Spayed Female,30.44556865,-97.2816537,49.53551587
2399,1 month,A691523,Dog,Border Collie Mix,Black/White,4/6/2014,6/3/2014 17:47,2014-06-03T17:47:00,Sadie,,Adoption,Spayed Female,30.62715416,-97.62058082,8.39156746
2400,9 months,A697665,Dog,Pit Bull Mix,White,2/22/2016,11/26/2016 16:50,2016-11-26T16:50:00,*Heidi,,Adoption,Spayed Female,30.54376663,-97.52024033,39.81448413
2401,12 years,A718748,Cat,Domestic Shorthair Mix,Brown Tabby/Black,4/10/2004,9/8/2016 13:08,2016-09-08T13:08:00,Maggie,Foster,Adoption,Spayed Female,30.63409518,-97.72493868,647.7924603
2402,3 years,A666066,Dog,Pit Bull Mix,White/Black,9/21/2014,9/26/2017 10:14,2017-09-26T10:14:00,,Partner,Transfer,Intact Female,30.52791418,-97.3649502,157.346627
2403,7 months,A673567,Cat,Domestic Shorthair Mix,Black/Black,5/17/2016,1/13/2017 19:07,2017-01-13T19:07:00,Elvis,,Adoption,Neutered Male,30.6947312,-97.39960843,34.54236111
2404,3 months,A764256,Dog,Catahoula Mix,White/Blue,3/8/2015,6/9/2015 17:38,2015-06-09T17:38:00,Remus,,Adoption,Neutered Male,30.45984274,-97.29862633,13.3906746
2405,1 year,A619107,Dog,Treeing Walker Coonhound Mix,Blue Tick,6/4/2013,7/24/2014 8:15,2014-07-24T08:15:00,*Ruby,Foster,Adoption,Spayed Female,30.58576317,-97.32807444,59.33482143
2406,2 months,A760683,Dog,Chihuahua Shorthair Mix,Tricolor,6/29/2017,8/31/2017 18:59,2017-08-31T18:59:00,,,Adoption,Neutered Male,30.4640639,-97.37274088,9.112996032
2407,1 year,A674353,Cat,Domestic Shorthair Mix,Calico,9/25/2012,12/8/2013 14:32,2013-12-08T14:32:00,Halo,Partner,Transfer,Spayed Female,30.41404585,-97.55682978,62.80079365
2408,4 months,A758993,Dog,American Bulldog Mix,Tan/White,5/16/2014,9/16/2014 15:09,2014-09-16T15:09:00,Melo,,Return to Owner,Intact Male,30.31758813,-97.48324841,17.66160714
2409,5 years,A667090,Cat,Domestic Shorthair Mix,Tortie,3/18/2011,3/23/2016 16:24,2016-03-23T16:24:00,,Suffering,Euthanasia,Intact Female,30.6914638,-97.50386358,261.8119048
2410,4 weeks,A640924,Dog,Chihuahua Longhair Mix,Black/White,10/21/2014,11/21/2014 13:19,2014-11-21T13:19:00,,Partner,Transfer,Intact Male,30.70607349,-97.37810101,4.507837302
2411,3 years,A710817,Dog,Chihuahua Shorthair Mix,Tan,2/26/2014,6/19/2017 16:49,2017-06-19T16:49:00,Biggie,Partner,Transfer,Neutered Male,30.38522586,-97.25643505,172.8143849
2412,6 years,A697320,Dog,Carolina Dog Mix,Brown,1/6/2011,1/29/2017 15:14,2017-01-29T15:14:00,Casidy,,Adoption,Spayed Female,30.46275258,-97.66095747,316.519246
2413,2 months,A758686,Cat,Domestic Shorthair Mix,Black/White,9/17/2013,11/24/2013 17:25,2013-11-24T17:25:00,Frenchie,,Adoption,Spayed Female,30.44877868,-97.41435837,9.817956349
2414,1 year,A739682,Other,Raccoon Mix,Gray/Black,2/26/2013,2/26/2014 15:22,2014-02-26T15:22:00,,Suffering,Euthanasia,Unknown,30.57507096,-97.58458873,52.2343254
2415,1 year,A705183,Dog,Australian Cattle Dog Mix,Black/White,12/26/2016,1/17/2018 16:09,2018-01-17T16:09:00,*Duchess,,Adoption,Spayed Female,30.31351154,-97.42748398,55.38184524
2416,6 years,A697599,Dog,German Shepherd Mix,Red/White,1/25/2011,5/2/2017 17:45,2017-05-02T17:45:00,Braulio,,Return to Owner,Neutered Male,30.56737884,-97.67930173,327.1056548
2417,5 months,A720230,Dog,Anatol Shepherd Mix,Tan/Tan,5/7/2017,10/26/2017 18:53,2017-10-26T18:53:00,,,Adoption,Neutered Male,30.50343784,-97.58096144,24.68382937
2418,3 years,A700095,Dog,Basenji Australian Cattle Dog,Yellow,3/11/2011,4/6/2014 12:20,2014-04-06T12:20:00,Penny,,Adoption,Spayed Female,30.34366128,-97.69579698,160.359127
2419,8 years,A747909,Dog,Toy Fox Terrier Mix,Black/White,9/25/2009,10/1/2017 13:45,2017-10-01T13:45:00,Bailey,,Adoption,Spayed Female,30.28932493,-97.62313364,418.3675595
2420,3 years,A654375,Dog,Pit Bull Mix,Chocolate/White,5/18/2010,11/19/2013 11:02,2013-11-19T11:02:00,Rex,Behavior,Euthanasia,Intact Male,30.31841896,-97.62936352,183.0656746
2421,2 years,A760277,Dog,Pit Bull,Brown/White,10/31/2011,7/16/2014 9:10,2014-07-16T09:10:00,Loco,Rabies Risk,Euthanasia,Intact Male,30.39638094,-97.58281691,141.3402778
2422,12 years,A750122,Dog,Rat Terrier Mix,Tricolor,8/28/2003,9/5/2015 13:33,2015-09-05T13:33:00,Cricket,,Adoption,Spayed Female,30.35428583,-97.50962816,627.366369
2423,1 year,A742065,Dog,Chihuahua Shorthair Mix,Tan/White,2/21/2014,2/28/2015 18:09,2015-02-28T18:09:00,Chloe,,Return to Owner,Spayed Female,30.65637153,-97.43145616,53.25089286
2424,2 months,A714278,Cat,Domestic Shorthair Mix,Brown Tabby,7/2/2017,9/28/2017 13:57,2017-09-28T13:57:00,*Winky,Partner,Transfer,Intact Female,30.47640515,-97.27091689,12.65446429
2425,1 year,A750363,Cat,Domestic Shorthair Mix,Black,12/6/2015,12/10/2016 13:57,2016-12-10T13:57:00,Shadow,Partner,Transfer,Neutered Male,30.27060476,-97.3293042,52.94017857
2426,1 year,A710580,Dog,Pit Bull Mix,White/Brown,6/14/2014,10/15/2015 12:03,2015-10-15T12:03:00,*Kenny,Foster,Adoption,Neutered Male,30.48169441,-97.27854715,69.7860119
2427,2 months,A739878,Cat,Domestic Longhair Mix,Torbie,12/25/2014,2/28/2015 0:00,2015-02-28T00:00:00,*Jasper,Partner,Transfer,Intact Female,30.63729842,-97.48891136,9.285714286
2428,2 years,A671749,Dog,Lhasa Apso Mix,Cream,2/5/2014,2/10/2016 11:19,2016-02-10T11:19:00,*Gordon,Partner,Transfer,Neutered Male,30.47727775,-97.27330349,105.0673611
2429,7 years,A726278,Dog,Pit Bull Mix,Tan/White,4/8/2009,1/12/2017 17:54,2017-01-12T17:54:00,Hercules,Partner,Transfer,Neutered Male,30.49416354,-97.28848573,405.2494048
2430,1 month,A688038,Other,Opossum Mix,Gray/Black,2/26/2017,4/26/2017 18:26,2017-04-26T18:26:00,,Suffering,Euthanasia,Unknown,30.4593547,-97.52674438,8.538293651
2431,5 months,A668972,Dog,Pit Bull Mix,Chocolate/White,5/4/2013,10/21/2013 15:24,2013-10-21T15:24:00,Pixie,,Return to Owner,Spayed Female,30.53397066,-97.32476106,24.37738095
2432,5 years,A697598,Dog,Shih Tzu Mix,White/Brown,9/23/2009,10/20/2014 11:51,2014-10-20T11:51:00,Chubs,Partner,Transfer,Neutered Male,30.38814629,-97.59447726,264.7848214
2433,2 years,A725047,Dog,Staffordshire Mix,Blue/White,10/15/2015,11/24/2017 16:56,2017-11-24T16:56:00,*Roger,,Adoption,Neutered Male,30.7621338,-97.47774263,110.2436508
2434,1 month,A758826,Dog,Labrador Retriever Mix,Black,4/8/2017,5/24/2017 18:36,2017-05-24T18:36:00,Happy Camper,Partner,Transfer,Intact Male,30.58144983,-97.62404414,6.682142857
2435,2 months,A681122,Dog,Dalmatian Mix,White/Black,11/14/2016,1/18/2017 17:07,2017-01-18T17:07:00,,,Adoption,Neutered Male,30.46023873,-97.65312136,9.387599206
2436,3 months,A664991,Cat,Domestic Shorthair Mix,Black,9/13/2015,12/15/2015 11:55,2015-12-15T11:55:00,Isabella,Foster,Adoption,Spayed Female,30.67844437,-97.57964737,13.35664683
2437,10 months,A713388,Cat,Domestic Shorthair Mix,Black,9/26/2016,7/30/2017 15:09,2017-07-30T15:09:00,*Joey,,Adoption,Neutered Male,30.66635432,-97.73178249,43.94732143
2438,3 weeks,A736992,Cat,Domestic Shorthair Mix,Black Smoke,8/2/2015,8/24/2015 18:58,2015-08-24T18:58:00,,Partner,Transfer,Intact Male,30.53584293,-97.26928233,3.255753968
2439,1 year,A731209,Dog,American Staffordshire Terrier Mix,Red/White,6/8/2015,12/20/2016 14:38,2016-12-20T14:38:00,*Serafina,,Adoption,Spayed Female,30.29492485,-97.32137299,80.22996032
2440,1 year,A690029,Cat,Domestic Shorthair Mix,Brown Tabby,1/30/2013,1/31/2014 14:39,2014-01-31T14:39:00,,SCRP,Transfer,Intact Female,30.56908333,-97.50922691,52.37291667
2441,1 month,A672184,Cat,Domestic Shorthair Mix,Orange Tabby,4/6/2016,5/28/2016 15:53,2016-05-28T15:53:00,*Sarita,Partner,Transfer,Intact Female,30.43945695,-97.44152989,7.523115079
2442,1 year,A742055,Dog,Norwich Terrier Yorkshire Terrier,Black/Brown,9/13/2013,9/17/2014 18:54,2014-09-17T18:54:00,Daisy,,Adoption,Spayed Female,30.28935413,-97.3095004,52.82678571
2443,4 years,A704459,Dog,Mastiff Mix,Black,12/12/2009,12/30/2013 14:40,2013-12-30T14:40:00,Mufasa,Rabies Risk,Euthanasia,Intact Male,30.68000668,-97.45586143,211.3730159
2444,2 months,A661868,Cat,Domestic Longhair Mix,Tortie,12/25/2014,2/28/2015 15:24,2015-02-28T15:24:00,*Jinx,Partner,Transfer,Intact Female,30.54290549,-97.61810035,9.377380952
2445,8 years,A706755,Dog,Miniature Schnauzer Mix,Black/Gray,4/25/2008,4/25/2016 17:39,2016-04-25T17:39:00,Max,,Return to Owner,Intact Male,30.69341246,-97.50377246,417.533631
2446,1 year,A756114,Cat,Domestic Shorthair Mix,Black/White,9/22/2016,10/6/2017 17:44,2017-10-06T17:44:00,Panda,,Adoption,Neutered Male,30.49925891,-97.27800834,54.2484127
2447,8 years,A686776,Cat,Domestic Shorthair Mix,Black,6/12/2006,6/24/2014 17:02,2014-06-24T17:02:00,Millie,,Return to Owner,Spayed Female,30.35401451,-97.70842088,419.244246
2448,8 years,A598751,Dog,Chihuahua Shorthair Mix,Black/Tan,10/19/2005,10/20/2013 18:20,2013-10-20T18:20:00,*Fritz,,Adoption,Neutered Male,30.35238646,-97.39745622,417.6805556
2449,2 years,A726419,Dog,Pit Bull Mix,Black,10/6/2013,10/9/2015 18:18,2015-10-09T18:18:00,Panther,,Return to Owner,Neutered Male,30.45244115,-97.37519506,104.8232143
2450,1 year,A711310,Bird,Cockatiel Mix,Gray/Yellow,10/20/2015,10/24/2016 13:11,2016-10-24T13:11:00,,,Return to Owner,Unknown,30.73885379,-97.74000947,52.93561508
2451,11 years,A697586,Dog,Labrador Retriever Mix,Black,7/18/2005,7/20/2016 21:59,2016-07-20T21:59:00,Midnight,Partner,Transfer,Intact Male,30.67990547,-97.68130927,574.4165675
2452,3 years,A339103,Cat,Domestic Shorthair Mix,Silver Tabby,10/13/2011,10/14/2014 9:00,2014-10-14T09:00:00,,SCRP,Transfer,Unknown,30.55114351,-97.45703095,156.7678571
2453,2 months,A747623,Dog,Chihuahua Shorthair Jack Russell Terrier,Tan/White,12/21/2013,2/22/2014 12:03,2014-02-22T12:03:00,Luna,Foster,Adoption,Spayed Female,30.50504111,-97.67548429,9.07172619
2454,1 year,A722085,Cat,Domestic Shorthair Mix,Blue,1/13/2016,1/22/2017 19:17,2017-01-22T19:17:00,,Partner,Transfer,Neutered Male,30.52440536,-97.45175513,53.68621032
2455,11 years,A694261,Dog,Norfolk Terrier Border Terrier,Cream,6/5/2004,6/6/2015 16:26,2015-06-06T16:26:00,Maui,,Return to Owner,Spayed Female,30.72188812,-97.37366102,574.0978175
2456,7 years,A709962,Cat,Russian Blue Mix,Blue,8/26/2006,11/15/2013 11:18,2013-11-15T11:18:00,Purrsimmon,Foster,Adoption,Spayed Female,30.37360114,-97.4459325,376.9244048
2457,2 days,A672744,Cat,Domestic Shorthair,Gray Tabby,7/1/2015,7/3/2015 11:04,2015-07-03T11:04:00,,Partner,Transfer,Intact Male,30.45710017,-97.46553831,0.351587302
2458,1 month,A704947,Dog,Labrador Retriever Mix,Black/White,6/22/2017,8/17/2017 17:09,2017-08-17T17:09:00,,In Kennel,Died,Intact Female,30.63452909,-97.56231004,8.102083333
2459,3 years,A668030,Dog,Siberian Husky,Black/White,8/26/2011,8/27/2014 18:33,2014-08-27T18:33:00,Koda,,Return to Owner,Neutered Male,30.58064473,-97.39787473,156.8247024
2460,4 years,A676213,Cat,Domestic Shorthair,Orange Tabby,3/23/2011,4/22/2015 11:55,2015-04-22T11:55:00,Ruby,,Adoption,Spayed Female,30.60511057,-97.26710969,213.0709325
2461,2 weeks,A733199,Dog,Labrador Retriever Mix,Brown Brindle,4/25/2016,5/10/2016 18:07,2016-05-10T18:07:00,,Partner,Transfer,Unknown,30.27673988,-97.69345458,2.250694444
2462,2 years,A741111,Dog,Miniature Schnauzer Mix,Gray/White,9/5/2013,9/9/2015 17:59,2015-09-09T17:59:00,,,Adoption,Neutered Male,30.70228237,-97.44724301,104.9641865
2463,2 months,A755098,Dog,Rottweiler Mix,Tricolor/White,12/10/2014,3/2/2015 17:26,2015-03-02T17:26:00,,,Adoption,Spayed Female,30.40134764,-97.48101585,11.81805556
2464,11 years,A719218,Dog,Labrador Retriever Mix,Brown/White,1/12/2004,4/21/2015 17:38,2015-04-21T17:38:00,Ani,,Return to Owner,Spayed Female,30.32529003,-97.29630996,588.2478175
2465,2 months,A696264,Dog,Boxer,Tan/White,3/7/2017,5/17/2017 16:32,2017-05-17T16:32:00,,Foster,Adoption,Neutered Male,30.44695171,-97.5101541,10.24126984
2466,1 year,A763168,Dog,Pit Bull Mix,Tan/White,3/10/2015,3/27/2016 0:00,2016-03-27T00:00:00,*Ty,Partner,Transfer,Neutered Male,30.62149628,-97.63253121,54.71428571
2467,6 years,A684615,Cat,Domestic Longhair Mix,Orange Tabby/White,12/23/2008,12/28/2014 14:05,2014-12-28T14:05:00,Moby,,Return to Owner,Neutered Male,30.4998117,-97.51745065,313.7981151
2468,4 months,A764623,Cat,Domestic Medium Hair Mix,Blue,4/15/2015,8/16/2015 9:00,2015-08-16T09:00:00,,SCRP,Transfer,Intact Female,30.36389229,-97.58442814,17.625
2469,3 years,A754830,Dog,Rottweiler Mix,Black/Tan,2/17/2011,4/17/2014 17:09,2014-04-17T17:09:00,Oso,Aggressive,Euthanasia,Intact Male,30.39526309,-97.35680808,165.1020833
2470,2 months,A693286,Cat,Domestic Medium Hair Mix,Black/White,5/11/2015,8/10/2015 13:10,2015-08-10T13:10:00,*Pete,,Adoption,Neutered Male,30.71474402,-97.38357979,13.07837302
2471,10 months,A693451,Dog,Border Terrier Mix,Brown Brindle,1/26/2013,12/1/2013 11:03,2013-12-01T11:03:00,*Kitty,Partner,Transfer,Intact Female,30.71174394,-97.53958483,44.20863095
2472,8 years,A732145,Cat,Domestic Shorthair Mix,Calico,4/6/2006,4/11/2014 16:00,2014-04-11T16:00:00,Buddy Buddy,Partner,Transfer,Spayed Female,30.33799989,-97.4973745,418.2380952
2473,3 months,A694452,Cat,Domestic Shorthair Mix,Torbie,5/18/2016,8/18/2016 17:28,2016-08-18T17:28:00,,Suffering,Euthanasia,Unknown,30.65960965,-97.48190062,13.2468254
2474,3 months,A756610,Cat,Domestic Shorthair Mix,Brown Tabby,11/13/2016,2/18/2017 12:18,2017-02-18T12:18:00,*Bunny,Foster,Adoption,Spayed Female,30.33012221,-97.45996293,13.93035714
2475,4 years,A724704,Dog,Labrador Retriever Mix,Black/White,7/29/2013,8/22/2017 8:06,2017-08-22T08:06:00,Berkley,Foster,Adoption,Neutered Male,30.56280123,-97.36789683,212.1910714
2476,2 years,A736104,Cat,Domestic Shorthair Mix,Brown Tabby/White,1/15/2014,1/20/2016 18:58,2016-01-20T18:58:00,,SCRP,Transfer,Neutered Male,30.46066931,-97.38135841,105.1128968
2477,2 years,A689062,Dog,Pit Bull Mix,Chocolate/White,2/1/2013,2/8/2015 17:26,2015-02-08T17:26:00,Chocolate,Aggressive,Euthanasia,Neutered Male,30.30089811,-97.34124567,105.3894841
2478,4 months,A665861,Cat,Domestic Shorthair Mix,Blue,7/27/2017,12/21/2017 13:26,2017-12-21T13:26:00,*Jackie,Partner,Transfer,Spayed Female,30.30659159,-97.56446633,21.07996032
2479,1 year,A739220,Dog,Chihuahua Shorthair Mix,Tan,7/26/2013,8/21/2014 14:20,2014-08-21T14:20:00,*Goose,Partner,Transfer,Neutered Male,30.76175448,-97.48751091,55.94246032
2480,3 years,A707825,Dog,Labrador Retriever Mix,Tan/White,1/2/2015,1/9/2018 17:12,2018-01-09T17:12:00,Scooby,,Return to Owner,Neutered Male,30.45029008,-97.43389146,157.6738095
2481,2 months,A720443,Cat,Domestic Shorthair Mix,Black/White,5/31/2017,8/3/2017 11:43,2017-08-03T11:43:00,*Waylon,Partner,Transfer,Intact Male,30.44280964,-97.66723961,9.212599206
2482,1 year,A735273,Other,Raccoon Mix,Gray/Black,12/5/2013,12/5/2014 11:49,2014-12-05T11:49:00,,Rabies Risk,Euthanasia,Unknown,30.72130765,-97.57657864,52.21319444
2483,3 years,A684564,Other,Opossum Mix,White/Gray,12/8/2011,12/8/2014 12:40,2014-12-08T12:40:00,,Suffering,Euthanasia,Unknown,30.34617386,-97.52931827,156.6468254
2484,1 year,A713631,Cat,Domestic Shorthair Mix,Black/White,8/3/2015,8/4/2016 9:00,2016-08-04T09:00:00,,SCRP,Transfer,Spayed Female,30.65054129,-97.34248066,52.48214286
2485,3 weeks,A734645,Cat,Domestic Shorthair Mix,Brown Tabby,12/7/2014,12/29/2014 10:55,2014-12-29T10:55:00,,Partner,Transfer,Intact Female,30.40778145,-97.71920091,3.207837302
2486,1 year,A755783,Other,Guinea Pig,Brown,8/23/2016,8/24/2017 13:30,2017-08-24T13:30:00,,Partner,Transfer,Unknown,30.44532703,-97.31015881,52.36607143
2487,1 year,A348272,Dog,Pit Bull Mix,Brown Brindle/White,4/20/2015,10/7/2016 13:16,2016-10-07T13:16:00,*Audrey,,Adoption,Spayed Female,30.5694276,-97.48153156,76.65039683
2488,8 years,A654970,Dog,Pomeranian Mix,Tricolor,10/4/2008,10/24/2016 0:00,2016-10-24T00:00:00,Boog,Partner,Transfer,Neutered Male,30.40006599,-97.43364635,420.2857143
2489,5 years,A739993,Dog,Pit Bull Chinese Sharpei,Brown Brindle/White,9/28/2009,10/19/2014 9:42,2014-10-19T09:42:00,Lita,Aggressive,Euthanasia,Intact Female,30.58112041,-97.41130235,263.914881
2490,1 year,A752170,Dog,Australian Shepherd Mix,White/Red,10/23/2012,10/28/2013 17:59,2013-10-28T17:59:00,Mistic,,Adoption,Spayed Female,30.26910435,-97.52653305,52.96418651
2491,1 year,A724582,Dog,Labrador Retriever Queensland Heeler,White/Brown,11/29/2015,1/14/2017 13:04,2017-01-14T13:04:00,Polly,,Adoption,Spayed Female,30.51087533,-97.40527209,58.93492063
2492,8 years,A757240,Cat,Domestic Shorthair Mix,Brown Tabby,7/18/2007,8/2/2015 13:06,2015-08-02T13:06:00,Rocco,,Adoption,Neutered Male,30.40134029,-97.37769208,419.6494048
2493,2 months,A743525,Dog,Pointer Mix,Black/White,12/9/2015,2/13/2016 18:27,2016-02-13T18:27:00,*Sleepy,,Adoption,Neutered Male,30.36500617,-97.71433826,9.538392857
2494,1 year,A739594,Dog,Pit Bull Mix,Blue/White,9/21/2015,11/5/2016 13:10,2016-11-05T13:10:00,*Butler,,Adoption,Neutered Male,30.76339929,-97.25804446,58.79265873
2495,2 weeks,A751113,Cat,Domestic Shorthair Mix,Black,7/10/2014,7/25/2014 16:22,2014-07-25T16:22:00,,Partner,Transfer,Intact Male,30.42212884,-97.73476586,2.240277778
2496,1 weeks,A667458,Cat,Domestic Shorthair Mix,Blue Tabby,9/26/2015,10/9/2015 19:12,2015-10-09T19:12:00,,Partner,Transfer,Unknown,30.31057298,-97.60015439,1.971428571
2497,2 years,A722610,Dog,Border Collie Catahoula,Black/White,9/10/2014,9/17/2016 18:18,2016-09-17T18:18:00,Maya,,Adoption,Spayed Female,30.50649707,-97.73322176,105.5375
2498,4 years,A718642,Dog,German Shepherd Mix,Black/Tan,8/8/2013,8/13/2017 17:44,2017-08-13T17:44:00,*Nelson,,Adoption,Neutered Male,30.60602257,-97.47156315,209.534127
2499,11 years,A710866,Dog,Labrador Retriever Chow Chow,Brown/Black,8/14/2003,7/24/2015 18:19,2015-07-24T18:19:00,Brandy,,Adoption,Spayed Female,30.59082879,-97.47808505,623.2518849
2500,10 years,A692491,Dog,Pointer Mix,White/Brown,5/27/2006,7/12/2016 9:38,2016-07-12T09:38:00,*Zena,Foster,Adoption,Spayed Female,30.34602607,-97.5944117,528.4859127
2501,1 year,A761277,Dog,Yorkshire Terrier Mix,Tan/Black,12/10/2015,12/11/2016 18:21,2016-12-11T18:21:00,Puppet,,Return to Owner,Intact Male,30.41177886,-97.25633183,52.53779762
2502,6 months,A757797,Other,Raccoon,Brown/Black,12/19/2016,6/20/2017 10:41,2017-06-20T10:41:00,,Rabies Risk,Euthanasia,Unknown,30.54517597,-97.4386775,26.20644841
2503,2 months,A707729,Cat,Domestic Shorthair Mix,Orange Tabby,2/23/2016,5/21/2016 14:38,2016-05-21T14:38:00,*Honey,Foster,Adoption,Spayed Female,30.66676629,-97.31667033,12.65853175
2504,2 years,A667329,Cat,Domestic Shorthair Mix,Orange Tabby,8/31/2015,9/12/2017 12:25,2017-09-12T12:25:00,Sam,,Adoption,Neutered Male,30.61035547,-97.69632388,106.2167659
2505,1 year,A752364,Dog,Pointer Mix,Chocolate/White,2/12/2016,2/19/2017 18:30,2017-02-19T18:30:00,*Symphony,,Adoption,Spayed Female,30.73830368,-97.42795626,53.39583333
2506,5 years,A703585,Cat,Domestic Shorthair,Blue,12/5/2011,12/10/2016 13:59,2016-12-10T13:59:00,*Cecil,Partner,Transfer,Neutered Male,30.27476667,-97.41898433,261.7975198
2507,2 months,A724884,Dog,Bulldog Mix,White/Brown,3/13/2017,6/4/2017 15:47,2017-06-04T15:47:00,Yogi,,Return to Owner,Intact Male,30.47913804,-97.3400956,11.95109127
2508,4 years,A727992,Dog,Pit Bull Mix,Brown Brindle/White,1/18/2013,7/23/2017 18:50,2017-07-23T18:50:00,Chino,,Return to Owner,Neutered Male,30.74414033,-97.72980727,235.3978175
2509,3 months,A675159,Cat,Domestic Shorthair Mix,Black Tabby,12/19/2015,3/25/2016 15:55,2016-03-25T15:55:00,Sparrow,,Adoption,Neutered Male,30.35613849,-97.28148083,13.95188492
2510,1 year,A759174,Dog,Great Pyrenees Mix,White,1/4/2015,1/5/2016 17:21,2016-01-05T17:21:00,Sugar Bear,,Return to Owner,Intact Female,30.61424972,-97.34769066,52.3889881
2511,1 year,A714859,Dog,German Shepherd Mix,Sable/Tan,9/8/2014,9/12/2015 17:06,2015-09-12T17:06:00,*Kenzo,,Adoption,Neutered Male,30.32995497,-97.64445615,52.81607143
2512,7 months,A720200,Dog,Black Mouth Cur Mix,Brown/Black,4/21/2014,11/30/2014 18:20,2014-11-30T18:20:00,Bailey,,Adoption,Spayed Female,30.41802763,-97.51371274,31.96626984
2513,2 months,A725691,Cat,Domestic Shorthair Mix,Black/White,10/2/2017,12/20/2017 18:32,2017-12-20T18:32:00,,,Adoption,Neutered Male,30.39520944,-97.45705738,11.39603175
2514,1 week,A679111,Cat,Domestic Shorthair Mix,Calico,8/30/2017,9/6/2017 14:00,2017-09-06T14:00:00,,Partner,Transfer,Intact Female,30.46238689,-97.69698551,1.083333333
2515,2 weeks,A684344,Cat,Domestic Shorthair Mix,Brown Tabby/White,6/27/2015,7/16/2015 18:39,2015-07-16T18:39:00,,Partner,Transfer,Intact Male,30.43542105,-97.60460035,2.825297619
2516,4 months,A704583,Cat,Domestic Shorthair Mix,Orange Tabby/White,7/1/2013,11/21/2013 13:34,2013-11-21T13:34:00,Tres,,Adoption,Neutered Male,30.28960735,-97.7097331,20.5093254
2517,8 months,A763975,Dog,Pit Bull Mix,Blue/White,10/21/2016,6/27/2017 18:02,2017-06-27T18:02:00,Lady,,Adoption,Spayed Female,30.40419413,-97.61639092,35.67876984
2518,3 months,A728067,Cat,Balinese Mix,Lynx Point,4/27/2015,8/4/2015 14:15,2015-08-04T14:15:00,*Willow,Foster,Adoption,Spayed Female,30.42878315,-97.38689,14.22767857
2519,1 year,A721822,Dog,Cardigan Welsh Corgi Mix,Red/White,4/22/2015,5/1/2016 17:27,2016-05-01T17:27:00,*Mason,,Adoption,Neutered Male,30.43300208,-97.46833238,53.67529762
2520,1 year,A753866,Dog,Plott Hound Mix,Brown Brindle/Brown,5/29/2015,9/4/2016 16:21,2016-09-04T16:21:00,*Gage,Partner,Transfer,Neutered Male,30.41289364,-97.29169892,66.38303571
2521,3 years,A685249,Dog,Labrador Retriever Mix,Brown,3/24/2011,3/24/2014 14:41,2014-03-24T14:41:00,Barbie,Suffering,Euthanasia,Intact Female,30.36672356,-97.39586747,156.6588294
2522,11 years,A741994,Cat,Domestic Shorthair Mix,Cream/White,2/28/2006,9/29/2017 12:39,2017-09-29T12:39:00,,,Return to Owner,Unknown,30.71700668,-97.48972931,604.503869
2523,10 months,A684030,Dog,Chihuahua Shorthair Mix,Black/White,12/29/2014,11/1/2015 18:04,2015-11-01T18:04:00,Junior,,Return to Owner,Neutered Male,30.73820625,-97.51719201,43.96468254
2524,10 months,A724807,Cat,Domestic Shorthair Mix,Black/White,4/4/2015,2/7/2016 12:22,2016-02-07T12:22:00,Boots,,Adoption,Spayed Female,30.72247128,-97.4696605,44.21646825
2525,8 years,A700018,Dog,Labrador Retriever Pit Bull,Black/White,5/1/2008,8/31/2016 11:10,2016-08-31T11:10:00,Bonnie,Foster,Adoption,Spayed Female,30.53012866,-97.65563409,434.9236111
2526,2 years,A715176,Dog,Chihuahua Shorthair Mix,Brown/White,5/16/2012,5/21/2014 18:05,2014-05-21T18:05:00,,,Adoption,Spayed Female,30.5097771,-97.40948012,105.1076389
2527,2 years,A753332,Cat,Domestic Shorthair Mix,Black/White,6/22/2014,3/5/2017 12:01,2017-03-05T12:01:00,Babyprincess,,Return to Owner,Spayed Female,30.52095505,-97.7034485,141.0715278
2528,2 weeks,A728134,Cat,Domestic Shorthair Mix,Black,5/22/2015,6/6/2015 16:20,2015-06-06T16:20:00,,Partner,Transfer,Unknown,30.44189982,-97.58952578,2.240079365
2529,2 years,A716119,Dog,Landseer Mix,Black/Gray,12/19/2015,12/31/2017 15:20,2017-12-31T15:20:00,*Domino,,Adoption,Neutered Male,30.48316168,-97.68119565,106.234127
2530,1 day,A760491,Cat,Domestic Shorthair Mix,Blue,5/29/2016,5/30/2016 19:25,2016-05-30T19:25:00,,Partner,Transfer,Unknown,30.29447475,-97.67387029,0.25843254
2531,9 years,A687670,Dog,Great Dane Mix,Tan/White,3/5/2007,3/5/2016 12:17,2016-03-05T12:17:00,Khronos,,Return to Owner,Neutered Male,30.75762727,-97.71413233,469.7874008
2532,2 weeks,A670993,Cat,Domestic Medium Hair Mix,Black Smoke,6/27/2017,7/12/2017 14:14,2017-07-12T14:14:00,,Partner,Transfer,Intact Female,30.43886961,-97.41595418,2.227579365
2533,6 years,A680039,Dog,Catahoula Labrador Retriever,Red,8/4/2008,8/4/2014 18:20,2014-08-04T18:20:00,Booger,Suffering,Euthanasia,Neutered Male,30.66806426,-97.64183272,313.109127
2534,2 months,A467567,Dog,Pit Bull Mix,White/Brown,11/12/2016,1/13/2017 18:08,2017-01-13T18:08:00,Soliel Amun,,Adoption,Spayed Female,30.49967975,-97.69048135,8.965079365
2535,2 months,A654090,Cat,Domestic Medium Hair Mix,Orange Tabby,6/11/2014,8/30/2014 16:15,2014-08-30T16:15:00,*Hugo,Foster,Adoption,Neutered Male,30.6575542,-97.51608426,11.52529762
2536,4 weeks,A683098,Dog,Australian Cattle Dog Mix,Brown,4/22/2016,5/21/2016 19:12,2016-05-21T19:12:00,,Partner,Transfer,Unknown,30.70359699,-97.62261423,4.257142857
2537,1 year,A740435,Dog,Cairn Terrier Mix,Silver/Chocolate,10/6/2013,4/10/2015 18:09,2015-04-10T18:09:00,Avery Mae,,Adoption,Spayed Female,30.36096692,-97.28230043,78.82232143
2538,2 years,A672075,Dog,Staffordshire Mix,Blue/White,11/1/2013,12/5/2015 17:54,2015-12-05T17:54:00,Zila,,Adoption,Spayed Female,30.46519214,-97.37079672,109.2494048
2539,1 year,A762863,Dog,Belgian Malinois Mix,Brown/Black,7/5/2016,7/5/2017 16:25,2017-07-05T16:25:00,Vader,,Return to Owner,Intact Male,30.63692534,-97.70023212,52.2405754
2540,5 months,A683685,Dog,Bull Terrier Miniature Mix,White/Brown,12/31/2015,6/4/2016 18:18,2016-06-04T18:18:00,*Maxine,,Adoption,Spayed Female,30.39454487,-97.50172539,22.39464286
2541,1 year,A727106,Cat,Domestic Shorthair Mix,Black,11/14/2014,11/18/2015 19:28,2015-11-18T19:28:00,,SCRP,Transfer,Intact Male,30.37908975,-97.3400975,52.83015873
2542,1 year,A680129,Other,Squirrel Mix,White,10/18/2016,10/18/2017 18:11,2017-10-18T18:11:00,,Suffering,Euthanasia,Unknown,30.47127387,-97.45172358,52.25109127
2543,3 years,A713898,Cat,Domestic Shorthair Mix,Orange Tabby,9/8/2011,9/11/2014 17:23,2014-09-11T17:23:00,Prince,,Adoption,Neutered Male,30.60255061,-97.62881612,157.1034722
2544,2 years,A732294,Cat,Domestic Shorthair Mix,Orange Tabby,1/17/2012,1/21/2014 15:16,2014-01-21T15:16:00,,SCRP,Transfer,Intact Male,30.59747185,-97.27457061,105.090873
2545,2 months,A690062,Cat,Domestic Longhair Mix,Blue/White,3/7/2014,6/2/2014 16:31,2014-06-02T16:31:00,*Molly,,Adoption,Spayed Female,30.35588627,-97.59468579,12.52688492
2546,15 years,A670273,Dog,Queensland Heeler Mix,Blue Merle,4/9/2002,11/6/2017 18:41,2017-11-06T18:41:00,Silky,,Return to Owner,Spayed Female,30.28819013,-97.32520654,812.9683532
2547,2 years,A694602,Cat,Domestic Shorthair Mix,Orange Tabby/White,5/15/2011,12/29/2013 12:28,2013-12-29T12:28:00,Mamma Mia,Partner,Transfer,Spayed Female,30.45986833,-97.28286111,137.0742063
2548,10 years,A741475,Cat,Domestic Shorthair Mix,Brown Tabby/White,7/7/2004,8/4/2014 14:34,2014-08-04T14:34:00,*Plato,Partner,Transfer,Neutered Male,30.43199076,-97.29595348,525.8009921
2549,1 year,A753399,Dog,Yorkshire Terrier Mix,Black/Brown,12/17/2015,12/21/2016 18:33,2016-12-21T18:33:00,,,Adoption,Neutered Male,30.54612158,-97.65584058,52.96755952
2550,4 years,A678042,Cat,Domestic Longhair Mix,Black/White,2/3/2010,2/3/2014 15:42,2014-02-03T15:42:00,,Suffering,Euthanasia,Intact Male,30.51288158,-97.69528152,208.8077381
2551,5 years,A743071,Dog,Australian Cattle Dog Mix,Black/Brown,11/28/2012,12/4/2017 12:41,2017-12-04T12:41:00,*Murphy,,Adoption,Neutered Male,30.39171444,-97.42344785,261.7897817
2552,1 year,A680346,Other,Dutch Rabbit Sh,Brown/White,7/13/2013,7/16/2014 16:11,2014-07-16T16:11:00,,Partner,Transfer,Intact Female,30.6740403,-97.68214053,52.66775794
2553,1 year,A708271,Cat,Domestic Shorthair Mix,Blue Tabby,5/18/2015,5/22/2016 18:18,2016-05-22T18:18:00,,SCRP,Transfer,Spayed Female,30.64020251,-97.64616115,52.96607143
2554,2 months,A742175,Cat,Siamese Mix,Flame Point,4/15/2014,7/3/2014 17:40,2014-07-03T17:40:00,*Hugh,Foster,Adoption,Neutered Male,30.47042748,-97.27141227,11.39087302
2555,3 weeks,A677267,Cat,Domestic Shorthair Mix,Tortie,9/22/2015,10/15/2015 12:30,2015-10-15T12:30:00,,Partner,Transfer,Intact Female,30.51519222,-97.52847935,3.360119048
2556,1 year,A730346,Cat,Domestic Shorthair Mix,Brown Tabby,8/26/2015,8/26/2016 14:57,2016-08-26T14:57:00,,Partner,Transfer,Intact Male,30.30927529,-97.37528913,52.37470238
2557,2 weeks,A688011,Cat,Domestic Shorthair Mix,Black/White,9/28/2014,10/13/2014 17:46,2014-10-13T17:46:00,,Partner,Transfer,Intact Male,30.62791974,-97.50408801,2.248611111
2558,2 years,A753390,Dog,Labrador Retriever Chesa Bay Retr,Brown/White,11/1/2011,3/21/2014 11:49,2014-03-21T11:49:00,*Annie,Partner,Transfer,Spayed Female,30.4589879,-97.35485209,124.4989087
2559,6 years,A667273,Dog,Chihuahua Shorthair Mix,Black/Tricolor,12/31/2008,1/6/2015 15:10,2015-01-06T15:10:00,*Jasmine,,Adoption,Spayed Female,30.42586393,-97.53763919,313.9474206
2560,1 year,A644452,Other,Bat Mix,Brown,1/2/2016,1/2/2017 18:57,2017-01-02T18:57:00,,Rabies Risk,Euthanasia,Unknown,30.50063608,-97.32210605,52.3985119
2561,2 years,A705077,Dog,Chihuahua Shorthair Mix,Tan/White,7/5/2015,7/13/2017 11:50,2017-07-13T11:50:00,*Cthulhu,Partner,Transfer,Intact Male,30.41778556,-97.24661801,105.6418651
2562,8 years,A689944,Dog,German Shepherd Mix,Black/Brown,5/3/2006,5/4/2014 18:23,2014-05-04T18:23:00,Sadie,,Return to Owner,Spayed Female,30.41169186,-97.72734486,417.6808532
2563,8 years,A765321,Dog,Pit Bull Mix,Red/White,2/3/2009,2/3/2017 15:01,2017-02-03T15:01:00,Scrappy,,Return to Owner,Intact Male,30.61770917,-97.54008705,417.5179563
2564,1 month,A761384,Cat,Domestic Shorthair Mix,Orange Tabby,4/27/2014,6/5/2014 14:55,2014-06-05T14:55:00,*Sam,Partner,Transfer,Intact Male,30.31921975,-97.34578494,5.660218254
2565,1 week,A699197,Cat,Domestic Shorthair Mix,Gray Tabby,7/18/2015,7/25/2015 16:29,2015-07-25T16:29:00,,Partner,Transfer,Unknown,30.3779864,-97.72222086,1.098115079
2566,4 months,A690266,Cat,Domestic Shorthair Mix,Blue/White,9/16/2016,1/17/2017 11:22,2017-01-17T11:22:00,Blaze,,Return to Owner,Neutered Male,30.44883978,-97.37781144,17.6390873
2567,9 years,A730202,Dog,German Shepherd Mix,Brown,4/22/2005,5/3/2014 12:22,2014-05-03T12:22:00,Dinky,,Return to Owner,Spayed Female,30.70371584,-97.41632341,471.2164683
2568,4 weeks,A699709,Cat,Domestic Shorthair Mix,Black Tabby,6/2/2016,7/2/2016 16:34,2016-07-02T16:34:00,,Suffering,Euthanasia,Intact Male,30.61019588,-97.27152708,4.384325397
2569,3 years,A705423,Cat,Domestic Shorthair Mix,Blue Tabby,9/13/2011,11/5/2014 15:47,2014-11-05T15:47:00,Cuddles,,Return to Owner,Neutered Male,30.67389435,-97.73551399,164.2368056
2570,2 years,A736988,Dog,Chihuahua Longhair Dachshund Wirehair,Black,7/5/2015,7/18/2017 16:59,2017-07-18T16:59:00,L.D.,,Return to Owner,Intact Male,30.27591016,-97.43249869,106.3868056
2571,2 years,A678971,Cat,Russian Blue Mix,Blue,11/15/2011,11/20/2013 19:11,2013-11-20T19:11:00,*Jonathon,SCRP,Transfer,Intact Male,30.76164362,-97.60532415,105.2570437
2572,6 years,A688091,Dog,Pit Bull Mix,Brown Brindle/White,12/27/2010,2/12/2017 12:56,2017-02-12T12:56:00,Acho,,Adoption,Neutered Male,30.44695331,-97.42424408,319.934127
2573,2 weeks,A752879,Cat,Domestic Shorthair Mix,Tortie,5/28/2015,6/17/2015 12:35,2015-06-17T12:35:00,,Partner,Transfer,Intact Female,30.48209224,-97.57594273,2.932043651
2574,2 months,A685157,Cat,Domestic Shorthair Mix,Black,7/27/2014,10/19/2014 13:01,2014-10-19T13:01:00,*Zeppelin,,Adoption,Spayed Female,30.40229392,-97.32853903,12.07748016
2575,19 years,A706515,Cat,Domestic Shorthair Mix,Brown Tabby/White,3/17/1998,1/17/2018 18:45,2018-01-17T18:45:00,Tyler,,Return to Owner,Neutered Male,30.69089298,-97.59231549,1035.254464
2576,3 years,A682559,Dog,Australian Kelpie Mix,Red,11/3/2014,11/4/2017 13:20,2017-11-04T13:20:00,Clyde,,Return to Owner,Neutered Male,30.719069,-97.6843946,156.7936508
2577,10 years,A746552,Dog,Labrador Retriever Mix,Tan/White,9/10/2005,1/18/2016 19:37,2016-01-18T19:37:00,Honey,,Adoption,Spayed Female,30.52430437,-97.66879059,540.4024802
2578,2 years,A707496,Dog,Doberman Pinsch Mix,Black/Tan,10/17/2012,10/23/2014 17:58,2014-10-23T17:58:00,Jasper,,Return to Owner,Neutered Male,30.45222495,-97.64633075,105.2498016
2579,2 months,A686395,Cat,Domestic Shorthair Mix,Cream Tabby/White,4/23/2016,7/19/2016 17:08,2016-07-19T17:08:00,,,Adoption,Neutered Male,30.45442021,-97.59591497,12.53055556
2580,2 months,A671631,Dog,Akita Mix,Black/White,1/17/2015,4/5/2015 16:42,2015-04-05T16:42:00,,,Adoption,Spayed Female,30.71364619,-97.49530173,11.2422619
2581,10 months,A733591,Dog,German Shepherd Labrador Retriever,Black/White,2/11/2015,12/19/2015 10:05,2015-12-19T10:05:00,*Bronco,Foster,Adoption,Neutered Male,30.32906375,-97.39132288,44.48859127
2582,12 years,A672383,Dog,Chihuahua Shorthair Mix,Tan/White,10/20/2004,3/18/2017 16:17,2017-03-18T16:17:00,Cesar,Foster,Adoption,Neutered Male,30.51563789,-97.37211427,647.525496
2583,14 years,A706131,Cat,Domestic Shorthair Mix,Brown Tabby,5/14/2000,5/17/2014 11:43,2014-05-17T11:43:00,Squeaky,Partner,Transfer,Spayed Female,30.58890628,-97.39849523,730.9268849
2584,1 month,A517675,Cat,Domestic Shorthair Mix,Black,8/14/2014,9/19/2014 14:36,2014-09-19T14:36:00,,Partner,Transfer,Intact Female,30.33302823,-97.53151467,5.229761905
2585,6 months,A699758,Other,Bat,Brown,12/28/2016,6/29/2017 8:55,2017-06-29T08:55:00,,Rabies Risk,Euthanasia,Unknown,30.50853195,-97.58987212,26.19593254
2586,2 months,A721892,Dog,Labrador Retriever Pit Bull,Black/White,6/15/2014,8/29/2014 11:43,2014-08-29T11:43:00,Sombra,Foster,Adoption,Spayed Female,30.72061673,-97.3063387,10.78402778
2587,2 years,A682590,Dog,Chihuahua Shorthair Mix,Tan/White,6/30/2013,7/9/2015 20:25,2015-07-09T20:25:00,Bean,,Adoption,Neutered Male,30.69153829,-97.53621216,105.6929563
2588,1 month,A750912,Cat,Snowshoe Mix,Blue Point,5/22/2014,6/30/2014 10:46,2014-06-30T10:46:00,,Partner,Transfer,Intact Male,30.66935137,-97.2945729,5.635515873
2589,1 week,A745159,Cat,Domestic Shorthair Mix,Brown Tabby,3/28/2017,4/4/2017 17:16,2017-04-04T17:16:00,,Partner,Transfer,Intact Female,30.4474706,-97.65815083,1.102777778
2590,7 years,A705411,Dog,Pit Bull Mix,Fawn/White,7/14/2008,7/23/2015 16:46,2015-07-23T16:46:00,Balu,Partner,Transfer,Neutered Male,30.3462833,-97.40469512,366.528373
2591,1 month,A631529,Dog,Pointer Mix,White/Black,6/29/2014,8/21/2014 15:36,2014-08-21T15:36:00,,Partner,Transfer,Intact Female,30.73345337,-97.43335873,7.664285714
2592,1 year,A760747,Cat,Domestic Longhair Mix,White/Brown Tabby,1/28/2013,1/29/2014 15:32,2014-01-29T15:32:00,,SCRP,Transfer,Unknown,30.30749968,-97.44855806,52.3781746
2593,6 years,A755677,Dog,Pit Bull Mix,White/Brown,8/24/2010,9/1/2016 17:52,2016-09-01T17:52:00,Jordan,Aggressive,Euthanasia,Spayed Female,30.64059767,-97.66254748,314.3920635
2594,1 year,A688705,Dog,Pit Bull Chinese Sharpei,White/Blue Cream,8/9/2012,2/15/2014 11:43,2014-02-15T11:43:00,Yayo,Aggressive,Euthanasia,Intact Male,30.28111598,-97.45631435,79.35545635
2595,2 years,A703054,Dog,Staffordshire Mix,Blue/White,6/25/2013,7/1/2015 17:00,2015-07-01T17:00:00,*West,,Adoption,Neutered Male,30.48467535,-97.26745798,105.2440476
2596,11 years,A666137,Dog,Australian Cattle Dog,White/Black,7/29/2004,9/20/2015 13:08,2015-09-20T13:08:00,Blanca,,Adoption,Spayed Female,30.37504481,-97.4914134,581.506746
2597,5 years,A605337,Dog,Labrador Retriever Flat Coat Retriever,Brown Brindle,4/2/2010,4/7/2015 11:03,2015-04-07T11:03:00,*River,Partner,Transfer,Neutered Male,30.37401483,-97.7099005,261.6372024
2598,7 months,A698514,Cat,Domestic Shorthair Mix,Black,8/6/2015,3/21/2016 14:13,2016-03-21T14:13:00,Fin,Partner,Transfer,Neutered Male,30.29716248,-97.52760573,32.65605159
2599,1 year,A666669,Dog,Mastiff Boxer,Tan/White,1/30/2014,12/16/2015 17:40,2015-12-16T17:40:00,Rex,,Adoption,Neutered Male,30.31148166,-97.29526679,97.96230159
2600,2 years,A666927,Dog,Leonberger Mix,Tricolor,6/2/2015,6/10/2017 13:36,2017-06-10T13:36:00,Rocky,,Adoption,Neutered Male,30.28437596,-97.28150378,105.652381
2601,1 year,A728728,Other,Bat,Brown,3/13/2016,3/13/2017 17:17,2017-03-13T17:17:00,,Rabies Risk,Euthanasia,Unknown,30.37390915,-97.30818173,52.24573413
2602,7 years,A758482,Dog,Weimaraner,Blue,6/17/2008,6/25/2015 11:13,2015-06-25T11:13:00,*Shadow,Partner,Transfer,Neutered Male,30.74254295,-97.30963605,366.3524802
2603,2 years,A687298,Dog,Chihuahua Shorthair Parson Russell Terrier,White,3/5/2012,5/12/2014 12:03,2014-05-12T12:03:00,Lala,,Return to Owner,Spayed Female,30.35225101,-97.4542461,114.0717262
2604,3 years,A719516,Dog,Great Pyrenees Mix,White,10/23/2014,10/28/2017 17:57,2017-10-28T17:57:00,Emma,,Adoption,Spayed Female,30.35603875,-97.41421156,157.3925595
2605,5 months,A763329,Other,Bat,Brown,2/7/2017,8/7/2017 13:54,2017-08-07T13:54:00,,Rabies Risk,Euthanasia,Unknown,30.60663785,-97.66002738,25.93988095
2606,2 months,A743764,Cat,Domestic Shorthair Mix,White/Black,7/7/2014,10/4/2014 18:02,2014-10-04T18:02:00,Junie,,Adoption,Spayed Female,30.31499185,-97.66657785,12.82162698
2607,1 year,A680763,Cat,Domestic Shorthair Mix,Flame Point,5/20/2014,5/26/2015 12:20,2015-05-26T12:20:00,*Sophie,Partner,Transfer,Spayed Female,30.64284504,-97.61602187,53.0734127
2608,12 years,A734446,Dog,Harrier Mix,Tricolor,10/27/2001,11/15/2013 17:50,2013-11-15T17:50:00,Rue,,Adoption,Spayed Female,30.6887018,-97.63023821,628.9632937
2609,3 years,A685166,Dog,Pit Bull Mix,Brown/White,9/6/2010,8/18/2014 15:25,2014-08-18T15:25:00,Ruby,,Adoption,Spayed Female,30.50367549,-97.33982155,206.0917659
2610,3 years,A764464,Dog,German Shepherd Mix,Black/Brown,3/13/2013,8/25/2016 19:07,2016-08-25T19:07:00,Ragnar,,Return to Owner,Neutered Male,30.58800278,-97.64944693,180.2566468
2611,2 years,A690160,Dog,Cardigan Welsh Corgi Mix,Brown/White,11/5/2011,11/6/2013 17:09,2013-11-06T17:09:00,Tuna,,Return to Owner,Neutered Male,30.57584052,-97.26493701,104.6735119
2612,1 year,A732319,Other,Raccoon Mix,Gray/Black,11/9/2012,11/9/2013 15:18,2013-11-09T15:18:00,,Rabies Risk,Euthanasia,Unknown,30.6303109,-97.58005109,52.23392857
2613,2 years,A695310,Dog,Airedale Terrier Mix,Black/White,6/7/2014,6/9/2016 12:29,2016-06-09T12:29:00,Chloe,,Return to Owner,Spayed Female,30.70691174,-97.32853397,104.7885913
2614,2 months,A737641,Cat,Domestic Medium Hair Mix,White/Brown Tabby,7/14/2017,9/29/2017 16:08,2017-09-29T16:08:00,Buddy,,Adoption,Neutered Male,30.27477785,-97.54478905,11.09603175
2615,2 years,A753210,Dog,Chihuahua Shorthair Mix,White/Cream,9/3/2012,9/13/2014 9:30,2014-09-13T09:30:00,*Lila,,Adoption,Spayed Female,30.4119897,-97.52333759,105.7708333
2616,1 year,A741844,Cat,Domestic Longhair Mix,Lynx Point,1/21/2015,2/8/2016 18:48,2016-02-08T18:48:00,*Macavoy,,Adoption,Neutered Male,30.64985094,-97.67026018,54.82619048
2617,3 years,A681113,Dog,Labrador Retriever Mix,Brown/Black,12/7/2014,12/14/2017 15:49,2017-12-14T15:49:00,*Nutmeg,,Adoption,Spayed Female,30.55602537,-97.63204359,157.6655754
2618,10 months,A761232,Dog,Pointer Mix,White/Black,4/16/2016,2/17/2017 16:42,2017-02-17T16:42:00,Niels,,Adoption,Spayed Female,30.59145716,-97.55741365,43.95654762
2619,1 year,A685497,Dog,Chihuahua Shorthair Mix,Black,12/7/2012,6/7/2014 15:27,2014-06-07T15:27:00,,Suffering,Euthanasia,Intact Female,30.4547442,-97.36960897,78.23482143
2620,7 years,A728397,Dog,Miniature Poodle Mix,Tan/White,9/8/2009,9/8/2016 15:37,2016-09-08T15:37:00,Romeo,,Return to Owner,Neutered Male,30.64411278,-97.67982487,365.3786706
2621,2 years,A672548,Dog,Pit Bull Mix,Brown/Tan,8/3/2012,7/11/2015 18:22,2015-07-11T18:22:00,Hammer,,Return to Owner,Neutered Male,30.74924539,-97.73644802,153.2521825
2622,2 months,A725087,Dog,Soft Coated Wheaten Terrier Mix,Black/Tricolor,10/15/2017,1/4/2018 17:21,2018-01-04T17:21:00,Lilo,,Adoption,Spayed Female,30.4394985,-97.73397909,11.67470238
2623,2 months,A698553,Cat,Domestic Longhair Mix,Brown Tabby,9/15/2014,11/19/2014 9:31,2014-11-19T09:31:00,*Desi,Foster,Adoption,Neutered Male,30.62367288,-97.38453495,9.342361111
2624,2 years,A696537,Dog,Labrador Retriever Mix,White,8/6/2014,9/22/2016 12:55,2016-09-22T12:55:00,Benton,,Return to Owner,Neutered Male,30.73357504,-97.44346464,111.2197421
2625,12 years,A730548,Dog,Miniature Schnauzer Mix,Gray,1/13/2003,1/17/2015 13:44,2015-01-17T13:44:00,Elijah,,Adoption,Neutered Male,30.69976534,-97.27277834,626.7960317
2626,1 year,A739937,Cat,Domestic Shorthair Mix,Orange Tabby,9/2/2015,11/2/2016 11:02,2016-11-02T11:02:00,,Suffering,Euthanasia,Intact Male,30.38727758,-97.34064413,61.0656746
2627,1 year,A723708,Other,Bat,Brown,7/3/2016,7/5/2017 9:15,2017-07-05T09:15:00,,Rabies Risk,Euthanasia,Unknown,30.54561013,-97.35881976,52.48363095
2628,11 years,A752926,Cat,Himalayan Mix,Flame Point,1/12/2006,1/13/2017 11:25,2017-01-13T11:25:00,Yaowyaow,,Return to Owner,Neutered Male,30.35001799,-97.72819949,574.2108135
2629,7 months,A755059,Dog,Chihuahua Shorthair Jack Russell Terrier,Tricolor,11/12/2013,6/24/2014 17:28,2014-06-24T17:28:00,Rocky,,Return to Owner,Neutered Male,30.27612519,-97.54345814,32.10396825
2630,4 months,A742628,Dog,Plott Hound Mix,Black/White,7/1/2017,11/9/2017 12:12,2017-11-09T12:12:00,*Pepper,Partner,Transfer,Neutered Male,30.4434389,-97.68986338,18.78690476
2631,3 months,A676121,Cat,Domestic Shorthair Mix,Brown Tabby,5/8/2014,8/9/2014 9:00,2014-08-09T09:00:00,,SCRP,Transfer,Intact Female,30.48738356,-97.39848305,13.33928571
2632,2 months,A675295,Cat,Siamese Mix,Lilac Point,4/26/2016,7/8/2016 17:09,2016-07-08T17:09:00,,Foster,Adoption,Neutered Male,30.52705293,-97.59112806,10.53065476
2633,2 months,A745796,Dog,Manchester Terrier Mix,Red,12/15/2013,2/16/2014 18:20,2014-02-16T18:20:00,Emma,,Adoption,Spayed Female,30.67553284,-97.73134233,9.109126984
2634,2 years,A765579,Cat,Domestic Longhair Mix,White/Orange Tabby,4/25/2014,6/19/2016 15:22,2016-06-19T15:22:00,*Handsome,,Adoption,Neutered Male,30.6896119,-97.5797949,112.3771825
2635,3 years,A682123,Dog,Staffordshire Mix,White/Black,3/24/2012,5/5/2015 14:35,2015-05-05T14:35:00,Mika,,Return to Owner,Spayed Female,30.63431076,-97.66946074,162.515377
2636,6 months,A734132,Dog,German Shepherd Mix,Black/Brown,9/13/2014,3/21/2015 12:14,2015-03-21T12:14:00,*Bil Bo,,Adoption,Neutered Male,30.43474918,-97.31620879,27.07281746
2637,3 years,A689600,Dog,Chihuahua Shorthair Mix,Tan,2/6/2012,3/11/2015 14:54,2015-03-11T14:54:00,Goofy,,Return to Owner,Neutered Male,30.34057164,-97.53208916,161.3744048
2638,10 years,A689909,Cat,Domestic Shorthair Mix,Black/White,7/6/2006,7/13/2016 14:10,2016-07-13T14:10:00,,Partner,Transfer,Neutered Male,30.48820995,-97.64593402,522.9414683
2639,6 years,A681696,Dog,Chihuahua Shorthair Mix,Black/White,12/9/2010,1/7/2017 16:00,2017-01-07T16:00:00,Taz,,Adoption,Neutered Male,30.27014774,-97.25466146,317.3809524
2640,2 months,A753591,Dog,Labrador Retriever Mix,Black,2/5/2016,4/10/2016 11:29,2016-04-10T11:29:00,,Partner,Transfer,Intact Female,30.63890274,-97.29426752,9.35406746
2641,1 month,A722225,Cat,Domestic Shorthair Mix,Black,6/5/2017,8/2/2017 14:47,2017-08-02T14:47:00,*Smurfette,Partner,Transfer,Intact Female,30.47528138,-97.66648145,8.373710317
2642,1 year,A668080,Dog,Labrador Retriever Mix,Tan,1/28/2016,8/21/2017 18:48,2017-08-21T18:48:00,*Edie,,Adoption,Spayed Female,30.74783423,-97.28415353,81.68333333
2643,4 months,A761763,Dog,Labrador Retriever Mix,White/Tan,9/25/2016,1/29/2017 16:54,2017-01-29T16:54:00,Scottie,,Adoption,Intact Female,30.50393508,-97.70141606,18.10059524
2644,2 years,A712655,Dog,Labrador Retriever Mix,Yellow,7/4/2012,11/23/2014 18:01,2014-11-23T18:01:00,Lola,Partner,Transfer,Spayed Female,30.49962877,-97.50153366,124.6786706
2645,2 weeks,A710054,Cat,Domestic Shorthair Mix,White/Brown Tabby,3/11/2014,3/26/2014 19:20,2014-03-26T19:20:00,,Partner,Transfer,Intact Female,30.32168835,-97.62709601,2.257936508
2646,2 months,A704714,Dog,Labrador Retriever Mix,Yellow,12/27/2016,3/28/2017 0:00,2017-03-28T00:00:00,,Partner,Transfer,Intact Male,30.75639351,-97.52165297,13
2647,5 months,A699967,Dog,Boston Terrier Mix,Black/White,8/23/2017,1/23/2018 17:46,2018-01-23T17:46:00,Sergeant,,Return to Owner,Intact Male,30.48138912,-97.35918572,21.96289683
2648,1 week,A536757,Cat,Domestic Shorthair Mix,Calico,6/17/2014,6/24/2014 19:14,2014-06-24T19:14:00,,Partner,Transfer,Intact Female,30.42116902,-97.53772653,1.114484127
2649,5 years,A663803,Dog,Pit Bull Mix,Brown/White,9/1/2012,12/28/2017 13:18,2017-12-28T13:18:00,Prince,,Rto-Adopt,Neutered Male,30.53044444,-97.42046382,277.7934524
2650,2 months,A706088,Dog,Miniature Pinscher Chihuahua Shorthair,Brown/Black,9/29/2014,12/5/2014 8:04,2014-12-05T08:04:00,Scout,Foster,Adoption,Intact Male,30.32764553,-97.51007688,9.619444444
2651,4 months,A700466,Cat,Domestic Shorthair Mix,Orange Tabby/White,6/11/2014,10/19/2014 12:52,2014-10-19T12:52:00,Bashful,,Adoption,Neutered Male,30.49646737,-97.34754055,18.64801587
2652,1 year,A717103,Dog,Labrador Retriever Mix,Sable/White,6/19/2013,10/30/2014 10:24,2014-10-30T10:24:00,Bo Bo,Foster,Adoption,Neutered Male,30.65636869,-97.41081017,71.2047619
2653,2 months,A734859,Dog,Labrador Retriever Mix,Black,4/27/2017,7/13/2017 16:51,2017-07-13T16:51:00,*Charity,,Adoption,Spayed Female,30.50820761,-97.30796386,11.10029762
2654,2 months,A683564,Dog,Boxer Mix,Red,12/25/2015,3/17/2016 15:28,2016-03-17T15:28:00,*Lulu,,Adoption,Spayed Female,30.40912588,-97.71731176,11.94920635
2655,1 year,A711783,Other,Raccoon Mix,Gray/Black,11/27/2012,11/27/2013 12:27,2013-11-27T12:27:00,,Suffering,Euthanasia,Unknown,30.35875618,-97.30424095,52.21696429
2656,2 months,A683336,Dog,Cairn Terrier Mix,Tan,11/2/2017,1/7/2018 18:20,2018-01-07T18:20:00,*Sweettart,Foster,Adoption,Neutered Male,30.30234832,-97.33628292,9.537698413
2657,2 months,A690093,Cat,Domestic Shorthair Mix,Orange Tabby,7/11/2015,9/30/2015 17:33,2015-09-30T17:33:00,*Morty,,Adoption,Neutered Male,30.52707845,-97.3502814,11.67589286
2658,5 months,A665085,Dog,Miniature Schnauzer Mix,Black/Tan,3/16/2015,8/18/2015 17:46,2015-08-18T17:46:00,Cuddles,,Adoption,Spayed Female,30.66294327,-97.70825015,22.24861111
2659,3 months,A754502,Cat,Domestic Medium Hair Mix,Black,5/14/2015,8/31/2015 18:22,2015-08-31T18:22:00,*Paloma,,Adoption,Spayed Female,30.28597062,-97.3211407,15.68075397
2660,5 years,A695741,Dog,Pit Bull Mix,Black/White,4/5/2010,4/10/2015 16:01,2015-04-10T16:01:00,Bala,Partner,Transfer,Spayed Female,30.61111085,-97.45733936,261.6667659
2661,8 years,A736119,Dog,Miniature Poodle Mix,Buff,3/4/2007,6/21/2015 11:59,2015-06-21T11:59:00,Tona,,Return to Owner,Spayed Female,30.69917649,-97.71157373,433.0713294
2662,4 years,A648236,Dog,Australian Cattle Dog Mix,Blue Merle,9/24/2009,10/17/2013 17:26,2013-10-17T17:26:00,Zoey,Foster,Adoption,Spayed Female,30.51281168,-97.44279674,212.1037698
2663,3 weeks,A697480,Cat,Domestic Shorthair Mix,Calico,6/2/2015,6/24/2015 16:39,2015-06-24T16:39:00,,Partner,Transfer,Unknown,30.38778222,-97.44315245,3.241964286
2664,2 years,A730146,Dog,Chihuahua Longhair Mix,Brown,4/14/2013,4/24/2015 14:36,2015-04-24T14:36:00,Jackson,,Return to Owner,Neutered Male,30.32943711,-97.4312102,105.8011905
2665,4 months,A723086,Cat,Domestic Shorthair Mix,Orange Tabby,10/11/2015,2/15/2016 14:49,2016-02-15T14:49:00,*Herb,,Adoption,Neutered Male,30.38277416,-97.7362897,18.23105159
2666,1 year,A715363,Dog,Pit Bull Mix,Brown/White,9/14/2015,10/7/2016 17:21,2016-10-07T17:21:00,*Ethan,,Adoption,Neutered Male,30.39883449,-97.50948347,55.67470238
2667,3 years,A717112,Dog,Lhasa Apso Mix,White,7/12/2011,7/16/2014 13:37,2014-07-16T13:37:00,,Partner,Transfer,Neutered Male,30.54035055,-97.55706982,157.2239087
2668,4 years,A665590,Dog,American Bulldog Pit Bull,White/Brown,9/12/2011,11/15/2015 15:28,2015-11-15T15:28:00,*Carl,Partner,Transfer,Neutered Male,30.36137585,-97.439991,217.9492063
2669,1 year,A719128,Dog,Chihuahua Shorthair Mix,Black/White,2/9/2013,7/14/2014 13:32,2014-07-14T13:32:00,Rosie,,Adoption,Spayed Female,30.75823967,-97.57265665,74.36626984
2670,3 years,A730007,Dog,Rhod Ridgeback Mix,Tan/White,10/14/2013,11/14/2016 11:39,2016-11-14T11:39:00,Rowdy,,Return to Owner,Spayed Female,30.38739562,-97.7042181,161.0693452
2671,1 year,A732438,Dog,Pit Bull Mix,White/Brown,10/13/2012,12/9/2013 16:20,2013-12-09T16:20:00,Blue,,Adoption,Neutered Male,30.2805542,-97.56192753,60.38293651
2672,2 months,A747882,Cat,Domestic Shorthair Mix,Brown Tabby/White,6/21/2017,9/2/2017 18:56,2017-09-02T18:56:00,*Bagel,,Adoption,Neutered Male,30.50935849,-97.66575263,10.54126984
2673,1 year,A743300,Dog,Pit Bull Mix,Brown/White,1/21/2014,2/4/2015 15:32,2015-02-04T15:32:00,*Libby,,Adoption,Spayed Female,30.4458793,-97.35572423,54.23531746
2674,1 year,A683574,Other,Rex Mix,White,1/4/2015,11/17/2016 16:32,2016-11-17T16:32:00,*Pipkin,,Adoption,Neutered Male,30.54755358,-97.54328328,97.66984127
2675,1 year,A673408,Dog,Australian Cattle Dog Mix,Red Tick/White,4/24/2012,2/26/2014 16:50,2014-02-26T16:50:00,Max,,Return to Owner,Neutered Male,30.29315176,-97.63149539,96.24305556
2676,5 months,A705125,Dog,Pit Bull Mix,Brown/White,9/24/2014,3/1/2015 17:36,2015-03-01T17:36:00,*Pepita,,Adoption,Spayed Female,30.33402845,-97.67713059,22.67619048
2677,2 months,A760925,Dog,Australian Cattle Dog Mix,Tricolor,4/29/2016,7/3/2016 18:11,2016-07-03T18:11:00,Matilda,,Adoption,Spayed Female,30.53219962,-97.53199444,9.393948413
2678,1 year,A698597,Dog,Pit Bull Mix,Blue/White,3/26/2015,4/5/2016 13:29,2016-04-05T13:29:00,*Bert,,Adoption,Neutered Male,30.49418164,-97.30780815,53.79454365
2679,5 months,A747290,Cat,Domestic Shorthair Mix,Torbie,9/4/2015,2/12/2016 13:35,2016-02-12T13:35:00,Grace,,Adoption,Spayed Female,30.51852677,-97.61253909,23.08085317
2680,2 years,A664712,Dog,Pit Bull Mix,White/Brown,12/2/2014,10/28/2017 16:56,2017-10-28T16:56:00,Fred,,Return to Owner,Neutered Male,30.60740208,-97.46323282,151.6722222
2681,2 years,A682041,Cat,Domestic Shorthair Mix,Brown Tabby,8/20/2013,9/10/2015 17:24,2015-09-10T17:24:00,*Marvin,,Adoption,Neutered Male,30.75343102,-97.49363357,107.3892857
2682,2 years,A599367,Dog,Norwich Terrier Mix,Tan/White,1/13/2014,1/17/2016 15:40,2016-01-17T15:40:00,*Lulu,,Adoption,Spayed Female,30.27324643,-97.57621681,104.9503968
2683,2 months,A697745,Cat,Domestic Shorthair Mix,Black,5/21/2016,8/6/2016 17:06,2016-08-06T17:06:00,*Auggie,Foster,Adoption,Neutered Male,30.4916036,-97.48164511,11.10178571
2684,7 months,A690497,Cat,Domestic Shorthair Mix,Black/White,6/7/2016,1/6/2017 11:59,2017-01-06T11:59:00,*Onion,Partner,Transfer,Spayed Female,30.37881089,-97.36797723,30.49990079
2685,2 months,A723638,Cat,Domestic Shorthair Mix,Cream Tabby/White,2/11/2017,4/30/2017 18:41,2017-04-30T18:41:00,*Julius,,Adoption,Neutered Male,30.561052,-97.47976413,11.25406746
2686,8 months,A742706,Dog,Harrier Mix,White/Red,8/7/2016,4/15/2017 9:26,2017-04-15T09:26:00,Ann,Foster,Adoption,Spayed Female,30.31399335,-97.396205,35.91329365
2687,7 months,A666974,Cat,Japanese Bobtail Mix,Calico,12/12/2013,7/24/2014 16:03,2014-07-24T16:03:00,Bell,,Adoption,Spayed Female,30.40198179,-97.38150268,32.09553571
2688,8 years,A670563,Dog,Chihuahua Shorthair Mix,White/Red,2/23/2006,3/12/2014 19:10,2014-03-12T19:10:00,Sabrina,,Adoption,Spayed Female,30.49963404,-97.62258822,419.9712302
2689,3 weeks,A724056,Cat,Domestic Shorthair Mix,Brown Tabby,5/23/2015,6/13/2015 14:32,2015-06-13T14:32:00,,Partner,Transfer,Intact Male,30.45971116,-97.58840151,3.086507937
2690,2 years,A542615,Other,Bat Mix,Black,10/26/2015,10/26/2017 10:13,2017-10-26T10:13:00,,Rabies Risk,Euthanasia,Unknown,30.6988016,-97.60744534,104.4893849
2691,2 years,A702585,Dog,Australian Kelpie Mix,White/Tricolor,3/14/2013,3/14/2015 18:07,2015-03-14T18:07:00,Thiago,Behavior,Euthanasia,Intact Male,30.75744644,-97.73354478,104.3935516
2692,4 weeks,A598610,Cat,Domestic Shorthair Mix,Torbie,3/18/2017,4/18/2017 14:40,2017-04-18T14:40:00,,Partner,Transfer,Intact Female,30.35079185,-97.29577202,4.515873016
2693,4 weeks,A685371,Dog,Chow Chow Mix,Black/Brown,9/7/2013,10/7/2013 19:06,2013-10-07T19:06:00,,Suffering,Euthanasia,Unknown,30.72544672,-97.42366567,4.399404762
2694,3 months,A762451,Cat,Domestic Shorthair Mix,Black/White,3/8/2014,7/2/2014 14:34,2014-07-02T14:34:00,*Nicholas,Partner,Transfer,Neutered Male,30.32503174,-97.4108788,16.65813492
2695,6 years,A670000,Dog,Chihuahua Shorthair Mix,Tan/White,7/5/2008,7/5/2014 17:36,2014-07-05T17:36:00,Princess,,Return to Owner,Spayed Female,30.5363839,-97.69934369,313.1047619
2696,3 years,A663299,Cat,Domestic Shorthair Mix,Calico,2/27/2012,3/3/2015 14:43,2015-03-03T14:43:00,Callie,Partner,Transfer,Spayed Female,30.46068129,-97.46600905,157.2304563
2697,3 years,A751119,Dog,Chihuahua Shorthair Mix,Black,4/21/2011,10/25/2014 15:29,2014-10-25T15:29:00,Tinker Bell,,Adoption,Spayed Female,30.54602432,-97.71593463,183.377877
2698,1 year,A704646,Dog,Chihuahua Shorthair Pekingese,White/Brown,10/4/2014,4/26/2016 11:03,2016-04-26T11:03:00,Elsa,Foster,Adoption,Spayed Female,30.36760117,-97.72470178,81.49434524
2699,1 year,A706071,Cat,Domestic Shorthair Mix,Tan,7/26/2015,1/26/2017 13:54,2017-01-26T13:54:00,,Suffering,Euthanasia,Unknown,30.42977572,-97.57218671,78.65416667
2700,2 years,A685552,Dog,Miniature Poodle Mix,White/Black,11/10/2011,11/13/2013 15:35,2013-11-13T15:35:00,Bella,,Return to Owner,Spayed Female,30.70785132,-97.57023045,104.9499008
2701,1 year,A754454,Dog,Pit Bull Mix,Blue/White,1/10/2013,9/18/2014 15:37,2014-09-18T15:37:00,Mia,Partner,Transfer,Spayed Female,30.29267147,-97.39807818,88.09295635
2702,1 year,A677863,Cat,Domestic Shorthair Mix,Tortie,4/11/2015,4/18/2016 18:55,2016-04-18T18:55:00,,SCRP,Transfer,Spayed Female,30.49407492,-97.72661433,53.39831349
2703,5 years,A691049,Dog,Pit Bull Mix,Brown/Brown Brindle,9/6/2008,8/6/2014 11:16,2014-08-06T11:16:00,Dikembe,,Return to Owner,Neutered Male,30.44181958,-97.32097217,308.6384921
2704,3 months,A665090,Cat,Domestic Shorthair Mix,Black,1/15/2015,5/16/2015 9:00,2015-05-16T09:00:00,,SCRP,Transfer,Intact Male,30.40889041,-97.50672874,17.33928571
2705,3 years,A631986,Dog,Australian Kelpie Mix,Black Brindle,4/30/2010,12/7/2013 15:40,2013-12-07T15:40:00,Ellie,,Adoption,Spayed Female,30.27463222,-97.39893728,188.2361111
2706,2 months,A683328,Dog,German Shepherd Mix,Brown/Black,6/6/2014,8/10/2014 17:56,2014-08-10T17:56:00,,,Adoption,Spayed Female,30.3748479,-97.62051037,9.392460317
2707,1 weeks,A718909,Dog,German Shepherd Mix,Black/Tan,11/17/2017,11/26/2017 9:46,2017-11-26T09:46:00,,Partner,Transfer,Unknown,30.43446621,-97.55169542,1.343849206
2708,6 months,A575180,Cat,Domestic Shorthair Mix,Black,7/1/2013,1/11/2014 15:05,2014-01-11T15:05:00,Tex,Partner,Transfer,Neutered Male,30.73691693,-97.74189881,27.80406746
2709,4 years,A713408,Dog,Pit Bull Mix,Brown Brindle/White,9/16/2009,10/24/2013 10:34,2013-10-24T10:34:00,Jedi,Aggressive,Euthanasia,Neutered Male,30.60964383,-97.71095401,214.205754
2710,2 months,A733862,Cat,Domestic Shorthair Mix,Calico,3/21/2017,6/17/2017 13:39,2017-06-17T13:39:00,*Summer,,Adoption,Spayed Female,30.56406857,-97.35982807,12.65267857
2711,2 years,A752728,Dog,Chihuahua Shorthair Mix,White/Brown,6/7/2013,6/26/2015 16:42,2015-06-26T16:42:00,*Fiona,,Adoption,Spayed Female,30.33641396,-97.6812612,107.0994048
2712,2 weeks,A687016,Cat,Domestic Shorthair Mix,Brown Tabby,6/9/2015,6/24/2015 17:05,2015-06-24T17:05:00,,Partner,Transfer,Unknown,30.72595509,-97.71181618,2.244543651
2713,2 years,A760393,Dog,Golden Retriever Mix,Cream,2/9/2012,8/17/2014 11:07,2014-08-17T11:07:00,Ziva,,Return to Owner,Spayed Female,30.30134965,-97.39610686,131.4947421
2714,1 year,A734713,Cat,Domestic Shorthair Mix,Black,7/21/2016,7/25/2017 12:05,2017-07-25T12:05:00,,Snr,Transfer,Unknown,30.29184394,-97.67680209,52.78621032
2715,1 year,A664440,Dog,Cardigan Welsh Corgi Miniature Pinscher,Brown,4/30/2013,5/7/2014 15:20,2014-05-07T15:20:00,Scooter,,Adoption,Neutered Male,30.69989948,-97.5767585,53.23412698
2716,3 years,A671188,Dog,Pit Bull Mix,Chocolate/White,10/29/2011,11/21/2014 17:42,2014-11-21T17:42:00,*Ridley,Behavior,Euthanasia,Neutered Male,30.68054133,-97.34316274,159.9625
2717,3 years,A666973,Other,Bat Mix,Black,10/13/2010,10/13/2013 15:39,2013-10-13T15:39:00,,Rabies Risk,Euthanasia,Unknown,30.54692855,-97.67942623,156.6645833
2718,1 year,A695341,Dog,Labrador Retriever Mix,Black/White,4/11/2012,11/12/2013 13:28,2013-11-12T13:28:00,Bishop,,Return to Owner,Neutered Male,30.5827755,-97.64991123,82.93730159
2719,2 months,A678131,Cat,Domestic Longhair Mix,Blue/White,4/24/2014,7/15/2014 17:48,2014-07-15T17:48:00,Solo,,Adoption,Neutered Male,30.28917278,-97.51364335,11.8202381
2720,2 years,A671339,Cat,Domestic Medium Hair Mix,Black/White,1/9/2014,4/26/2016 11:40,2016-04-26T11:40:00,Moriah,Foster,Adoption,Spayed Female,30.28498313,-97.4715553,119.7837302
2721,4 years,A669764,Dog,Pit Bull Mix,White/Black,6/11/2011,6/18/2015 12:34,2015-06-18T12:34:00,Blue,,Return to Owner,Neutered Male,30.6206239,-97.38436439,209.7890873
2722,1 year,A668306,Cat,Domestic Shorthair Mix,Brown Tabby,10/6/2014,11/28/2015 0:00,2015-11-28T00:00:00,Trinity,,Adoption,Spayed Female,30.66245339,-97.67942588,59.71428571
2723,4 months,A727723,Cat,Domestic Shorthair Mix,Orange Tabby,4/13/2016,8/29/2016 9:00,2016-08-29T09:00:00,,SCRP,Transfer,Neutered Male,30.51411099,-97.31479709,19.76785714
2724,6 months,A750243,Cat,Domestic Shorthair Mix,Black,5/15/2017,12/1/2017 13:57,2017-12-01T13:57:00,*Topaz,Foster,Adoption,Spayed Female,30.39997873,-97.59490351,28.65446429
2725,4 months,A759129,Cat,Domestic Shorthair Mix,Calico,4/15/2014,8/31/2014 9:00,2014-08-31T09:00:00,,SCRP,Transfer,Intact Female,30.75165268,-97.34133728,19.76785714
2726,2 years,A737425,Dog,Pit Bull Mix,Black/White,10/17/2015,10/17/2017 16:35,2017-10-17T16:35:00,Nitro,,Return to Owner,Intact Male,30.51856838,-97.3897188,104.5272817
2727,6 months,A724686,Dog,Australian Kelpie Mix,Black/White,3/11/2016,9/15/2016 17:20,2016-09-15T17:20:00,*Francine,,Adoption,Spayed Female,30.56663758,-97.55913931,26.96031746
2728,2 months,A682053,Cat,Domestic Shorthair Mix,Tortie,8/12/2013,10/19/2013 15:12,2013-10-19T15:12:00,*Sunshine,,Adoption,Spayed Female,30.58043009,-97.67972853,9.804761905
2729,1 month,A692804,Dog,Australian Cattle Dog Mix,Tricolor,12/20/2013,2/14/2014 17:09,2014-02-14T17:09:00,*Junie,Foster,Adoption,Spayed Female,30.40121381,-97.69305032,8.102083333
2730,1 year,A733821,Dog,Boxer Mix,Brown Brindle/White,11/10/2012,11/13/2013 15:34,2013-11-13T15:34:00,Bohdi,,Return to Owner,Neutered Male,30.75297187,-97.56230095,52.6640873
2731,5 months,A699089,Dog,Jack Russell Terrier Chihuahua Shorthair,Brown,8/14/2014,1/18/2015 9:52,2015-01-18T09:52:00,Copper,Offsite,Adoption,Neutered Male,30.43929537,-97.38900733,22.48730159
2732,1 year,A761438,Dog,Jack Russell Terrier Australian Cattle Dog,White/Black,5/4/2013,5/10/2014 14:10,2014-05-10T14:10:00,Peewee,,Return to Owner,Neutered Male,30.47818336,-97.4632081,53.0843254
2733,2 years,A761123,Dog,Pointer Catahoula,White/Yellow Brindle,1/22/2012,1/30/2014 17:21,2014-01-30T17:21:00,,,Adoption,Spayed Female,30.43545283,-97.39844497,105.6747024
2734,2 months,A722372,Dog,Labrador Retriever Mix,Black,10/11/2013,1/2/2014 11:21,2014-01-02T11:21:00,,Partner,Transfer,Intact Female,30.38409973,-97.5488194,11.92470238
2735,2 months,A683430,Dog,German Shepherd Mix,Red,10/17/2013,12/23/2013 13:53,2013-12-23T13:53:00,,,Adoption,Spayed Female,30.28071891,-97.58424833,9.65406746
2736,7 months,A725138,Dog,Rottweiler Mix,Tan/Black,10/26/2015,5/27/2016 17:17,2016-05-27T17:17:00,Teddy Bear J,,Return to Owner,Neutered Male,30.3528626,-97.70518728,30.67430556
2737,3 weeks,A695827,Cat,Domestic Shorthair Mix,Brown Tabby,5/2/2017,5/25/2017 15:25,2017-05-25T15:25:00,,Partner,Transfer,Intact Male,30.28567766,-97.56499212,3.377480159
2738,2 months,A669054,Cat,Domestic Shorthair Mix,Brown Tabby,7/27/2017,9/28/2017 13:25,2017-09-28T13:25:00,,Partner,Transfer,Intact Male,30.57524591,-97.35127625,9.079861111
2739,1 year,A714492,Dog,Chihuahua Shorthair Mix,Black,10/27/2015,11/1/2016 17:11,2016-11-01T17:11:00,*Steadman,,Adoption,Neutered Male,30.63974241,-97.53372817,53.10228175
2740,2 months,A494120,Dog,St  Bernard Smooth Coat Mix,Tricolor,2/20/2016,4/24/2016 17:34,2016-04-24T17:34:00,,,Adoption,Spayed Female,30.49718366,-97.61588519,9.247420635
2741,2 months,A763588,Dog,American Staffordshire Terrier Labrador Retriever,Black/White,4/23/2014,7/3/2014 18:55,2014-07-03T18:55:00,Ellie,,Adoption,Spayed Female,30.41753382,-97.66116157,10.25545635
2742,1 year,A726795,Cat,Siamese Mix,Lynx Point,11/25/2013,11/26/2014 9:00,2014-11-26T09:00:00,,SCRP,Transfer,Intact Female,30.67175058,-97.49314584,52.33928571
2743,4 years,A745803,Dog,Chihuahua Shorthair Rat Terrier,Tricolor,8/28/2012,9/4/2016 16:43,2016-09-04T16:43:00,*Celine,,Adoption,Spayed Female,30.27523309,-97.44307414,209.8137897
2744,1 year,A720712,Other,Squirrel Mix,Brown/Tan,3/22/2014,3/22/2015 14:46,2015-03-22T14:46:00,,Suffering,Euthanasia,Intact Female,30.70849067,-97.45960967,52.23075397
2745,2 years,A671750,Dog,Pit Bull Mix,Brown Brindle/White,11/4/2015,11/17/2017 10:58,2017-11-17T10:58:00,*Joey,Partner,Transfer,Neutered Male,30.7020267,-97.47689899,106.3509921
2746,5 years,A716880,Dog,German Shepherd Mix,Black/Tan,10/29/2012,10/29/2017 18:07,2017-10-29T18:07:00,,Partner,Transfer,Intact Female,30.63634913,-97.47642858,260.9649802
2747,6 months,A750767,Other,Bat,Brown,9/15/2015,3/20/2016 17:36,2016-03-20T17:36:00,,Rabies Risk,Euthanasia,Unknown,30.61637534,-97.37141882,26.81904762
2748,3 weeks,A679630,Cat,Domestic Shorthair Mix,Blue Cream,6/18/2014,7/11/2014 19:09,2014-07-11T19:09:00,,Partner,Transfer,Intact Male,30.28120556,-97.55715985,3.399702381
2749,2 months,A759521,Dog,Weimaraner Mix,Blue/White,3/11/2016,5/18/2016 10:11,2016-05-18T10:11:00,*Misty,Foster,Adoption,Spayed Female,30.45322248,-97.73129916,9.774900794
2750,6 months,A761569,Cat,Domestic Shorthair Mix,Orange Tabby,7/23/2014,1/24/2015 9:00,2015-01-24T09:00:00,,SCRP,Transfer,Intact Male,30.69598983,-97.68835945,26.48214286
2751,1 year,A749744,Cat,Domestic Shorthair Mix,Blue Tabby,12/13/2012,12/18/2013 14:38,2013-12-18T14:38:00,*Izzy,SCRP,Transfer,Spayed Female,30.64210584,-97.42784005,52.94424603
2752,2 years,A707321,Dog,Siberian Husky Mix,Sable,10/23/2013,4/29/2016 11:37,2016-04-29T11:37:00,Emma Lou,,Adoption,Spayed Female,30.48072059,-97.24626803,131.3548611
2753,8 years,A745848,Dog,West Highland Toy Fox Terrier,White,7/31/2007,4/7/2016 19:38,2016-04-07T19:38:00,Chino,,Adoption,Neutered Male,30.54817425,-97.28133172,453.4025794
2754,2 months,A661430,Cat,Domestic Shorthair Mix,Black,9/23/2017,12/16/2017 17:24,2017-12-16T17:24:00,,,Adoption,Neutered Male,30.52057632,-97.28217441,12.10357143
2755,2 months,A713962,Cat,Domestic Shorthair Mix,Brown Tabby/White,3/30/2016,6/14/2016 12:39,2016-06-14T12:39:00,*Davey,Foster,Adoption,Neutered Male,30.52840655,-97.26425634,10.93244048
2756,9 years,A760853,Dog,Pit Bull Mix,Tan/White,3/24/2008,9/4/2017 12:42,2017-09-04T12:42:00,Coach,,Return to Owner,Intact Male,30.53719489,-97.38111552,493.0755952
2757,8 years,A680137,Dog,Rat Terrier,White/Black,2/14/2008,2/28/2016 16:28,2016-02-28T16:28:00,*Eddie,,Adoption,Neutered Male,30.61027859,-97.48380258,419.5265873
2758,2 years,A680230,Cat,Domestic Shorthair Mix,Orange Tabby/White,1/30/2012,1/31/2014 14:39,2014-01-31T14:39:00,,SCRP,Transfer,Neutered Male,30.46924865,-97.54909805,104.658631
2759,2 years,A730598,Cat,Domestic Shorthair Mix,Black,6/27/2015,7/1/2017 15:57,2017-07-01T15:57:00,Bear,,Adoption,Neutered Male,30.70611008,-97.67518552,105.0949405
2760,2 months,A682040,Cat,Domestic Shorthair Mix,Brown Tabby/White,4/24/2017,6/29/2017 14:52,2017-06-29T14:52:00,*Tony,Foster,Adoption,Neutered Male,30.41009971,-97.56242063,9.517063492
2761,10 months,A687512,Dog,Chihuahua Longhair Mix,White,6/24/2013,5/24/2014 14:06,2014-05-24T14:06:00,Bella,,Died,Spayed Female,30.31377968,-97.67429323,47.79821429
2762,5 years,A726332,Dog,Shih Tzu,Silver,10/3/2012,10/4/2017 18:47,2017-10-04T18:47:00,Fern,,Return to Owner,Intact Male,30.33827613,-97.51804919,261.1118056
2763,9 months,A676789,Dog,American Bulldog,White/Brown Brindle,2/25/2017,11/26/2017 12:54,2017-11-26T12:54:00,Raider,,Adoption,Neutered Male,30.62142585,-97.30050465,39.21964286
2764,2 years,A749127,Dog,Pit Bull Mix,Blue/White,5/19/2015,5/19/2017 18:50,2017-05-19T18:50:00,Blue,,Return to Owner,Intact Male,30.40267551,-97.71794513,104.5406746
2765,2 months,A682928,Cat,Domestic Shorthair Mix,Tortie,6/11/2015,8/17/2015 17:45,2015-08-17T17:45:00,Bella,,Adoption,Spayed Female,30.73215555,-97.27552226,9.677083333
2766,1 year,A679170,Dog,Chihuahua Shorthair Mix,White,3/25/2016,4/3/2017 11:10,2017-04-03T11:10:00,*Axel,Partner,Transfer,Neutered Male,30.6747193,-97.72415243,53.49503968
2767,5 years,A685668,Cat,Domestic Shorthair Mix,Torbie,8/20/2008,10/6/2013 12:15,2013-10-06T12:15:00,*Choochoo,In Kennel,Died,Spayed Female,30.28968883,-97.27674554,267.6443452
2768,2 years,A549214,Dog,Labrador Retriever Mix,Black,10/15/2013,10/15/2015 18:59,2015-10-15T18:59:00,,,Return to Owner,Spayed Female,30.33889206,-97.73352676,104.3987103
2769,2 months,A736939,Cat,Domestic Shorthair Mix,Black Tabby,9/19/2017,12/2/2017 14:31,2017-12-02T14:31:00,*Thunder,Foster,Adoption,Neutered Male,30.42485405,-97.55689327,10.6578373
2770,2 months,A654170,Cat,Domestic Shorthair Mix,Torbie,3/23/2014,6/7/2014 13:36,2014-06-07T13:36:00,Sophie,,Adoption,Spayed Female,30.69594298,-97.39801329,10.93809524
2771,3 weeks,A750665,Cat,Domestic Shorthair Mix,Brown Tabby/White,5/9/2014,5/31/2014 12:27,2014-05-31T12:27:00,,Partner,Transfer,Intact Male,30.35576713,-97.71509434,3.216964286
2772,5 months,A610476,Dog,Labrador Retriever Mix,Black/White,2/7/2016,7/14/2016 15:57,2016-07-14T15:57:00,Ace,,Adoption,Neutered Male,30.64919167,-97.62725122,22.66636905
2773,3 years,A720974,Cat,Domestic Shorthair Mix,Brown Tabby/White,12/23/2010,7/2/2014 14:34,2014-07-02T14:34:00,*Samantha,Partner,Transfer,Spayed Female,30.64308231,-97.62801939,183.9438492
2774,2 months,A732500,Cat,Domestic Shorthair Mix,Cream Tabby,6/28/2014,9/9/2014 18:46,2014-09-09T18:46:00,Bluto,,Adoption,Neutered Male,30.57208027,-97.32693139,10.54027778
2775,3 months,A695921,Cat,Domestic Shorthair Mix,Brown Tabby,4/2/2016,7/3/2016 17:54,2016-07-03T17:54:00,Ramsey,,Adoption,Neutered Male,30.42481915,-97.73184452,13.24940476
2776,3 years,A733820,Dog,American Staffordshire Terrier Mix,White/Blue,4/15/2011,6/5/2014 19:03,2014-06-05T19:03:00,Precious,Partner,Transfer,Spayed Female,30.33513958,-97.49053801,163.9705357
2777,7 months,A698618,Dog,Pit Bull Mix,Blue/White,9/12/2016,5/12/2017 16:40,2017-05-12T16:40:00,Princess,,Return to Owner,Spayed Female,30.42306626,-97.46440888,34.67063492
2778,2 months,A752049,Cat,Domestic Shorthair Mix,Calico,5/29/2014,8/4/2014 17:47,2014-08-04T17:47:00,*Cheryl,,Adoption,Spayed Female,30.3352182,-97.66219142,9.677281746
2779,3 weeks,A703572,Cat,Domestic Shorthair Mix,White/Gray,4/25/2014,5/17/2014 14:00,2014-05-17T14:00:00,,Partner,Transfer,Intact Female,30.75892863,-97.67898988,3.226190476
2780,5 years,A728535,Other,Bat,Gray,8/10/2009,8/11/2014 8:51,2014-08-11T08:51:00,,In Kennel,Died,Unknown,30.60219451,-97.70101625,261.0526786
2781,10 years,A727356,Dog,Pit Bull Mix,Brown,12/4/2003,12/3/2013 18:15,2013-12-03T18:15:00,Bella,,Return to Owner,Spayed Female,30.61893767,-97.320727,521.8229167
2782,2 months,A724895,Cat,Domestic Shorthair Mix,Brown Tabby,9/13/2016,12/3/2016 12:49,2016-12-03T12:49:00,*Jimmy,Foster,Adoption,Neutered Male,30.62615789,-97.26535871,11.64771825
2783,8 months,A691691,Dog,Catahoula Chow Chow,Red Merle,3/16/2013,11/16/2013 15:08,2013-11-16T15:08:00,Tigger,Partner,Transfer,Neutered Male,30.52098367,-97.33459638,35.09007937
2784,1 year,A750607,Dog,Labrador Retriever Pit Bull,Brown,5/30/2016,7/2/2017 18:56,2017-07-02T18:56:00,*Reddy,,Adoption,Neutered Male,30.50393372,-97.63999521,56.96984127
2785,6 years,A748736,Dog,Border Terrier Mix,Tan,5/23/2011,12/18/2017 18:08,2017-12-18T18:08:00,Trinity,,Return to Owner,Spayed Female,30.31290232,-97.60802456,343.1079365
2786,2 months,A676855,Dog,Chihuahua Shorthair Mix,Brown/Tan,12/3/2015,2/22/2016 18:27,2016-02-22T18:27:00,Russo,,Adoption,Neutered Male,30.40407704,-97.34020933,11.68125
2787,6 years,A755951,Dog,Norwich Terrier Mix,Tan/White,8/10/2010,8/8/2016 19:28,2016-08-08T19:28:00,,Suffering,Euthanasia,Neutered Male,30.47529099,-97.45962079,312.9730159
2788,8 months,A679086,Cat,Domestic Shorthair Mix,Black,5/25/2014,2/2/2015 14:58,2015-02-02T14:58:00,Colugo,,Adoption,Neutered Male,30.57410684,-97.27226939,36.23194444
2789,4 years,A619861,Dog,Cocker Spaniel,Black/Brown,8/27/2012,9/6/2016 18:01,2016-09-06T18:01:00,Maris,,Return to Owner,Neutered Male,30.61755683,-97.46295104,210.2500992
2790,1 year,A653367,Other,Rabbit Sh Mix,White/Blue,3/14/2014,3/16/2015 18:08,2015-03-16T18:08:00,,Partner,Transfer,Unknown,30.61290645,-97.62575697,52.53650794
2791,1 year,A712861,Dog,German Shepherd,Black/Tan,6/17/2016,6/21/2017 18:43,2017-06-21T18:43:00,,,Adoption,Neutered Male,30.68867323,-97.58591256,52.82569444
2792,2 months,A741700,Cat,Domestic Shorthair Mix,Calico,4/27/2015,6/29/2015 16:06,2015-06-29T16:06:00,*Sandra,,Adoption,Spayed Female,30.47183917,-97.32903432,9.095833333
2793,1 year,A699740,Dog,Chihuahua Shorthair Shiba Inu,Tan/White,6/5/2015,6/9/2016 17:37,2016-06-09T17:37:00,Bruce,,Adoption,Neutered Male,30.76402245,-97.41323036,52.96200397
2794,4 weeks,A711853,Cat,Domestic Shorthair Mix,Brown Tabby/Black,4/21/2016,5/21/2016 15:54,2016-05-21T15:54:00,,Partner,Transfer,Intact Female,30.75241289,-97.42122359,4.380357143
2795,1 year,A759054,Cat,Domestic Shorthair Mix,Calico/Brown Tabby,4/22/2015,4/24/2016 9:46,2016-04-24T09:46:00,,Rabies Risk,Euthanasia,Intact Female,30.5586637,-97.4036608,52.62956349
2796,11 months,A724918,Dog,German Shepherd Labrador Retriever,Red,1/8/2014,1/2/2015 18:52,2015-01-02T18:52:00,Tiva,,Adoption,Spayed Female,30.76139434,-97.5086383,51.39801587
2797,8 years,A743139,Cat,Domestic Shorthair Mix,White,5/31/2009,6/3/2017 11:46,2017-06-03T11:46:00,Taboo,Partner,Transfer,Spayed Female,30.33717621,-97.41132084,417.9271825
2798,1 year,A677631,Cat,Domestic Shorthair Mix,Black,5/6/2016,5/28/2017 17:34,2017-05-28T17:34:00,*Wink,,Adoption,Neutered Male,30.29910497,-97.46199109,55.39027778
2799,5 years,A658626,Dog,Rat Terrier Chihuahua Shorthair,Tricolor/White,4/15/2009,4/22/2014 17:54,2014-04-22T17:54:00,Chica,Partner,Transfer,Spayed Female,30.56511964,-97.50969172,261.9636905
2800,1 month,A716855,Dog,Labrador Retriever Mix,Tan/White,6/15/2017,8/15/2017 18:46,2017-08-15T18:46:00,,,Adoption,Spayed Female,30.47411259,-97.26813848,8.825992063
2801,2 years,A759638,Cat,Domestic Shorthair Mix,Brown Tabby/White,5/16/2012,5/26/2014 14:48,2014-05-26T14:48:00,*Smores,Partner,Transfer,Intact Female,30.61161841,-97.55112204,105.802381
2802,3 years,A478560,Dog,Pit Bull Boxer,Brown/White,2/8/2011,2/8/2014 18:25,2014-02-08T18:25:00,*Jessie,,Adoption,Spayed Female,30.3312975,-97.58272116,156.6810516
2803,4 years,A711919,Dog,Catahoula Mix,White/Black,1/5/2013,2/8/2017 0:00,2017-02-08T00:00:00,Otis,,Return to Owner,Intact Male,30.68427589,-97.63000174,213.5714286
2804,4 months,A718256,Cat,Domestic Shorthair Mix,Black/White,5/14/2015,10/7/2015 12:00,2015-10-07T12:00:00,*Ajax,Partner,Transfer,Neutered Male,30.28347219,-97.72442456,20.92857143
2805,2 years,A713332,Cat,Domestic Longhair Mix,Calico,1/6/2015,3/22/2017 12:06,2017-03-22T12:06:00,*Kat,Partner,Transfer,Spayed Female,30.56547108,-97.67513796,115.214881
2806,10 months,A676092,Dog,Cardigan Welsh Corgi Chihuahua Shorthair,Brown/White,8/1/2014,6/6/2015 17:17,2015-06-06T17:17:00,Oliver,Offsite,Adoption,Neutered Male,30.28753974,-97.25478217,44.24573413
2807,2 months,A720151,Cat,Domestic Shorthair Mix,Brown Tabby,8/12/2015,11/7/2015 19:14,2015-11-07T19:14:00,*Nala,,Adoption,Spayed Female,30.34618355,-97.44866775,12.54305556
2808,2 months,A754423,Dog,Yorkshire Terrier Mix,Black,7/25/2017,9/28/2017 16:55,2017-09-28T16:55:00,,Partner,Transfer,Intact Female,30.62928375,-97.43208369,9.38640873
2809,2 years,A757696,Dog,Chihuahua Shorthair,Tan,4/22/2014,5/8/2016 15:51,2016-05-08T15:51:00,*Ginger Snap,,Adoption,Spayed Female,30.72138152,-97.37656994,106.808631
2810,5 years,A748579,Dog,Pit Bull Mix,Red,2/4/2012,2/23/2017 14:52,2017-02-23T14:52:00,Rayne,,Return to Owner,Spayed Female,30.74408546,-97.66873153,263.8027778
2811,2 weeks,A685358,Cat,Domestic Shorthair Mix,Black/White,4/12/2014,4/27/2014 12:07,2014-04-27T12:07:00,,Partner,Transfer,Unknown,30.43511029,-97.56261159,2.214980159
2812,4 years,A765374,Dog,Chihuahua Shorthair Mix,Tan/White,7/12/2012,2/19/2017 15:27,2017-02-19T15:27:00,Chuck Norris,,Adoption,Neutered Male,30.56627252,-97.59312543,240.5205357
2813,11 years,A755167,Cat,Domestic Shorthair Mix,Tortie,11/27/2004,12/30/2015 18:27,2015-12-30T18:27:00,Faux,,Adoption,Spayed Female,30.34222927,-97.47343426,578.68125
2814,8 months,A733804,Dog,Norfolk Terrier Mix,Cream,2/5/2017,10/15/2017 12:52,2017-10-15T12:52:00,Merlin,,Adoption,Neutered Male,30.54002126,-97.39127239,36.0765873
2815,9 years,A666725,Dog,Australian Cattle Dog Mix,Blue Tick/Brown,1/14/2007,4/3/2016 12:21,2016-04-03T12:21:00,Noel,,Adoption,Spayed Female,30.68594074,-97.74004951,481.0735119
2816,6 years,A670061,Dog,Maltese Mix,White,9/13/2009,9/17/2015 15:14,2015-09-17T15:14:00,,Partner,Transfer,Neutered Male,30.45596672,-97.3106532,313.6621032
2817,2 years,A687232,Cat,Domestic Shorthair Mix,Blue Tabby,12/26/2013,12/26/2015 14:01,2015-12-26T14:01:00,Milo,,Return to Owner,Intact Male,30.6551444,-97.38201855,104.3691468
2818,1 month,A755420,Cat,Domestic Shorthair Mix,Black/White,8/21/2015,10/8/2015 14:37,2015-10-08T14:37:00,*Janet,Partner,Transfer,Intact Female,30.26995917,-97.60639665,6.944146825
2819,10 years,A672268,Dog,Chihuahua Shorthair Mix,Liver/Tan,4/4/2004,4/16/2014 17:11,2014-04-16T17:11:00,Scamper,,Return to Owner,Neutered Male,30.63653713,-97.38661673,523.5308532
2820,9 years,A674376,Cat,Domestic Shorthair Mix,Tortie,2/6/2007,2/11/2016 13:04,2016-02-11T13:04:00,Alfie,,Return to Owner,Spayed Female,30.45098782,-97.25888962,470.3634921
2821,3 months,A667765,Cat,Domestic Medium Hair Mix,Brown Tabby/White,5/5/2017,8/11/2017 14:13,2017-08-11T14:13:00,,Partner,Transfer,Intact Male,30.68756919,-97.40236112,14.08462302
2822,11 months,A761852,Dog,German Shepherd Mix,White/Tan,10/5/2016,9/9/2017 17:05,2017-09-09T17:05:00,Sage,,Adoption,Neutered Male,30.43081491,-97.42617995,48.53025794
2823,2 weeks,A718759,Cat,Domestic Shorthair Mix,Brown Tabby/White,4/19/2017,5/4/2017 14:22,2017-05-04T14:22:00,,Partner,Transfer,Intact Male,30.46303944,-97.24839294,2.228373016
2824,1 year,A504189,Cat,Domestic Shorthair Mix,Blue Tabby/White,8/6/2013,8/7/2014 9:00,2014-08-07T09:00:00,,SCRP,Transfer,Unknown,30.53894874,-97.26338684,52.33928571
2825,2 years,A668732,Dog,Pit Bull Mix,Brown/White,1/18/2016,1/23/2018 21:07,2018-01-23T21:07:00,Koda,,Adoption,Neutered Male,30.73764539,-97.31258159,105.2685516
2826,2 months,A677994,Dog,Pit Bull Mix,White/Black,6/27/2017,9/6/2017 12:41,2017-09-06T12:41:00,Duke,Foster,Adoption,Intact Male,30.48713552,-97.4621117,10.21835317
2827,11 years,A681005,Dog,Chihuahua Shorthair Dachshund,Tan/Black,8/28/2005,8/28/2016 13:10,2016-08-28T13:10:00,Nacho,,Return to Owner,Neutered Male,30.47499554,-97.31536963,574.078373
2828,2 months,A691443,Dog,Pointer Anatol Shepherd,White/Brown,8/22/2013,11/11/2013 15:33,2013-11-11T15:33:00,,,Adoption,Neutered Male,30.4160439,-97.29945559,11.6639881
2829,2 years,A692577,Dog,Chow Chow Mix,Red,1/1/2012,1/24/2014 13:41,2014-01-24T13:41:00,Koda,,Adoption,Neutered Male,30.67331495,-97.32755726,107.7957341
2830,4 months,A618691,Cat,Domestic Shorthair Mix,Black/White,5/2/2014,9/9/2014 17:31,2014-09-09T17:31:00,,,Adoption,Neutered Male,30.76326311,-97.32158367,18.67569444
2831,9 years,A703417,Dog,Australian Cattle Dog Mix,Black/Brown,8/3/2008,8/17/2017 12:57,2017-08-17T12:57:00,*Emma,Partner,Transfer,Intact Female,30.46909911,-97.60383778,471.6485119
2832,1 year,A715665,Other,Bat Mix,Brown,2/6/2013,2/6/2014 18:59,2014-02-06T18:59:00,,Rabies Risk,Euthanasia,Unknown,30.35734177,-97.51855572,52.25585317
2833,2 years,A696905,Dog,Labrador Retriever Beagle,White/Tan,3/12/2013,2/29/2016 14:26,2016-02-29T14:26:00,Bandido,,Adoption,Neutered Male,30.50012708,-97.69449307,154.9430556
2834,1 year,A670180,Dog,Dachshund Mix,Black/Brown,5/22/2012,11/30/2013 15:59,2013-11-30T15:59:00,Rory,,Return to Owner,Neutered Male,30.67642181,-97.44202104,79.66656746
2835,2 months,A754368,Cat,Domestic Shorthair Mix,Blue Tabby/White,8/26/2017,11/13/2017 17:25,2017-11-13T17:25:00,Luna,,Adoption,Neutered Male,30.32994255,-97.4153076,11.38938492
2836,3 years,A718769,Cat,Domestic Shorthair Mix,Black,10/11/2012,1/15/2016 11:50,2016-01-15T11:50:00,Jill,Partner,Transfer,Spayed Female,30.75860132,-97.48311123,170.2132937
2837,9 years,A762461,Dog,Labrador Retriever Basset Hound,Chocolate/White,9/25/2006,2/2/2016 16:32,2016-02-02T16:32:00,Muddy Waters,,Return to Owner,Neutered Male,30.61900863,-97.64211635,488.2412698
2838,4 months,A665700,Cat,Domestic Shorthair Mix,Orange Tabby/White,8/8/2013,12/13/2013 17:20,2013-12-13T17:20:00,Sunshine,,Adoption,Spayed Female,30.4120347,-97.59700252,18.24603175
2839,1 year,A723548,Cat,Domestic Shorthair Mix,Tortie,11/2/2012,7/29/2014 13:43,2014-07-29T13:43:00,*Isadora,Foster,Adoption,Spayed Female,30.43150235,-97.49616022,90.6530754
2840,2 months,A691945,Dog,St  Bernard Smooth Coat Mix,Tricolor,3/27/2014,6/16/2014 13:20,2014-06-16T13:20:00,,Medical,Euthanasia,Intact Female,30.74502701,-97.3286703,11.65079365
2841,2 months,A692277,Cat,Domestic Shorthair Mix,Black/White,10/5/2014,12/12/2014 16:59,2014-12-12T16:59:00,*Julian,,Adoption,Neutered Male,30.57820771,-97.30870578,9.815376984
2842,3 months,A721336,Dog,Pit Bull Mix,Chocolate/White,8/23/2014,11/27/2014 14:49,2014-11-27T14:49:00,,Partner,Transfer,Intact Male,30.27346181,-97.38454091,13.80248016
2843,2 years,A715209,Dog,Chihuahua Shorthair Mix,Tan/White,1/18/2011,10/3/2013 13:05,2013-10-03T13:05:00,Chucha,,Return to Owner,Spayed Female,30.44310033,-97.30541628,141.3635913
2844,11 months,A726229,Dog,Labrador Retriever Mix,Black,5/29/2014,5/26/2015 16:59,2015-05-26T16:59:00,Marley,,Return to Owner,Neutered Male,30.37004305,-97.26029993,51.81537698
2845,1 month,A734367,Dog,Anatol Shepherd Mix,White/Brown,9/15/2015,11/9/2015 16:30,2015-11-09T16:30:00,Pup 2,,Adoption,Spayed Female,30.70639895,-97.40152922,7.955357143
2846,10 years,A709133,Dog,Shih Tzu Mix,White,2/14/2005,2/18/2015 11:37,2015-02-18T11:37:00,,Partner,Transfer,Spayed Female,30.28151749,-97.45383336,522.3548611
2847,1 year,A727087,Dog,Dachshund Mix,Brown/Black,7/3/2012,1/7/2014 15:46,2014-01-07T15:46:00,,Partner,Transfer,Intact Male,30.63388569,-97.63332309,79.09384921
2848,4 weeks,A668333,Cat,Domestic Shorthair Mix,Black/White,6/19/2017,7/19/2017 17:11,2017-07-19T17:11:00,,Partner,Transfer,Unknown,30.51353338,-97.47530458,4.387996032
2849,5 years,A707045,Dog,Doberman Pinsch Mix,Buff,3/6/2011,3/9/2016 12:01,2016-03-09T12:01:00,Buddy,Partner,Transfer,Neutered Male,30.76274935,-97.36111682,261.5000992
2850,2 years,A673115,Dog,Great Dane Mix,Tan/Black,11/20/2015,11/21/2017 17:37,2017-11-21T17:37:00,Grace,,Return to Owner,Intact Female,30.44082607,-97.32890584,104.6762897
2851,1 year,A738157,Other,Bat Mix,Brown,10/21/2012,10/21/2013 18:51,2013-10-21T18:51:00,,,Euthanasia,Unknown,30.69613885,-97.53305791,52.25505952
2852,3 months,A664062,Cat,Domestic Shorthair Mix,Blue,4/3/2016,7/9/2016 19:26,2016-07-09T19:26:00,*Teodora,Foster,Adoption,Spayed Female,30.57722215,-97.68175174,13.97281746
2853,2 months,A721514,Cat,Domestic Shorthair Mix,Brown Tabby,8/30/2014,11/20/2014 12:33,2014-11-20T12:33:00,*Spice,Partner,Transfer,Neutered Male,30.45841861,-97.37544692,11.7889881
2854,3 years,A674389,Dog,Pit Bull Mix,Brown Brindle/White,11/18/2011,12/4/2014 17:28,2014-12-04T17:28:00,*Scoobie,Partner,Transfer,Neutered Male,30.2991708,-97.47066503,158.9611111
2855,3 years,A731755,Dog,Chihuahua Shorthair Mix,Brown,2/24/2013,2/26/2016 11:34,2016-02-26T11:34:00,Jb,,Return to Owner,Neutered Male,30.7660658,-97.42477337,156.7831349
2856,2 months,A673950,Dog,Cocker Spaniel Labrador Retriever,White/Brown,9/2/2015,11/3/2015 16:47,2015-11-03T16:47:00,Murphy,,Adoption,Spayed Female,30.44849519,-97.60404031,8.957043651
2857,3 months,A760912,Cat,Domestic Longhair Mix,Orange Tabby,4/13/2016,7/19/2016 14:45,2016-07-19T14:45:00,*Goose,Foster,Adoption,Neutered Male,30.66409761,-97.33242644,13.94494048
2858,1 year,A691000,Dog,Pointer Mix,White/Brown,9/5/2015,2/24/2017 15:25,2017-02-24T15:25:00,Taz,,Return to Owner,Neutered Male,30.51044828,-97.6337328,76.94890873
2859,1 year,A733482,Cat,Domestic Medium Hair Mix,Black,8/5/2014,9/21/2015 15:53,2015-09-21T15:53:00,*Petra,Partner,Transfer,Spayed Female,30.51948214,-97.37916988,58.95168651
2860,2 months,A752413,Cat,Domestic Shorthair Mix,Torbie,5/11/2016,8/5/2016 13:55,2016-08-05T13:55:00,*Leia,,Adoption,Spayed Female,30.6751287,-97.63403136,12.36855159
2861,7 months,A691295,Dog,Whippet Beagle,Red/White,6/2/2013,1/20/2014 16:45,2014-01-20T16:45:00,Sawyer,Foster,Adoption,Neutered Male,30.66459519,-97.60537583,33.24255952
2862,1 month,A758391,Dog,Pit Bull Mix,Black/White,5/16/2015,7/12/2015 13:37,2015-07-12T13:37:00,Black,,Adoption,Neutered Male,30.63782948,-97.50998256,8.22390873
2863,3 years,A705741,Dog,Yorkshire Terrier,Black/Red,2/19/2011,6/5/2014 16:34,2014-06-05T16:34:00,Minnie,Partner,Transfer,Spayed Female,30.31452088,-97.41904879,171.8128968
2864,3 years,A725158,Dog,Lhasa Apso Miniature Poodle,White,11/10/2013,11/14/2016 12:03,2016-11-14T12:03:00,,Partner,Transfer,Intact Male,30.7179137,-97.5227404,157.2145833
2865,1 year,A733899,Cat,Domestic Shorthair Mix,Black,3/28/2012,10/5/2013 13:51,2013-10-05T13:51:00,Faxon,,Adoption,Neutered Male,30.49836559,-97.73773252,79.5110119
2866,1 year,A667526,Cat,Domestic Shorthair Mix,Blue,2/28/2015,3/3/2016 18:15,2016-03-03T18:15:00,Thelonious,,Adoption,Neutered Male,30.37514029,-97.43344155,52.82291667
2867,2 years,A689712,Dog,Jack Russell Terrier Mix,White/Tan,3/12/2012,3/17/2014 19:24,2014-03-17T19:24:00,Tom,,Adoption,Neutered Male,30.49085055,-97.69244819,105.1154762
2868,6 months,A666313,Dog,Chihuahua Shorthair Mix,Black Brindle,1/27/2016,7/31/2016 17:08,2016-07-31T17:08:00,,,Adoption,Neutered Male,30.33039282,-97.63532302,26.6734127
2869,2 years,A694501,Dog,Labrador Retriever Mix,Black/Brown,3/5/2012,3/7/2014 12:03,2014-03-07T12:03:00,Baby,,Return to Owner,Spayed Female,30.5394314,-97.43357441,104.6431548
2870,1 year,A745030,Other,Bat Mix,Brown,10/25/2016,10/26/2017 9:08,2017-10-26T09:08:00,,Rabies Risk,Euthanasia,Unknown,30.54486292,-97.51939377,52.34007937
2871,8 years,A744610,Dog,Miniature Schnauzer Mix,Gray/Silver,10/28/2007,11/1/2015 12:01,2015-11-01T12:01:00,Puchungas,,Return to Owner,Spayed Female,30.68702794,-97.46955788,418.0715278
2872,3 years,A711302,Dog,Chihuahua Longhair Cairn Terrier,Buff,8/22/2013,9/15/2016 15:48,2016-09-15T15:48:00,*Chippy,Partner,Transfer,Neutered Male,30.58566061,-97.44697646,160.0940476
2873,5 months,A748141,Dog,Boxer Mix,White,1/6/2017,6/28/2017 14:37,2017-06-28T14:37:00,,Partner,Transfer,Spayed Female,30.4124774,-97.52810874,24.80128968
2874,18 years,A691406,Dog,Labrador Retriever Australian Cattle Dog,Chocolate/White,11/4/1996,11/4/2014 11:19,2014-11-04T11:19:00,Max,,Return to Owner,Neutered Male,30.70786671,-97.25239348,939.2102183
2875,7 years,A680416,Dog,Rottweiler Mix,Black/Brown,9/15/2010,9/22/2017 18:51,2017-09-22T18:51:00,Angelita,,Adoption,Spayed Female,30.65390136,-97.29210788,366.3979167
2876,2 weeks,A717641,Cat,Domestic Shorthair Mix,Torbie,6/5/2015,6/20/2015 17:43,2015-06-20T17:43:00,,Partner,Transfer,Intact Female,30.56466489,-97.60249858,2.248313492
2877,4 weeks,A694108,Cat,Domestic Shorthair Mix,Black/White,4/4/2016,5/3/2016 12:44,2016-05-03T12:44:00,*Oscar,Suffering,Euthanasia,Intact Male,30.5066083,-97.24537979,4.218650794
2878,5 months,A687613,Cat,Domestic Medium Hair Mix,White/Black,3/14/2016,9/2/2016 17:09,2016-09-02T17:09:00,*Zane,,Adoption,Neutered Male,30.75088636,-97.32116244,24.6735119
2879,6 months,A675069,Cat,Domestic Shorthair Mix,Black,5/19/2013,11/20/2013 15:28,2013-11-20T15:28:00,Alley,SCRP,Transfer,Spayed Female,30.35392956,-97.73799173,26.52063492
2880,2 years,A759122,Dog,German Shepherd Mix,Brown Brindle/Tan,10/8/2012,10/18/2014 11:43,2014-10-18T11:43:00,Lucky,,Return to Owner,Neutered Male,30.31896194,-97.47312056,105.7840278
2881,8 months,A670486,Dog,Leonberger Mix,Brown/White,3/2/2013,11/3/2013 17:26,2013-11-03T17:26:00,,,Adoption,Neutered Male,30.28928888,-97.66351552,35.24662698
2882,6 months,A744633,Dog,Labrador Retriever Mix,Black/White,6/30/2014,1/1/2015 17:07,2015-01-01T17:07:00,Penelope,,Return to Owner,Spayed Female,30.69293635,-97.71043686,26.53045635
2883,7 months,A756846,Cat,Domestic Shorthair Mix,Gray,8/11/2016,3/12/2017 9:00,2017-03-12T09:00:00,,SCRP,Transfer,Intact Male,30.71295128,-97.5537889,30.48214286
2884,7 years,A703923,Dog,Chihuahua Shorthair Mix,Black,12/23/2007,2/24/2015 12:20,2015-02-24T12:20:00,Cloy,,Return to Owner,Neutered Male,30.5881725,-97.62991303,374.359127
2885,4 years,A722816,Dog,Great Pyrenees Mix,Cream,3/4/2013,3/6/2017 14:31,2017-03-06T14:31:00,Lobo,Partner,Transfer,Neutered Male,30.50760139,-97.67585355,209.0864087
2886,2 weeks,A732427,Cat,Siamese Mix,Flame Point,8/21/2015,9/5/2015 12:13,2015-09-05T12:13:00,,Partner,Transfer,Unknown,30.31671887,-97.53969016,2.215575397
2887,1 month,A716120,Cat,Domestic Shorthair Mix,Black,3/11/2017,5/3/2017 12:56,2017-05-03T12:56:00,Tig,,Adoption,Intact Male,30.38080631,-97.36771124,7.648412698
2888,2 years,A712471,Dog,Siberian Husky Mix,Red/White,5/3/2012,11/5/2014 18:33,2014-11-05T18:33:00,Rajah,,Return to Owner,Spayed Female,30.63723459,-97.38144096,130.9675595
2889,2 months,A678641,Cat,Domestic Shorthair Mix,Black/White,4/17/2014,7/8/2014 11:16,2014-07-08T11:16:00,*Snickers,Foster,Adoption,Neutered Male,30.3805234,-97.4533194,11.78134921
2890,3 years,A682784,Dog,Rat Terrier Chihuahua Shorthair,Black/White,12/11/2012,12/17/2015 12:42,2015-12-17T12:42:00,Mellow,,Adoption,Neutered Male,30.30975044,-97.71896219,157.3613095
2891,1 year,A689534,Dog,Dachshund Beagle,Tricolor,12/20/2013,12/24/2014 16:22,2014-12-24T16:22:00,,,Adoption,Neutered Male,30.64449292,-97.40720828,52.81170635
2892,2 months,A706564,Dog,Chihuahua Shorthair German Shepherd,Brown/Black,7/7/2014,9/9/2014 18:09,2014-09-09T18:09:00,,,Adoption,Neutered Male,30.75597737,-97.4247721,9.250892857
2893,10 years,A725013,Cat,Domestic Shorthair Mix,Calico/Orange Tabby,3/25/2004,4/21/2014 13:11,2014-04-21T13:11:00,*Spring,,Adoption,Spayed Female,30.57306501,-97.67381411,525.6499008
2894,8 years,A673962,Dog,Chihuahua Shorthair Mix,Tan/White,9/27/2009,10/2/2017 16:25,2017-10-02T16:25:00,,Partner,Transfer,Intact Male,30.75784703,-97.5357629,418.2405754
2895,2 years,A679649,Cat,Domestic Longhair Mix,Blue Tabby/White,1/9/2012,1/11/2014 15:15,2014-01-11T15:15:00,,SCRP,Transfer,Intact Male,30.60456676,-97.70848875,104.8050595
2896,8 months,A650188,Cat,Domestic Shorthair Mix,Orange Tabby,12/4/2016,9/2/2017 13:25,2017-09-02T13:25:00,Tiger,,Adoption,Neutered Male,30.52522571,-97.72145528,38.93700397
2897,4 years,A684719,Cat,Domestic Shorthair Mix,Torbie,8/26/2013,10/28/2017 11:35,2017-10-28T11:35:00,Jasmine,,Adoption,Spayed Female,30.48905305,-97.65743501,217.7832341
2898,2 months,A716550,Cat,Domestic Shorthair Mix,Black/White,3/17/2015,6/1/2015 18:30,2015-06-01T18:30:00,Fluffy,,Adoption,Spayed Female,30.37323183,-97.26770961,10.9672619
2899,6 months,A690388,Other,Bat,Brown,9/22/2015,3/23/2016 8:37,2016-03-23T08:37:00,,Rabies Risk,Euthanasia,Unknown,30.29076466,-97.72461164,26.19414683
